id,conversation_id,created_at,date,timezone,place,tweet,language,hashtags,cashtags,user_id,user_id_str,username,name,day,hour,link,urls,photos,video,thumbnail,retweet,nlikes,nreplies,nretweets,quote_url,search,near,geo,source,user_rt_id,user_rt,retweet_id,reply_to,retweet_date,translate,trans_src,trans_dest
1500964682919661574,1500964682919661574,1646692841000.0,2022-03-07 14:40:41,-700,,"Have you missed the origins of covid debate &amp; #lableak entirely? No, it is not how medicine advances...it is how global pandemics start. 🙄",en,['lableak'],[],1194957349,1194957349,beachvetlbc,Dr. Ena Valikov aka Notorious KGB Aggie,1,14,https://twitter.com/beachvetlbc/status/1500964682919661574,[],[],0,,False,1,0,1,https://twitter.com/DrHayada/status/1500936413096861704,#lableak,,,,,,,[],,,,
1500949462579134465,1500949462579134465,1646689212000.0,2022-03-07 13:40:12,-700,,"This is another clue that this virus is not natural but a man made and lab leak. Natural things cannot be so aggressive and dangerous straight away, they need to develop and eventually get there. #COVID #lableak #zoonosis",en,"['covid', 'lableak', 'zoonosis']",[],796203645314310148,796203645314310148,pgdifrancesco,P. Di Francesco,1,13,https://twitter.com/pgdifrancesco/status/1500949462579134465,[],[],0,,False,0,0,1,https://twitter.com/nytimes/status/1500944396937793536,#lableak,,,,,,,[],,,,
1500939370924326916,1500939370924326916,1646686806000.0,2022-03-07 13:00:06,-700,,"Shhh! This is an example of how reality can damage the ""approved #NeoMarxist narrative""!   Reps. Comer, Jordan expose new #Fauci emails, point to COVID-19 #lableak 'cover up'  https://t.co/ljm4wR47hu #FoxNews #Socialism @POTUS @VP @TheDemocrats #JoeBiden #KamalaHarris #DNC @DNC",en,"['neomarxist', 'fauci', 'lableak', 'foxnews', 'socialism', 'joebiden', 'kamalaharris', 'dnc']",[],4360328592,4360328592,karlvanover,KEVanOver ن  مسيحي,1,13,https://twitter.com/karlvanover/status/1500939370924326916,['https://www.foxnews.com/politics/reps-comer-jordan-new-fauci-emails-covid-19-lab-leak'],[],0,,False,0,0,0,,#lableak,,,,,,,[],,,,
1500848675848962051,1500848675848962051,1646665183000.0,2022-03-07 06:59:43,-700,,“Hard earned American taxpayer dollars should not be going…to labs that are controlled by the Chinese Communist Party.”  THANK YOU @GReschenthaler for working with WCW to INVESTIGATE the #WuhanLab &amp; COVID-19 origin #LabLeak 👏  https://t.co/rFotRAsMNG,en,"['wuhanlab', 'lableak']",[],248859211,248859211,WhiteCoatWaste,White Coat Waste Project 🥼🗑️,1,6,https://twitter.com/WhiteCoatWaste/status/1500848675848962051,[],[],1,https://pbs.twimg.com/ext_tw_video_thumb/1500848391361810437/pu/img/EDQQ27WBcPCXnsnp.jpg,False,28,1,11,,#lableak,,,,,,,[],,,,
1500846775296577541,1497483712505729027,1646664730000.0,2022-03-07 06:52:10,-700,,"@Shoshin41734407 @OpIndia_com ""two biological warfare labs in Kiev &amp; Odessa"" #lableak  https://t.co/rnKObODnUz",en,['lableak'],[],1006204277155561472,1006204277155561472,medikaltercume,🦠😷🦠,1,6,https://twitter.com/medikaltercume/status/1500846775296577541,['https://mobile.twitter.com/search?q=%20%22We%20have%20information%20that%20US%20built%20two%20biological%20warfare%20labs%20in%20Kiev%20%26%20Odessa.&src=typed_query'],[],0,,False,0,0,0,,#lableak,,,,,,,"[{'screen_name': 'Shoshin41734407', 'name': 'Shoshin', 'id': '1416682119661854726'}, {'screen_name': 'OpIndia_com', 'name': 'OpIndia.com', 'id': '74980737'}]",,,,
1500784824495316993,1500784824495316993,1646649960000.0,2022-03-07 02:46:00,-700,,"Exactly what was done with #LymeDisease. Would a confirmed #lableak origin of C19 lend credibility to the idea that #Lyme came from Plum Island? Journalists have utterly failed the public—asking the wrong questions  of the wrong people, further marginalizing the victims.",en,"['lymedisease', 'lableak', 'lyme']",[],2816046234,2816046234,BeauxReliosis,Beaux Reliosis,1,2,https://twitter.com/BeauxReliosis/status/1500784824495316993,[],[],0,,False,10,0,3,https://twitter.com/Ayjchan/status/1500557232701947915,#lableak,,,,,,,[],,,,
1500771541134594048,1500771541134594048,1646646793000.0,2022-03-07 01:53:13,-700,,"3,3% hart en vaat ziekten.. fuuuccckk wat een aantallen! The shit has hit the fan. Iedereen, blijf kijken naar Putin. Erg he wat daar gebeurd!! #afleiding #lableak #WEFGate",nl,"['afleiding', 'lableak', 'wefgate']",[],274874110,274874110,CreativeFrubser,Kristian Dansen,1,1,https://twitter.com/CreativeFrubser/status/1500771541134594048,[],[],0,,False,0,0,0,https://twitter.com/BossBlunts1/status/1498753272101978113,#lableak,,,,,,,[],,,,
1500761861125734403,1500761861125734403,1646644485000.0,2022-03-07 01:14:45,-700,,"Scientists released a pair of studies on Saturday that once again reprise the assertion that the #COVID19  pandemic began in a Wuhan market, not a lab. Case closed then, right?  #Wuhan #LabLeak #Covid #Pandemic  https://t.co/1PyPKvxx3J",en,"['covid19', 'wuhan', 'lableak', 'covid', 'pandemic']",[],1230089373103771648,1230089373103771648,michaelkhalsat1,Michael Khalsa,1,1,https://twitter.com/michaelkhalsat1/status/1500761861125734403,['https://rumble.com/vwgrjj-did-we-get-this-wrong.html'],[],0,,False,0,0,0,,#lableak,,,,,,,[],,,,
