id,conversation_id,created_at,date,timezone,place,tweet,language,hashtags,cashtags,user_id,user_id_str,username,name,day,hour,link,urls,photos,video,thumbnail,retweet,nlikes,nreplies,nretweets,quote_url,search,near,geo,source,user_rt_id,user_rt,retweet_id,reply_to,retweet_date,translate,trans_src,trans_dest
1495160816089325573,1495160816089325573,1645309091000.0,2022-02-19 14:18:11,-0700,,Izrael se nuklearizovao preko #France još 1957. Neregularno. Delovao podrivački pritom prema #JCPOA I na kraju smo videli kroz pandemiju da su i na polju #BioWeapons neodgovorni #BioTerrorims I mnogo toga što ukazuje da ih je KARTELIZACIJA deformisala kao državu ⤵️⤴️,und,"['france', 'jcpoa', 'bioweapons', 'bioterrorims']",[],352529588,352529588,TihTri,Tihomir Trišić,6,14,https://twitter.com/TihTri/status/1495160816089325573,[],[],0,,False,1,0,1,https://twitter.com/nukes_of_hazard/status/1368720681341493249,#bioweapons,,,,,,,[],,,,
1495105664754102273,1495105664754102273,1645295942000.0,2022-02-19 10:39:02,-0700,,Čitao sam vaš WHO izveštaj o poreklu pandemije od sisavaca sa pijace u Wuhan. Znate da su to gluposti. Reč je o dizajniranom #BioWeapons virusu i pandemiji sa #BioTerrorism karakteristikama #COVID19 Tako da je usled toga i najadekvatnije rešenje #MilltaryMedicine profila ⤵️,und,"['bioweapons', 'bioterrorism', 'covid19', 'milltarymedicine']",[],352529588,352529588,TihTri,Tihomir Trišić,6,10,https://twitter.com/TihTri/status/1495105664754102273,[],[],0,,False,0,0,0,https://twitter.com/TihTri/status/1367877425959419905,#bioweapons,,,,,,,[],,,,
1494959882000543744,1494959882000543744,1645261185000.0,2022-02-19 00:59:45,-0700,,Speak the truth even though people will hate you.... #chemtrails #bioweapons #geoengineering  #chemicalweapons  https://t.co/8GpFtEr151,en,"['chemtrails', 'bioweapons', 'geoengineering', 'chemicalweapons']",[],998373180837265409,998373180837265409,mysubuh,mysubuh,6,00,https://twitter.com/mysubuh/status/1494959882000543744,[],['https://pbs.twimg.com/media/FL8pFj9aUAEVPgQ.jpg'],1,https://pbs.twimg.com/media/FL8pFj9aUAEVPgQ.jpg,False,15,1,4,,#bioweapons,,,,,,,[],,,,
1494880912328302596,1494880912328302596,1645242357000.0,2022-02-18 19:45:57,-0700,,No Worries!  They have more #Bioweapons for us.   Count on it.,en,['bioweapons'],[],1094754512378781697,1094754512378781697,root_ball,Root Ball🤠Takes His Country Back🇺🇲,5,19,https://twitter.com/root_ball/status/1494880912328302596,[],[],0,,False,1,0,0,https://twitter.com/disclosetv/status/1494810193175195652,#bioweapons,,,,,,,[],,,,
1494844892442664960,1494804818883678209,1645233769000.0,2022-02-18 17:22:49,-0700,,@nodaworld 「ウイルス」一般の危険性においての、備考事項です。  「#Bioweapons の開発」の全般における、懸念事項。  病原体において。2つの成分を組み合わせた場合にのみ有効になるバイナリ「BioWeapons」エージェントが、発生する可能性が存在するとのこと。,ja,['bioweapons'],[],1182267889132294144,1182267889132294144,TILogAndDiary,TI Log And Diary,5,17,https://twitter.com/TILogAndDiary/status/1494844892442664960,[],[],0,,False,6,1,3,https://twitter.com/TILogAndDiary/status/1477731424677826561,#bioweapons,,,,,,,"[{'screen_name': 'nodaworld', 'name': '野田CEO', 'id': '268786155'}]",,,,
1494784455554347012,1494784455554347012,1645219360000.0,2022-02-18 13:22:40,-0700,,@CraigKellyMP thank you for your open truthful and transparency within @AustralianGovt #bioweapons upon the people is criminal … #exposing crimes against humanity these government officials are torturing people standing in their freedom holding onto democracy #CanberraConvoy  https://t.co/MWCycbImLj,en,"['bioweapons', 'exposing', 'canberraconvoy']",[],1474848911844167681,1474848911844167681,SianGissingMcM,sian gissing-mcmeel,5,13,https://twitter.com/SianGissingMcM/status/1494784455554347012,[],[],1,https://pbs.twimg.com/ext_tw_video_thumb/1494783004715233284/pu/img/dOfuZkhtHqoj6SUG.jpg,False,1,1,0,,#bioweapons,,,,,,,[],,,,
1494721591527227396,1494721591527227396,1645204372000.0,2022-02-18 09:12:52,-0700,,"E TUTTO PER IL BENE DELLA POPOLAZIONE ?!😈#genocidio, ⏰  WAKE UP!🔔 #armibiologiche, #bioweapons, #guerrabiologica, #biowar      #LRAD  ( 👉Long Range Acoustic Device ) Sonic #Weapon Used at Protest Against COVID-19 Vaccine Mandates !!😈 https://t.co/OjvClc5fMk  https://t.co/afOuiYc05m",en,"['genocidio', 'armibiologiche', 'bioweapons', 'guerrabiologica', 'biowar', 'lrad', 'weapon']",[],1342223197131993088,1342223197131993088,MDX_0x0,MDX😇🔥,5,09,https://twitter.com/MDX_0x0/status/1494721591527227396,['https://ussanews.com/lrad-sonic-weapon-used-at-protest-against-covid-19-vaccine-mandates/'],"['https://pbs.twimg.com/media/FL5RWfUWYAM5ha9.jpg', 'https://pbs.twimg.com/media/FL5RWzLXEAQgmXD.jpg', 'https://pbs.twimg.com/media/FL5RXJvXsAAPMSy.jpg', 'https://pbs.twimg.com/media/FL5RXZ9WQAIAsjE.jpg']",1,https://pbs.twimg.com/media/FL5RWfUWYAM5ha9.jpg,False,1,2,1,,#bioweapons,,,,,,,[],,,,
1494705200833126405,1494705200833126405,1645200464000.0,2022-02-18 08:07:44,-0700,,"Yesterday, top biodefense experts testified in front of the US Congress on the need for better preparation in dealing with #pandemics and #bioweapons threats.   @MatthewField2 shares an overview of some of the important points they made:  https://t.co/slyt0vVhxd",en,"['pandemics', 'bioweapons']",[],266635682,266635682,BulletinAtomic,Bulletin of the Atomic Scientists,5,08,https://twitter.com/BulletinAtomic/status/1494705200833126405,['http://ow.ly/nYQ150HYLQf'],[],0,,False,10,0,7,,#bioweapons,,,,,,,[],,,,
1494663719649005573,1494663719649005573,1645190574000.0,2022-02-18 05:22:54,-0700,,#Bioweapons #Terrorism #WANTED #Covid19 #Covid19Terrorism #MedicalTyranny #MedicalFascism  https://t.co/Wk3Sq8Xfit,und,"['bioweapons', 'terrorism', 'wanted', 'covid19', 'covid19terrorism', 'medicaltyranny', 'medicalfascism']",[],1356012014309683203,1356012014309683203,SaffaCrypto,Genocide Not Okay #Donbass #Ukraine #Genocide,5,05,https://twitter.com/SaffaCrypto/status/1494663719649005573,[],['https://pbs.twimg.com/media/FL4cjB_X0AYf-0x.jpg'],1,https://pbs.twimg.com/media/FL4cjB_X0AYf-0x.jpg,False,1,0,2,,#bioweapons,,,,,,,[],,,,
1494623386257039363,1494457982234423300,1645180958000.0,2022-02-18 02:42:38,-0700,,"@Ayjchan @imUrB00gieman Who in world at this point doesn't know that #covid19 was #nwo #billgates #obama.gov #fauci &amp; #ccp #china making #bioweapons [#gainoffunction] in #wuhan? Blaming Asian people is stupid but knowing what we know now, it's closer to #mentalilness same as ""it didn't come from a lab.""  https://t.co/zST8wCnubO",en,"['covid19', 'nwo', 'billgates', 'obama', 'fauci', 'ccp', 'china', 'bioweapons', 'gainoffunction', 'wuhan', 'mentalilness']",[],620825735,620825735,ThesilenceJames,Andrew James,5,02,https://twitter.com/ThesilenceJames/status/1494623386257039363,[],['https://pbs.twimg.com/media/FL34DEbX0AEIe5n.jpg'],1,https://pbs.twimg.com/media/FL34DEbX0AEIe5n.jpg,False,3,0,1,,#bioweapons,,,,,,,"[{'screen_name': 'Ayjchan', 'name': 'Alina Chan', 'id': '431762931'}, {'screen_name': 'imUrB00gieman', 'name': 'WICK', 'id': '1355347989821186058'}]",,,,
1494534273889714177,1494534273889714177,1645159712000.0,2022-02-17 20:48:32,-0700,, https://t.co/rD2OaYshe8 #BioWeapons #WakeUp,und,"['bioweapons', 'wakeup']",[],301076059,301076059,Shawn367,Shawny girl 🍊,4,20,https://twitter.com/Shawn367/status/1494534273889714177,['https://www.reignitedemocracyaustralia.com.au/symptoms-from-saturdays-protest/'],[],0,,False,0,0,0,,#bioweapons,,,,,,,[],,,,
1494466093183868938,1494466093183868938,1645143457000.0,2022-02-17 16:17:37,-0700,,#biologicalweapons #bioweapons    https://t.co/m9PSJATfxB,und,"['biologicalweapons', 'bioweapons']",[],1220673990080987136,1220673990080987136,RobertP48264217,Robert Petersen,4,16,https://twitter.com/RobertP48264217/status/1494466093183868938,['https://councilonstrategicrisks.org/understanding-the-threat-of-biological-weapons-in-a-world-with-covid-19/'],[],0,,False,1,0,0,,#bioweapons,,,,,,,[],,,,
1494425685691092994,1494425685691092994,1645133823000.0,2022-02-17 13:37:03,-0700,,"The Chickens have come Home to Roost indicating too many that USA #Bioweapons labs were the original source of #Covid19: U.S. smaller population now leads the entire world in #Covid19 deaths, day after Trump announces 'opening our country' task force.   https://t.co/Zr7JE8134n",en,"['bioweapons', 'covid19', 'covid19']",[],101386226,101386226,360CNN,A. Smith,4,13,https://twitter.com/360CNN/status/1494425685691092994,['https://www.nbcnews.com/news/world/trump-launch-opening-our-country-task-force-global-deaths-pass-n1181796'],[],0,,False,0,0,0,,#bioweapons,,,,,,,[],,,,
1494424173015404547,1494424173015404547,1645133462000.0,2022-02-17 13:31:02,-0700,,Biodefense experts to Congress: The United States is still unprepared for #pandemic and #bioweapons threats  https://t.co/8sSP8eukH1,en,"['pandemic', 'bioweapons']",[],266635682,266635682,BulletinAtomic,Bulletin of the Atomic Scientists,4,13,https://twitter.com/BulletinAtomic/status/1494424173015404547,['http://ow.ly/py2B50HY5Nm'],[],0,,False,7,0,4,,#bioweapons,,,,,,,[],,,,
1494344709208223748,1494344709208223748,1645114516000.0,2022-02-17 08:15:16,-0700,,#covid #vaccines #bioweapons #lockdowns #maskmandates  https://t.co/85P4NZgpvb,und,"['covid', 'vaccines', 'bioweapons', 'lockdowns', 'maskmandates']",[],32303121,32303121,DjCoolstyle,Cool Style,4,08,https://twitter.com/DjCoolstyle/status/1494344709208223748,[],['https://pbs.twimg.com/media/FLz6XJSXsAQi7f-.jpg'],1,https://pbs.twimg.com/media/FLz6XJSXsAQi7f-.jpg,False,0,0,0,,#bioweapons,,,,,,,[],,,,
1494267842979680262,1494267842979680262,1645096190000.0,2022-02-17 03:09:50,-0700,,"To vam je valjda jasno šta sam vam napisao pod “22 vek” pre godinu dana, vama u EU. To vam je #Tehnology oblast. I da li pandemija ima prirodno poreklo od “sisavaca” sa pijace u Wuhan kako #Fake kaže izveštaj WHO ili je reč o dizajniranom virusu #BioWeapons Good morning ⤵️",und,"['tehnology', 'fake', 'bioweapons']",[],352529588,352529588,TihTri,Tihomir Trišić,4,03,https://twitter.com/TihTri/status/1494267842979680262,[],[],0,,False,0,0,0,https://twitter.com/TihTri/status/1368643673773248513,#bioweapons,,,,,,,[],,,,
1494266659162492929,1494266659162492929,1645095908000.0,2022-02-17 03:05:08,-0700,,#CCP #bioweapons.   https://t.co/VLGSvMA0N5,und,"['ccp', 'bioweapons']",[],832435481283612672,832435481283612672,Truthsayer7077,TruthSayer7077,4,03,https://twitter.com/Truthsayer7077/status/1494266659162492929,['https://rumble.com/vv4fxx-chinese-whistleblower-exposes-ccps-plan-to-rule-the-world-with-biosecurity.html'],[],0,,False,0,0,0,,#bioweapons,,,,,,,[],,,,
1494213048407527425,1494210483372498946,1645083126000.0,2022-02-16 23:32:06,-0700,,"In 1989, Vladimir Pasechnik defected from the Former #Soviet Union (FSU) to Great #Britain while on a trip to Paris. He had been the top scientist in the FSU's #bioweapons program, which is heavily dependent upon DNA sequencing. @charlesmok  https://t.co/SkzaAMzqmM",en,"['soviet', 'britain', 'bioweapons']",[],1429842973768962049,1429842973768962049,cpggtp,Pietro Ponzi,3,23,https://twitter.com/cpggtp/status/1494213048407527425,[],['https://pbs.twimg.com/media/FLyC2U2UUAAAHRp.jpg'],1,https://pbs.twimg.com/media/FLyC2U2UUAAAHRp.jpg,False,0,0,0,,#bioweapons,,,,,,,[],,,,
