id,conversation_id,created_at,date,timezone,place,tweet,language,hashtags,cashtags,user_id,user_id_str,username,name,day,hour,link,urls,photos,video,thumbnail,retweet,nlikes,nreplies,nretweets,quote_url,search,near,geo,source,user_rt_id,user_rt,retweet_id,reply_to,retweet_date,translate,trans_src,trans_dest
1492645309876477957,1492645309876477957,1644709348000.0,2022-02-12 15:42:28,-700,,What can we learn about Bill by seeing the new direction his ex is taking in her philanthropic efforts?  #Gates #WEFGate #Philanthropy #WorldEconomicForum #Control #oneworldgovernment #NWO #DepopulationAgenda #Eugenics #MelindaFrenchGates #MelindaGates   https://t.co/8UXmYyYZYg,en,"['gates', 'wefgate', 'philanthropy', 'worldeconomicforum', 'control', 'oneworldgovernment', 'nwo', 'depopulationagenda', 'eugenics', 'melindafrenchgates', 'melindagates']",[],279105896,279105896,ResearcherBy,LW. PhD,6,15,https://twitter.com/ResearcherBy/status/1492645309876477957,['https://www.inc.com/jeff-steen/melinda-gates-shifts-her-wealth-away-from-gates-foundation-her-1-sentence-reason-turns-modern-leadership-upside-down.html'],[],0,,False,2,1,2,,#depopulationagenda,,,,,,,[],,,,
1492615338151845895,1492615338151845895,1644702202000.0,2022-02-12 13:43:22,-700,,#DepopulationAgenda,und,['depopulationagenda'],[],806338794056253440,806338794056253440,AwakeningTV2,TV is a Mind Control Device,6,13,https://twitter.com/AwakeningTV2/status/1492615338151845895,[],[],0,,False,0,0,0,https://twitter.com/Mad_F/status/1492123920887169024,#depopulationagenda,,,,,,,[],,,,
1492592893281722369,1492592893281722369,1644696851000.0,2022-02-12 12:14:11,-700,,"If #HIV is the 1st ingredient in the jab 💉does that mean HIV is mostly what it’s made up of. You know like food ingredients on a box of something. Either way, that’s fkd up. #DepopulationAgenda #CrimesAgainstHumanity #LockFauciUpNOW  https://t.co/og8IpHYol3",en,"['hiv', 'depopulationagenda', 'crimesagainsthumanity', 'lockfauciupnow']",[],1390419209927102464,1390419209927102464,Mel2Marz,Mel,6,12,https://twitter.com/Mel2Marz/status/1492592893281722369,[],['https://pbs.twimg.com/media/FLbBU31UcAAEc_R.jpg'],1,https://pbs.twimg.com/media/FLbBU31UcAAEc_R.jpg,False,0,1,2,,#depopulationagenda,,,,,,,[],,,,
1492589832891207682,1492589832891207682,1644696121000.0,2022-02-12 12:02:01,-700,,#DepopulationAgenda   https://t.co/BNY1VGXlcX,und,['depopulationagenda'],[],1382574987425501187,1382574987425501187,GloriaR56965767,GRV,6,12,https://twitter.com/GloriaR56965767/status/1492589832891207682,['https://www.reddit.com/r/conspiracy/comments/qw69yx/pfizer_vaccine_is_using_sterilization_delivery/?utm_source=share&utm_medium=ios_app&utm_name=iossmf'],[],0,,False,1,0,0,,#depopulationagenda,,,,,,,[],,,,
1492583532962717699,1492583532962717699,1644694619000.0,2022-02-12 11:36:59,-700,,#DepopulationAgenda,und,['depopulationagenda'],[],806338794056253440,806338794056253440,AwakeningTV2,TV is a Mind Control Device,6,11,https://twitter.com/AwakeningTV2/status/1492583532962717699,[],[],0,,False,0,0,0,https://twitter.com/Wildebeestguy/status/1492437402362814467,#depopulationagenda,,,,,,,[],,,,
1492509618156851202,1492465870236487684,1644676997000.0,2022-02-12 06:43:17,-700,,"@pirate_baltic 🙏🏼 Wozu? Überleben werden nur die bodenständigsten 😎während die anderen nicht merken wie Ihnen alles unterm Hintern weg #geschossen wird.  So oder so geht’s den obsessiven ... um dreisten #Massenmord in #Europa, egal unter welchem #Vorwand #Menschheitsfamilie #DepopulationAgenda",de,"['geschossen', 'massenmord', 'europa', 'vorwand', 'menschheitsfamilie', 'depopulationagenda']",[],377013645,377013645,CarolaJojo,👁🙏🏼👁 #FirstDoNoHarm #Immunsystem #Menschheit,6,6,https://twitter.com/CarolaJojo/status/1492509618156851202,[],[],0,,False,0,0,0,,#depopulationagenda,,,,,,,"[{'screen_name': 'pirate_baltic', 'name': ""BalticPirate (versteckt sich in Sissi's Bett 🤭)"", 'id': '1256320851235962880'}]",,,,
1492509092136562693,1492509092136562693,1644676871000.0,2022-02-12 06:41:11,-700,,"Rarity; Putin speaks,wisely. They are trying to lure us into a war! Russians doesn't want a war. Ukraine doesn't want a war. Nobody wants a war. Except for #NWO scum. A war greatly helps their #DepopulationAgenda &amp; makes them a fortune as they own or invested in weapons! #JailWEF",en,"['nwo', 'depopulationagenda', 'jailwef']",[],1467994743430864903,1467994743430864903,KitKat_McTruthy,Kat_Cat,6,6,https://twitter.com/KitKat_McTruthy/status/1492509092136562693,[],[],0,,False,0,0,0,https://twitter.com/2Ajaxfriend/status/1491333988593684485,#depopulationagenda,,,,,,,[],,,,
1492437384218165250,1492437384218165250,1644659775000.0,2022-02-12 01:56:15,-700,,"So therefore #GATES THOUGHT IT WOULD BE WISE TO BUY UP THE FARMLAND FOR HIMSELF &amp; CREATE A B!0W3@P0N FOR EVERYONE ELSE because you see, AFTER they buy it all up, there just isn't enough LAND to go around. It's better for them to get rid of us instead #EUGENICS #DEPOPULATIONAGENDA",en,"['gates', 'eugenics', 'depopulationagenda']",[],2820675258,2820675258,ClickyBuzz_c2c,Clicky #BuzzChatLive 🐝 🎙️,6,1,https://twitter.com/ClickyBuzz_c2c/status/1492437384218165250,[],[],0,,False,2,0,0,https://twitter.com/morr67329099/status/1491717838750498817,#depopulationagenda,,,,,,,[],,,,
