id,conversation_id,created_at,date,timezone,place,tweet,language,hashtags,cashtags,user_id,user_id_str,username,name,day,hour,link,urls,photos,video,thumbnail,retweet,nlikes,nreplies,nretweets,quote_url,search,near,geo,source,user_rt_id,user_rt,retweet_id,reply_to,retweet_date,translate,trans_src,trans_dest
1503509351423750147,1503471126692966404,1647299537000.0,2022-03-14 16:12:17,-700,,@MagisterBracey Nothing really different than if everyone was wearing mask. #MasksDontWork,en,['masksdontwork'],[],44459525,44459525,4TiffanyJustice,Tiffany Justice,1,16,https://twitter.com/4TiffanyJustice/status/1503509351423750147,[],[],0,,False,3,0,0,,#masksdontwork,,,,,,,"[{'screen_name': 'MagisterBracey', 'name': 'John Bracey', 'id': '281666501'}]",,,,
1503503517562159111,1503503517562159111,1647298146000.0,2022-03-14 15:49:06,-700,,Scientists say those masks are utterly useless and psychiatrists say your a bad parent. Your restricting their airflow so you can feel responsible. And those are two boys and three girls for the record. #LiberalismIsAMentalDisorder #TrudeauTyranny #MasksDontWork,en,"['liberalismisamentaldisorder', 'trudeautyranny', 'masksdontwork']",[],1490437497708584968,1490437497708584968,3dom4domfreedom,Jeff Senior,1,15,https://twitter.com/3dom4domfreedom/status/1503503517562159111,[],[],0,,False,0,1,0,https://twitter.com/BreannaPhipps12/status/1503095884015452170,#masksdontwork,,,,,,,[],,,,
1503485329461989377,1503485329461989377,1647293810000.0,2022-03-14 14:36:50,-700,,They want us ENSLAVED! ⚠️⚠️⚠️ The Buffoon @POTUS does Not do SCIENCE Obviously 🤬 #MasksDontWork  https://t.co/GfWwIrdY6M,en,['masksdontwork'],[],1243264327823626240,1243264327823626240,Conserv76161604,ConservativeGal,1,14,https://twitter.com/Conserv76161604/status/1503485329461989377,[],['https://pbs.twimg.com/media/FN1z8BAXwAkPuKu.jpg'],1,https://pbs.twimg.com/media/FN1z8BAXwAkPuKu.jpg,False,0,0,0,https://twitter.com/RandPaul/status/1501955794157330443,#masksdontwork,,,,,,,[],,,,
1503460071824576513,1503460071824576513,1647287788000.0,2022-03-14 12:56:28,-700,,That and #MasksDontWork,en,['masksdontwork'],[],492410227,492410227,griffey1965,Dog Faced Pony Soldier Tim Griffiths,1,12,https://twitter.com/griffey1965/status/1503460071824576513,[],[],0,,False,0,0,0,https://twitter.com/RMConservative/status/1503450717314502657,#masksdontwork,,,,,,,[],,,,
1503443582979649545,1503443582979649545,1647283857000.0,2022-03-14 11:50:57,-700,,"Good example of #MasksDontWork!  Many started coming around to ""cloth masks are useless"" and ""surgical masks aren't much better"" but kept pushing N95s as the be all, end all. But the virus is still small enough to penetrate AND they have to fit and be worn and used properly.",en,['masksdontwork'],[],1479224091613798406,1479224091613798406,space_florida,SpaceCoastFloridaMan,1,11,https://twitter.com/space_florida/status/1503443582979649545,[],[],0,,False,0,0,0,https://twitter.com/ianmSC/status/1503427965605933057,#masksdontwork,,,,,,,[],,,,
1503421672916930561,1503417394282311689,1647278633000.0,2022-03-14 10:23:53,-700,,"@GovKathyHochul New Yorkers couldn’t come together due to tyrannical edicts such as lockdowns, masks, and v@xs. Now even the CDC accept how damaging those policies have been for the population! #masksdontwork #lockdownskill #VaccineSideEffects #vaccineLowEfficacy",en,"['masksdontwork', 'lockdownskill', 'vaccinesideeffects', 'vaccinelowefficacy']",[],1454943463,1454943463,adrianafitnall,Adriana FitnAll🇺🇸✊🏻,1,10,https://twitter.com/adrianafitnall/status/1503421672916930561,[],[],0,,False,7,0,1,,#masksdontwork,,,,,,,"[{'screen_name': 'GovKathyHochul', 'name': 'Kathy Hochul', 'id': '2977083957'}]",,,,
1503415424410521602,1503415424410521602,1647277143000.0,2022-03-14 09:59:03,-700,,When I drop my son off at the high school I always get sad to see so many kids still wearing masks.   They are still living in fear after being terrorized for two years w/ blatant propaganda.   Very sad that they have parents who continue to feed into those fears.  #MasksDontWork,en,['masksdontwork'],[],790629748024029184,790629748024029184,megdogwuff,Magan 🍊⭐️ I Will Not Comply 🇺🇸,1,9,https://twitter.com/megdogwuff/status/1503415424410521602,[],[],0,,False,38,7,13,,#masksdontwork,,,,,,,[],,,,
1503414495594622985,1503379686541475858,1647276922000.0,2022-03-14 09:55:22,-700,,@ArminGrau #masksdontwork und machen #MIES.  Zudem schaden sie wegen der  Virenrückatmung.  https://t.co/qH6YIDNIWu,de,"['masksdontwork', 'mies']",[],1269985268779692032,1269985268779692032,AnLa18294437,An La,1,9,https://twitter.com/AnLa18294437/status/1503414495594622985,['https://zachariasfoegen.wordpress.com/2022/03/08/der-foegen-effekt/'],[],0,,False,2,0,0,,#masksdontwork,,,,,,,"[{'screen_name': 'ArminGrau', 'name': 'Armin Grau', 'id': '1451274021518069770'}]",,,,
