id,conversation_id,created_at,date,timezone,place,tweet,language,hashtags,cashtags,user_id,user_id_str,username,name,day,hour,link,urls,photos,video,thumbnail,retweet,nlikes,nreplies,nretweets,quote_url,search,near,geo,source,user_rt_id,user_rt,retweet_id,reply_to,retweet_date,translate,trans_src,trans_dest
1503519002341036034,1503517787750375430,1647301838000.0,2022-03-14 16:50:38,-700,,"#Earth  ""We hate this episode.""  #QAnon",en,"['earth', 'qanon']",[],1478933970263977984,1478933970263977984,Catheri93400573,Valleri the Red,1,16,https://twitter.com/Catheri93400573/status/1503519002341036034,[],[],0,,False,0,0,0,,#QAnon,,,,,,,[],,,,
1503514944410726403,1501306008181911553,1647300871000.0,2022-03-14 16:34:31,-700,,"@Jaradvm The MegaAnon and #QAnon conspiracy theories arose at the same time, in the same place, with proponents of both theories interacting, and even clashing, writes @Jaradvm for @TheSkepticMag.  https://t.co/b9XmHc9cj6",en,['qanon'],[],81179597,81179597,cambskeptics,Cambridge Skeptics,1,16,https://twitter.com/cambskeptics/status/1503514944410726403,['https://buff.ly/36fWwFf'],[],0,,False,0,0,0,,#QAnon,,,,,,,"[{'screen_name': 'Jaradvm', 'name': 'Jarad', 'id': '1252392023606394880'}]",,,,
1503514758737063936,1494458806620680199,1647300827000.0,2022-03-14 16:33:47,-700,,"Backstory on #US #biolabs"" conspiracy theory, apparently referring to efforts to manage post-Soviet weapons in #Ukraine. It ""has taken over as the prevailing narrative on pro-Trump and #QAnon websites"" and now jumped to #Russia's media as a talking point.   https://t.co/lpRPE11jVU",en,"['us', 'biolabs', 'ukraine', 'qanon', 'russia']",[],116914454,116914454,BillyMallard,William Mallard,1,16,https://twitter.com/BillyMallard/status/1503514758737063936,['https://www.nbcnews.com/tech/internet/qanon-ukraine-biolabs-russian-propaganda-efforts-boosted-us-far-right-rcna19392'],[],0,,False,4,2,0,,#QAnon,,,,,,,[],,,,
1503514695843696646,1501306008181911553,1647300812000.0,2022-03-14 16:33:32,-700,,"@Jaradvm While the MegaAnon and #QAnon conspiracy theories were created separately, their ideas quickly cross-pollinated to create a shared universe, writes @Jaradvm for @TheSkepticMag.  https://t.co/QxBHvPA0Xl",en,['qanon'],[],81179597,81179597,cambskeptics,Cambridge Skeptics,1,16,https://twitter.com/cambskeptics/status/1503514695843696646,['https://buff.ly/34EjHJd'],[],0,,False,0,0,0,,#QAnon,,,,,,,"[{'screen_name': 'Jaradvm', 'name': 'Jarad', 'id': '1252392023606394880'}]",,,,
1503514272122482692,1501306008181911553,1647300711000.0,2022-03-14 16:31:51,-700,,"@Jaradvm The message board that birthed the #QAnon conspiracy was host to a string of failed conspiracies, by looking their failures, we can learn why QAnon flourished, writes @Jaradvm for @TheSkepticMag.  https://t.co/8Yil8XVgFo",en,['qanon'],[],81179597,81179597,cambskeptics,Cambridge Skeptics,1,16,https://twitter.com/cambskeptics/status/1503514272122482692,['https://buff.ly/3KBBJLq'],[],0,,False,0,0,0,,#QAnon,,,,,,,"[{'screen_name': 'Jaradvm', 'name': 'Jarad', 'id': '1252392023606394880'}]",,,,
1503510858663485443,1503510858663485443,1647299897000.0,2022-03-14 16:18:17,-700,, https://t.co/ImUMXWrONc 【情報】 #TIME 誌が選んだ #Q ・ #Qanon の正体は #プーチン !? #wwg1wga とは?分断の象徴を知るとアメリカが少し分かる。  https://t.co/63f6cYizgX,ja,"['time', 'q', 'qanon', 'プーチン', 'wwg1wga']",[],980014960490160128,980014960490160128,BuzFix,KayZ,1,16,https://twitter.com/BuzFix/status/1503510858663485443,['http://buzfix.tokyo/2018/09/qanon/'],['https://pbs.twimg.com/media/DmLdWjAUYAAqHkm.jpg'],1,https://pbs.twimg.com/media/DmLdWjAUYAAqHkm.jpg,False,2,0,0,,#QAnon,,,,,,,[],,,,
1503505851000229893,1503505851000229893,1647298703000.0,2022-03-14 15:58:23,-700,,"No surprise here. The masses believe any bs #propaganda be it #qanon, #Bannon #TuckerCarlson  or at #Putin. Having said that, Tucker is hiding his real nationality. He's Russian, isn't he?!  #Birtherism",en,"['propaganda', 'qanon', 'bannon', 'tuckercarlson', 'putin', 'birtherism']",[],871762061302300673,871762061302300673,V_de_Quimper,V. de Quimper 🇪🇺🌻,1,15,https://twitter.com/V_de_Quimper/status/1503505851000229893,[],[],0,,False,0,0,0,https://twitter.com/HannaLiubakova/status/1503381998206861314,#QAnon,,,,,,,[],,,,
1503500095807008769,1503500095807008769,1647297331000.0,2022-03-14 15:35:31,-700,,You know who else places #TuckerCarlson with subtitles in Spanish? Private #QAnon channels with thousands of subscribers around the world and in the U.S.,en,"['tuckercarlson', 'qanon']",[],52491611,52491611,EvelynPR,Evelyn Pérez-Verdía #Pro-Democracia,1,15,https://twitter.com/EvelynPR/status/1503500095807008769,[],[],0,,False,4,0,2,,#QAnon,,,,,,,[],,,,
1503497911950319624,1501509313344331778,1647296810000.0,2022-03-14 15:26:50,-700,,@elisethoma5 So in other words the 3 #qanon imbeciles that were planning a terrorist attack in #wuhan for for the last 2 years were given the wrong targeting info…by #qanon?,en,"['qanon', 'wuhan', 'qanon']",[],1375958934679343108,1375958934679343108,harrygr68605786,Harry Grimes,1,15,https://twitter.com/harrygr68605786/status/1503497911950319624,[],[],0,,False,0,0,0,,#QAnon,,,,,,,"[{'screen_name': 'elisethoma5', 'name': 'Elise Thomas', 'id': '3003083709'}]",,,,
1503493698952253451,1503493698952253451,1647295806000.0,2022-03-14 15:10:06,-700,,@AlbertaParty 's DT cycle track would homo-fornicate In the senate unless we protect children against LGBTQ news #yyc  #Qanon #abvote,en,"['yyc', 'qanon', 'abvote']",[],920672018776825856,920672018776825856,LarryHeatherBot,🏛Larry Heather Bot,1,15,https://twitter.com/LarryHeatherBot/status/1503493698952253451,[],[],0,,False,1,0,0,,#QAnon,,,,,,,[],,,,
1503491131878752258,1503491131878752258,1647295194000.0,2022-03-14 14:59:54,-700,,The government should stop any government assistance to people like her. She probably sits all day researching crazy shit like this.🤦🏻‍♀️  #TruckerConvoy #QAnonCult #Qanon,en,"['truckerconvoy', 'qanoncult', 'qanon']",[],819014526745968640,819014526745968640,LaResistance01,News Junky 🇺🇦🌻🕊,1,14,https://twitter.com/LaResistance01/status/1503491131878752258,[],[],0,,False,2,0,0,https://twitter.com/thegoodliars/status/1503470345436684289,#QAnon,,,,,,,[],,,,
1503484453112406019,1503471378867134466,1647293601000.0,2022-03-14 14:33:21,-700,,"@IronErnst Ja, das ist so, @IronErnst 💁‍♂️. Habe ja schon 2015 in „Öl- und Glaubenskriege“ mit der #Rentierstaatstheorie vor #Putin gewarnt, danach auch immer wieder vor #Trump, #Querdenken &amp; #QAnon… Die mögen mich nicht. 💁‍♂️  https://t.co/st8CcReLPX",de,"['rentierstaatstheorie', 'putin', 'trump', 'querdenken', 'qanon']",[],23929169,23929169,BlumeEvolution,Dr. Michael Blume,1,14,https://twitter.com/BlumeEvolution/status/1503484453112406019,['https://scilogs.spektrum.de/natur-des-glaubens/putin-eskaliert-den-konflikt-zwischen-dem-iran-saudi-arabien-und-israel/'],[],0,,False,18,1,1,,#QAnon,,,,,,,"[{'screen_name': 'IronErnst', 'name': 'IronErnst', 'id': '1500233077670526978'}]",,,,
1503483603312914433,1503483603312914433,1647293399000.0,2022-03-14 14:29:59,-700,,"""Regrettably, for a number of years, I worked at #FoxNews &amp; worked on #MAGA #QAnon propaganda, I am very ashamed of this right now. Ashamed that I was allowed to tell lies from the tv screen. Ashamed that I allowed the zombification of #Trump supporters.""  https://t.co/KQt6LF6Km8",en,"['foxnews', 'maga', 'qanon', 'trump']",[],911961538814255105,911961538814255105,SonOfAlgos,𝘾𝙤𝙤𝙡 𝘽𝙡𝙪𝙚 Persuasion 🆒💙⚠️🗽🇺🇸⚠️,1,14,https://twitter.com/SonOfAlgos/status/1503483603312914433,['https://www.theguardian.com/world/2022/mar/14/russian-tv-employee-interrupts-news-broadcast-marina-ovsyannikova'],[],0,,False,3,1,0,,#QAnon,,,,,,,[],,,,
1503481837288624130,1503481837288624130,1647292978000.0,2022-03-14 14:22:58,-700,,"Pathetic to see #GOP office holders calling for Dr #Fauci to be jailed for some insane #Qanon conspiracy theory. There have always been dangerously insane people on the fringes of this country, but they’ve now taken over control of the #Republican Party. #QOP #TrumpCult #Trump",en,"['gop', 'fauci', 'qanon', 'republican', 'qop', 'trumpcult', 'trump']",[],1091079040084127746,1091079040084127746,2kLiberty,Common Sense,1,14,https://twitter.com/2kLiberty/status/1503481837288624130,[],[],0,,False,18,3,5,,#QAnon,,,,,,,[],,,,
1503478203989463041,1503478203989463041,1647292111000.0,2022-03-14 14:08:31,-700,,"Tonight when you lay your head on your pillow, you can sleep well knowing my campaign is being bank rolled by pillow man! I met him at the bar at the pool and he just kept shoving $20s in my pocket. What a great guy!! Sorry, he gave me a discount code, but I forgot it! #Qanon  https://t.co/J77sRQNcha",en,['qanon'],[],3291135818,3291135818,RodneyAssman,Rodney Assman,1,14,https://twitter.com/RodneyAssman/status/1503478203989463041,[],['https://pbs.twimg.com/media/FN1tdRuUcAMBR3z.jpg'],1,https://pbs.twimg.com/media/FN1tdRuUcAMBR3z.jpg,False,2,0,0,,#QAnon,,,,,,,[],,,,
1503476147891281924,1503476147891281924,1647291621000.0,2022-03-14 14:00:21,-700,,Am I doing it right? #QAnon #FollowTheWhiteRabbit #TickTockTickTock #PitterPatter,en,"['qanon', 'followthewhiterabbit', 'ticktockticktock', 'pitterpatter']",[],990985771606728705,990985771606728705,SeanSpammity,Sean Spammity,1,14,https://twitter.com/SeanSpammity/status/1503476147891281924,[],[],0,,False,0,0,0,,#QAnon,,,,,,,[],,,,
1503475078020935683,1503475078020935683,1647291366000.0,2022-03-14 13:56:06,-700,,I’m fully convinced at this point that Q is a creation of Russian Intelligence and the entire #qanon conspiracy is a Russian disinformation operation aimed at the #MAGA right,en,"['qanon', 'maga']",[],47298435,47298435,Evan_GoCats,Evan L,1,13,https://twitter.com/Evan_GoCats/status/1503475078020935683,[],[],0,,False,3,1,0,,#QAnon,,,,,,,[],,,,
1503471331223945219,1503471331223945219,1647290473000.0,2022-03-14 13:41:13,-700,,"that's just how activist journalism works: ""randomly pulling idiotic conspiracy theories from #QAnon randos is good enough for the Tucker/Greenwald Alt-Right Industrial Complex"" @LemieuxLGM  https://t.co/2vgAEQGDU8 #TuckerCarlsonRussianAsset",en,"['qanon', 'tuckercarlsonrussianasset']",[],14304930,14304930,dgolumbia,"David ""🌷🗿🌷"" Golumbia",1,13,https://twitter.com/dgolumbia/status/1503471331223945219,['https://www.lawyersgunsmoneyblog.com/2022/03/every-old-pretext-is-new-again'],[],0,,False,2,0,0,,#QAnon,,,,,,,[],,,,
1503467840325787652,1503398288707436550,1647289640000.0,2022-03-14 13:27:20,-700,,"@DonaldJTrumpJr #LetsGo @ananavarro kick some ass!  Not everyone has the correct moral compass to have the privilege of freedom of speech.  They abuse it without any #accountability, i.e. #GOL #MAGA #QAnon #TuckerCarson #TulsiGabbard #MarjorieTaylorGreene   Just to name a few.",en,"['letsgo', 'accountability', 'gol', 'maga', 'qanon', 'tuckercarson', 'tulsigabbard', 'marjorietaylorgreene']",[],1445714028689461256,1445714028689461256,samyglot1,Sam,1,13,https://twitter.com/samyglot1/status/1503467840325787652,[],[],0,,False,0,0,0,,#QAnon,,,,,,,"[{'screen_name': 'DonaldJTrumpJr', 'name': 'Donald Trump Jr.', 'id': '39344374'}]",,,,
1503466337011703814,1503466337011703814,1647289282000.0,2022-03-14 13:21:22,-700,,"To all the #QAnon /Putin supporters... You should give serious consideration that whoever isreleasing conspiracies as ""Q"", could very well be Russians who want to spread disinformation in the US.",en,['qanon'],[],328260787,328260787,jsc1835,Jean,1,13,https://twitter.com/jsc1835/status/1503466337011703814,[],[],0,,False,2,1,1,,#QAnon,,,,,,,[],,,,
1503461190483259401,1503461190483259401,1647288055000.0,2022-03-14 13:00:55,-700,,All of you #qanoncult a bunch of treasonous antiamerican flunkies yall beed to take yallselves to russia so yall can be his slaves and crashtest dummies… america dont need #qanon regects!!!!!,en,"['qanoncult', 'qanon']",[],914688470454501376,914688470454501376,BODGmediaempire,director:Bamir El Amin🎥ig:bodgmediaempire,1,13,https://twitter.com/BODGmediaempire/status/1503461190483259401,[],[],0,,False,0,0,0,,#QAnon,,,,,,,[],,,,
1503460745945698308,1503460745945698308,1647287949000.0,2022-03-14 12:59:09,-700,,#QAnon pro-Trump right wing conspiracy movement embraces Putin and tries to justify Russia’s invasion of Ukraine     https://t.co/ME6wPn6RI7,en,['qanon'],[],2857124404,2857124404,SummertonNews,Summerton News,1,12,https://twitter.com/SummertonNews/status/1503460745945698308,['https://www.vice.com/en/article/93bgxd/qanon-russia-putin'],[],0,,False,0,0,0,,#QAnon,,,,,,,[],,,,
1503459260981780482,1503459260981780482,1647287595000.0,2022-03-14 12:53:15,-700,,#GOPPartyOfPutin:   @GOP Putin-loving #CONservatives 'Conspiracy Theory On Ukrainian Biolabs Is 'Dumber Than You Imagine':  Based On #QAnon's Fake Claim Of Dangerous Bioweapons Laboratories Within The Country Of #Ukraine↷  https://t.co/lHp8p57WM9 / #OpResistance  https://t.co/BD4aSCx5Vf,en,"['goppartyofputin', 'conservatives', 'qanon', 'ukraine', 'opresistance']",[],76067448,76067448,AnonymousBC1,AnonymousBC🍀,1,12,https://twitter.com/AnonymousBC1/status/1503459260981780482,['https://tinyurl.com/3779nybn'],['https://pbs.twimg.com/media/FN1cMJJXEAQdEde.jpg'],1,https://pbs.twimg.com/media/FN1cMJJXEAQdEde.jpg,False,1,0,2,,#QAnon,,,,,,,[],,,,
1503450910638358538,1503450910638358538,1647285604000.0,2022-03-14 12:20:04,-700,,#QAnon #Trump #Putin -,und,"['qanon', 'trump', 'putin']",[],140015085,140015085,mark_tights,Mark Schneider 🇪🇺 🚦 vollst. geimpft+geboostert,1,12,https://twitter.com/mark_tights/status/1503450910638358538,[],[],0,,False,0,0,0,https://twitter.com/oneunderscore__/status/1503389183590612992,#QAnon,,,,,,,[],,,,
1503448948341723140,1503448948341723140,1647285136000.0,2022-03-14 12:12:16,-700,,"Reminder: QAnon loves Putin and Russia, and believers continue to pray for violence in the U.S. Or as they love to put it, ""public executions."" #QAnon #conspiracytheories #Anons #Ukraine  https://t.co/pDVL95IoJs",en,"['qanon', 'conspiracytheories', 'anons', 'ukraine']",[],6604072,6604072,PasteMagazine,Paste Magazine,1,12,https://twitter.com/PasteMagazine/status/1503448948341723140,['https://www.pastemagazine.com/politics/qanon/qanon-russia-putin-ukraine-conspiracy-theories-public-executions/'],[],0,,False,4,0,2,,#QAnon,,,,,,,[],,,,
1503446185687748608,1503446185687748608,1647284478000.0,2022-03-14 12:01:18,-700,,"The latest data drop from #Qanon exposes the conspirators who are meeting to perform machinations against god-fearing Americans. As usual, the DEMs turn a blind eye to the ringleaders.",en,['qanon'],[],830017898089414656,830017898089414656,trumpscuttlebot,clockworkOrangeTrump,1,12,https://twitter.com/trumpscuttlebot/status/1503446185687748608,[],[],0,,False,0,0,0,,#QAnon,,,,,,,[],,,,
1503444904701317121,1503444513746034696,1647284172000.0,2022-03-14 11:56:12,-700,,@AnimeEBoy3 So true! Trump 2024! #Trump2024 #TrumpWasRightAboutEverything #QAnon #TRUMP2024ToSaveAmerica #MassiveFraud,en,"['trump2024', 'trumpwasrightabouteverything', 'qanon', 'trump2024tosaveamerica', 'massivefraud']",[],1152607885265920000,1152607885265920000,uncfr4nk,uncfrank,1,11,https://twitter.com/uncfr4nk/status/1503444904701317121,[],[],0,,False,1,0,0,,#QAnon,,,,,,,"[{'screen_name': 'AnimeEBoy3', 'name': 'Anime_Logan 🧀 🇺🇸 🇭🇺', 'id': '1481016584617476097'}]",,,,
1503438220171747328,1503438220171747328,1647282578000.0,2022-03-14 11:29:38,-700,,Beware what you call real news. You may be duped and be propagating #fakeNews yourself. #propaganda #QAnon #ConspiracyTheories  https://t.co/YetGY3N113,en,"['fakenews', 'propaganda', 'qanon', 'conspiracytheories']",[],17178779,17178779,ruelhg,ruelhg,1,11,https://twitter.com/ruelhg/status/1503438220171747328,['https://firstdraftnews.org/articles/the-5-sources-of-fake-news-everyone-needs-to-look-out-for-online/'],[],0,,False,0,0,0,,#QAnon,,,,,,,[],,,,
1503430823697125383,1503430823697125383,1647280815000.0,2022-03-14 11:00:15,-700,,"Russian allegations of ""secret"" US biological weapons research laboratories in Ukraine are rooted in an unlikely conspiracy theory that has been promoted by both China and the pro-Trump conspiracy movement #QAnon, reports @TechF24 for @France24.  https://t.co/MnmSOqD2xD",en,['qanon'],[],81179597,81179597,cambskeptics,Cambridge Skeptics,1,11,https://twitter.com/cambskeptics/status/1503430823697125383,['https://buff.ly/3CDW8MY'],[],0,,False,1,2,0,,#QAnon,,,,,,,[],,,,
1503430547925839877,1503430547925839877,1647280749000.0,2022-03-14 10:59:09,-700,,This is #dominickMadden - a CI used by the feds to incite a #riot on #jan6th. They’re called #LiveDeepFakes - look at the police radio in his right pocket. And the matching #qanon shirt. Bullhorn guy wz actor too #hippie. @fbi we 👀 u! #caughtintheAct  https://t.co/b044e6mNW5  https://t.co/dNfbyF38SE,en,"['dominickmadden', 'riot', 'jan6th', 'livedeepfakes', 'qanon', 'hippie', 'caughtintheact']",[],1493330686643785734,1493330686643785734,D3arsoci3ty,Dear Society,1,10,https://twitter.com/D3arsoci3ty/status/1503430547925839877,['https://youtu.be/SuwV1mzwtgE'],"['https://pbs.twimg.com/media/FN1CGRKWUAEK1Ex.jpg', 'https://pbs.twimg.com/media/FN1CGRHWYAYO0yv.jpg', 'https://pbs.twimg.com/media/FN1CGSxXoAE4T2L.jpg']",1,https://pbs.twimg.com/media/FN1CGRKWUAEK1Ex.jpg,False,0,0,0,,#QAnon,,,,,,,[],,,,
1503429290142363648,1503379085694836736,1647280449000.0,2022-03-14 10:54:09,-700,,@wil_da_beast630 My Dad called me #QAnon the other day... HAHAHA... He watches network news every single day.,en,['qanon'],[],89570289,89570289,CSigmaShow,Romans 12:21 🇷🇺 Thou Shall Be Champions.,1,10,https://twitter.com/CSigmaShow/status/1503429290142363648,[],[],0,,False,9,0,0,,#QAnon,,,,,,,"[{'screen_name': 'wil_da_beast630', 'name': 'Wilfred Reilly', 'id': '1011008340367953920'}]",,,,
1503426011744149506,1503426011744149506,1647279668000.0,2022-03-14 10:41:08,-700,,"Does anyone else find it interesting that an official post from the Trump/Nunes ""#TruthSocial"" platform is using the #QAnon motto ""where we go one, we go all""?",en,"['truthsocial', 'qanon']",[],100987374,100987374,TrueBlueLiberal,True Blue Liberal,1,10,https://twitter.com/TrueBlueLiberal/status/1503426011744149506,[],[],0,,False,2,1,1,https://twitter.com/BodhisattvaKat/status/1501588251102040064,#QAnon,,,,,,,[],,,,
1503424452528324609,1503424452528324609,1647279296000.0,2022-03-14 10:34:56,-700,,RogerStone states that he is very familiar with the ‘extraordinary and prophetic’ thinking of Lyndon #LaRouche during a Schiller Conference.He encountered LLR in 1980 and recognised the backstage role LaRouche played in the last non neocon election. La Rouche was a Quaker #qanon  https://t.co/Gj0zUEkRHy,en,"['larouche', 'qanon']",[],2683390520,2683390520,purplepebble811,purple pebble,1,10,https://twitter.com/purplepebble811/status/1503424452528324609,[],['https://pbs.twimg.com/media/FN020ObXsAUMImW.jpg'],1,https://pbs.twimg.com/media/FN020ObXsAUMImW.jpg,False,0,0,0,,#QAnon,,,,,,,[],,,,
1503423991662395397,1503423991662395397,1647279186000.0,2022-03-14 10:33:06,-700,,In live ora per parlare della differenza fra QAnon e BluAnon 🤡 #qanon #bluanon #complotti #brettkavanaugh #JussieSmollett #UrbanDictionary  https://t.co/h2oyqPWb5Z,it,"['qanon', 'bluanon', 'complotti', 'brettkavanaugh', 'jussiesmollett', 'urbandictionary']",[],1226064767351173120,1226064767351173120,AntoLilanto,Anto LilAnto,1,10,https://twitter.com/AntoLilanto/status/1503423991662395397,['https://www.twitch.tv/lilantoontwitch'],[],0,,False,0,0,0,,#QAnon,,,,,,,[],,,,
1503421924399063047,1501588251102040064,1647278693000.0,2022-03-14 10:24:53,-700,,"@BodhisattvaKat Is that an actual post from the Trump/Nunes #TruthSocial using the #QAnon motto ""where we go one, we go all""?",en,"['truthsocial', 'qanon']",[],100987374,100987374,TrueBlueLiberal,True Blue Liberal,1,10,https://twitter.com/TrueBlueLiberal/status/1503421924399063047,[],[],0,,False,1,1,0,,#QAnon,,,,,,,"[{'screen_name': 'BodhisattvaKat', 'name': 'Kat AntifaCollectionAgency #BlackLivesMatter🌎🇺🇦', 'id': '277202090'}]",,,,
1503421775564230659,1503421775564230659,1647278658000.0,2022-03-14 10:24:18,-700,,#drellenbrandt #Republicans #GOP #QAnon The QAnon Hoax was created to distract Americans from the real issues which Conservatives do agree on: Massive election fraud in 2020 and a Plandemic for the primary purpose of a Globalist economic reset.📣📣📣,en,"['drellenbrandt', 'republicans', 'gop', 'qanon']",[],36286459,36286459,VenerAbility,Dr. Ellen Brandt,1,10,https://twitter.com/VenerAbility/status/1503421775564230659,[],[],0,,False,1,0,0,,#QAnon,,,,,,,[],,,,
1503421570601177094,1503421570601177094,1647278609000.0,2022-03-14 10:23:29,-700,,"#drellenbrandt #Conservatives #Republicans #GOP #QAnon Many Conservatives believe strongly that the QAnon False Flag hoax was created to embarrass Conservatives and discredit our agendas, via childish and idiotic Hate Speech and other means.📣📣📣",en,"['drellenbrandt', 'conservatives', 'republicans', 'gop', 'qanon']",[],36286459,36286459,VenerAbility,Dr. Ellen Brandt,1,10,https://twitter.com/VenerAbility/status/1503421570601177094,[],[],0,,False,2,0,0,,#QAnon,,,,,,,[],,,,
1503421348101726208,1503421348101726208,1647278556000.0,2022-03-14 10:22:36,-700,,"#drellenbrandt #Conservatives #Republicans #GOP #QAnon For all who believe QAnon is Conservative: The vast majority of Conservatives believe QAnon is a hoax, a joke, and a False Flag created by operatives on the Left, not the Right.📣📣📣",en,"['drellenbrandt', 'conservatives', 'republicans', 'gop', 'qanon']",[],36286459,36286459,VenerAbility,Dr. Ellen Brandt,1,10,https://twitter.com/VenerAbility/status/1503421348101726208,[],[],0,,False,2,1,0,,#QAnon,,,,,,,[],,,,
1503420544128933890,1503420544128933890,1647278364000.0,2022-03-14 10:19:24,-700,,"#QAnon, #Ukraine &amp; 'biolabs': #Russian #Propaganda boosted by #US #Fascists. ⁦@GOP⁩, #Republican party, #MAGA nation, Trump &amp; their ilk are a wholly-owned subsidiary of #Putin. They’re #TERRORISTS, #Traitors, #Quislings &amp; #FifthColumnists. 🤮#Jan6  https://t.co/zG5oe6a5L3",en,"['qanon', 'ukraine', 'russian', 'propaganda', 'us', 'fascists', 'republican', 'maga', 'putin', 'terrorists', 'traitors', 'quislings', 'fifthcolumnists', 'jan6']",[],966878355814465537,966878355814465537,AnomiePotpourri,Anomie Potpourri,1,10,https://twitter.com/AnomiePotpourri/status/1503420544128933890,['https://www.nbcnews.com/tech/internet/qanon-ukraine-biolabs-russian-propaganda-efforts-boosted-us-far-right-rcna19392'],[],0,,False,0,0,0,,#QAnon,,,,,,,[],,,,
1503420316676153346,1503420316676153346,1647278310000.0,2022-03-14 10:18:30,-700,,L'accusa per il leader #QAnon di #Dallas è quella di aver sfruttato dei ragazzini per diffondere il complottismo del gruppo via #Telegram   https://t.co/XPKueXTfz9,it,"['qanon', 'dallas', 'telegram']",[],53154047,53154047,giornalettismo,Giornalettismo,1,10,https://twitter.com/giornalettismo/status/1503420316676153346,['https://www.giornalettismo.com/qanon-sfrutta-bambini-indottrinati-via-telegram/'],[],0,,False,0,1,1,,#QAnon,,,,,,,[],,,,
1503420072311808002,1503420072311808002,1647278252000.0,2022-03-14 10:17:32,-700,,'Trump continued his unrelenting praise of Russian President Vladimir Putin on Saturday when he spoke at the Save America Rally'  #BoycottFoxNews #QAnon #MAGA #GOP #tRumpCULT #IMPOTUS #PutinsPuppets #FAKEnews  #LIARS    https://t.co/haenbocb3D via @mediaite,en,"['boycottfoxnews', 'qanon', 'maga', 'gop', 'trumpcult', 'impotus', 'putinspuppets', 'fakenews', 'liars']",[],1391374197876744199,1391374197876744199,Dannoz4,"Danno, a Browncoat",1,10,https://twitter.com/Dannoz4/status/1503420072311808002,['https://mediaite.com/a/yooau'],[],0,,False,0,0,0,,#QAnon,,,,,,,[],,,,
1503419854660980740,1503419854660980740,1647278200000.0,2022-03-14 10:16:40,-700,,"@RepMTG @laurenboebert Gets all her news from #Fox &amp; #QAnon. #RandyRainbow @fcc @EnergyCommerce, you have 1 job: democracy.   https://t.co/sojZkny9YS",en,"['fox', 'qanon', 'randyrainbow']",[],16201679,16201679,DrAmyCarson,Dr Amy,1,10,https://twitter.com/DrAmyCarson/status/1503419854660980740,['https://youtu.be/-4GxbdEmpPI'],[],0,,False,0,0,0,,#QAnon,,,,,,,[],,,,
1503419620610519049,1503419620610519049,1647278144000.0,2022-03-14 10:15:44,-700,,#TraitorsToDemocracy #Jan6 #MAGA #MAGACult #Cult45 #RepublicansAreTheProblem #Criminal #ConspiracyTheories #Qanon #SeditionHunters #Sedition #Extermists #ElectionTampering #MyVote,und,"['traitorstodemocracy', 'jan6', 'maga', 'magacult', 'cult45', 'republicansaretheproblem', 'criminal', 'conspiracytheories', 'qanon', 'seditionhunters', 'sedition', 'extermists', 'electiontampering', 'myvote']",[],2290406826,2290406826,StevenHarp_,Steven Harp,1,10,https://twitter.com/StevenHarp_/status/1503419620610519049,[],[],0,,False,0,0,0,https://twitter.com/duty2warn/status/1503416618474475521,#QAnon,,,,,,,[],,,,
1503418923491885057,1503418923491885057,1647277978000.0,2022-03-14 10:12:58,-700,,#QAnon followers believe Trump is mispronouncing ‘Chy-na’ because he secretly means Ukraine  https://t.co/2btkMqxsNp (via@RawStory) #news #breaking #thugs,en,"['qanon', 'news', 'breaking', 'thugs']",[],454478622,454478622,Newzjunkie_,HEADLINE NEWS,1,10,https://twitter.com/Newzjunkie_/status/1503418923491885057,['https://www.rawstory.com/qanon-donald-trump-china-ukraine/'],[],0,,False,0,0,1,,#QAnon,,,,,,,[],,,,
