id,conversation_id,created_at,date,timezone,place,tweet,language,hashtags,cashtags,user_id,user_id_str,username,name,day,hour,link,urls,photos,video,thumbnail,retweet,nlikes,nreplies,nretweets,quote_url,search,near,geo,source,user_rt_id,user_rt,retweet_id,reply_to,retweet_date,translate,trans_src,trans_dest
1498447902204645380,1498447902204645380,1646092794000.0,2022-02-28 15:59:54,-700,,The lack of a social safety set for the most vulnerable ensured that the effects of COVID-19 would be experienced unequally - @robingnelson #anthrotwitter #anthropology #care #covid #publichealth #NYASDLS,en,"['anthrotwitter', 'anthropology', 'care', 'covid', 'publichealth', 'nyasdls']",[],1105166470097616897,1105166470097616897,NYAS_Anth,NYAS Anthropology Section,1,15,https://twitter.com/NYAS_Anth/status/1498447902204645380,[],[],0,,False,1,0,1,,#Covid-19,,,,,,,[],,,,
1498447892788375552,1498447892788375552,1646092792000.0,2022-02-28 15:59:52,-700,,"Si tienes 18 años o más ya puedes ir por tu dosis de refuerzo contra COVID-19.  De ser posible, lleva impreso tu registro para agilizar el trámite, puedes generarlo aquí  https://t.co/hxe1tyRBlO  https://t.co/XhJhsp2vmY",es,[],[],1399763789453484032,1399763789453484032,BCGobierno,BC GOBIERNO,1,15,https://twitter.com/BCGobierno/status/1498447892788375552,['https://mivacuna.salud.gob.mx'],['https://pbs.twimg.com/media/FMuOakpVUAAnlnO.jpg'],1,https://pbs.twimg.com/media/FMuOakpVUAAnlnO.jpg,False,1,1,0,,#Covid-19,,,,,,,[],,,,
1498447883636547586,1498447883636547586,1646092789000.0,2022-02-28 15:59:49,-700,,中国紧紧抓住COVID-19的零点    https://t.co/pa7FvN6h9O,zh,[],[],1466666122342637572,1466666122342637572,chvideonews,头条趋势,1,15,https://twitter.com/chvideonews/status/1498447883636547586,['https://toutiaoqushi.com/archives/41505'],[],0,,False,0,0,0,,#Covid-19,,,,,,,[],,,,
1498447871741693952,1498447871741693952,1646092787000.0,2022-02-28 15:59:47,-700,,"New Zealand: Covid-19 Omicron outbreak: 14,633 new community cases, in hospital; 17 linked to protest test positive There are reports of large queues for rapid antigen tests, with experts anticipating a tough few weeks ahead   https://t.co/eidEFtWkCm",en,[],[],1206451618796802048,1206451618796802048,KittyPo80176717,KittyPooh,1,15,https://twitter.com/KittyPo80176717/status/1498447871741693952,['https://weehingthong.org/2022/02/28/new-zealand-covid-19/'],[],0,,False,0,0,0,,#Covid-19,,,,,,,[],,,,
1498447850891472896,1498447850891472896,1646092782000.0,2022-02-28 15:59:42,-700,,"Vietnam’s capital will hit its COVID-19 peak in two weeks as 86,990 new Covid-19 cases have been registered in the country in the past 24 hours  https://t.co/o2RWIeDI7f",en,[],[],1320164233724608512,1320164233724608512,times24hnews,TIMES24H,1,15,https://twitter.com/times24hnews/status/1498447850891472896,['https://www.times24h.com/vietnams-capital-will-hit-its-covid-19-peak-in-two-weeks-as-86990-new-covid-19-cases-have-been-registered-in-the-country-in-the-past-24-hours/'],[],0,,False,0,0,0,,#Covid-19,,,,,,,[],,,,
1498447836941324294,1498447836941324294,1646092778000.0,2022-02-28 15:59:38,-700,,"Beauty Company Executive Fired for Posting Sesame Street Meme Mentioning Chingy, the N-Word and COVID-19 – Report  https://t.co/ZnDDtVLyh8",en,[],[],271636957,271636957,myB106tweets,B106,1,15,https://twitter.com/myB106tweets/status/1498447836941324294,['https://ift.tt/kyg0N7J'],[],0,,False,0,0,0,,#Covid-19,,,,,,,[],,,,
1498447834496086016,1498447834496086016,1646092778000.0,2022-02-28 15:59:38,-700,,Procesión de Viernes Santo del Calvario tendrá nuevo recorrido este 2022 por la pandemia del covid-19.  https://t.co/1yucI0JJSF,es,[],[],43971175,43971175,Guatevision_tv,Guatevisión,1,15,https://twitter.com/Guatevision_tv/status/1498447834496086016,['https://bit.ly/3Iy8kky'],[],0,,False,2,0,1,,#Covid-19,,,,,,,[],,,,
1498447834382745602,1498447834382745602,1646092778000.0,2022-02-28 15:59:38,-700,,Procesión de Viernes Santo del Calvario tendrá nuevo recorrido este 2022 por la pandemia del covid-19.  https://t.co/YtJLlq8blp,es,[],[],38687143,38687143,prensa_libre,Prensa Libre,1,15,https://twitter.com/prensa_libre/status/1498447834382745602,['https://bit.ly/36Q1wAZ'],[],0,,False,8,2,0,,#Covid-19,,,,,,,[],,,,
1498447800199122944,1498447800199122944,1646092770000.0,2022-02-28 15:59:30,-700,,📍#REPORTE #COAHUILA DEL PLAN ESTATAL DE PREVENCIÓN Y CONTROL #COVID_19 • Actualización 🗒️ 28 de febrero.  https://t.co/dw0xlB36pC,es,"['reporte', 'coahuila', 'covid_19']",[],3226760149,3226760149,Canal6TZ,Canal 6 Telecable Zaragoza,1,15,https://twitter.com/Canal6TZ/status/1498447800199122944,[],['https://pbs.twimg.com/media/FMuOUT8VcAQ9bqe.jpg'],1,https://pbs.twimg.com/media/FMuOUT8VcAQ9bqe.jpg,False,0,0,0,,#Covid-19,,,,,,,[],,,,
1498447797074472962,1498447797074472962,1646092769000.0,2022-02-28 15:59:29,-700,,"Agri development, COVID 19 to headline CARICOM Heads of Gov’t meet  https://t.co/SyRJmUNoTn",en,[],[],3903478037,3903478037,dpiguyana,Department of Public Information,1,15,https://twitter.com/dpiguyana/status/1498447797074472962,['https://dpi.gov.gy/agri-development-covid-19-to-headline-caricom-heads-of-govt-meet/'],[],0,,False,2,0,1,,#Covid-19,,,,,,,[],,,,
1498447796034322432,1498447796034322432,1646092769000.0,2022-02-28 15:59:29,-700,,"EARN A DEGREE FAST According to statistica, 2020 alone saw a record high for study online programs. As the result of the COVID’19, students within the age of 16-24 turned to online study more as this is the age bracket for college and high school students   https://t.co/fL5BtWaEcH  https://t.co/YhhUDBBOal",en,[],[],1481560626304634880,1481560626304634880,Worldstudyport1,Worldstudyportal,1,15,https://twitter.com/Worldstudyport1/status/1498447796034322432,['https://worldstudyportal.com/earn-a-degree-online-fast/'],['https://pbs.twimg.com/media/FMuOUqGXEAU03HP.jpg'],1,https://pbs.twimg.com/media/FMuOUqGXEAU03HP.jpg,False,1,0,0,,#Covid-19,,,,,,,[],,,,
1498447765680001027,1498447765680001027,1646092761000.0,2022-02-28 15:59:21,-700,,"Rosa, de 22 años, sufrió el contago de Covid-19 entre marzo y abril de 2021. Si bien pudo sobrellevar la afección, después desarrolló secuelas que le derivaron algunas molestias #COVID19 #pandemia   https://t.co/0dbkjwdqq5",es,"['covid19', 'pandemia']",[],107224800,107224800,diariochihuahua,Diario de Chihuahua,1,15,https://twitter.com/diariochihuahua/status/1498447765680001027,['https://www.eldiariodechihuahua.mx/estado/vencen-al-coronavirus-pero-sufren-secuelas-20220228-1903133.html'],[],0,,False,0,0,0,,#Covid-19,,,,,,,[],,,,
1498447752094973954,1498447752094973954,1646092758000.0,2022-02-28 15:59:18,-700,,Khairy: MySejahtera health checks vital during Covid-19 quarantine to cut risks of dying  https://t.co/nuucSMykt3,en,[],[],14120939,14120939,eryna82,+plain-jane,1,15,https://twitter.com/eryna82/status/1498447752094973954,['https://malaysia.news.yahoo.com/khairy-mysejahtera-health-checks-vital-090042296.html'],[],0,,False,0,0,0,,#Covid-19,,,,,,,[],,,,
1498447713511567360,1498157992625070082,1646092749000.0,2022-02-28 15:59:09,-700,,"@Delta5by5Dawn @WotTheElf217 It's a mix of things - I'd guess staffing constraints given the COVID-19 numbers there, plus the massively small numbers of international flights / ships compared to pre COVID-19. Nothing to do with our Government.",en,[],[],20628533,20628533,crims0nl1z,"🇳🇿 Liz, on the edge of burnout 🤯",1,15,https://twitter.com/crims0nl1z/status/1498447713511567360,[],[],0,,False,0,2,0,,#Covid-19,,,,,,,"[{'screen_name': 'Delta5by5Dawn', 'name': 'Delta5by5Dawn🇺🇸🦅', 'id': '1045105184492474368'}, {'screen_name': 'WotTheElf217', 'name': 'E L F L I S S O', 'id': '1366933527862812673'}]",,,,
1498447702853812224,1498447702853812224,1646092746000.0,2022-02-28 15:59:06,-700,,COVID-19 SAFETY TIPS #TeamPNP #WeServeAndProtect #PNPKakampiMo  https://t.co/CchPeqxKxO,en,"['teampnp', 'weserveandprotect', 'pnpkakampimo']",[],2587707396,2587707396,tagoloanmpsldn,Tagoloan MPS,1,15,https://twitter.com/tagoloanmpsldn/status/1498447702853812224,[],['https://pbs.twimg.com/media/FMuOPQKaMAI5hvH.jpg'],1,https://pbs.twimg.com/media/FMuOPQKaMAI5hvH.jpg,False,0,0,0,,#Covid-19,,,,,,,[],,,,
1498447690564317184,1498447690564317184,1646092743000.0,2022-02-28 15:59:03,-700,,"In Some African Nations, Armed Police Enforce Covid-19 Vaccinations - The Wall Street Journal  https://t.co/hzo15dKJq8",en,[],[],209219798,209219798,stepawaytravel,Rosetta Springer,1,15,https://twitter.com/stepawaytravel/status/1498447690564317184,['https://apple.news/ASm2fh4_wT_ODtbCZQz8-PQ'],[],0,,False,0,0,0,,#Covid-19,,,,,,,[],,,,
1498447685854146560,1498447685854146560,1646092742000.0,2022-02-28 15:59:02,-700,,"Cases: 436,216,788 (+27,018)  Deaths: 5,954,881 (+0)  Recovered: 0 (+0)  Active Cases: 436,216,788 (100%) Completed Cases: 5,954,881 (1.37%) Mortality Rate: 1.37% (No Change) Case Fatality Rate: 100.00% (No Change)  #COVID19 #Coronavirus #StayHome",en,"['covid19', 'coronavirus', 'stayhome']",[],1237837670182793217,1237837670182793217,_covid_19_bot_,Covid-19 Bot,1,15,https://twitter.com/_covid_19_bot_/status/1498447685854146560,[],[],0,,False,0,0,0,,#Covid-19,,,,,,,[],,,,
1498447673564831748,1498447673564831748,1646092739000.0,2022-02-28 15:58:59,-700,,We finally hit the point where our covid-19 deaths are starting to drop... We were trailing behind the rest of the nation in reference to that...  https://t.co/rQwt5OQDm0,en,[],[],815964634825924608,815964634825924608,TheRealRazielah,Lawrence Moore,1,15,https://twitter.com/TheRealRazielah/status/1498447673564831748,[],['https://pbs.twimg.com/media/FMuONx5XIAI_IZG.jpg'],1,https://pbs.twimg.com/media/FMuONx5XIAI_IZG.jpg,False,0,0,0,,#Covid-19,,,,,,,[],,,,
1498447663930515462,1498386108002017285,1646092737000.0,2022-02-28 15:58:57,-700,,@FPWellman It’s obvious that Putin is not secure with Covid-19,en,[],[],1224132582717251585,1224132582717251585,jft66354447,jft,1,15,https://twitter.com/jft66354447/status/1498447663930515462,[],[],0,,False,0,0,0,,#Covid-19,,,,,,,"[{'screen_name': 'FPWellman', 'name': 'Fred Wellman', 'id': '42518865'}]",,,,
1498447647488757760,1498447647488757760,1646092733000.0,2022-02-28 15:58:53,-700,,Caserta: Covid-19: dati aggiornati per tutti i Comuni della provincia -  Comune – Totale positivi – Guariti – Deceduti – Positivi attuali – AILANO 133 115 2 16 ALIFE 1156 1054...- https://t.co/rcAfMHYhuU  https://t.co/waTL1lcRod,it,[],[],388719284,388719284,TeleradioNews,TeleradioNews,1,15,https://twitter.com/TeleradioNews/status/1498447647488757760,['https://www.teleradio-news.it/2022/03/01/caserta-covid-19-dati-aggiornati-per-tutti-i-comuni-della-provincia/'],['https://pbs.twimg.com/media/FMuOMdqWYAYpmnU.jpg'],1,https://pbs.twimg.com/media/FMuOMdqWYAYpmnU.jpg,False,0,0,0,,#Covid-19,,,,,,,[],,,,
