id,conversation_id,created_at,date,timezone,place,tweet,language,hashtags,cashtags,user_id,user_id_str,username,name,day,hour,link,urls,photos,video,thumbnail,retweet,nlikes,nreplies,nretweets,quote_url,search,near,geo,source,user_rt_id,user_rt,retweet_id,reply_to,retweet_date,translate,trans_src,trans_dest
1486851499418431495,1486851488202829828,1643327996000.0,2022-01-27 15:59:56,-700,,"Vendrán los ""espertos"" fachos a decir que México ""por falta de pruebas tiene 10, 30 o 100 veces más casos que EU, la realidad es que gastar en pruebas, no ayuda a nada más allá de la estadística, los síntomas de Covid-19 no pueden fingirse y menos ocultarse; si fuéramos fachos  https://t.co/ojU2wpAosd",es,[],[],1082060258544177153,1082060258544177153,Tupeorp39518112,Tupeorpesadilla,4,15,https://twitter.com/Tupeorp39518112/status/1486851499418431495,[],['https://pbs.twimg.com/media/FKJbjxWWYAEylRN.jpg'],1,https://pbs.twimg.com/media/FKJbjxWWYAEylRN.jpg,False,43,1,18,,#Covid-19,,,,,,,[],,,,
1486851479310794757,1486851479310794757,1643327991000.0,2022-01-27 15:59:51,-700,,Are declawing veterinarians contributing to more COVID-19 deaths? Read this story. - City the Kitty - Official  https://t.co/AWxE2CKQuO,en,[],[],16086855,16086855,jmuhj1,jmuhj1 STAND WITH UKRAINE & free world!,4,15,https://twitter.com/jmuhj1/status/1486851479310794757,['http://citythekitty.org/are-declawing-veterinarians-contributing-to-more-covid-19-deaths-read-this-story/'],[],0,,False,0,0,0,,#Covid-19,,,,,,,[],,,,
1486851479050797062,1486459311991762948,1643327991000.0,2022-01-27 15:59:51,-700,,"@AltSanJuanIsNP @anthonysalyers @KarenStrine3 @denise_dewald You’re only quoting the most damning part of the study… in the other group it was only 31%   They also explained in the study that: Alternatively, COVID-19 might have indirectly increased diabetes risk through pandemic-associated increases in body mass index",en,[],[],1253498049026043904,1253498049026043904,woke_alt,Meh,4,15,https://twitter.com/woke_alt/status/1486851479050797062,[],[],0,,False,0,0,0,,#Covid-19,,,,,,,"[{'screen_name': 'anthonysalyers', 'name': 'jim from strongsville', 'id': '61665619'}, {'screen_name': 'KarenStrine3', 'name': 'Karen Strine', 'id': '1454217724066942989'}, {'screen_name': 'denise_dewald', 'name': 'Denise Dewald, MD 🗽', 'id': '760219193195302912'}]",,,,
1486851474634194951,1486851474634194951,1643327990000.0,2022-01-27 15:59:50,-700,,"Qué bueno!, habrá que institucionalizar un día para recordar a las víctimas del covid-19, en especial aquí en México, no cree Canciller? Total, hacen lo que quieren con la Constitución y con las leyes, será fácil: otro decretazo!",es,[],[],1459610763333718018,1459610763333718018,TigredlMalasia,TigredlMalasia 🇲🇽🇺🇦⚕︎⚓🎾,4,15,https://twitter.com/TigredlMalasia/status/1486851474634194951,[],[],0,,False,1,0,0,https://twitter.com/m_ebrard/status/1486771931152064518,#Covid-19,,,,,,,[],,,,
1486851473812201477,1486473109121110020,1643327990000.0,2022-01-27 15:59:50,-700,,@ResistanceRages @Spotify It’s hilarious seeing the COVID-19 cultists throwing little hissy fits because Spotify won’t censor free speech of all the prominent professionals who have spoken on Joe Rogan.wake up your prolonging the madness.,en,[],[],1431328429811675138,1431328429811675138,wunsche_thomas,Thomas Wunsche,4,15,https://twitter.com/wunsche_thomas/status/1486851473812201477,[],[],0,,False,0,0,0,,#Covid-19,,,,,,,"[{'screen_name': 'ResistanceRages', 'name': 'JB Posits', 'id': '1039860564263165952'}, {'screen_name': 'Spotify', 'name': 'Spotify', 'id': '17230018'}]",,,,
1486851467558502401,1486851467558502401,1643327988000.0,2022-01-27 15:59:48,-700,,NTEB PROPHECY NEWS PODCAST: Biden Administration Moves To Silence Joe Rogan For Letting The Cat Out Of The Bag On COVID-19 Great Reset. Live Podcast Friday Noon EST. @joerogan #NTEB #GreatReset #FourthIndustrialRevolution #Prophecy  https://t.co/DryolH8iGK,en,"['nteb', 'greatreset', 'fourthindustrialrevolution', 'prophecy']",[],144367359,144367359,NowTheEndBegins,Now The End Begins ✈️Flight #777,4,15,https://twitter.com/NowTheEndBegins/status/1486851467558502401,['https://www.nowtheendbegins.com/nteb-prophecy-news-podcast-biden-administration-moves-to-silence-joe-rogan-for-exposing-covid-19-great-reset/'],[],0,,False,5,0,3,,#Covid-19,,,,,,,[],,,,
1486851458738049027,1486851458738049027,1643327986000.0,2022-01-27 15:59:46,-700,,"The carousel of speakers at NSW's COVID-19 update press conferences is starting to get ridiculously large  Six today, including two (!!) talking about buses",en,[],[],361030098,361030098,LukeCostin,Luke Costin,4,15,https://twitter.com/LukeCostin/status/1486851458738049027,[],[],0,,False,1,0,0,,#Covid-19,,,,,,,[],,,,
1486851444644868099,1486851444644868099,1643327983000.0,2022-01-27 15:59:43,-700,,Musk says 'Canadian truckers rule' ahead of drivers' protest over COVID-19 vaccine mandate  https://t.co/obh7ZejRRu,en,[],[],961721367854018563,961721367854018563,Ground_app,Ground News,4,15,https://twitter.com/Ground_app/status/1486851444644868099,['https://ground.news/article/93714b9e-b7cb-444f-b761-5569fbaf093d?utm_source=tw_bal&utm_medium=tw_bal&utm_campaign=v5'],[],0,,False,3,0,1,,#Covid-19,,,,,,,[],,,,
1486851439477542914,1483499860498259973,1643327982000.0,2022-01-27 15:59:42,-700,,@petepango @yuribombs @DLS_111911 @Covid19Critical Stop accusing me of false certainty when the only thing I have said is that there is no evidence that IVM effectively treats COVID-19.    Because that is a FACT.  And take a look in the fucking mirror.,en,[],[],1451737619159785480,1451737619159785480,tabonebrake,Ted Bonebrake,4,15,https://twitter.com/tabonebrake/status/1486851439477542914,[],[],0,,False,0,1,0,,#Covid-19,,,,,,,"[{'screen_name': 'petepango', 'name': 'Peter Rhoads', 'id': '913121978'}, {'screen_name': 'yuribombs', 'name': 'good guy yuri', 'id': '1160070460064878593'}, {'screen_name': 'DLS_111911', 'name': 'Dana Lynn', 'id': '2906509269'}, {'screen_name': 'Covid19Critical', 'name': 'FLCCC—Front Line COVID-19 Critical Care Alliance', 'id': '1255176009764294656'}]",,,,
1486851431457910784,1486851431457910784,1643327980000.0,2022-01-27 15:59:40,-700,,Andy Vermaut shares:LVMH blows past COVID-19 pandemic with record sales and profit  https://t.co/BIuBWCujaM Thank you.  https://t.co/nxa0zCi1Re,en,[],[],283604227,283604227,AndyVermaut,Andy Vermaut,4,15,https://twitter.com/AndyVermaut/status/1486851431457910784,['https://www.channelnewsasia.com/business/lvmh-blows-past-covid-19-pandemic-record-sales-and-profit-2464851?utm_source=dlvr.it&utm_medium=twitter'],['https://pbs.twimg.com/media/FKJbf2SUUAAbVWl.jpg'],1,https://pbs.twimg.com/media/FKJbf2SUUAAbVWl.jpg,False,0,0,0,,#Covid-19,,,,,,,[],,,,
1486851430069805061,1486851430069805061,1643327979000.0,2022-01-27 15:59:39,-700,,"Cuidarnos en esta pandemia de Covid_19 es responsabilidad de todas y todos, no bajes la guardia y sigue respetando los protocolos de salud. #GobiernoParaTodos  https://t.co/OYG7VMLsGl",es,['gobiernoparatodos'],[],1477150376134692873,1477150376134692873,MpioZaachila,Mpio. Villa De Zaachila,4,15,https://twitter.com/MpioZaachila/status/1486851430069805061,[],['https://pbs.twimg.com/media/FKJbfgtVIAEH5er.jpg'],1,https://pbs.twimg.com/media/FKJbfgtVIAEH5er.jpg,False,3,0,2,,#Covid-19,,,,,,,[],,,,
1486851424373911553,1486849901677924354,1643327978000.0,2022-01-27 15:59:38,-700,,@drcorazon2016 En noticias que para  PR llegaban 10 millones de pruebas caseras para detectar el Covid 19 gratis .Algunas 4 pruebas por familia. En algún municipio las empezaron  a repartir por método de servi carro . Se vio en noticias . Ahora los planes se quejan . Dónde  están pruebas Biden,es,[],[],748950626642472960,748950626642472960,Carmen911350611,Carmen,4,15,https://twitter.com/Carmen911350611/status/1486851424373911553,[],[],0,,False,0,0,0,,#Covid-19,,,,,,,"[{'screen_name': 'drcorazon2016', 'name': 'IVAN F GONZALEZ-CANC', 'id': '1388114839'}]",,,,
1486851422520020997,1486851422520020997,1643327978000.0,2022-01-27 15:59:38,-700,,#Moderna begins early-stage trials of mRNA-based #HIV vaccine The shot uses the same technology as the company's COVID-19 vaccine.  https://t.co/VyL47iiNL9,en,"['moderna', 'hiv']",[],1296405577149624320,1296405577149624320,DDBH59,DDBH59 What's new?,4,15,https://twitter.com/DDBH59/status/1486851422520020997,['https://www.engadget.com/moderna-mrna-hiv-vaccine-trials-225655400.html'],[],0,,False,0,0,0,,#Covid-19,,,,,,,[],,,,
1486851421438103552,1486836420371116032,1643327977000.0,2022-01-27 15:59:37,-700,,@kic6592 世相切ってますよ✨ CはCOVID-19でしょ🤣,ja,[],[],1226796136159014912,1226796136159014912,market_hands,🍀Hands Up Market【公式】🍀　UV Ver.,4,15,https://twitter.com/market_hands/status/1486851421438103552,[],[],0,,False,1,1,0,,#Covid-19,,,,,,,"[{'screen_name': 'kic6592', 'name': 'KIC キック株式会社', 'id': '1250349598104621056'}]",,,,
1486851420133507072,1486851420133507072,1643327977000.0,2022-01-27 15:59:37,-700,,"Habrá ofertas de empleo en Yaguará, Gigante, Pitalito, Tello y Palermo   Una estrategia que se suma a las que vine adelantando el departamento en cabeza del  Gobernador del Huila  y los Alcaldes con el propósito de continuar mitigando las consecuencias causadas por el Covid-19  https://t.co/yaolFJnhwg",es,[],[],351083462,351083462,HuilaGob,Gobernación del Huila,4,15,https://twitter.com/HuilaGob/status/1486851420133507072,[],[],1,https://pbs.twimg.com/ext_tw_video_thumb/1486848989240643585/pu/img/_J7bRg3jPzGVWU82.jpg,False,19,0,8,,#Covid-19,,,,,,,[],,,,
1486851417889554432,1486851417889554432,1643327977000.0,2022-01-27 15:59:37,-700,,"5.000 Euro Impfprämie zahlt die Böttcher AG in Jena allen Be­schäf­tig­ten, die sich gegen Covid-19 impfen lassen. Der Vor­stand will damit einen An­reiz schaffen, sich mit den wis­sen­schaft­lichen Fakten aus­ein­an­der­zu­setzen - mit Erfolg.  https://t.co/cqOBLdcvZN",de,[],[],312504234,312504234,Saerdnaya,Meira Erler 🙏,4,15,https://twitter.com/Saerdnaya/status/1486851417889554432,['https://www.mdr.de/nachrichten/thueringen/corona-impfpflicht-unternehmen-impfpraemie-100.html'],[],0,,False,0,1,0,,#Covid-19,,,,,,,[],,,,
1486851415687536640,1486851415687536640,1643327976000.0,2022-01-27 15:59:36,-700,,At-Home COVID-19 Antigen Test Kits: Where to Buy and What You Should Know | Wirecutter  https://t.co/Qv90y4vn6Z via @wirecutter,en,[],[],12176742,12176742,RobertCFried,Robert C. Fried,4,15,https://twitter.com/RobertCFried/status/1486851415687536640,['https://www.nytimes.com/wirecutter/reviews/at-home-covid-test-kits/'],[],0,,False,0,0,0,,#Covid-19,,,,,,,[],,,,
1486851413284114441,1486851413284114441,1643327975000.0,2022-01-27 15:59:35,-700,,Anti-Vaxxer Sarah Palin Tests Positive for COVID-19 Again  https://t.co/U4xNvywLOi via @politicususa,en,[],[],3222641663,3222641663,JcKatherine,Fortress3,4,15,https://twitter.com/JcKatherine/status/1486851413284114441,['https://www.politicususa.com/2022/01/24/anti-vaxxer-sarah-palin-tests-positive-for-covid-19-again.html'],[],0,,False,1,0,0,,#Covid-19,,,,,,,[],,,,
1486851405101080577,1486851405101080577,1643327973000.0,2022-01-27 15:59:33,-700,,"Situación Actual del Covid-19 en Morelos   La @SSM_Morelos informa que a la fecha en Morelos se han estudiado 276 mil 551 personas, de las cuales se han confirmado 56 mil 793 con COVID-19; 2 mil 149 están activas y se han registrado 5 mil 086 defunciones.  https://t.co/bSf34GeV1Y  https://t.co/gqu06XMwbO",es,[],[],137801914,137801914,GobiernoMorelos,Gobierno de Morelos,4,15,https://twitter.com/GobiernoMorelos/status/1486851405101080577,['https://www.facebook.com/112454552127355/posts/4971965572842871/'],"['https://pbs.twimg.com/media/FKJbdKnWYAU885V.jpg', 'https://pbs.twimg.com/media/FKJbdfJWQAQgj3s.jpg', 'https://pbs.twimg.com/media/FKJbeRzXEAcAjZ9.jpg']",1,https://pbs.twimg.com/media/FKJbdKnWYAU885V.jpg,False,0,0,0,,#Covid-19,,,,,,,[],,,,
