id,conversation_id,created_at,date,timezone,place,tweet,language,hashtags,cashtags,user_id,user_id_str,username,name,day,hour,link,urls,photos,video,thumbnail,retweet,nlikes,nreplies,nretweets,quote_url,search,near,geo,source,user_rt_id,user_rt,retweet_id,reply_to,retweet_date,translate,trans_src,trans_dest
1493374478528950272,1493374478528950272,1644883195000.0,2022-02-14 15:59:55,-700,,Ingat! Covid-19 Varian Omicron Juga Berbahaya  https://t.co/VzBNH1AfTM,in,[],[],191032800,191032800,SuluhSumatera,SuluhSumateraCoId,1,15,https://twitter.com/SuluhSumatera/status/1493374478528950272,['https://www.suluhsumatera.co.id/2022/02/ingat-covid-19-varian-omicron-juga.html'],[],0,,False,0,0,0,,#Covid-19,,,,,,,[],,,,
1493374465723359232,1493374461516521477,1644883192000.0,2022-02-14 15:59:52,-700,,"Del total de internados en áreas COVID-19, hay 1 paciente pediátrico y no hay embarazadas ni puérperas.",es,[],[],1849484233,1849484233,torresariel80,Ariel Torres,1,15,https://twitter.com/torresariel80/status/1493374465723359232,[],[],0,,False,0,0,0,,#Covid-19,,,,,,,[],,,,
1493374464171462670,1493374461516521477,1644883192000.0,2022-02-14 15:59:52,-700,,"Con los 43 nuevos casos, el total de contagios en la provincia llegó a 143.332. Además hay 140.785 recuperados y 38 pacientes internados en las Áreas Covid-19 (entre positivos y sospechosos): 13 en Área Crítica y 3 con asistencia respiratoria mecánica.",es,[],[],1849484233,1849484233,torresariel80,Ariel Torres,1,15,https://twitter.com/torresariel80/status/1493374464171462670,[],[],0,,False,0,1,1,,#Covid-19,,,,,,,[],,,,
1493374461516521477,1493374461516521477,1644883191000.0,2022-02-14 15:59:51,-700,,"#SanJuan #Coronavirus ⚠❗CONFIRMAN 4 NUEVOS FALLECIMIENTOS Y OTROS 43 CASOS POSITIVOS DE COVID-19   ➡ Los 4 nuevos fallecidos son: un hombre de 79 años, de Calingasta; una mujer de 87 años, de Albardón; un hombre de 76 años, de Rawson y un hombre de 60 años, de Caucete.  https://t.co/fZGMTXUNSo",es,"['sanjuan', 'coronavirus']",[],1849484233,1849484233,torresariel80,Ariel Torres,1,15,https://twitter.com/torresariel80/status/1493374461516521477,[],"['https://pbs.twimg.com/media/FLmIJldWQAMqQxY.jpg', 'https://pbs.twimg.com/media/FLmIJzBWUAIVvJn.jpg', 'https://pbs.twimg.com/media/FLmIKD-WUAA_-Ff.jpg']",1,https://pbs.twimg.com/media/FLmIJldWQAMqQxY.jpg,False,2,1,1,,#Covid-19,,,,,,,[],,,,
1493374456051425282,1493374456051425282,1644883190000.0,2022-02-14 15:59:50,-700,,"Governor McKee has announced the schedules for the community based COVID-19 vaccination clinics for Tuesday, February 15.  https://t.co/hxBuVEvrwZ",en,[],[],16547992,16547992,ABC6,ABC6 News Desk,1,15,https://twitter.com/ABC6/status/1493374456051425282,['https://www.abc6.com/tuesday-schedules-released-for-all-community-based-covid-19-vaccination-clinics-in-rhode-island/'],[],0,,False,0,0,0,,#Covid-19,,,,,,,[],,,,
1493374438246694917,1493374438246694917,1644883186000.0,2022-02-14 15:59:46,-700,,Covid-19 is here to stay and we have to learn to live with it  https://t.co/Iw3Bsq2D5T,en,[],[],35606154,35606154,bmangh,BM,1,15,https://twitter.com/bmangh/status/1493374438246694917,['http://a.msn.com/05/en-us/AATB3Fc?ocid=st'],[],0,,False,0,0,0,,#Covid-19,,,,,,,[],,,,
1493374413751869442,1493374413751869442,1644883180000.0,2022-02-14 15:59:40,-700,,"Tom Murphy, a longtime Berkshire Hathaway board member, plans to resign after a battle with Covid-19  https://t.co/WKDqMS0koF",en,[],[],588261604,588261604,BloombergAsia,Bloomberg Asia,1,15,https://twitter.com/BloombergAsia/status/1493374413751869442,['https://trib.al/YFb5Aep'],[],0,,False,1,0,0,,#Covid-19,,,,,,,[],,,,
1493374391534731266,1493374391534731266,1644883175000.0,2022-02-14 15:59:35,-700,,"ENVÍDIO la capacidad matemática de @limyueng para sacar los porcentajes aproximados de casos positivos del Covid-19, en vivo y en directo por @tvnnoticias  Yo voy por algo a la tienda de los paisanos y dudo que me estén dando el vuelto correcto.  Que destino.  https://t.co/PSeIz7QRjE",es,[],[],611639518,611639518,rodpma,🇵🇦Rod A. Moreno,1,15,https://twitter.com/rodpma/status/1493374391534731266,[],['https://pbs.twimg.com/tweet_video_thumb/FLmIFy_WUAQ_7uM.jpg'],1,https://pbs.twimg.com/tweet_video_thumb/FLmIFy_WUAQ_7uM.jpg,False,0,0,0,,#Covid-19,,,,,,,[],,,,
1493374387281543168,1493374387281543168,1644883174000.0,2022-02-14 15:59:34,-700,,"Good morning, I have a Master’s student interested in interviewing emergency nurses about their experiences of studying during COVID-19. We are looking for nurses who were working in Melbourne EDs &amp; did their graduate certificate in emergency nursing duri… https://t.co/VgPBWSX5Td",en,[],[],382393124,382393124,Julie_Considine,Professor Julie Considine (she/her),1,15,https://twitter.com/Julie_Considine/status/1493374387281543168,['https://lnkd.in/gH4mr4sE'],[],0,,False,16,0,20,,#Covid-19,,,,,,,[],,,,
1493374385071308801,1493374385071308801,1644883173000.0,2022-02-14 15:59:33,-700,,📰PIDEN ACUDIR A LOS MÓDULOS DE VACUNACIÓN EN CANCÚN.  Entre escasa y nula fue la convocatoria hoy para la jornada de vacunación contra el COVID-19 en las distintas sedes instaladas en esta ciudad.  @TransformarQRoo  https://t.co/akclOhJTf4,es,[],[],1470847066037489669,1470847066037489669,TransformarQRoo,TransformarQroo,1,15,https://twitter.com/TransformarQRoo/status/1493374385071308801,[],['https://pbs.twimg.com/media/FLmIFcQXMAY3hd4.jpg'],1,https://pbs.twimg.com/media/FLmIFcQXMAY3hd4.jpg,False,0,0,0,,#Covid-19,,,,,,,[],,,,
1493374379962548231,1493374379962548231,1644883172000.0,2022-02-14 15:59:32,-700,,🍁 El Covid-19 y las pandemias son insignificantes ante el grave problema que amenaza a la humanidad...  https://t.co/ibq9j8FYEr,es,[],[],4034184622,4034184622,La_Excusa_,La Excusa,1,15,https://twitter.com/La_Excusa_/status/1493374379962548231,['https://www.cinconoticias.com/pandemias-insignificantes-ante-amenaza-humanidad/'],[],0,,False,0,0,0,,#Covid-19,,,,,,,[],,,,
1493374379891503110,1493374379891503110,1644883172000.0,2022-02-14 15:59:32,-700,,"Hallo Kawan JM  Patuhi protokol kesehatan untuk memutus penyebaran Covid-19, buat Kawan JM yang beraktivitas dimanapun dan kapanpun jangan lupa untuk 6M ya!  Yuk bersama-sama kita cegah penyebaran Covid-19!  https://t.co/YJ77iJ2UXp",in,[],[],540625251,540625251,PTJASAMARGA,PT. JASAMARGA,1,15,https://twitter.com/PTJASAMARGA/status/1493374379891503110,[],"['https://pbs.twimg.com/media/FLmH15DaIAUJvf_.jpg', 'https://pbs.twimg.com/media/FLmH15ZagAED8y1.jpg']",1,https://pbs.twimg.com/media/FLmH15DaIAUJvf_.jpg,False,1,0,0,,#Covid-19,,,,,,,[],,,,
1493374353756540934,1493374353756540934,1644883166000.0,2022-02-14 15:59:26,-700,,COVID-19. España. Curva de muerte vertical:,es,[],[],410103064,410103064,DemiurgoTuiter,El Demiurgo,1,15,https://twitter.com/DemiurgoTuiter/status/1493374353756540934,[],[],0,,False,0,0,1,https://twitter.com/Gab_H_R/status/1492938266588459016,#Covid-19,,,,,,,[],,,,
1493374342113030146,1493374340494024704,1644883163000.0,2022-02-14 15:59:23,-700,,if you don't want to pay cause it's expensive is said the wedding would be small and the banquet because of covid 19 so we could save their and borrow outfits  to marry in for a day and take pictures for my locket and wedding book of photos I want to do a shutter fly book,en,[],[],1100606220094693376,1100606220094693376,MelodyC16164899,MS.Melody Chan,1,15,https://twitter.com/MelodyC16164899/status/1493374342113030146,[],[],0,,False,0,1,0,,#Covid-19,,,,,,,[],,,,
1493374341421355013,1493075560326897664,1644883163000.0,2022-02-14 15:59:23,-700,,"@TheCallieCat @CrossbowResists @MarkMcGowanMP Primarily used for those things. It also stops Covid 19. As proven in places like Japan, Rishikesh,El Salvador and many other poor countries that did not want to partake in the no liability experiment of the MRNA vaccines (that don't work)",en,[],[],192437811,192437811,Bitcoinjimbo,₿itcoin Jimbo,1,15,https://twitter.com/Bitcoinjimbo/status/1493374341421355013,[],[],0,,False,0,0,0,,#Covid-19,,,,,,,"[{'screen_name': 'TheCallieCat', 'name': '👸Callie 😼', 'id': '1315709878141440000'}, {'screen_name': 'MarkMcGowanMP', 'name': 'Mark McGowan', 'id': '430452224'}]",,,,
1493374330578735104,1493374330578735104,1644883160000.0,2022-02-14 15:59:20,-700,,COVID-19 hospitalizations continues to spiral down  https://t.co/lDLgcr8Ygh  https://t.co/pTAmDrGswy,en,[],[],180987994,180987994,mypgnow,My Prince George Now,1,15,https://twitter.com/mypgnow/status/1493374330578735104,['https://bit.ly/3sE2l7b'],['https://pbs.twimg.com/media/FLmICVnVkAERF0r.jpg'],1,https://pbs.twimg.com/media/FLmICVnVkAERF0r.jpg,False,1,0,0,,#Covid-19,,,,,,,[],,,,
1493374328699772929,1493374247305203713,1644883160000.0,2022-02-14 15:59:20,-700,,My question is why Israel knows so much about the Covid-19 and the diferen Viarant?,en,[],[],1425531448598138887,1425531448598138887,CajinaNeftali,Neftali Cajina,1,15,https://twitter.com/CajinaNeftali/status/1493374328699772929,[],[],0,,False,0,0,0,,#Covid-19,,,,,,,[],,,,
1493374328003612673,1493374328003612673,1644883160000.0,2022-02-14 15:59:20,-700,,"COVID-19 update: There are 18 newly reported COVID-19-related deaths in Oregon over the past three days, raising the state’s death toll to 6,373, along with 4,756 new cases, the Oregon Health Authority reported today.  https://t.co/JPrUBELXuk",en,[],[],25451167,25451167,KTVZ,KTVZ NewsChannel 21,1,15,https://twitter.com/KTVZ/status/1493374328003612673,['https://ktvz.com/news/coronavirus/2022/02/14/oregon-reports-18-more-covid-19-related-deaths-4756-new-cases-in-past-3-days/'],[],0,,False,0,0,0,,#Covid-19,,,,,,,[],,,,
1493374320772632588,1493328539533328390,1644883158000.0,2022-02-14 15:59:18,-700,,@JohnSteiner32 @nathaliejacoby1 They sent off their findings for their peer reviews. Their findings were that rhinovirus was the cure for coronavirus. They gave their case study the common cold rhino virus and because it is a cousin of coronavirus it queued the T &amp; B cells to fight coronavirus I.e. COVID-19,en,[],[],1325181747978526722,1325181747978526722,ChrisBu29550966,Chris Burke,1,15,https://twitter.com/ChrisBu29550966/status/1493374320772632588,[],[],0,,False,0,1,0,,#Covid-19,,,,,,,"[{'screen_name': 'JohnSteiner32', 'name': 'John Steiner', 'id': '1602637255'}, {'screen_name': 'nathaliejacoby1', 'name': 'Nathalie Jacoby', 'id': '1280478731874848769'}]",,,,
1493374300858077184,1493374300858077184,1644883153000.0,2022-02-14 15:59:13,-700,,"Número de casos de Covid-19 chega a 27,5 milhões no Brasil  https://t.co/lr9edmFlLD",pt,[],[],2977077706,2977077706,TodaBahia,Toda Bahia,1,15,https://twitter.com/TodaBahia/status/1493374300858077184,['https://todabahia.com.br/numero-de-casos-de-covid-19-chega-a-275-milhoes-no-brasil/'],[],0,,False,0,0,0,,#Covid-19,,,,,,,[],,,,
1493374287490727939,1493374287490727939,1644883150000.0,2022-02-14 15:59:10,-700,,Flowers? Check.   Chocolate? Check.   COVID-19 vaccine? Check.   Show your love with up-to date-vaccines for Valentine’s Day.  https://t.co/ipz1wVQkLQ,en,[],[],870535057,870535057,AusPublicHealth,Austin Public Health,1,15,https://twitter.com/AusPublicHealth/status/1493374287490727939,[],['https://pbs.twimg.com/media/FLmH7wdXIAM1yV_.png'],1,https://pbs.twimg.com/media/FLmH7wdXIAM1yV_.png,False,5,0,0,,#Covid-19,,,,,,,[],,,,
1493374285263433728,1493374285263433728,1644883149000.0,2022-02-14 15:59:09,-700,,Tijuana concentra la mayoría de casos positivos de COVID-19  https://t.co/P4f0o4ws5n,es,[],[],290350413,290350413,monitor_bc,monitor_bc,1,15,https://twitter.com/monitor_bc/status/1493374285263433728,['http://monitoreconomico.org/noticias/2022/feb/14/tijuana-concentra-la-mayoria-de-casos-positivos-de-covid-19/'],[],0,,False,0,0,0,,#Covid-19,,,,,,,[],,,,
1493374279240589312,1493374279240589312,1644883148000.0,2022-02-14 15:59:08,-700,,"#YoSíMeVacuno | Personal del Consultorio de San José Pinula visitó la aldea San Luis para proteger a vecinos contra el COVID-19 con la aplicación de esquemas primarios y dosis de refuerzo, según requerimiento. #TodosSomosIGSS  https://t.co/Yxe7osP1N7",es,"['yosímevacuno', 'todossomosigss']",[],2303669820,2303669820,Noticias_IGSS,Noticias IGSS,1,15,https://twitter.com/Noticias_IGSS/status/1493374279240589312,[],"['https://pbs.twimg.com/media/FLmHLTyXwAIb_Bx.jpg', 'https://pbs.twimg.com/media/FLmHLTzWQAEqFSK.jpg', 'https://pbs.twimg.com/media/FLmHLTzWQAc2Zmf.jpg', 'https://pbs.twimg.com/media/FLmHLTwXwAMDeLe.jpg']",1,https://pbs.twimg.com/media/FLmHLTyXwAIb_Bx.jpg,False,1,0,0,,#Covid-19,,,,,,,[],,,,
1493374267680964611,1493374267680964611,1644883145000.0,2022-02-14 15:59:05,-700,,"Memula ni lah yg doktor swasta ingat aku n husband kene denggi, turn out both of us positive covid-19. tatau la apa khabar klinik tu. bkn salah kami, kami da buat rtk kt klinik yg sama k",in,[],[],210747232,210747232,blurryonface,big girl ✨,1,15,https://twitter.com/blurryonface/status/1493374267680964611,[],[],0,,False,0,0,0,https://twitter.com/MedTweetMYHQ/status/1492862167724351494,#Covid-19,,,,,,,[],,,,
1493374260076847104,1493374260076847104,1644883143000.0,2022-02-14 15:59:03,-700,,"Antes de ter um marido/namorado, uma pessoa que você chame de amor, tenha um companheiro. Isso é muito mais importante que muita coisa e vem cheio de outras coisas boas. O companheirismo que vivi essa última semana com @Paulinho_dg , enfrentando a COVID-19 me fez entender +",pt,[],[],127962883,127962883,laisfsallix,Laís Florêncio,1,15,https://twitter.com/laisfsallix/status/1493374260076847104,[],[],0,,False,4,1,0,,#Covid-19,,,,,,,[],,,,
1493374242137718787,1492616769441251329,1644883139000.0,2022-02-14 15:58:59,-700,,"@DanskeFor @OGPureblood @KVarming Jeg tror bestemt godt på din erfaring. Det er bare ikke særlig videnskabeligt.  Jeg kender bestemt godt den Reuters artikel, som de jo måtte ændre i undervejs.  Men hvor ser du, at den siger, at Ivermectin er effektivt mod covid-19?",da,[],[],196245821,196245821,Stig_Skov,Stig Skov Mortensen,1,15,https://twitter.com/Stig_Skov/status/1493374242137718787,[],[],0,,False,0,0,0,,#Covid-19,,,,,,,"[{'screen_name': 'DanskeFor', 'name': 'Hans jørgen', 'id': '1164401188709765120'}, {'screen_name': 'OGPureblood', 'name': 'One of the Original PureBloods', 'id': '1479478037318184960'}, {'screen_name': 'KVarming', 'name': 'Kim Varming', 'id': '792314484'}]",,,,
1493374235883933698,1493374235883933698,1644883138000.0,2022-02-14 15:58:58,-700,,インフルの流行は完全に抑えきってるこの状況で、入院しないと命にかかわるケースでベッドが埋まるというのはやはりCOVID-19はインフルとは段違いに恐ろしい。少なくとも今はインフルと同じ扱いにできる状況じゃないね。,ja,[],[],14094743,14094743,wakalixes,A!ういっち💉💉💉,1,15,https://twitter.com/wakalixes/status/1493374235883933698,[],[],0,,False,0,0,0,,#Covid-19,,,,,,,[],,,,
1493374225058611201,1493374225058611201,1644883135000.0,2022-02-14 15:58:55,-700,,Covid 19 Omicron: 164 schools and early childhood centres have cases  https://t.co/Nk5e55gtKx,en,[],[],52725360,52725360,myheadlinez,MyHeadlinez,1,15,https://twitter.com/myheadlinez/status/1493374225058611201,['https://www.myheadlinez.com/41518330/Covid-19-Omicron:-164-schools-and-early-childhood-centres-have-cases/'],[],0,,False,0,0,0,,#Covid-19,,,,,,,[],,,,
1493374206200922114,1493374206200922114,1644883130000.0,2022-02-14 15:58:50,-700,,Boti detecta casos sospechosos de Covid-19 a través de audios de WhatsApp  #Boti #CABA #CasosSospechosos #Coronavirus #Ahora #Hoy  https://t.co/WbUxoaA76o a través de @elpaisdiario,es,"['boti', 'caba', 'casossospechosos', 'coronavirus', 'ahora', 'hoy']",[],1146044014568886272,1146044014568886272,ElPaisDiarioOk,El País Diario 🌎,1,15,https://twitter.com/ElPaisDiarioOk/status/1493374206200922114,['https://www.elpaisdiario.com.ar/nacionales/boti-detecta-casos-sospechosos-de-covid-19-a-traves-de-audios-de-whatsapp-62173/'],[],0,,False,0,0,1,,#Covid-19,,,,,,,[],,,,
1493374175377080321,1493324342616367104,1644883123000.0,2022-02-14 15:58:43,-700,,"@MelissaLantsman 100% of Canadians want this to be over, but it is not because the Omicron variant is still out there.  Majority of Canadians support more COVID-19 restrictions for unvaccinated: poll - National |  https://t.co/aTMUC7MfDp  https://t.co/7riyfIZ0Yt",en,[],[],599418199,599418199,Colleen_B2B,Francis Armstrong,1,15,https://twitter.com/Colleen_B2B/status/1493374175377080321,"['http://Globalnews.ca', 'https://globalnews.ca/news/8532791/covid-unvaccinated-restrictions-tax-poll/']",[],0,,False,0,0,0,,#Covid-19,,,,,,,"[{'screen_name': 'MelissaLantsman', 'name': 'Melissa Lantsman', 'id': '210149871'}]",,,,
1493374164400734209,1493374164400734209,1644883121000.0,2022-02-14 15:58:41,-700,,危険な薬剤耐性菌、次のパンデミックに...  https://t.co/6AWqb02tKd CDC/FDA/WHO/FEMA/COVID-19/PPE/N95/NHS/ICRC/NIAID/NIH/抗体/河岡義裕/高田礼人/本庶佑/山中伸弥/福岡伸一/竹内薫/坂本史衣/大村智/村中璃子/BSE/HIV/忽那賢志/中澤港/川端裕人/堀潤/池上彰/市川紗椰/佐藤佳/木村知/岡秀昭/塩谷舞,ja,[],[],1155640990050344960,1155640990050344960,encu210,CASSETTE_BOY_2,1,15,https://twitter.com/encu210/status/1493374164400734209,['https://news.yahoo.co.jp/articles/eaaf7db97c5371b4a36cfb93b470de6b74d5d3a0'],[],0,,False,1,1,0,,#Covid-19,,,,,,,[],,,,
1493374163888881665,1493374163888881665,1644883120000.0,2022-02-14 15:58:40,-700,,Se informa que Soojin de @_Weeekly ha dado positivo al COVID-19 al sentir síntomas de este mismo  #SOOJIN #수진 #Weeekly #위클리 #COVID19   𝖒𝖎𝖑𝖑𝖔🐱  https://t.co/bTZyWnkncj,es,"['soojin', '수진', 'weeekly', '위클리', 'covid19']",[],1415208796595671041,1415208796595671041,kpop_mioyu,kpop_mioyu🧚🏻‍♀️,1,15,https://twitter.com/kpop_mioyu/status/1493374163888881665,[],['https://pbs.twimg.com/media/FLmH40VXMAMzacl.jpg'],1,https://pbs.twimg.com/media/FLmH40VXMAMzacl.jpg,False,0,0,0,,#Covid-19,,,,,,,[],,,,
1493374137561083910,1492286647345590274,1644883114000.0,2022-02-14 15:58:34,-700,,"@jaseytv It aint that bad I have had covid 19, Delta,  Omicron. I lived damn it!",en,[],[],3305489173,3305489173,Nosthedeer,Nosthedeer,1,15,https://twitter.com/Nosthedeer/status/1493374137561083910,[],[],0,,False,0,0,0,,#Covid-19,,,,,,,"[{'screen_name': 'jaseytv', 'name': 'Jason Welch', 'id': '759090854250225665'}]",,,,
1493374114500804611,1493374114500804611,1644883109000.0,2022-02-14 15:58:29,-700,,"मिजोरम में 577 नए COVID-19 मामले, एक और मौत  https://t.co/kSJ214t4G3",hi,[],[],3177008455,3177008455,KRANTISAMAY1,KRANTISAMAY,1,15,https://twitter.com/KRANTISAMAY1/status/1493374114500804611,['https://krantisamay.com/112023/'],[],0,,False,0,0,0,,#Covid-19,,,,,,,[],,,,
1493374113255096321,1493291904355684354,1644883108000.0,2022-02-14 15:58:28,-700,,"@LDT37010506 Was he able to take Ivermectin? I heard it was not safe for kidney patients.  My mom has COVID-19, and I'm sure it's just ""Omicron"". But she's not getting any better after being sick with it for a week. She's very ill, did get the jab, and has end-stage renal failure.",en,[],[],2912952005,2912952005,razzuria,Jason Martin — Patron Saint of Tic-Tac-Toe,1,15,https://twitter.com/razzuria/status/1493374113255096321,[],[],0,,False,0,1,0,,#Covid-19,,,,,,,"[{'screen_name': 'LDT37010506', 'name': 'LDT', 'id': '875569058430672897'}]",,,,
1493374104824692736,1493374104824692736,1644883106000.0,2022-02-14 15:58:26,-700,,#Entérate En #Puebla capital no se cumplió con la meta de vacunación de refuerzo contra #Covid-19. 32 mil 645 ciudadanos decidieron no vacunarse. @SaludGobPue @Gob_Puebla @JAntonioMtzGa   https://t.co/MR7HN6CyNE,es,"['entérate', 'puebla', 'covid']",[],474269249,474269249,PrimeraNoti,PrimeraPlana,1,15,https://twitter.com/PrimeraNoti/status/1493374104824692736,['https://primeraplananoticias.com/?p=63119'],[],0,,False,0,0,0,,#Covid-19,,,,,,,[],,,,
1493374089800601600,1493374089800601600,1644883103000.0,2022-02-14 15:58:23,-700,,"US capital ending COVID-19 vaccination, mask mandates: Mayor  https://t.co/KYBs0QuD8K  https://t.co/LAdp93yh6e",en,[],[],240265305,240265305,anadoluagency,ANADOLU AGENCY,1,15,https://twitter.com/anadoluagency/status/1493374089800601600,['http://v.aa.com.tr/2502719'],['https://pbs.twimg.com/media/FLmH0ehWUAUOdPB.jpg'],1,https://pbs.twimg.com/media/FLmH0ehWUAUOdPB.jpg,False,0,0,1,,#Covid-19,,,,,,,[],,,,
1493374085430132740,1493374085430132740,1644883102000.0,2022-02-14 15:58:22,-700,,Sergipe recebeu nesta segunda-feira mais de 60 mil doses de vacina contra a Covid-19  https://t.co/p5x3Q572ZI,pt,[],[],1370044624568455169,1370044624568455169,SergipeFolha,Folha de Sergipe,1,15,https://twitter.com/SergipeFolha/status/1493374085430132740,['https://folhadesergipe.com/sergipe-recebeu-nesta-segunda-feira-mais-de-60-mil-doses-de-vacina-contra-a-covid-19/'],[],0,,False,0,0,0,,#Covid-19,,,,,,,[],,,,
1493374081210937344,1493363082541735939,1644883101000.0,2022-02-14 15:58:21,-700,,"@cravinmelatonin Covid is more important than any caces nowadays, that's why all suspect will be guessed as covid-19 variant 😷",en,[],[],1691027419,1691027419,mrtaufikwn,Taufik,1,15,https://twitter.com/mrtaufikwn/status/1493374081210937344,[],[],0,,False,0,1,0,,#Covid-19,,,,,,,"[{'screen_name': 'cravinmelatonin', 'name': '🛌', 'id': '1305332102641065984'}]",,,,
1493374064001490952,1493374064001490952,1644883097000.0,2022-02-14 15:58:17,-700,,State Department: Proof Of COVID-19 Vaccine Needed For Americans Fleeing Ukraine Into Poland  #BidenWorstPresidentEver   https://t.co/Zgzx2kBTx7,en,['bidenworstpresidentever'],[],882784867,882784867,westieTX,Denise,1,15,https://twitter.com/westieTX/status/1493374064001490952,['https://www.dailywire.com/news/state-department-proof-of-covid-19-vaccine-needed-for-americans-fleeing-ukraine-into-poland'],[],0,,False,0,0,0,,#Covid-19,,,,,,,[],,,,
1493374048499376128,1493374048499376128,1644883093000.0,2022-02-14 15:58:13,-700,,IMSS brinda acompañamiento a pacientes con trastornos de ansiedad derivados de la pandemia de COVID-19  https://t.co/cvNKCFMZID,es,[],[],430142425,430142425,PoliticArte_Mx,PoliticArte,1,15,https://twitter.com/PoliticArte_Mx/status/1493374048499376128,['https://politicarte.mx/contenido/1711/imss-brinda-acompanamiento-a-pacientes-con-trastornos-de-ansiedad-derivados-de-l'],[],0,,False,2,0,0,,#Covid-19,,,,,,,[],,,,
1493374042795032581,1493374042795032581,1644883092000.0,2022-02-14 15:58:12,-700,,"We all need to reject Chinese-Made COVID-19 Test Kits Handed Out to Over 100,000 Super Bowl Fans  https://t.co/XnCrtKGcrR   Download our app to read more at  https://t.co/wVvDQIgpAd",en,[],[],3122085488,3122085488,TerryKalUSMC,Terrence Kaliner,1,15,https://twitter.com/TerryKalUSMC/status/1493374042795032581,"['https://link.theepochtimes.com/mkt_app/chinese-made-covid-19-test-kits-handed-out-to-over-100000-super-bowl-fans_4277980.html?utm_source=appan2028330', 'https://ept.ms/DownloadApp']",[],0,,False,3,0,2,,#Covid-19,,,,,,,[],,,,
1493374023409016836,1493374023409016836,1644883087000.0,2022-02-14 15:58:07,-700,,"BC is reporting 2,701 of COVID-19 over the past three days   423 in Island Health  In the past 72 hours, there have been 17 new deaths    2 in Island Health.    803 people are in hospital with COVID-19 and 119 are in intensive care. #bcpoli #yyj  https://t.co/ldSL3qsmZY",en,"['bcpoli', 'yyj']",[],97606428,97606428,cfax1070,CFAX1070,1,15,https://twitter.com/cfax1070/status/1493374023409016836,[],['https://pbs.twimg.com/media/FLmHwbaX0AAc6go.jpg'],1,https://pbs.twimg.com/media/FLmHwbaX0AAc6go.jpg,False,1,1,1,,#Covid-19,,,,,,,[],,,,
1493374013720055811,1493374013720055811,1644883085000.0,2022-02-14 15:58:05,-700,,Enhanced external counterpulsation therapy benefits long COVID-19 patients  https://t.co/y97SZbcjpj  https://t.co/swASIYZgLu,en,[],[],111995707,111995707,ThePostsynaptic,Paul McCullough,1,15,https://twitter.com/ThePostsynaptic/status/1493374013720055811,['http://dlvr.it/SJzhl9'],['https://pbs.twimg.com/media/FLmHwELVcAEjtyR.jpg'],1,https://pbs.twimg.com/media/FLmHwELVcAEjtyR.jpg,False,0,0,0,,#Covid-19,,,,,,,[],,,,
1493374012801515521,1493374012801515521,1644883084000.0,2022-02-14 15:58:04,-700,,"TEMPEST Tunda Debut Maret, Semua Member Positif Covid-19  https://t.co/srdruidTt3",in,[],[],1291246080269545472,1291246080269545472,ngopibareng_id,NgopiBareng.id,1,15,https://twitter.com/ngopibareng_id/status/1493374012801515521,['https://www.ngopibareng.id/read/tempest-tunda-debut-maret-semua-member-positif-covid-19?utm_source=dlvr.it&utm_medium=twitter'],[],0,,False,0,0,0,,#Covid-19,,,,,,,[],,,,
1493374004043952129,1493374004043952129,1644883082000.0,2022-02-14 15:58:02,-700,,Covid-19. Pass vaccinal : voici tout ce qui change ce mardi 15 février 2022,fr,[],[],1443113173553491968,1443113173553491968,MichelMonster38,Michel,1,15,https://twitter.com/MichelMonster38/status/1493374004043952129,[],[],0,,False,0,0,0,,#Covid-19,,,,,,,[],,,,
1493373994984165380,1493373994984165380,1644883080000.0,2022-02-14 15:58:00,-700,,Senador Veneziano segue em isolamento após novo exame detectar Covid-19 pela segunda vez  https://t.co/jsAIUwrjQX,pt,[],[],445048069,445048069,estadaodapb,O ESTADÃO da Paraíba,1,15,https://twitter.com/estadaodapb/status/1493373994984165380,['https://estadaodaparaiba.com.br/noticia/10301/senador-veneziano-segue-em-isolamento-apos-novo-exame-detectar-covid-19-pela-segunda-vez'],[],0,,False,0,0,0,,#Covid-19,,,,,,,[],,,,
