id,conversation_id,created_at,date,timezone,place,tweet,language,hashtags,cashtags,user_id,user_id_str,username,name,day,hour,link,urls,photos,video,thumbnail,retweet,nlikes,nreplies,nretweets,quote_url,search,near,geo,source,user_rt_id,user_rt,retweet_id,reply_to,retweet_date,translate,trans_src,trans_dest
1493373512823848966,1493373512823848966,1644882965000.0,2022-02-14 15:56:05,-700,,"Balance #Covid-19 | Lunes 14 de febrero de 2022  Nuevos casos: 799 Pruebas Nuevas: 5,755 Positividad: 13.9% Nuevas muertes: 10 Hospitalizados: 442 Sala: 382 UCI: 60 Vacunas aplicadas: 7,430,176  https://t.co/qtZONcJBnr",es,['covid'],[],1970069144,1970069144,ecotvpanama,ECO TV,1,15,https://twitter.com/ecotvpanama/status/1493373512823848966,[],[],1,https://pbs.twimg.com/ext_tw_video_thumb/1493373483564376064/pu/img/V1Gk_9qJdmg1qGfb.jpg,False,1,0,0,,#Covid-19,,,,,,,[],,,,
1493373508667289604,1493373508667289604,1644882964000.0,2022-02-14 15:56:04,-700,,Here's where to get tested for COVID-19 in Manitowoc County  https://t.co/XKVmc7bt1M,en,[],[],22736351,22736351,htrnews,Manitowoc Herald Times Reporter,1,15,https://twitter.com/htrnews/status/1493373508667289604,['http://rssfeeds.htrnews.com/~/677821328/0/manitowoc/home~Heres-where-to-get-tested-for-COVID-in-Manitowoc-County/?utm_campaign=snd-autopilot'],[],0,,False,0,0,0,,#Covid-19,,,,,,,[],,,,
1493373502023417858,1493373502023417858,1644882963000.0,2022-02-14 15:56:03,-700,,El café positiu en Covid 19?????  https://t.co/PZNQI0ePw9,ca,[],[],1230216824991686656,1230216824991686656,Conxita83032260,Conxita,1,15,https://twitter.com/Conxita83032260/status/1493373502023417858,[],['https://pbs.twimg.com/media/FLmHSAaWQAMdUg-.jpg'],1,https://pbs.twimg.com/media/FLmHSAaWQAMdUg-.jpg,False,1,0,0,,#Covid-19,,,,,,,[],,,,
1493373498651295744,1493373498651295744,1644882962000.0,2022-02-14 15:56:02,-700,,"COVID-19 diary day 671 - Sunday, decided to do laundry at Aunt and Uncle's place while watching Superbowl LVI. But before that, finally finished ""Book of Boba Fett."" Both this series and ""Mandalorian"" play like westerns in space. Was going to make nachos, but no. #Covid19diary",en,['covid19diary'],[],58007674,58007674,joedrawing3,Joseph Peñaloza,1,15,https://twitter.com/joedrawing3/status/1493373498651295744,[],[],0,,False,0,0,0,,#Covid-19,,,,,,,[],,,,
1493373494767149058,1493373494767149058,1644882961000.0,2022-02-14 15:56:01,-700,,😷 Cuatro muertos más por COVID-19 en República Domnicana y 422 nuevos contagios - Diario Libre 👉  https://t.co/Wst4GnMGTN 💊 #Medical #GroupZirigoza,es,"['medical', 'groupzirigoza']",[],1119900799105228801,1119900799105228801,GroupZirigoza,Medical Zirigoza Group,1,15,https://twitter.com/GroupZirigoza/status/1493373494767149058,['https://buff.ly/3oMQQJn'],[],0,,False,0,0,0,,#Covid-19,,,,,,,[],,,,
1493373492850573312,1493373492850573312,1644882960000.0,2022-02-14 15:56:00,-700,,#Noti90 Los contagios de covid-19 en Tailandia se han duplicado y las autoridades temen que San Valentín agrave la situación.   https://t.co/Tyb1THDWRv,es,['noti90'],[],310385299,310385299,Noti90Minutos,Noticiero 90 Minutos,1,15,https://twitter.com/Noti90Minutos/status/1493373492850573312,['https://90minutos.co/vida-moderna/salud/tailandia-pide-tener-relaciones-sexuales-con-tapabocas-prevenir-contagios-14-02-2022/?utm_source=twitter&utm_medium=post-twitter&utm_campaign=redessociales'],[],0,,False,0,0,0,,#Covid-19,,,,,,,[],,,,
1493373489956458501,1493373489956458501,1644882960000.0,2022-02-14 15:56:00,-700,,"Among the unvaccinated, long-term heart risks attributed to Covid-19 were ""everywhere,"" researchers found.  https://t.co/Bwcu3RrH1i @NBCNews",en,[],[],60694237,60694237,ColumbiaScience,ColumbiaScience,1,15,https://twitter.com/ColumbiaScience/status/1493373489956458501,['https://nbcnews.to/3GR2M38'],[],0,,False,2,0,1,,#Covid-19,,,,,,,[],,,,
1493373470394261507,1493373470394261507,1644882955000.0,2022-02-14 15:55:55,-700,,Sejumlah negara mulai melonggarkan pembatasan dan tak lagi menganggap COVID-19 sebagai ancaman serius. Indonesia hingga kini belum mengambil sikap serupa.  https://t.co/v9sqzK7o80,in,[],[],104446991,104446991,detikHealth,detikHealth,1,15,https://twitter.com/detikHealth/status/1493373470394261507,['https://health.detik.com/berita-detikhealth/d-5942566/banyak-negara-sudah-bye-bye-covid-ri-kok-belum-menkes-ungkap-alasannya?utm_term=echoboxauto&utm_campaign=detikcomsocmed&utm_medium=oa&utm_content=detikhealth&utm_source=Twitter#Echobox=1644881239'],[],0,,False,8,3,5,,#Covid-19,,,,,,,[],,,,
1493373429827108865,1493373429827108865,1644882945000.0,2022-02-14 15:55:45,-700,,"Hi all, I have a lovely Master’s student interested in interviewing emergency nurses about experiences of studying during COVID-19. If you worked in a Melbourne ED &amp; did a graduate certificate in emergency nursing during 2020/21, please DM me &amp; I’ll connect you with my student",en,[],[],382393124,382393124,Julie_Considine,Professor Julie Considine (she/her),1,15,https://twitter.com/Julie_Considine/status/1493373429827108865,[],[],0,,False,21,0,28,,#Covid-19,,,,,,,[],,,,
1493373425301209091,1493373425301209091,1644882944000.0,2022-02-14 15:55:44,-700,,COVID-19 hospitalizations in Texas continue dropping as omicron surge wanes   https://t.co/E73waDLiT7,en,[],[],15169032,15169032,KXAN_News,KXAN News,1,15,https://twitter.com/KXAN_News/status/1493373425301209091,['https://trib.al/z1ams0j'],[],0,,False,3,1,2,,#Covid-19,,,,,,,[],,,,
1493373424705495040,1493373424705495040,1644882944000.0,2022-02-14 15:55:44,-700,,Sen. Marshall to introduce legislation ending COVID-19 national emergency declaration  https://t.co/YBhwOwLUYF via @YahooNews  https://t.co/tqyCeJ40nL,en,[],[],1232831360349302785,1232831360349302785,goldenflowerst,Goldenflowerst,1,15,https://twitter.com/goldenflowerst/status/1493373424705495040,['https://news.yahoo.com/sen-marshall-introduce-legislation-ending-184350801.html?soc_src=social-sh&soc_trk=tw&tsrc=twtr'],['https://pbs.twimg.com/media/FLmHMtgVEAIOvHZ.jpg'],1,https://pbs.twimg.com/media/FLmHMtgVEAIOvHZ.jpg,False,0,0,0,,#Covid-19,,,,,,,[],,,,
1493373415713087493,1493373415713087493,1644882942000.0,2022-02-14 15:55:42,-700,,Idosos Sousenses que estavam internados no Hospital das Clínicas em Campina Grande devido a Covid-19 morrem...  https://t.co/Cd00Y8rqXP,pt,[],[],133116908,133116908,reporterpb,REPORTERPB,1,15,https://twitter.com/reporterpb/status/1493373415713087493,['https://www.reporterpb.com.br/noticia/saude/2022/02/14/idosos-sousenses-que-estavam-internados-no-hospital-das-clinicas-em-campina-grande-devido-a-covid-19-morrem/126234.html'],[],0,,False,0,0,0,,#Covid-19,,,,,,,[],,,,
1493373414316281856,1493264164235747332,1644882942000.0,2022-02-14 15:55:42,-700,,"@Francis73080794 @Not_Jotace Pero no se han dado cuenta que a #Maduro, nadie lo quiere, mucho menos el Covid-19.  Muy probable que ni el diablo lo recibe... Los únicos que lo aceptan son las personas a las cuales les paga para que hagan daño...",es,['maduro'],[],3099896529,3099896529,PanayParga,Sergio A. Panay Parga,1,15,https://twitter.com/PanayParga/status/1493373414316281856,[],[],0,,False,5,0,0,,#Covid-19,,,,,,,"[{'screen_name': 'Not_Jotace', 'name': 'Juan Carlos', 'id': '273983595'}]",,,,
1493373402719330305,1493373402719330305,1644882939000.0,2022-02-14 15:55:39,-700,,ワクチン接種は、 感染を模倣したものである。  接種後、ヘモグロビンA1c，血清ナトリウム・カリウム値，凝固プロファイル，腎機能などに一貫した変化が認められた。同様の変化はCOVID-19患者でも報告されている。  https://t.co/D3LawoTvYR,ja,[],[],1431774993419956224,1431774993419956224,jhmdrei,Laughing Man,1,15,https://twitter.com/jhmdrei/status/1493373402719330305,['https://www.nature.com/articles/s41421-021-00329-3'],[],0,,False,22,0,16,,#Covid-19,,,,,,,[],,,,
1493373392094904321,1493373392094904321,1644882936000.0,2022-02-14 15:55:36,-700,,#14Feb | El Ministerio de Salud y Protección de Colombia (@MinSaludCol) informó que se registraron 3.162 casos y 186 muertes por #COVID_19 en las últimas 24 horas.  El país suma 6.023.257 contagios y 137.301 fallecidos desde el inicio de la pandemia.  https://t.co/O7RbsPQp5z,es,"['14feb', 'covid_19']",[],42832810,42832810,eldiario,El Diario,1,15,https://twitter.com/eldiario/status/1493373392094904321,[],['https://pbs.twimg.com/media/FLmHK9-XwAQmBHq.jpg'],1,https://pbs.twimg.com/media/FLmHK9-XwAQmBHq.jpg,False,0,0,0,,#Covid-19,,,,,,,[],,,,
1493373376563499010,1493373376563499010,1644882933000.0,2022-02-14 15:55:33,-700,,"Covid-19, calano i positivi: sono 17 nel comune  Comune di Isola del Giglio Medaglia d’Oro al Merito Civile Provincia di Grosseto Il Sindaco  STATO DI EMERGENZA COVID - 19 #rispettareleregole AGGIORNAMENTI DEL 15 FEBBRAIO 2022  COMUNICATO n. 114  Positiv…  https://t.co/fk4r3Ppqlg  https://t.co/DcjJQa0ltM",it,['rispettareleregole'],[],216141512,216141512,giglionews,GiglioNews,1,15,https://twitter.com/giglionews/status/1493373376563499010,['https://ift.tt/Le5QVby'],['https://pbs.twimg.com/media/FLmHK7CXMAMV7-i.jpg'],1,https://pbs.twimg.com/media/FLmHK7CXMAMV7-i.jpg,False,0,0,0,,#Covid-19,,,,,,,[],,,,
1493373367109537792,1493336864769593347,1644882930000.0,2022-02-14 15:55:30,-700,,"@metejt2 Well, I would NOT go that far, because there are Americans at high risk and I've seen several DIE from covid-19. But it should be a free choice after a nuanced discussion which does not often happen. There are people WHO SHOULD GET it. The truth is in between my friend.",en,[],[],43326045,43326045,agargmd,Ashwani🌱Garg he/him 😷禅🌏🇮🇳💉💉🏳️‍🌈✊🇺🇦🇺🇸,1,15,https://twitter.com/agargmd/status/1493373367109537792,[],[],0,,False,1,1,0,,#Covid-19,,,,,,,"[{'screen_name': 'metejt2', 'name': 'Nottoday', 'id': '32829457'}]",,,,
1493373363833692161,1493373363833692161,1644882930000.0,2022-02-14 15:55:30,-700,,"Cegah Covid-19, Majelis Desa Adat Batasi Pawai Ogoh-Ogoh Saat Perayaan Nyepi  https://t.co/kRMjCOMeqv",in,[],[],1480102576284602369,1480102576284602369,GarudaSatuNews,Garuda Satu News,1,15,https://twitter.com/GarudaSatuNews/status/1493373363833692161,['https://www.garudasatunews.co.id/cegah-covid-19-majelis-desa-adat-batasi-pawai-ogoh-ogoh-saat-perayaan-nyepi/'],[],0,,False,1,0,0,,#Covid-19,,,,,,,[],,,,
1493373353473814531,1493373353473814531,1644882927000.0,2022-02-14 15:55:27,-700,,"*Situación COVID-19 del 14 de febrero 2022 en Panamá*  Nuevos casos: 799 Recuperados: 716,681 (*3,490) Total de casos: 743,653  Pruebas Nuevas: 5,755 (+13.9%) Fallecidos: 7,960(9hoy)(1acum.) Casa: 18,468 Hoteles: 102 Hospitalizados: 442 Sala: 382 UCI: 60 Total Pruebas: 5,397,083",es,[],[],2750060503,2750060503,panamalaverdad,La Verdad Panamá,1,15,https://twitter.com/panamalaverdad/status/1493373353473814531,[],[],0,,False,0,0,0,,#Covid-19,,,,,,,[],,,,
1493373341935312901,1493373341935312901,1644882924000.0,2022-02-14 15:55:24,-700,,House GOP wants answers on Fauci shutting down COVID-19 lab leak debate | Washington Examiner  https://t.co/IqInr5AyAe,en,[],[],2876704776,2876704776,Pat_P_B,Pat P_B,1,15,https://twitter.com/Pat_P_B/status/1493373341935312901,['https://www.washingtonexaminer.com/news/house-gop-wants-answers-on-fauci-shutting-down-covid-19-lab-leak-debate'],[],0,,False,0,0,0,,#Covid-19,,,,,,,[],,,,
1493373334767255557,1493364159588843528,1644882923000.0,2022-02-14 15:55:23,-700,,5. @ZulmaCucunuba. También epidemióloga. Trabaja en el modelamiento de pandemias y vacunas. Utiliza su plataforma para combatir la desinformación sobre la covid-19 y las vacunas  https://t.co/Vk0Eb2p6aj,es,[],[],1326902839713685504,1326902839713685504,ManifiestaMedia,Manifiesta Media,1,15,https://twitter.com/ManifiestaMedia/status/1493373334767255557,[],['https://pbs.twimg.com/media/FLmHIGqXIAAGes_.jpg'],1,https://pbs.twimg.com/media/FLmHIGqXIAAGes_.jpg,False,2,1,0,,#Covid-19,,,,,,,[],,,,
1493373302315921408,1493373302315921408,1644882915000.0,2022-02-14 15:55:15,-700,,"Nunca falta el que salta y te dice.... ""Yo perdí a mi familiar por el Covid-19"", flaca yo estoy protestando contra un pase sanitario ilegal y inconstitucional, nunca negué la enfermedad. Retrasadita mental. De tanta leche que te entró puede que se te hayan engrasado las neuronas.",es,[],[],1149027847635382272,1149027847635382272,LuchoTaladro,LANUS 0 BANFIELD 5,1,15,https://twitter.com/LuchoTaladro/status/1493373302315921408,[],[],0,,False,0,0,0,,#Covid-19,,,,,,,[],,,,
1493373299719811072,1493373299719811072,1644882914000.0,2022-02-14 15:55:14,-700,,Senado promove sessão com desinformação sobre vacina contra a Covid-19  https://t.co/eokEyGKaIL   Por que eles tem permissão para nos enganar? O que fizemos pra merecer esses idiotas?,pt,[],[],2820615074,2820615074,esquerdeando,Artemis,1,15,https://twitter.com/esquerdeando/status/1493373299719811072,['https://oglobo.globo.com/politica/senado-promove-sessao-com-desinformacao-sobre-vacina-contra-covid-19-25394064?utm_source=Twitter&utm_medium=Social&utm_campaign=compartilhar'],[],0,,False,42,8,15,,#Covid-19,,,,,,,[],,,,
1493373290064216064,1493373290064216064,1644882912000.0,2022-02-14 15:55:12,-700,,La Dirección del Hospital J.R. Vidal  informó este 14 de febrero que se registraron 4 (cuatro) casos positivos COVID-19 en San Miguel. ➡️Altas Médica: 3 (tres). ➡️Total Activos: 13 (trece). ➡️Cumplir el aislamiento corta propagación del virus.,es,[],[],921452802316161024,921452802316161024,smcorrientes,smcorrientes,1,15,https://twitter.com/smcorrientes/status/1493373290064216064,[],[],0,,False,0,0,0,,#Covid-19,,,,,,,[],,,,
1493373288118108166,681025943926865921,1644882912000.0,2022-02-14 15:55:12,-700,,"If you test positive for COVID-19 and have one or more health conditions that increase your risk of becoming very sick, treatment may be available. Contact a health professional right away after a positive test to determine if you may be eligible.    https://t.co/aUCthXdiNS",en,[],[],366517094,366517094,geopolytica,George Cassis,1,15,https://twitter.com/geopolytica/status/1493373288118108166,['https://www.cdc.gov/coronavirus/2019-ncov/need-extra-precautions/people-with-medical-conditions.html'],[],0,,False,0,0,0,,#Covid-19,,,,,,,[],,,,
1493373283760279556,1493272047253962752,1644882911000.0,2022-02-14 15:55:11,-700,,"@EduGiraoOficial @SenadoFederal Cara vive em 1908. 2022 e o cara vem com negacionismo, antivax e desrespeito a ciência ao combate à Covid 19. Desserviço ao país.",pt,[],[],220323918,220323918,jprcamposbahea,Bora Bahea Minha Porrinha,1,15,https://twitter.com/jprcamposbahea/status/1493373283760279556,[],[],0,,False,0,0,0,,#Covid-19,,,,,,,"[{'screen_name': 'EduGiraoOficial', 'name': 'Eduardo Girão', 'id': '1024403315164160000'}, {'screen_name': 'SenadoFederal', 'name': 'Senado Federal', 'id': '40095953'}]",,,,
1493373278261583882,1493373278261583882,1644882909000.0,2022-02-14 15:55:09,-700,,Autopsy Histopathologic Cardiac Findings in Two Adolescents Following the Second COVID-19 Vaccine Dose | Archives of Pathology &amp; Laboratory Medicine  https://t.co/JBAYMdu0Ib,en,[],[],3054551319,3054551319,wsimpsonkw,Old Scratch’s hot viral load,1,15,https://twitter.com/wsimpsonkw/status/1493373278261583882,['https://meridian.allenpress.com/aplm/article/doi/10.5858/arpa.2021-0435-SA/477788/Autopsy-Histopathologic-Cardiac-Findings-in-Two'],[],0,,False,1,0,0,,#Covid-19,,,,,,,[],,,,
1493373271227904001,1493373271227904001,1644882908000.0,2022-02-14 15:55:08,-700,,Quilty calls on #China to lift bans on 10 Australian abattoirs. China temporarily suspended exports from the processors in what Mr Quilty said was in response to Chinese concerns around media reports and issues linked to COVID-19. Suspension lasts until May 2022. #agchatoz,en,"['china', 'agchatoz']",[],312687740,312687740,BryceEishold,Bryce Eishold,1,15,https://twitter.com/BryceEishold/status/1493373271227904001,[],[],0,,False,0,0,0,,#Covid-19,,,,,,,[],,,,
1493373268237352960,1493373268237352960,1644882907000.0,2022-02-14 15:55:07,-700,,15-2-65  06:50 ตารางแสดงจำนวน 20 อันดับแรกของประเทศที่มีผู้ติดเชื้อ​โรค COVID-19​ รายใหม่ต่อวันสูงสุดในโลก (ช่องสีเหลือง)​ ช่วง 24 ชั่วโมง​ที่ผ่านมา ​ (ยอดเสียชีวิต​อยู่​ในช่องสีแดง)​​ (ข้อมูล​จาก​  https://t.co/wgzJdVbToR) ประเทศไทยอยู่อันดับที่ 27  https://t.co/kcAil2AjJt,th,[],[],62256661,62256661,MrVop,ѴѺҎ,1,15,https://twitter.com/MrVop/status/1493373268237352960,['http://worldometers.info'],['https://pbs.twimg.com/media/FLmHEZiaMAIOG-t.jpg'],1,https://pbs.twimg.com/media/FLmHEZiaMAIOG-t.jpg,False,3,0,7,,#Covid-19,,,,,,,[],,,,
1493373256858050561,1493373256858050561,1644882904000.0,2022-02-14 15:55:04,-700,,Pfizer has delayed the rollout of their COVID-19 vaccine for kids | How this could affect your child and the community on News 19 at 6,en,[],[],15397175,15397175,whnt,News 19,1,15,https://twitter.com/whnt/status/1493373256858050561,[],[],0,,False,3,3,1,,#Covid-19,,,,,,,[],,,,
1493373246292561920,1493373246292561920,1644882902000.0,2022-02-14 15:55:02,-700,,"""The prime minister’s pledge to scrap legally enforced isolation for people in England with Covid-19 flies in the face of basic infectious disease management, which tells us to avoid infecting other people when you are infectious."" Devi Sridhar  https://t.co/cFiSTCnwkT",en,[],[],1189233070601396226,1189233070601396226,StTogether1,StrongerTogether #ProtectLife 🇪🇺🌻🇺🇦,1,15,https://twitter.com/StTogether1/status/1493373246292561920,['https://www.theguardian.com/commentisfree/2022/feb/14/isolate-covid-politicians-normal-scientists-pandemic'],[],0,,False,5,1,4,,#Covid-19,,,,,,,[],,,,
1493373245822840843,1493373245822840843,1644882901000.0,2022-02-14 15:55:01,-700,,Province Accelerating Plan to Reduce Public Health Restrictions Based on Improving COVID-19 Situation @MBGov  -  https://t.co/LrP1AIYuoH #Manitoba #Health,en,"['manitoba', 'health']",[],309200071,309200071,MINnews,Municipal Info Net,1,15,https://twitter.com/MINnews/status/1493373245822840843,['http://minj.me/2e2u'],[],0,,False,0,0,0,,#Covid-19,,,,,,,[],,,,
1493373244602159106,1493369397259296771,1644882901000.0,2022-02-14 15:55:01,-700,,"@ScottTDaley Seventeen people fewer in ICU - because they all died!  😞 “In the past 72 hours, 17 people with COVID-19 have died and deaths have been reported, for an overall total of 2,764.”",en,[],[],1236314695805493255,1236314695805493255,ChristineGuent8,Christine 🌻 Guenter,1,15,https://twitter.com/ChristineGuent8/status/1493373244602159106,[],[],0,,False,1,1,0,,#Covid-19,,,,,,,"[{'screen_name': 'ScottTDaley', 'name': '🚆 The Daley Express 🚆', 'id': '375946266'}]",,,,
1493373243218341888,1493373243218341888,1644882901000.0,2022-02-14 15:55:01,-700,,Really proper dangerous one: Aboriginal responses to the first wave of COVID-19 in the Kimberley ➡️ https://t.co/VUnIftKISx  Nulungu Research Institute @notredameaus,en,[],[],1366949342297268225,1366949342297268225,APOorgau,Analysis & Policy Observatory (APO),1,15,https://twitter.com/APOorgau/status/1493373243218341888,['http://apo.org.au/node/316406'],[],0,,False,1,0,2,,#Covid-19,,,,,,,[],,,,
1493373243180285953,1492648948540100610,1644882901000.0,2022-02-14 15:55:01,-700,,"@RadioFreeTom @mehdirhasan Approaching spring and scientists believe it will be a mild Covid event. Now it’s time to make a plan how to move past masks and shutting places down. Covid 19 is here to stay, now we learn to live with it.",en,[],[],323406681,323406681,ancheta67,Kat Ancheta,1,15,https://twitter.com/ancheta67/status/1493373243180285953,[],[],0,,False,0,0,0,,#Covid-19,,,,,,,"[{'screen_name': 'RadioFreeTom', 'name': 'Tom Nichols', 'id': '459872442'}, {'screen_name': 'mehdirhasan', 'name': 'Mehdi Hasan', 'id': '130557513'}]",,,,
1493373238470230017,1493373238470230017,1644882900000.0,2022-02-14 15:55:00,-700,,"Brasil tem 78,87% da população com pelo menos uma dose da vacina contra a covid-19  https://t.co/qjczmbzGx7",pt,[],[],9317502,9317502,Estadao,Estadão 🗞️,1,15,https://twitter.com/Estadao/status/1493373238470230017,"['https://saude.estadao.com.br/noticias/geral,brasil-tem-78-87-da-populacao-com-pelo-menos-uma-dose-da-vacina-contra-a-covid-19,70003979257?utm_source=twitter:newsfeed&utm_medium=social-organic&utm_campaign=redes-sociais:022022:e&utm_content=:::&utm_term=']",[],0,,False,30,4,3,,#Covid-19,,,,,,,[],,,,
1493373238432473096,1493373238432473096,1644882900000.0,2022-02-14 15:55:00,-700,,IFO report: Seniors bore brunt of COVID-19 deaths  https://t.co/TfMU0Rfj3n via @CityAndStatePA,en,[],[],2371245793,2371245793,MHerz67,Michael Herzing,1,15,https://twitter.com/MHerz67/status/1493373238432473096,['https://www.cityandstatepa.com/content/ifo-report-seniors-bore-brunt-covid-19-deaths#.YgpfM2Jm-g0.twitter'],[],0,,False,0,0,0,,#Covid-19,,,,,,,[],,,,
1493373238302359563,1493373238302359563,1644882900000.0,2022-02-14 15:55:00,-700,,#JornadaDeVacunación💉| Si tienes más de 15 semanas de embarazo y aún no estás vacunada contra la COVID-19 acude al centro de salud más cercano.    ¡Sabemos cómo hacerlo!  ¡Cuidémonos!    #SomosPuebloDeAmor  https://t.co/QqSklhiVGN,es,"['jornadadevacunación', 'somospueblodeamor']",[],118864905,118864905,VTVcanal8,VTV CANAL 8,1,15,https://twitter.com/VTVcanal8/status/1493373238302359563,[],[],1,https://pbs.twimg.com/ext_tw_video_thumb/1493208756171194370/pu/img/Xbazszh92HfSqz05.jpg,False,10,1,27,,#Covid-19,,,,,,,[],,,,
1493373224595435522,1493373224595435522,1644882896000.0,2022-02-14 15:54:56,-700,,"""A 56-year-old immunosuppressed COVID-19 patient (also suffering from leukemia) has been testing positive for 14 months in a row. 78 tests have been done, all of them positive. He has spent 9 months in the hospital and 5 months mostly alone at home.""",en,[],[],1478070589516656651,1478070589516656651,pizza_strip_,pizza strip,1,15,https://twitter.com/pizza_strip_/status/1493373224595435522,[],[],0,,False,13,0,4,https://twitter.com/masanpra/status/1493363253510029317,#Covid-19,,,,,,,[],,,,
1493373218341765122,1493373218341765122,1644882895000.0,2022-02-14 15:54:55,-700,,Dia D da Família para vacinação contra a Covid-19 acontece no próximo sábado em Aracaju #sergipe #sergipe  https://t.co/F7jm8NCgxt,pt,"['sergipe', 'sergipe']",[],713836792,713836792,NoticiasAracaju,ARACAJU AGORA NOTÍCIAS,1,15,https://twitter.com/NoticiasAracaju/status/1493373218341765122,['https://ift.tt/eczYHgm'],[],0,,False,0,0,0,,#Covid-19,,,,,,,[],,,,
1493373210909421570,1493373210909421570,1644882893000.0,2022-02-14 15:54:53,-700,,"Covid-19, calano i positivi: sono 17 nel comune  Comune di Isola del Giglio Medaglia d’Oro al Merito Civile Provincia di Grosseto Il Sindaco  STATO DI EMERGENZA COVID - 19 #rispettareleregole AGGIORNAMENTI DEL 15 FEBBRAIO 2022  COMUNICATO n. 114  Positiv…  https://t.co/fk4r3Ppqlg  https://t.co/MYueLA1PGU",it,['rispettareleregole'],[],216141512,216141512,giglionews,GiglioNews,1,15,https://twitter.com/giglionews/status/1493373210909421570,['https://ift.tt/Le5QVby'],['https://pbs.twimg.com/media/FLmHBXsXEAQHArs.jpg'],1,https://pbs.twimg.com/media/FLmHBXsXEAQHArs.jpg,False,0,0,0,,#Covid-19,,,,,,,[],,,,
1493373197592543238,1493373197592543238,1644882890000.0,2022-02-14 15:54:50,-700,,Vítimas da Covid-19 pedem indenização de R$ 200 milhões à União por má gestão da pandemia:  https://t.co/bM3Pz89i0h  https://t.co/UN6ZSLY1bt,pt,[],[],1358066826249457664,1358066826249457664,instanoticias1,instanoticias,1,15,https://twitter.com/instanoticias1/status/1493373197592543238,['http://www.instanoticias.com.br/noticias/2588.html'],['https://pbs.twimg.com/media/FLmHASkWUAMQWYY.jpg'],1,https://pbs.twimg.com/media/FLmHASkWUAMQWYY.jpg,False,0,1,0,,#Covid-19,,,,,,,[],,,,
1493373186494193667,1493373186494193667,1644882887000.0,2022-02-14 15:54:47,-700,,En Ecuador se aplicará la vacuna contra la COVID-19 a niños de 3 y 4 años para evitar casos graves por la enfermedad y la mortalidad.  https://t.co/Ua1pojzPyv,es,[],[],1043604811994816512,1043604811994816512,PrensaEc1,PrensaEc,1,15,https://twitter.com/PrensaEc1/status/1493373186494193667,[],['https://pbs.twimg.com/media/FLmG__YVIAA1QSq.jpg'],1,https://pbs.twimg.com/media/FLmG__YVIAA1QSq.jpg,False,0,0,2,,#Covid-19,,,,,,,[],,,,
1493373183239409664,1493373183239409664,1644882887000.0,2022-02-14 15:54:47,-700,,A New Variant of California COVID-19 Supplemental Paid Sick Leave Law Emerges — What Employers Need to Know  https://t.co/uCbdEADCsq,en,[],[],16894383,16894383,GreenbergGluske,Greenberg Glusker,1,15,https://twitter.com/GreenbergGluske/status/1493373183239409664,['https://www.jdsupra.com/legalnews/a-new-variant-of-california-covid-19-6585093/'],[],0,,False,0,0,0,,#Covid-19,,,,,,,[],,,,
1493373171361267718,1493373171361267718,1644882884000.0,2022-02-14 15:54:44,-700,,#CoronavirusWorld data ! ;) #CoronaVirusUpdates #coronavirus #COVID19 #Covid_19 #COVID__19 #covid,in,"['coronavirusworld', 'coronavirusupdates', 'coronavirus', 'covid19', 'covid_19', 'covid__19', 'covid']",[],213451073,213451073,Mauri_SMM_SEO,Ⓜaurizio ©Ⓜy®eal☺™☼🇮🇹,1,15,https://twitter.com/Mauri_SMM_SEO/status/1493373171361267718,[],[],0,,False,0,0,1,https://twitter.com/Mauri_SMM_SEO/status/1493236554487287818,#Covid-19,,,,,,,[],,,,
