id,conversation_id,created_at,date,timezone,place,tweet,language,hashtags,cashtags,user_id,user_id_str,username,name,day,hour,link,urls,photos,video,thumbnail,retweet,nlikes,nreplies,nretweets,quote_url,search,near,geo,source,user_rt_id,user_rt,retweet_id,reply_to,retweet_date,translate,trans_src,trans_dest
1493373991624527877,1493373991624527877,1644883079000.0,2022-02-14 15:57:59,-700,,Revisa esta infográfia sobre la importancia de conocer los medicamentos que no debes consumir si tienes #COVID-19.  https://t.co/2uyROe8EJO,es,['covid'],[],1044330939994836992,1044330939994836992,Gob_Zihuatanejo,Gobierno de Zihuatanejo,1,15,https://twitter.com/Gob_Zihuatanejo/status/1493373991624527877,[],['https://pbs.twimg.com/media/FLmHtsEXwAIvRvd.jpg'],1,https://pbs.twimg.com/media/FLmHtsEXwAIvRvd.jpg,False,3,0,2,,#Covid-19,,,,,,,[],,,,
1493373979092221952,1493373979092221952,1644883076000.0,2022-02-14 15:57:56,-700,,#auspol  #COVID19 #Covid_19   #FIAMMA,und,"['auspol', 'covid19', 'covid_19', 'fiamma']",[],1350050747849707522,1350050747849707522,DHurburgh,David Hurburgh,1,15,https://twitter.com/DHurburgh/status/1493373979092221952,[],[],0,,False,1,0,0,https://twitter.com/DHurburgh/status/1493373650694963201,#Covid-19,,,,,,,[],,,,
1493373976713867269,1493373976713867269,1644883076000.0,2022-02-14 15:57:56,-700,,#ATENCIÓN📢 ¡Te estamos esperando!  Estos son los puntos habilitados para la vacunación💉 contra el covid-19 durante este martes 15 de febrero en Bogotá.  ✅Acude teniendo en cuenta las medidas de bioseguridad. ¡El autocuidado y la vacunación son la clave!👌  https://t.co/2Z5Py4JUZf,es,['atención'],[],241135651,241135651,SectorSalud,Secretaría Distrital de Salud,1,15,https://twitter.com/SectorSalud/status/1493373976713867269,[],['https://pbs.twimg.com/media/FLmHt5VWQAAfbTX.jpg'],1,https://pbs.twimg.com/media/FLmHt5VWQAAfbTX.jpg,False,56,16,14,,#Covid-19,,,,,,,[],,,,
1493373970124472321,1493373970124472321,1644883074000.0,2022-02-14 15:57:54,-700,,"#Selasa #LintasBantenPagi Covid-19 Meningkat, 3.019 Tempat Tidur Disiapkan  https://t.co/80PaNA9sI6",in,"['selasa', 'lintasbantenpagi']",[],558371444,558371444,RRIBanten,"RRI Banten | 94,9 FM",1,15,https://twitter.com/RRIBanten/status/1493373970124472321,['https://www.radarbanten.co.id/covid-19-meningkat-3-019-tempat-tidur-disiapkan/'],[],0,,False,0,0,0,,#Covid-19,,,,,,,[],,,,
1493373967746355208,1493373967746355208,1644883074000.0,2022-02-14 15:57:54,-700,,🦠 🦠  ATENCIÓN: 1 fallecido y 5 casos por COVID-19 se registran hoy en #Cartagena. (( @MinSaludCol @INSColombia @Fruizgomez @vablelscaff @daulaw @camilorey @Coosalud @JaimeGonzalezM @largonatalia @RamosnAlicia @funcicar @ESECartagena @sabogalruben @ConsejoGremialB @ConcejoCTG )),es,['cartagena'],[],161155702,161155702,RevistaMetro,Revista Metro,1,15,https://twitter.com/RevistaMetro/status/1493373967746355208,[],[],0,,False,0,0,0,,#Covid-19,,,,,,,[],,,,
1493373940437164032,1493373937215967233,1644883067000.0,2022-02-14 15:57:47,-700,,"Over the last week, 28.5% of new non-ICU admissions are incidental cases. COVID-19 is the primary cause of admission or a contributing cause in 69% of cases. The remaining 2.5% are undetermined. For ICU, 15.3% were incidental, 84.7% of new admissions were due to COVID. (4/6)",en,[],[],1239656978495856641,1239656978495856641,CMOH_Alberta,Dr. Deena Hinshaw,1,15,https://twitter.com/CMOH_Alberta/status/1493373940437164032,[],[],0,,False,8,2,1,,#Covid-19,,,,,,,[],,,,
1493373937215967233,1493373937215967233,1644883066000.0,2022-02-14 15:57:46,-700,,"Here is a summary of the latest #COVID19AB numbers: There are 1,528 people in hospital with COVID-19, including 124 in ICU. Complete, up-to-date data can be found here:  https://t.co/odPoiSTm3Z… (1/6)",en,['covid19ab'],[],1239656978495856641,1239656978495856641,CMOH_Alberta,Dr. Deena Hinshaw,1,15,https://twitter.com/CMOH_Alberta/status/1493373937215967233,['https://alberta.ca/covid-19-alberta-data.aspx'],[],0,,False,19,23,3,,#Covid-19,,,,,,,[],,,,
1493373927221243907,1493304560118480897,1644883064000.0,2022-02-14 15:57:44,-700,,"@EtherealartNFT As everyone is like this because of COVID-19, our couple is more refraining from going out because of the birth of our first baby this month. Feeling sorry for not being able to take him to a nice restaurant, I did some food (steak, abalone risotto) for my wife. Happy holiday",en,[],[],1491933732059889667,1491933732059889667,Jaejaechu,JEJECHU,1,15,https://twitter.com/Jaejaechu/status/1493373927221243907,[],[],0,,False,0,0,0,,#Covid-19,,,,,,,"[{'screen_name': 'EtherealartNFT', 'name': 'Ethereal Art NFT', 'id': '1449988351365242882'}]",,,,
1493373896866742278,1493373896866742278,1644883057000.0,2022-02-14 15:57:37,-700,,A New Variant of California COVID-19 Supplemental Paid Sick Leave Law Emerges — What Employers Need to Know  https://t.co/wRGwWf4Eei,en,[],[],594867923,594867923,WageHourLaws,Wage and Hour,1,15,https://twitter.com/WageHourLaws/status/1493373896866742278,['https://www.jdsupra.com/legalnews/a-new-variant-of-california-covid-19-6585093/'],[],0,,False,0,0,0,,#Covid-19,,,,,,,[],,,,
1493373896812281861,1493373896812281861,1644883057000.0,2022-02-14 15:57:37,-700,,"A dor no corpo que eu ando sentindo ou é efeito da Covid-19 ou é dengue, pq tá pra lá de cansaço.",pt,[],[],979500688156909568,979500688156909568,jeskavenk,"Jeska, vem cá! 🧜🏾‍♀️🐆🧬",1,15,https://twitter.com/jeskavenk/status/1493373896812281861,[],[],0,,False,2,0,0,,#Covid-19,,,,,,,[],,,,
1493373887115112451,1493305274043551744,1644883054000.0,2022-02-14 15:57:34,-700,,@yfblanchet Pourquoi n’avez-vous pas voté concernant la motion concernant les mesures obligatoires et restrictions fédérales relatives à la Covid-19?  https://t.co/V4YTPztyoc,fr,[],[],611235083,611235083,Columbo_feminin,L’observatrice curieuse,1,15,https://twitter.com/Columbo_feminin/status/1493373887115112451,[],['https://pbs.twimg.com/media/FLmHogIXMAEaQhr.jpg'],1,https://pbs.twimg.com/media/FLmHogIXMAEaQhr.jpg,False,3,3,0,,#Covid-19,,,,,,,"[{'screen_name': 'yfblanchet', 'name': 'Yves-F. Blanchet 🎗⚜️', 'id': '38262290'}]",,,,
1493373880903290882,1493373880903290882,1644883053000.0,2022-02-14 15:57:33,-700,,"There are currently 51candidates Out of which, 10 candidates are in phase 3. #coronavirus #COVID #Covid-19 #vaccine #vaccines #vaccination Use #telegram and add bot 'CoronaTrackerNepal_bot' to get details and notifications.  Source:  https://t.co/HmUwd0efIQ",en,"['coronavirus', 'covid', 'covid', 'vaccine', 'vaccines', 'vaccination', 'telegram']",[],976098246882885634,976098246882885634,krishna444_test,World Alert,1,15,https://twitter.com/krishna444_test/status/1493373880903290882,['https://www.raps.org/news-and-articles/news-articles/2020/3/covid-19-vaccine-tracker'],[],0,,False,0,0,0,,#Covid-19,,,,,,,[],,,,
1493373839446847494,1493373839446847494,1644883043000.0,2022-02-14 15:57:23,-700,,La Secretaría Distrital de Salud entrega recomendaciones a los ciudadanos frente al COVID-19 y hace un llamado para que se aíslen quienes tienen síntomas leves y a que consulten el servicio médico de manera oportuna quienes tienen signos de alarma #JuntosNosCuidamos  https://t.co/TIgaakTzYs,es,['juntosnoscuidamos'],[],763430973333708800,763430973333708800,SubRedNorte,Subred Norte ESE,1,15,https://twitter.com/SubRedNorte/status/1493373839446847494,[],['https://pbs.twimg.com/media/FLmHltgXoAATwvC.jpg'],1,https://pbs.twimg.com/media/FLmHltgXoAATwvC.jpg,False,2,0,0,,#Covid-19,,,,,,,[],,,,
1493373830655586307,1493373830655586307,1644883041000.0,2022-02-14 15:57:21,-700,,"El médico neurólogo dialogó sobre la situación epidemiológica del Covid 19 en Argentina y señaló que durante el otoño se producirá una endemia. Con @majulluis, @bebogranados y @Gus_Noriega en #EstaTarde.    https://t.co/PRCrlEQBwW",es,['estatarde'],[],151170333,151170333,Rivadavia630,Radio Rivadavia,1,15,https://twitter.com/Rivadavia630/status/1493373830655586307,['https://rivadavia.com.ar/noticias/esta-tarde/conrado-estol-el-covid-largo-es-peligroso-por-eso-es-importante-el-refuerzo-de-vacunacion'],[],0,,False,10,3,4,,#Covid-19,,,,,,,[],,,,
1493373828424245255,1493370450675924994,1644883040000.0,2022-02-14 15:57:20,-700,,"@Indoemie41 Selamat pagi Kak. Sampai saat ini masih dilakukan pembatasan kapasitas maksimal dalam perjalanan kereta api, sesuai dengan peraturan yang berlaku. KAI berkomitmen untuk mencegah penyebaran COVID-19 dengan menerapkan protokol kesehatan ketat, |1",in,[],[],516165629,516165629,KAI121,Kereta Api Indonesia,1,15,https://twitter.com/KAI121/status/1493373828424245255,[],[],0,,False,0,0,0,,#Covid-19,,,,,,,"[{'screen_name': 'Indoemie41', 'name': '🐞', 'id': '1009955179356016640'}]",,,,
1493373826893324288,1492971292714319884,1644883040000.0,2022-02-14 15:57:20,-700,,@janinisabel Die Neuaufnahmen auf die Intensivstationen nehmen ebenfalls kontinuierlich zu.  Durch teils kürzere Verweildauern der Omikron-Fälle und einen Rückgang der PatientInnen mit einer Delta-Infektion steigt die Gesamtzahl der IntensivpatientInnen mit COVID-19 bisher nicht wesentlich an,de,[],[],607578214,607578214,rob_ert6,Robert,1,15,https://twitter.com/rob_ert6/status/1493373826893324288,[],[],0,,False,0,0,0,,#Covid-19,,,,,,,"[{'screen_name': 'janinisabel', 'name': 'Janina Lionello', 'id': '435040269'}]",,,,
1493373826335453185,1493373826335453185,1644883040000.0,2022-02-14 15:57:20,-700,,Hasta el 14 de febrero de 2022 han sido confirmados 90 mil 211  casos positivos de COVID-19 en Quintana Roo.  https://t.co/AsJkiMNxxn,es,[],[],318117122,318117122,SESA_QROO,SESA Quintana Roo,1,15,https://twitter.com/SESA_QROO/status/1493373826335453185,[],['https://pbs.twimg.com/media/FLmHlCcXsAAe_-P.jpg'],1,https://pbs.twimg.com/media/FLmHlCcXsAAe_-P.jpg,False,3,0,2,,#Covid-19,,,,,,,[],,,,
1493373816231321605,1493373816231321605,1644883037000.0,2022-02-14 15:57:17,-700,,"Oh hey, I found my NYC immunization registry. Apparently, I need a Tdap (booster)?  Also, why does it say I need my Covid-19 vaccine ""DUE NOW""? It documented my Moderna booster in Dec.",en,[],[],35628428,35628428,Maximinalist,Maximinalist,1,15,https://twitter.com/Maximinalist/status/1493373816231321605,[],[],0,,False,0,1,0,,#Covid-19,,,,,,,[],,,,
1493373802004287490,1493373802004287490,1644883034000.0,2022-02-14 15:57:14,-700,,В США разработали новую недорогую вакцину от COVID-19,ru,[],[],2225188109,2225188109,elieMccu,Ваня Сидоров,1,15,https://twitter.com/elieMccu/status/1493373802004287490,[],[],0,,False,0,0,0,,#Covid-19,,,,,,,[],,,,
1493373799743766528,1493373799743766528,1644883034000.0,2022-02-14 15:57:14,-700,,"Communication of living with covid “must counter fear by providing objective, quantitative data that sets this pandemic into context” “risks need to be set into context, c/w risks of everyday life eg. -12,000 deaths in UK every wk, many of them ..easier to prevent than covid-19”",en,[],[],987475948994875392,987475948994875392,Fiona_M_Russell,Fiona Russell,1,15,https://twitter.com/Fiona_M_Russell/status/1493373799743766528,[],[],0,,False,18,0,5,https://twitter.com/LucyGoBag/status/1493288055914082310,#Covid-19,,,,,,,[],,,,
1493373796170047492,1493373796170047492,1644883033000.0,2022-02-14 15:57:13,-700,,"COVID-19 в мире: протесты в Европе, разблокированный мост в Канаде, карнавал вернулся в Венецию",ru,[],[],2225188109,2225188109,elieMccu,Ваня Сидоров,1,15,https://twitter.com/elieMccu/status/1493373796170047492,[],[],0,,False,0,0,0,,#Covid-19,,,,,,,[],,,,
1493373778499231746,1493367289907150851,1644883028000.0,2022-02-14 15:57:08,-700,,@nealejones …and this is the very thing that has me on edge. Not Covid-19 and all it’s variants but THIS piece of historical fact.  https://t.co/RUEghBQOnJ,en,[],[],1129539181670100993,1129539181670100993,AuntyPippi,Aunty Pippi 🇺🇦🌻,1,15,https://twitter.com/AuntyPippi/status/1493373778499231746,[],['https://pbs.twimg.com/media/FLmHiLJVIAImBm3.jpg'],1,https://pbs.twimg.com/media/FLmHiLJVIAImBm3.jpg,False,1,0,0,,#Covid-19,,,,,,,"[{'screen_name': 'nealejones', 'name': 'Neale Jones', 'id': '22605803'}]",,,,
1493373769787719684,1493373769787719684,1644883026000.0,2022-02-14 15:57:06,-700,,A New Variant of California COVID-19 Supplemental Paid Sick Leave Law Emerges — What Employers Need to Know  https://t.co/8aPJDcFMSJ | by @GreenbergGluske,en,[],[],21947050,21947050,LegalNews,The Corporate Brief,1,15,https://twitter.com/LegalNews/status/1493373769787719684,['https://www.jdsupra.com/legalnews/a-new-variant-of-california-covid-19-6585093/'],[],0,,False,0,0,0,,#Covid-19,,,,,,,[],,,,
1493373769263505408,1493373769263505408,1644883026000.0,2022-02-14 15:57:06,-700,,"COVID-19: confirman en Perú tres casos de BA.2, subvariante de ómicron ► https://t.co/73xbs1fFYp  https://t.co/JXAlOGWdPk",es,[],[],110822488,110822488,Gestionpe,Diario Gestión,1,15,https://twitter.com/Gestionpe/status/1493373769263505408,['https://bit.ly/3uKmF9E'],['https://pbs.twimg.com/media/FLmHfiyXwAAVFQT.png'],1,https://pbs.twimg.com/media/FLmHfiyXwAAVFQT.png,False,3,0,4,,#Covid-19,,,,,,,[],,,,
1493373766977662977,1493373766977662977,1644883026000.0,2022-02-14 15:57:06,-700,,COVID 19| ¡ALERTA MUNDIAL! NEOCOV: “NUEVA CEPA MÁS MORTAL DEL CORONAVIRU...  https://t.co/oyixTSq6KL via @YouTube,es,[],[],1442287323081678851,1442287323081678851,Benjami99635026,Benjamin Rodriguez,1,15,https://twitter.com/Benjami99635026/status/1493373766977662977,['https://youtu.be/R79PvkKK7r4'],[],0,,False,0,0,0,,#Covid-19,,,,,,,[],,,,
1493373702087585798,1493373702087585798,1644883010000.0,2022-02-14 15:56:50,-700,,"#Nacional 🇲🇽💉 I Vacuna Patria contra COVID-19 es segura, afirma Conacyt  https://t.co/MlhLaF81hL  👉Síguenos en Facebook  MarcrixNoticias1👇  https://t.co/6HBiyexYAc  https://t.co/bDD1gF6zE0",es,['nacional'],[],1653727837,1653727837,MarcrixNoticias,Marcrix Noticias,1,15,https://twitter.com/MarcrixNoticias/status/1493373702087585798,"['https://www.marcrixnoticias.com/vacuna-patria-contra-covid-19-es-segura-afirma-conacyt/', 'http://www.facebook.com/MarcrixNoticias1/']",['https://pbs.twimg.com/media/FLmHdmEWQAUYa75.jpg'],1,https://pbs.twimg.com/media/FLmHdmEWQAUYa75.jpg,False,0,0,0,,#Covid-19,,,,,,,[],,,,
1493373693220769798,1493373693220769798,1644883008000.0,2022-02-14 15:56:48,-700,,Review of COVID-19 Pfizer vaccine for children under 5 delayed  https://t.co/smMbdDB5vL via @YouTube,en,[],[],925833813959364608,925833813959364608,GuardianJunebug,junebug,1,15,https://twitter.com/GuardianJunebug/status/1493373693220769798,['https://youtu.be/eBg-TEPFq74'],[],0,,False,0,0,0,,#Covid-19,,,,,,,[],,,,
1493373680877031432,1493373680877031432,1644883005000.0,2022-02-14 15:56:45,-700,,#News #Canada #North Nunavut cabinet minister tests positive for COVID-19  https://t.co/AmDrN3OsW0,ca,"['news', 'canada', 'north']",[],715260608,715260608,inewsreportnet,Internet News Report,1,15,https://twitter.com/inewsreportnet/status/1493373680877031432,['https://ift.tt/eHo56KT'],[],0,,False,0,0,0,,#Covid-19,,,,,,,[],,,,
1493373660626931713,1493373660626931713,1644883000000.0,2022-02-14 15:56:40,-700,,شكلي مصاب COVID-19 مع اني ما الي اسبوع مخلص فتره الحجر 😤,ar,[],[],1067558282838114308,1067558282838114308,al_haretm,‏﮼الحارث،المستريحي⚔️🇯🇴,1,15,https://twitter.com/al_haretm/status/1493373660626931713,[],[],0,,False,5,1,0,,#Covid-19,,,,,,,[],,,,
1493373660106792960,1493373660106792960,1644883000000.0,2022-02-14 15:56:40,-700,,"By the thousands, Americans have been seeking religious exemptions in order to circumvent COVID-19 vaccine mandates, but generally they are doing so without the encouragement of major denominations and prominent religious leaders.  https://t.co/a1Dtt3DXNI",en,[],[],86141342,86141342,ABCWorldNews,World News Tonight,1,15,https://twitter.com/ABCWorldNews/status/1493373660106792960,['https://abcn.ws/3uPTpOz'],[],0,,False,17,14,2,,#Covid-19,,,,,,,[],,,,
1493373660102496257,1493373660102496257,1644883000000.0,2022-02-14 15:56:40,-700,,COVID-19の状況下で、春摘の会社の一番偉い人が「のんびり判断する」という方針を出したのは、ここ10年で2番目に良い采配で……いったい何を食べたのだろうと常々首を捻っている。,ja,[],[],283167655,283167655,harutsumiren,春摘怜,1,15,https://twitter.com/harutsumiren/status/1493373660102496257,[],[],0,,False,2,1,0,,#Covid-19,,,,,,,[],,,,
1493373658559131649,1493373658559131649,1644883000000.0,2022-02-14 15:56:40,-700,,Estrogen Replacement May Reduce COVID-19 Death Risk  https://t.co/wwXnLXbaM6,en,[],[],1062199628941058048,1062199628941058048,trishanmurry,Trisha Murry,1,15,https://twitter.com/trishanmurry/status/1493373658559131649,['http://www.medscape.com/viewarticle/968450'],[],0,,False,0,0,0,,#Covid-19,,,,,,,[],,,,
1493373650845712393,1493373650845712393,1644882998000.0,2022-02-14 15:56:38,-700,,Senador Cid Gomes propõe que vacinação contra a Covid-19 passe a ser obrigatória no Brasil  https://t.co/Mvmi6wP9iC,pt,[],[],1265286148508786690,1265286148508786690,jornalistaroge1,jornalistarogeriogomes,1,15,https://twitter.com/jornalistaroge1/status/1493373650845712393,[],['https://pbs.twimg.com/media/FLmHarQWQAI50-i.jpg'],1,https://pbs.twimg.com/media/FLmHarQWQAI50-i.jpg,False,0,0,0,,#Covid-19,,,,,,,[],,,,
1493373650019438598,1493373650019438598,1644882998000.0,2022-02-14 15:56:38,-700,,CoronaV Series: Ep. #1 Fight The Fakes about COVID-19:  https://t.co/BPNKgfXpI1,en,[],[],1276386008,1276386008,DarylDoc22,Daryl Franklin,1,15,https://twitter.com/DarylDoc22/status/1493373650019438598,['https://discountprescriptioncards.org?p=10446'],[],0,,False,0,0,0,,#Covid-19,,,,,,,[],,,,
1493373646919897092,1493373646919897092,1644882997000.0,2022-02-14 15:56:37,-700,,CoronaV Series: Ep. #1 Fight The Fakes about COVID-19:  https://t.co/Q2QdWfwtX2,en,[],[],113797201,113797201,ownbusinesses,Daryl Franklin,1,15,https://twitter.com/ownbusinesses/status/1493373646919897092,['https://discountprescriptioncards.org?p=10446'],[],0,,False,0,0,0,,#Covid-19,,,,,,,[],,,,
1493373645896441856,1493373645896441856,1644882997000.0,2022-02-14 15:56:37,-700,,"O covid 19 foi ruim, mais vcs nunca sentiram a dor de não cair na sala com ela...",pt,[],[],1492644322101104644,1492644322101104644,DnqqzX,dnqqzX,1,15,https://twitter.com/DnqqzX/status/1493373645896441856,[],[],0,,False,0,0,0,,#Covid-19,,,,,,,[],,,,
1493373643761471489,1493373643761471489,1644882996000.0,2022-02-14 15:56:36,-700,,"Autoridades de salud de México indicaron que para reducir hospitalizaciones y defunciones por covid-19 y contribuir a restaurar la vida social, se autorizaron 10 vacunas diferentes para uso de emergencia.   https://t.co/CKHvzCqSlI",es,[],[],91430932,91430932,NewsweekEspanol,Newsweek en Español,1,15,https://twitter.com/NewsweekEspanol/status/1493373643761471489,['https://newsweekespanol.com/2022/02/mexico-covid-19-erradicar-salud/'],[],0,,False,2,0,1,,#Covid-19,,,,,,,[],,,,
1493373627768573954,1493373627768573954,1644882993000.0,2022-02-14 15:56:33,-700,,"Bravo! Bravo! ""Prime Minister Justin Trudeau is enacting the Emergencies Act, first time in Canadian history, in response to ongoing protests over COVID-19 restrictions. The act overrides provinces and authorizes temporary measures to ensure security during national emergencies.""",en,[],[],897115470783852549,897115470783852549,HenryJKraven,Henry Kraven,1,15,https://twitter.com/HenryJKraven/status/1493373627768573954,[],[],0,,False,16,3,3,,#Covid-19,,,,,,,[],,,,
1493373593454985216,1493373593454985216,1644882984000.0,2022-02-14 15:56:24,-700,,The Australian Defence Force will be brought in to assist Tasmanian aged care facilities after a number of COVID-19 outbreaks #covid19tas  https://t.co/hxGPECY7Id,en,['covid19tas'],[],1871258388,1871258388,MonteBovill,Monte Bovill,1,15,https://twitter.com/MonteBovill/status/1493373593454985216,['https://www.abc.net.au/news/2022-02-15/tas-covid-outbreak-aged-care-homes-defence-force/100830646'],[],0,,False,32,4,7,,#Covid-19,,,,,,,[],,,,
1493373586702155777,1493373586702155777,1644882983000.0,2022-02-14 15:56:23,-700,,"93.1% (4,315,735) of eligible people 12+ in BC have received their 1st dose of COVID-19 vaccine.   90.5% (4,193,878) received their 2nd dose.   Full COVID Update:  https://t.co/yK1jUSJNeP",en,[],[],22997830,22997830,adriandix,Adrian Dix,1,15,https://twitter.com/adriandix/status/1493373586702155777,['https://news.gov.bc.ca/26258'],[],0,,False,50,34,24,,#Covid-19,,,,,,,[],,,,
1493373576132673537,1492947901412261888,1644882980000.0,2022-02-14 15:56:20,-700,,"@Zipfeklatscha @SonOfData @PrienKarin Frau Prien ist jetzt daran Schuld das von 14 Mio Kinder rund 60 in 2 Jahren Pandemie verstorben sind davon die meisten ursächlich NICHT an Covid-19 ???? Hass und Hetze bis hin zu Rufmord über Twitter ist einfach nur noch unsäglich,ja Menschenunwürdig.",de,[],[],1411732988375842817,1411732988375842817,MatthiasGrimm14,Matthias Grimm,1,15,https://twitter.com/MatthiasGrimm14/status/1493373576132673537,[],[],0,,False,0,0,0,,#Covid-19,,,,,,,"[{'screen_name': 'Zipfeklatscha', 'name': 'Oida naaaa', 'id': '1418973955298373637'}, {'screen_name': 'SonOfData', 'name': 'SonOfData', 'id': '1908889189'}, {'screen_name': 'PrienKarin', 'name': 'Karin Prien', 'id': '1653823657'}]",,,,
1493373565625933826,1493373565625933826,1644882978000.0,2022-02-14 15:56:18,-700,,RDC : Suppression du test covid-19 à l’entrée du territoire national pour « tout voyageur complètement vacciné »   https://t.co/pwr77ynZXb,fr,[],[],1250728961849597953,1250728961849597953,Actu7rdc,Actu7,1,15,https://twitter.com/Actu7rdc/status/1493373565625933826,['https://actu7.cd/2022/02/14/rdc-suppression-du-test-covid-19-a-lentree-du-territoire-national-pour-tout-voyageur-completement-vaccine/'],[],0,,False,0,0,0,,#Covid-19,,,,,,,[],,,,
1493373541131112450,1492739266337595392,1644882972000.0,2022-02-14 15:56:12,-700,,"@rorywaller932in @ActivistMerriam @Blucollarp8riot @iancfairclough @MichaelPSenger Interesting that Covid-19 has been shown to cause myocarditis as well, isn't it? How did the study you're siting control for that variable?",en,[],[],1270775130847879168,1270775130847879168,UncleBuck666420,Ryan David,1,15,https://twitter.com/UncleBuck666420/status/1493373541131112450,[],[],0,,False,0,1,0,,#Covid-19,,,,,,,"[{'screen_name': 'rorywaller932in', 'name': 'Rory Waller', 'id': '958833129778638849'}, {'screen_name': 'ActivistMerriam', 'name': 'ActivistMerram', 'id': '1467662053963882506'}, {'screen_name': 'Blucollarp8riot', 'name': 'DNA', 'id': '1338290274980618240'}, {'screen_name': 'iancfairclough', 'name': 'Ian Fairclough', 'id': '552740280'}, {'screen_name': 'MichaelPSenger', 'name': 'Michael P Senger', 'id': '1679362640'}]",,,,
1493373530213343233,1493373530213343233,1644882969000.0,2022-02-14 15:56:09,-700,,"No, hospitalized COVID-19 patients weren’t killed by remdesivir:  https://t.co/isLZa1E6w5",en,[],[],854792794984120321,854792794984120321,Charger0843Rion,Brenda Rion 🌊,1,15,https://twitter.com/Charger0843Rion/status/1493373530213343233,['https://mailchi.mp/politifact/no-hospitalized-covid-19-patients-werent-killed-by-remdesivir'],[],0,,False,1,0,0,,#Covid-19,,,,,,,[],,,,
1493373526857981953,1493373526857981953,1644882968000.0,2022-02-14 15:56:08,-700,,"#Microsoft to Start Bringing Employees Back to the Office  The company cites the high vaccination rates for Covid-19 in King County, where most of the company’s Washington-based employees live, as well as declining hospitalizations and deaths in the state.",en,['microsoft'],[],19651092,19651092,MrTopStep,MrTopStep,1,15,https://twitter.com/MrTopStep/status/1493373526857981953,[],[],0,,False,0,0,0,,#Covid-19,,,,,,,[],,,,
1493373524840706048,1493345514884329472,1644882968000.0,2022-02-14 15:56:08,-700,,@BobLefridge Exactly this.   Covid-19 and other nasties being cooked up in their filth will end the protest. Just need to contain the rabble so they don’t spread covid all over the country,en,[],[],1819831740,1819831740,TwHandle,W8C,1,15,https://twitter.com/TwHandle/status/1493373524840706048,[],[],0,,False,2,0,0,,#Covid-19,,,,,,,"[{'screen_name': 'BobLefridge', 'name': 'Bob LeFridge - the 2022 full-blown AI edition 💚', 'id': '1222697129560293376'}]",,,,
1493373523292733444,1493373523292733444,1644882968000.0,2022-02-14 15:56:08,-700,,Oestrogen levels linked to risk of COVID-19 death in older women  https://t.co/saGfPIgNMb  https://t.co/I5fMDYe1FM,en,[],[],1300521625587273730,1300521625587273730,Monarchglobalh,Monarch Global Health,1,15,https://twitter.com/Monarchglobalh/status/1493373523292733444,['http://ow.ly/uV5x103oSmq'],['https://pbs.twimg.com/media/FLmHTgYX0AU4xmG.jpg'],1,https://pbs.twimg.com/media/FLmHTgYX0AU4xmG.jpg,False,0,0,0,,#Covid-19,,,,,,,[],,,,
1493373521040654340,1493373521040654340,1644882967000.0,2022-02-14 15:56:07,-700,,「COVID-19ワクチン」の追加接種（ブースター）を慌てて頻繁に実施することは危険 https://t.co/MeOHoScguK  https://t.co/rK7nGbrCLA,ja,[],[],336465992,336465992,oimatu07,oimatu,1,15,https://twitter.com/oimatu07/status/1493373521040654340,['https://www.rui.jp/ruinet.html?i=200&c=400&m=372067&g=132107'],['https://pbs.twimg.com/media/FDWKlz9agAAQDKK.jpg'],1,https://pbs.twimg.com/media/FDWKlz9agAAQDKK.jpg,False,0,0,0,,#Covid-19,,,,,,,[],,,,
