id,conversation_id,created_at,date,timezone,place,tweet,language,hashtags,cashtags,user_id,user_id_str,username,name,day,hour,link,urls,photos,video,thumbnail,retweet,nlikes,nreplies,nretweets,quote_url,search,near,geo,source,user_rt_id,user_rt,retweet_id,reply_to,retweet_date,translate,trans_src,trans_dest
1493373168215486469,1493373168215486469,1644882883000.0,2022-02-14 15:54:43,-700,,COVID-19 close contact for 1st day. Hope vaccine work🙏  https://t.co/T5lTFGRUDc,en,[],[],844393561667842049,844393561667842049,ChongguangW,St Lucia🌇,1,15,https://twitter.com/ChongguangW/status/1493373168215486469,[],['https://pbs.twimg.com/media/FLmG6LgVgAM-fkh.jpg'],1,https://pbs.twimg.com/media/FLmG6LgVgAM-fkh.jpg,False,0,0,0,,#Covid-19,,,,,,,[],,,,
1493373161605255170,1493373161605255170,1644882881000.0,2022-02-14 15:54:41,-700,,A New Variant of California COVID-19 Supplemental Paid Sick Leave Law Emerges — What Employers Need to Know  https://t.co/sp5jogEuZU,en,[],[],442246804,442246804,California_Laws,California Law News,1,15,https://twitter.com/California_Laws/status/1493373161605255170,['https://www.jdsupra.com/legalnews/a-new-variant-of-california-covid-19-6585093'],[],0,,False,0,0,0,,#Covid-19,,,,,,,[],,,,
1493373161190141957,1493373161190141957,1644882881000.0,2022-02-14 15:54:41,-700,,COVID-19. Red flags about bad misinformation on health.,en,[],[],410103064,410103064,DemiurgoTuiter,El Demiurgo,1,15,https://twitter.com/DemiurgoTuiter/status/1493373161190141957,[],[],0,,False,0,0,0,https://twitter.com/DrEricDing/status/1449079854159343617,#Covid-19,,,,,,,[],,,,
1493373159977930754,1493268765408206853,1644882881000.0,2022-02-14 15:54:41,-700,,@engineers_feed Covid-19 vaccines,en,[],[],1453318924259500033,1453318924259500033,AnnaSky92974146,AnnaSky9 🌅,1,15,https://twitter.com/AnnaSky92974146/status/1493373159977930754,[],[],0,,False,0,0,0,,#Covid-19,,,,,,,"[{'screen_name': 'engineers_feed', 'name': 'World of Engineering', 'id': '3429950987'}]",,,,
1493373156622585857,1493373156622585857,1644882880000.0,2022-02-14 15:54:40,-700,,"THEORY: If Covid was created in a laboratory, and several parts of the AIDS virus were copied verbatim into SARS-CoV-2, and natural immunity creates antibodies against many parts of a virus and not just the spike protein, then if you had Covid-19, you might show positive for HIV.",en,[],[],1249315862059909122,1249315862059909122,ColonelWhite2,Colonel White,1,15,https://twitter.com/ColonelWhite2/status/1493373156622585857,[],[],0,,False,4,0,0,,#Covid-19,,,,,,,[],,,,
1493373146321518592,1493373146321518592,1644882878000.0,2022-02-14 15:54:38,-700,,COVID-19ワクチンを接種した母親から母乳を通じて乳児が被害を受ける可能性については別スレッドに纏める。,ja,[],[],266505821,266505821,kawamomotwitt,川流桃桜＠UnmasktheEmpire,1,15,https://twitter.com/kawamomotwitt/status/1493373146321518592,[],[],0,,False,15,1,9,https://twitter.com/kawamomotwitt/status/1434660502349631488,#Covid-19,,,,,,,[],,,,
1493373110292082691,831597185888198656,1644882869000.0,2022-02-14 15:54:29,-700,,ワクチンは良くない 白人 HIV AIDS これらの輸入品に注意する必要があります 彼らがあなたを愛していると考えるべきではありません タンザニア 大統領 コロナ パパイヤ ヤギ Tanzania's Bulldozer president and COVID-19  https://t.co/FqwOjoaqTo   https://t.co/mPzAm0Ottf,ja,[],[],479674998,479674998,jisyuhinan,311memo 甲状腺癌,1,15,https://twitter.com/jisyuhinan/status/1493373110292082691,"['https://www.reuters.com/article/us-tanzania-president-mangufuli-obituary-idUSKBN2B930J', 'https://twitter.com/jisyuhinan/status/1391121482261032961?s=20&t=rbAw6GehRAIwDYLwrnmWBg']",[],0,,False,1,1,0,https://twitter.com/jisyuhinan/status/1391121482261032961?s=20&t=rbAw6GehRAIwDYLwrnmWBg,#Covid-19,,,,,,,[],,,,
1493373094689452033,1493239154565599232,1644882865000.0,2022-02-14 15:54:25,-700,,"@Ericson_ubbhult Bara för att @SAS släpper  munskyddskrav inom Skandinavien så innebär det inte att d  det inte finns någon covid-19-smitta på planet. Behåll munskyddet på, precis sol övriga SAS flighter uti i övriga världen gör!",sv,[],[],1381673544279584768,1381673544279584768,Susanna_E_L,Susanna,1,15,https://twitter.com/Susanna_E_L/status/1493373094689452033,[],[],0,,False,14,1,3,,#Covid-19,,,,,,,"[{'screen_name': 'Ericson_ubbhult', 'name': 'Jan Ericson 🇸🇪🇺🇦', 'id': '393890670'}]",,,,
1493373082131652609,1493371710216851457,1644882862000.0,2022-02-14 15:54:22,-700,,"@BlogdoNoblat Mesmo assim esse pseudo presidente continua no cargo! Não importam os absurdos, a destruição das nossas matas e rios, a sanha golpista, a destruição da Economia, os quase 700.000 mortos pela Covid-19. Aparelhou tudo!",pt,[],[],1269065872452325377,1269065872452325377,VozNao,Voz Do Além. Não Vem Que Não Tem.,1,15,https://twitter.com/VozNao/status/1493373082131652609,[],[],0,,False,1,0,0,,#Covid-19,,,,,,,"[{'screen_name': 'BlogdoNoblat', 'name': 'Blog do Noblat', 'id': '16794066'}]",,,,
1493373061126844416,1493338034858770438,1644882857000.0,2022-02-14 15:54:17,-700,,"@Jim_Jordan And to think, the U.S. COVID-19 death toll is a mere 920,000 so far.  https://t.co/4U9og25v1q",en,[],[],1046198600,1046198600,fourscoreand6,jkatiforis,1,15,https://twitter.com/fourscoreand6/status/1493373061126844416,[],['https://pbs.twimg.com/media/FLmG4ogakAEuN0s.jpg'],1,https://pbs.twimg.com/media/FLmG4ogakAEuN0s.jpg,False,2,0,0,,#Covid-19,,,,,,,"[{'screen_name': 'Jim_Jordan', 'name': 'Rep. Jim Jordan', 'id': '18166778'}]",,,,
1493373050154270730,1493373050154270730,1644882855000.0,2022-02-14 15:54:15,-700,,"guys did you know Prime Minister Justin Trudeau announced on Monday he is enacting the Emergencies Act for the first time in Canadian history, in response to ongoing protests over COVID-19 restrictions in Ottawa and around Canada?",en,[],[],2749497771,2749497771,padenspencer,Paden,1,15,https://twitter.com/padenspencer/status/1493373050154270730,[],[],0,,False,1,1,0,,#Covid-19,,,,,,,[],,,,
1493373038452170753,1492921003147776013,1644882852000.0,2022-02-14 15:54:12,-700,,"@GOPChairwoman Gov. Youngkin encourages Virginians to get vaccinated, releases COVID-19 PSA video.  Now here is a responsible GOP Leader!!",en,[],[],1969174938,1969174938,robronjohn,rob johnson,1,15,https://twitter.com/robronjohn/status/1493373038452170753,[],[],0,,False,0,0,0,,#Covid-19,,,,,,,"[{'screen_name': 'GOPChairwoman', 'name': 'Ronna McDaniel', 'id': '2353605901'}]",,,,
1493373019477065730,1493373019477065730,1644882848000.0,2022-02-14 15:54:08,-700,,Morning class at 7.40 am in a lecture hall after Covid-19 restrictions. A fantastic feeling!👍  https://t.co/VahqmASSHr,en,[],[],74875426,74875426,ob2133,Бээлийн чинээ охинᅠᅠᅠᅠᅠᅠᅠᅠᅠᅠᅠᅠᅠᅠᅠᅠᅠᅠᅠᅠᅠᅠᅠᅠᅠᅠᅠᅠᅠᅠ,1,15,https://twitter.com/ob2133/status/1493373019477065730,[],['https://pbs.twimg.com/media/FLmG1m9X0AMoebh.jpg'],1,https://pbs.twimg.com/media/FLmG1m9X0AMoebh.jpg,False,27,0,0,,#Covid-19,,,,,,,[],,,,
1493373015438069760,1493373015438069760,1644882847000.0,2022-02-14 15:54:07,-700,,"Ichu: VIEP divulga boletim desta segunda (14/02) com 27 novos casos de COVID-19, 84 curas e 34 ativos  https://t.co/Pik5sG4H8s  https://t.co/BKiMArXU2X",pt,[],[],1832324864,1832324864,ichunoticias,ICHU NOTÍCIAS,1,15,https://twitter.com/ichunoticias/status/1493373015438069760,['http://www.ichunoticias.com.br/2022/02/ichu-viep-divulga-boletim-desta-segunda.html?m=0'],['https://pbs.twimg.com/media/FLmG19hWQAIXS6w.jpg'],1,https://pbs.twimg.com/media/FLmG19hWQAIXS6w.jpg,False,0,0,0,,#Covid-19,,,,,,,[],,,,
1493373010979479553,1493373010979479553,1644882846000.0,2022-02-14 15:54:06,-700,,"El Ministerio de Salud (Minsa) informó este lunes, 14 de febrero, que en las últimas 24 horas se reportan 799 contagios de Covid-19, una cifra que viene en descenso en los últimos días. #LaPrensaSecuestrada   https://t.co/lKHYA1amiX",es,['laprensasecuestrada'],[],27011708,27011708,prensacom,La Prensa Panamá,1,15,https://twitter.com/prensacom/status/1493373010979479553,['https://www.prensa.com/sociedad/panama-reporta-799-nuevos-contagios-por-coronavirus-y-9-defunciones/?utm_source=prensa.com&utm_medium=compartir&utm_campaign=twitter'],[],0,,False,3,0,1,,#Covid-19,,,,,,,[],,,,
1493373005124317185,1493373005124317185,1644882844000.0,2022-02-14 15:54:04,-700,,Estrogen Replacement May Reduce COVID-19 Death Risk  https://t.co/mZ7789R5u6,en,[],[],1061800653738127360,1061800653738127360,frankherdj,Frank Herd,1,15,https://twitter.com/frankherdj/status/1493373005124317185,['http://www.medscape.com/viewarticle/968450'],[],0,,False,0,0,0,,#Covid-19,,,,,,,[],,,,
1493373001521569792,1493373001521569792,1644882843000.0,2022-02-14 15:54:03,-700,,Jangan Abai Protokol Kesehatan Dan Segera Ikut Vaksinasi Covid-19  https://t.co/PIWLR11DGL,in,[],[],1442683018959724546,1442683018959724546,Sekkenduruan,Polsekkenduruan,1,15,https://twitter.com/Sekkenduruan/status/1493373001521569792,[],['https://pbs.twimg.com/media/FLmG0geaIAIyL3e.jpg'],1,https://pbs.twimg.com/media/FLmG0geaIAIyL3e.jpg,False,1,0,0,,#Covid-19,,,,,,,[],,,,
1493372995359940610,1493372995359940610,1644882842000.0,2022-02-14 15:54:02,-700,,"A partir de este 15 de febrero y hasta el 21 del mismo mes, las Brigadas Correcaminos estarán aplicando la vacuna de refuerzo contra COVID-19 en el Puerto de #Veracruz.  https://t.co/ajfBkOJwqg",es,['veracruz'],[],158877910,158877910,eli8427,Elie Ramírez Rueda,1,15,https://twitter.com/eli8427/status/1493372995359940610,[],['https://pbs.twimg.com/media/FLmG01-WQAUwN2P.jpg'],1,https://pbs.twimg.com/media/FLmG01-WQAUwN2P.jpg,False,0,0,0,,#Covid-19,,,,,,,[],,,,
1493372995330576391,1493372995330576391,1644882842000.0,2022-02-14 15:54:02,-700,,"People have been asking, so there it is: ""Liberal MP Joël Lightbound, who broke with the government last week over its handling of COVID-19 restrictions, voted with the Conservatives.""  Poilievre doubles down on support for Ottawa demonstrators | The Star  https://t.co/EVrcrQfyzp",en,[],[],1111742456134074368,1111742456134074368,sandi89701936,Sandi: World! Do not let Russia take Ukraine,1,15,https://twitter.com/sandi89701936/status/1493372995330576391,['https://www.thestar.com/politics/federal/2022/02/14/yes-to-peaceful-protests-pierre-poilievre-doubles-down-on-support-for-ottawa-demonstrators.html'],[],0,,False,0,0,0,,#Covid-19,,,,,,,[],,,,
1493372990339354624,1493372990339354624,1644882841000.0,2022-02-14 15:54:01,-700,,"British Columbia recorded another 17 deaths related to COVID-19 over the weekend, as the number of test-positive patients in hospital continued to decline.   https://t.co/nh6kKbj7lb",en,[],[],16313405,16313405,CTVVancouver,CTV News Vancouver,1,15,https://twitter.com/CTVVancouver/status/1493372990339354624,['https://bc.ctvnews.ca/covid-19-update-b-c-reports-17-deaths-over-72-hours-another-drop-in-hospitalizations-1.5780579'],[],0,,False,5,5,2,,#Covid-19,,,,,,,[],,,,
1493372983582371841,1493252155280605185,1644882839000.0,2022-02-14 15:53:59,-700,,@RepPatFallon Celebrity can suffer or die. Who cares? But youth must be protected from stupidity and life threatening sickness caused by communicable infection caused by COVID-19. Adults dying due their own stupid negligence is their own business.,en,[],[],450983554,450983554,Annntst,Alok Tripathi,1,15,https://twitter.com/Annntst/status/1493372983582371841,[],[],0,,False,0,0,0,,#Covid-19,,,,,,,"[{'screen_name': 'RepPatFallon', 'name': 'Rep. Pat Fallon', 'id': '1343258042704527362'}]",,,,
1493372968910602242,1493352458269175810,1644882835000.0,2022-02-14 15:53:55,-700,,"@TheUSASingers @bvnt123 Over 3000 died of Covid 19 today in the U.S., Dr. Ozscam !",en,[],[],2513476004,2513476004,BKatakis,Gimmie Warp Drive,1,15,https://twitter.com/BKatakis/status/1493372968910602242,[],[],0,,False,1,0,0,,#Covid-19,,,,,,,"[{'screen_name': 'TheUSASingers', 'name': 'The USA Singers', 'id': '832616065259614209'}, {'screen_name': 'bvnt123', 'name': '((bb))Bigly S3CR3TS: Unholy Empires *GopTrumpNazis', 'id': '4841697589'}]",,,,
1493372947821518848,1492527604452188169,1644882830000.0,2022-02-14 15:53:50,-700,,"@franyavinsky ¡Hola, Francisco! Solamente se solicita prueba de COVID-19 a las personas que no cuenten con su esquema completo de vacunas aceptadas por la OMS y la ONU. Encuentra todos los detalles aquí:  https://t.co/fgrJMYoLRb",es,[],[],35764728,35764728,viajaVolaris,Volaris,1,15,https://twitter.com/viajaVolaris/status/1493372947821518848,['https://bit.ly/3GlHRoQ'],[],0,,False,1,0,0,,#Covid-19,,,,,,,"[{'screen_name': 'franyavinsky', 'name': 'Francisco Gómez', 'id': '1456750275213991938'}]",,,,
1493372946563444737,1493240133470068738,1644882830000.0,2022-02-14 15:53:50,-700,,"@GOPChairwoman Gov. Youngkin encourages Virginians to get vaccinated, releases COVID-19 PSA video.  Now here is a responsible GOP Leader!!",en,[],[],1969174938,1969174938,robronjohn,rob johnson,1,15,https://twitter.com/robronjohn/status/1493372946563444737,[],[],0,,False,0,0,0,,#Covid-19,,,,,,,"[{'screen_name': 'GOPChairwoman', 'name': 'Ronna McDaniel', 'id': '2353605901'}]",,,,
1493372938409676802,1493372938409676802,1644882828000.0,2022-02-14 15:53:48,-700,,"El alcalde Renán Barrera destacó que la actual administración realiza diversos programas para ofrecer de manera solidaria servicios y atención médica 🧑‍⚕, especialmente ahora que los esfuerzos están enfocados en poner freno a la pandemia por COVID-19.  https://t.co/LwnLVS9ZoP",es,[],[],541841931,541841931,Enotrasnoticia,En otras noticias,1,15,https://twitter.com/Enotrasnoticia/status/1493372938409676802,['http://enotrasnoticias.com/2022/02/14/medico-a-domicilio-salud-para-los-mas-vulnerables/'],[],0,,False,0,0,0,,#Covid-19,,,,,,,[],,,,
1493372919786921984,1493372919786921984,1644882824000.0,2022-02-14 15:53:44,-700,,Biden should embrace every weapon against COVID-19 - Washington Times  https://t.co/aLtJwALs6v,en,[],[],3291829355,3291829355,ramsdell_dave,Dave Ramsdell,1,15,https://twitter.com/ramsdell_dave/status/1493372919786921984,['https://www.washingtontimes.com/news/2022/feb/13/biden-should-embrace-every-weapon-against-covid-19/'],[],0,,False,0,0,0,,#Covid-19,,,,,,,[],,,,
1493372904607727618,1493335534713847812,1644882820000.0,2022-02-14 15:53:40,-700,,Trump was unleashing hell on this nation with his lack of urgency in dealing with Covid-19 resulting in the deaths of 400K.,en,[],[],1011269833,1011269833,vbgunlt4th,Positively 4Th Street,1,15,https://twitter.com/vbgunlt4th/status/1493372904607727618,[],[],0,,False,1,0,0,,#Covid-19,,,,,,,[],,,,
1493372900119830530,1493301267195744256,1644882819000.0,2022-02-14 15:53:39,-700,,"@GOPChairwoman Gov. Youngkin encourages Virginians to get vaccinated, releases COVID-19 PSA video.  Now here is a responsible GOP Leader!!",en,[],[],1969174938,1969174938,robronjohn,rob johnson,1,15,https://twitter.com/robronjohn/status/1493372900119830530,[],[],0,,False,0,0,0,,#Covid-19,,,,,,,"[{'screen_name': 'GOPChairwoman', 'name': 'Ronna McDaniel', 'id': '2353605901'}]",,,,
1493372892670742539,1493372892670742539,1644882817000.0,2022-02-14 15:53:37,-700,,COVID-19. Covid is airbone in many indoor places:,en,[],[],410103064,410103064,DemiurgoTuiter,El Demiurgo,1,15,https://twitter.com/DemiurgoTuiter/status/1493372892670742539,[],[],0,,False,0,0,0,https://twitter.com/DrEricDing/status/1446548486355357716,#Covid-19,,,,,,,[],,,,
1493372874073067521,1493372874073067521,1644882813000.0,2022-02-14 15:53:33,-700,,5 Hal yang Disampaikan Kemenkes soal RS Covid-19 Segera Ajukan Klaim  https://t.co/e8OJ8mRHFp,in,[],[],47596019,47596019,liputan6dotcom,Liputan6.com,1,15,https://twitter.com/liputan6dotcom/status/1493372874073067521,['http://dlvr.it/SJzhWp'],[],0,,False,0,0,0,,#Covid-19,,,,,,,[],,,,
1493372870361112578,1493372870361112578,1644882812000.0,2022-02-14 15:53:32,-700,,"COVID-19 vaccine clinic returns to this Friday. Drop-in for dose 1 or 2, or book an appointment for a booster dose. Clinic in Birch Building, Room BR126. #NorthVan  https://t.co/q5qsX49gqs",en,['northvan'],[],33659170,33659170,CapilanoU,Capilano University,1,15,https://twitter.com/CapilanoU/status/1493372870361112578,[],['https://pbs.twimg.com/media/FLmGJRDVIAAymQ7.jpg'],1,https://pbs.twimg.com/media/FLmGJRDVIAAymQ7.jpg,False,2,0,5,,#Covid-19,,,,,,,[],,,,
1493372836282396672,1493372836282396672,1644882804000.0,2022-02-14 15:53:24,-700,,"Idaho Athletics has announced that the temporary suspension of concessions, put in place as a public health safety measure due to the Omicron variant of COVID-19, has been lifted. Concessions will be available starting Feb. 17.  https://t.co/61RpjY1CUo",en,[],[],2284308170,2284308170,IdahoPubRadio,Idaho Public Radio,1,15,https://twitter.com/IdahoPubRadio/status/1493372836282396672,[],['https://pbs.twimg.com/media/FLmGrKwVIAA12vK.jpg'],1,https://pbs.twimg.com/media/FLmGrKwVIAA12vK.jpg,False,1,0,0,,#Covid-19,,,,,,,[],,,,
1493372822638538756,1493372822638538756,1644882801000.0,2022-02-14 15:53:21,-700,,Canadian Prime Minister Justin Trudeau says he has invoked emergency powers to try to quell the protests by truck drivers and others over #COVID_19 restrictions. |#FreedomConvoy #TruckersForFreedom  https://t.co/Zc2509hybX,en,"['covid_19', 'freedomconvoy', 'truckersforfreedom']",[],85062283,85062283,Paul_Gaspais,Paul Gaspais,1,15,https://twitter.com/Paul_Gaspais/status/1493372822638538756,['https://www.euronews.com/2022/02/14/canada-s-trudeau-invokes-emergency-powers-to-quell-protests'],[],0,,False,1,0,1,,#Covid-19,,,,,,,[],,,,
1493372814610604034,1493332223759634440,1644882799000.0,2022-02-14 15:53:19,-700,,"@GOPChairwoman Gov. Youngkin encourages Virginians to get vaccinated, releases COVID-19 PSA video.  Now here is a responsible GOP Leader!!",en,[],[],1969174938,1969174938,robronjohn,rob johnson,1,15,https://twitter.com/robronjohn/status/1493372814610604034,[],[],0,,False,0,0,0,,#Covid-19,,,,,,,"[{'screen_name': 'GOPChairwoman', 'name': 'Ronna McDaniel', 'id': '2353605901'}]",,,,
1493372800085725187,1493372800085725187,1644882795000.0,2022-02-14 15:53:15,-700,,Oregon mother brings awareness of COVID-19 vaccine side effects  https://t.co/6RXGNLKP48,en,[],[],18459457,18459457,Computergeek64,Computergeek64,1,15,https://twitter.com/Computergeek64/status/1493372800085725187,['https://rumble.com/vutnt0-oregon-mother-brings-awareness-of-covid-19-vaccine-side-effects.html'],[],0,,False,0,0,0,,#Covid-19,,,,,,,[],,,,
1493372797183217670,1493372797183217670,1644882795000.0,2022-02-14 15:53:15,-700,,"“Roses are red.  Violets are blue. @MayorWu made three bus lines free … ”🚍🚍 🚍 @wutrain🚍 🚍 =$8 million in federal COVID-19 relief money,” so maybe for thee but not for me, 2 jobs taxed red, white &amp; blue for Michelle Wu choo choo. I work for a living.   https://t.co/V3nyOxZVUX",en,[],[],1489092391546114049,1489092391546114049,TheOnnaBugeisha,Helen Zhang,1,15,https://twitter.com/TheOnnaBugeisha/status/1493372797183217670,['https://www.wgbh.org/news/local-news/2022/02/09/boston-to-make-three-more-buses-fare-free-until-early-2024-under-wus-public-transit-agenda'],[],0,,False,1,0,0,https://twitter.com/JonathanCohn/status/1493351782193545217,#Covid-19,,,,,,,[],,,,
1493372792653459464,1493372792653459464,1644882793000.0,2022-02-14 15:53:13,-700,,Como veníamos diciendo desde diciembre… Por fin un medio profesional online español recoge la actuación de las autonomías en cuanto al fraude numérico de los muertos por COVID. Voz Populi: Al menos 8 CCAA inflan sus cifras reales de muertos por covid-19   https://t.co/kKLzsiQQC7,es,[],[],1458889914699984900,1458889914699984900,MiguelVegaSant,Miguel Vega Santos,1,15,https://twitter.com/MiguelVegaSant/status/1493372792653459464,['https://www.vozpopuli.com/sanidad/cifras-muertos-covid.html'],[],0,,False,104,5,62,,#Covid-19,,,,,,,[],,,,
