id,conversation_id,created_at,date,timezone,place,tweet,language,hashtags,cashtags,user_id,user_id_str,username,name,day,hour,link,urls,photos,video,thumbnail,retweet,nlikes,nreplies,nretweets,quote_url,search,near,geo,source,user_rt_id,user_rt,retweet_id,reply_to,retweet_date,translate,trans_src,trans_dest
1498770231921192960,1498733023487008773,1646169643000.0,2022-03-01 13:20:43,-700,,@St_Publikon Wie gut wird hier kontrolliert? Es geht um gain of function Forschung in Berlin! #lableak   https://t.co/PyisNxh8z2,de,['lableak'],[],1468370784112373761,1468370784112373761,EnnoMarkendorf,Enno Markendorf,2,13,https://twitter.com/EnnoMarkendorf/status/1498770231921192960,['https://zoonosen.net/forschungsnetz/verbuende-nachwuchsgruppen/rapid'],[],0,,False,0,0,0,,#lableak,,,,,,,"[{'screen_name': 'St_Publikon', 'name': 'Publikumskonferenz', 'id': '2413219236'}]",,,,
1498740420586708992,1498566446997192704,1646162536000.0,2022-03-01 11:22:16,-700,,@stuartjdneil I'm far from the only one who has lost confidence in  your field.  Why do you guys keep doubling down on zoonosis when its obvious to even the casual observer that the #lableak is far more likely?  Why do you cast your lot in with fools like Dazak?    https://t.co/Pf81yp0pOZ,en,['lableak'],[],788131260359061504,788131260359061504,ethanbrooke11,Ethan Brooke,2,11,https://twitter.com/ethanbrooke11/status/1498740420586708992,['https://twitter.com/NateSilver538/status/1473552007680118785?s=20&t=5e265EYKrSH9JcxkWd-skA'],[],0,,False,0,0,0,https://twitter.com/NateSilver538/status/1473552007680118785?s=20&t=5e265EYKrSH9JcxkWd-skA,#lableak,,,,,,,"[{'screen_name': 'stuartjdneil', 'name': 'Stuart Neil', 'id': '862431716337758208'}]",,,,
1498681335136800771,1498566446997192704,1646148449000.0,2022-03-01 07:27:29,-700,,"@theuresamaven @randomjeweler @stuartjdneil @beyerstein There are a lot of us, and we are very real.  Virologists dont seem to understand just how terrible your field looks to outsiders.  As we have learned by FOIA, lawsuit and leak, The coverup of the #lableak is the real conspiracy.",en,['lableak'],[],788131260359061504,788131260359061504,ethanbrooke11,Ethan Brooke,2,7,https://twitter.com/ethanbrooke11/status/1498681335136800771,[],[],0,,False,0,0,0,,#lableak,,,,,,,"[{'screen_name': 'theuresamaven', 'name': 'Theuresa Maven', 'id': '1205869880'}, {'screen_name': 'randomjeweler', 'name': 'Random Jeweler 🌹🌹', 'id': '14251990'}, {'screen_name': 'stuartjdneil', 'name': 'Stuart Neil', 'id': '862431716337758208'}, {'screen_name': 'beyerstein', 'name': 'Lindsay Beyerstein', 'id': '15694863'}]",,,,
1498647655643328524,1498647655643328524,1646140419000.0,2022-03-01 05:13:39,-700,,These #lableak conspiracy theorists are conspiracy theorists. They they adjust their conspiracy theory in the face of new data only to find ways to reject the data or somehow spin the data to support their views.,en,['lableak'],[],85227160,85227160,gorskon,"David Gorski, MD, PhD",2,5,https://twitter.com/gorskon/status/1498647655643328524,[],[],0,,False,41,5,4,https://twitter.com/Samuel_Gregson/status/1498617128878026754,#lableak,,,,,,,[],,,,
1498610085190418434,1498610085190418434,1646131461000.0,2022-03-01 02:44:21,-700,,"#Lableak It's totally fine to insinuate with no evidence that scientists are responsible for the death of millions of people &amp; argue for their research to be taken apart, as long as you refrain from using harsh words.  But don't you dare call a grifter a grifter when they grift",en,['lableak'],[],708601196861325313,708601196861325313,PhilippMarkolin,"Philipp Markolin, PhD",2,2,https://twitter.com/PhilippMarkolin/status/1498610085190418434,[],[],0,,False,51,8,4,,#lableak,,,,,,,[],,,,
