id,conversation_id,created_at,date,timezone,place,tweet,language,hashtags,cashtags,user_id,user_id_str,username,name,day,hour,link,urls,photos,video,thumbnail,retweet,nlikes,nreplies,nretweets,quote_url,search,near,geo,source,user_rt_id,user_rt,retweet_id,reply_to,retweet_date,translate,trans_src,trans_dest
1498807375976976391,1498772574905540615,1646178499000.0,2022-03-01 15:48:19,-700,,@Takeactioncan @Cherylscotian1 🎯🎯🎯 Crazy Karens will not be able to control themselves #masksdontwork,en,['masksdontwork'],[],160737796,160737796,FITbyFRED,Frederico No Consento To Coerced Experimental 💉💉,2,15,https://twitter.com/FITbyFRED/status/1498807375976976391,[],[],0,,False,1,0,1,,#masksdontwork,,,,,,,"[{'screen_name': 'Takeactioncan', 'name': '@takeactioncanada.ca', 'id': '1369088440474689537'}, {'screen_name': 'Cherylscotian1', 'name': '🇨🇦Unacceptable Cheryl 🇨🇦 #HonkHonk', 'id': '1096613561147764736'}]",,,,
1498800483216986114,1498800483216986114,1646176856000.0,2022-03-01 15:20:56,-700,,I didn’t realise medical degrees come out of corn flakes packets #Covid_19 #Masks #masksdontwork ... that last hashtag is posted ironically on my part  https://t.co/3nAFwMR1QL,en,"['covid_19', 'masks', 'masksdontwork']",[],3120604187,3120604187,Savvastzionis,Savvas 'The Natural' Jonis,2,15,https://twitter.com/Savvastzionis/status/1498800483216986114,[],['https://pbs.twimg.com/media/FMzPFT_VQAAIW72.jpg'],1,https://pbs.twimg.com/media/FMzPFT_VQAAIW72.jpg,False,0,0,0,,#masksdontwork,,,,,,,[],,,,
1498796998522286083,1498796998522286083,1646176025000.0,2022-03-01 15:07:05,-700,,"So politicians invest in Pfizer, help Pfizer cover up inefficacy, help Pfizer avoid liability, pressure corporations and govts into mandating...  And somehow no one is talking about tarring and feathering these assholes?  #masksdontwork #vaccineinjuries",en,"['masksdontwork', 'vaccineinjuries']",[],513503674,513503674,Rothbardian1627,Rick,2,15,https://twitter.com/Rothbardian1627/status/1498796998522286083,[],[],0,,False,11,0,5,,#masksdontwork,,,,,,,[],,,,
1498783778617049094,1498783778617049094,1646172873000.0,2022-03-01 14:14:33,-700,,@HStefansonMB can we please have this too?   I don’t like paying taxes for buildings I’m being denied access to.   #masksdontwork,en,['masksdontwork'],[],474491040,474491040,docTENnant,Mark H,2,14,https://twitter.com/docTENnant/status/1498783778617049094,[],[],0,,False,0,0,0,https://twitter.com/jkenney/status/1498723201471242244,#masksdontwork,,,,,,,[],,,,
1498780458447872006,1498333863533293571,1646172081000.0,2022-03-01 14:01:21,-700,,@DissentingCat @Jim_Jordan #Fauci Can’t keep his “SCIENCE” straight from one day to the next. You probably wear your mask while you drive alone in your car too. 🤣🤣 #Masksdontwork check the science,en,"['fauci', 'masksdontwork']",[],180725554,180725554,YeOldShoppe,NFT Newbie,2,14,https://twitter.com/YeOldShoppe/status/1498780458447872006,[],[],0,,False,0,0,0,,#masksdontwork,,,,,,,"[{'screen_name': 'DissentingCat', 'name': 'Smudge The Insult Cat', 'id': '1463995508905717767'}, {'screen_name': 'Jim_Jordan', 'name': 'Rep. Jim Jordan', 'id': '18166778'}]",,,,
1498772574905540615,1498772574905540615,1646170202000.0,2022-03-01 13:30:02,-700,,Suddenly it's nobody's business.  #masksdontwork  https://t.co/1WK0ssDNEl,en,['masksdontwork'],[],1369088440474689537,1369088440474689537,Takeactioncan,@takeactioncanada.ca,2,13,https://twitter.com/Takeactioncan/status/1498772574905540615,[],['https://pbs.twimg.com/media/FMy1tsQWUAI1yX6.jpg'],1,https://pbs.twimg.com/media/FMy1tsQWUAI1yX6.jpg,False,48,3,9,,#masksdontwork,,,,,,,[],,,,
1498752974365106186,1498752974365106186,1646165529000.0,2022-03-01 12:12:09,-700,,"“If someone believes that the change in mask policy at this point right now is not political, they are too stupid to have opinions about politics that are worth hearing.” #covid19 #masksdontwork   Today’s podcast:  https://t.co/D07Yc4FWAn  https://t.co/MlJ0J2wIjY",en,"['covid19', 'masksdontwork']",[],334715818,334715818,BuckSexton,Buck Sexton,2,12,https://twitter.com/BuckSexton/status/1498752974365106186,['https://link.chtbl.com/PWvSZXy6'],[],1,https://pbs.twimg.com/ext_tw_video_thumb/1498752895008788490/pu/img/CsD_WQOBCv7BY352.jpg,False,612,33,143,,#masksdontwork,,,,,,,[],,,,
1498728205880020992,1498728205880020992,1646159623000.0,2022-03-01 10:33:43,-700,,Children all across Fairfax county today look happy! 😁 #masksdontwork,en,['masksdontwork'],[],1388161629205024771,1388161629205024771,BigBMack33,Mack,2,10,https://twitter.com/BigBMack33/status/1498728205880020992,[],[],0,,False,2,0,0,,#masksdontwork,,,,,,,[],,,,
1498725125469917187,1498725125469917187,1646158889000.0,2022-03-01 10:21:29,-700,,What is the reasoning.. Oh yeah... Science 🤡🤡🤡 #Covid19UK #coronavirusuk #CovidVaccine #MasksOff #masksdontwork,en,"['covid19uk', 'coronavirusuk', 'covidvaccine', 'masksoff', 'masksdontwork']",[],1418326275727429634,1418326275727429634,V3BluesMan,ThirdTimeLucky🌸🩸,2,10,https://twitter.com/V3BluesMan/status/1498725125469917187,[],[],0,,False,2,1,0,https://twitter.com/ollysmithtravel/status/1498689047824326656,#masksdontwork,,,,,,,[],,,,
1498718565821652993,1498718565821652993,1646157325000.0,2022-03-01 09:55:25,-700,,Coincide they’re dropping the mandates before the midterms? #scamdemic   #California #washington #oregon #masksdontwork #FreedomConvoy  https://t.co/79i8rZcWzl,en,"['scamdemic', 'california', 'washington', 'oregon', 'masksdontwork', 'freedomconvoy']",[],4265299414,4265299414,HeadlineUSA,Headline USA,2,9,https://twitter.com/HeadlineUSA/status/1498718565821652993,[],['https://pbs.twimg.com/media/FMyEgReUUAAVetO.jpg'],1,https://pbs.twimg.com/media/FMyEgReUUAAVetO.jpg,False,3,1,0,,#masksdontwork,,,,,,,[],,,,
1498713995385131008,1498713995385131008,1646156235000.0,2022-03-01 09:37:15,-700,,And the final proof (besides all the data) that #masksdontwork is all the left-wing cities/states dropping the mandates in near concert. Is LA the same as rural IL? Of course not! But this isn't about science. It's politics. Religion. A security blanket for the weak.,en,['masksdontwork'],[],27889546,27889546,benheck,Ben Heckendorn,2,9,https://twitter.com/benheck/status/1498713995385131008,[],[],0,,False,45,13,3,,#masksdontwork,,,,,,,[],,,,
1498713380336640008,1498378432333369348,1646156089000.0,2022-03-01 09:34:49,-700,,@SarahOC_MECFS Because they have worked so well so far? Good grief. #masksdontwork,en,['masksdontwork'],[],1439220504796221446,1439220504796221446,whysocompliant,Dirk Doobla-Decca,2,9,https://twitter.com/whysocompliant/status/1498713380336640008,[],[],0,,False,0,0,0,,#masksdontwork,,,,,,,"[{'screen_name': 'SarahOC_MECFS', 'name': ""Sarah O'Connell"", 'id': '1429173826689064961'}]",,,,
1498704260866842628,1498704260866842628,1646153915000.0,2022-03-01 08:58:35,-700,,"If you still insist masking is the best way to prevent, or even significantly slow the spread of Covid, then prove it. Show me actual, real world data where masks effectively reduced transmission. Until then, sit down and shut up. #masksdontwork",en,['masksdontwork'],[],116838919,116838919,siameseninja,Make Orwell Fiction Again,2,8,https://twitter.com/siameseninja/status/1498704260866842628,[],[],0,,False,1,0,0,,#masksdontwork,,,,,,,[],,,,
1498694471659266053,1498479813035802627,1646151581000.0,2022-03-01 08:19:41,-700,,"@ZackSandorKerr Evil, unscientific, cruel and stupid. #MasksDontWork",en,['masksdontwork'],[],1445751022526160908,1445751022526160908,Rachel93369258,Rachel Miss bc,2,8,https://twitter.com/Rachel93369258/status/1498694471659266053,[],[],0,,False,0,0,0,,#masksdontwork,,,,,,,"[{'screen_name': 'ZackSandorKerr', 'name': 'Zack Sandor-Kerr', 'id': '24178069'}]",,,,
1498693851606925315,1498525158012858378,1646151433000.0,2022-03-01 08:17:13,-700,,"@SiWOism Come on #Ontario #Canada!   People, take your life back and ditch the masks.   Local mall food court was fully open but nearly every single person walking around had their head down and mask on.   #NoMoreMasks #NoMoreMandates  #NoDigitalID  #MasksDontWork",en,"['ontario', 'canada', 'nomoremasks', 'nomoremandates', 'nodigitalid', 'masksdontwork']",[],1330892277451993093,1330892277451993093,brian3692,brian369,2,8,https://twitter.com/brian3692/status/1498693851606925315,[],[],0,,False,2,0,0,,#masksdontwork,,,,,,,"[{'screen_name': 'SiWOism', 'name': 'Simon 🇨🇦', 'id': '100806400'}]",,,,
1498680982827896835,1498487474393272323,1646148365000.0,2022-03-01 07:26:05,-700,,@RougeMenace @Clinteroo1969 @albertaoilmedic @CRVVancouverBC @MarkHechtPPCma1 If masks worked COVID numbers would have gone down when the mask mandate came in - they went up &amp; up &amp; up. Facts! #masksdontwork,en,['masksdontwork'],[],1486010055811993605,1486010055811993605,finnegansmum21,Unacceptable Deeare,2,7,https://twitter.com/finnegansmum21/status/1498680982827896835,[],[],0,,False,1,1,0,,#masksdontwork,,,,,,,"[{'screen_name': 'RougeMenace', 'name': 'Rouge Menace', 'id': '494609110'}, {'screen_name': 'Clinteroo1969', 'name': 'Clinteroo', 'id': '1157374064542924800'}, {'screen_name': 'albertaoilmedic', 'name': 'albertamedic', 'id': '881409502695837696'}, {'screen_name': 'CRVVancouverBC', 'name': 'CRV Vancouver BC', 'id': '193000961'}, {'screen_name': 'MarkHechtPPCma1', 'name': 'MarkHecht🇨🇦', 'id': '1393729133973184515'}]",,,,
1498679765561188362,1498487474393272323,1646148074000.0,2022-03-01 07:21:14,-700,,@MarkHechtPPCma1 I cannot stand Bon Bon!!! She &amp; @jjhorgan &amp; @adriandix need to go!! #EndTheMandatesNow #FreedomFight #VaccineSideEffects #MasksDontWork,en,"['endthemandatesnow', 'freedomfight', 'vaccinesideeffects', 'masksdontwork']",[],1486010055811993605,1486010055811993605,finnegansmum21,Unacceptable Deeare,2,7,https://twitter.com/finnegansmum21/status/1498679765561188362,[],[],0,,False,0,0,0,,#masksdontwork,,,,,,,"[{'screen_name': 'MarkHechtPPCma1', 'name': 'MarkHecht🇨🇦', 'id': '1393729133973184515'}]",,,,
1498669947244982283,1498627585181466626,1646145734000.0,2022-03-01 06:42:14,-700,,@Klampfradler @BundesstadtBonn Oh nein.  Holen Sie sich therapeutische Hilfe und machen sich sachkundig.  Draußen sind die Masken noch sinnloser als drinnen. #masksdontwork und machen #MIES.   Ansonsten sind die ja noch nicht verboten.,de,"['masksdontwork', 'mies']",[],1269985268779692032,1269985268779692032,AnLa18294437,An La,2,6,https://twitter.com/AnLa18294437/status/1498669947244982283,[],[],0,,False,1,0,0,,#masksdontwork,,,,,,,"[{'screen_name': 'Klampfradler', 'name': 'Klampfradler 🎸🚴🏻', 'id': '22984720'}, {'screen_name': 'BundesstadtBonn', 'name': 'Bundesstadt Bonn', 'id': '84279399'}]",,,,
1498652272934408194,1498652272934408194,1646141520000.0,2022-03-01 05:32:00,-700,,#masksdontwork  https://t.co/PUZOEkiRtd,und,['masksdontwork'],[],341004414,341004414,EOTILLOGICAL,Enemy Of The Illogical,2,5,https://twitter.com/EOTILLOGICAL/status/1498652272934408194,[],[],1,https://pbs.twimg.com/ext_tw_video_thumb/1498652213329211394/pu/img/UG4atyhiTQTRzoVn.jpg,False,4,3,0,,#masksdontwork,,,,,,,[],,,,
1498647740439576583,1498647740439576583,1646140439000.0,2022-03-01 05:13:59,-700,,Truly fantastic. 60% mask free in Liffey Valley today. Tested out Boots maskless and NO issues. All this stuff from Chemists yesterday that they are health settings was proven WRONG. Pharma is Retail Dispensary is Health Care. Hopefully by next week it will be 90%. #masksdontwork,en,['masksdontwork'],[],1352392445934366721,1352392445934366721,Naz119109522,Naz🇮🇪,2,5,https://twitter.com/Naz119109522/status/1498647740439576583,[],[],0,,False,7,1,0,,#masksdontwork,,,,,,,[],,,,
1498640626962862081,1498640626962862081,1646138743000.0,2022-03-01 04:45:43,-700,,Liberals? Where are your bs talking points about #masks #masksdontwork,en,"['masks', 'masksdontwork']",[],1371988868887625731,1371988868887625731,TM40811,TM4081,2,4,https://twitter.com/TM40811/status/1498640626962862081,[],[],0,,False,0,0,0,https://twitter.com/AreOhEssEyeEe/status/1498313867033731082,#masksdontwork,,,,,,,[],,,,
1498638008240820230,1498638008240820230,1646138119000.0,2022-03-01 04:35:19,-700,,#masksdontwork,und,['masksdontwork'],[],171591545,171591545,ecfcJakey,Jakeyd,2,4,https://twitter.com/ecfcJakey/status/1498638008240820230,[],[],0,,False,0,0,0,https://twitter.com/FatEmperor/status/1498637269284139008,#masksdontwork,,,,,,,[],,,,
1498626528464277511,1498626528464277511,1646135382000.0,2022-03-01 03:49:42,-700,,"Okay @SecDef it is time to end mask mandates. Go ahead, other democrats are doing it. #masksdontwork  https://t.co/YzZnRBun2M",en,['masksdontwork'],[],1453223231826108423,1453223231826108423,Just_1_Dude,Just1Dude,2,3,https://twitter.com/Just_1_Dude/status/1498626528464277511,['https://thehill.com/opinion/healthcare/596198-new-cdc-face-mask-guidelines-send-important-message'],[],0,,False,1,0,0,,#masksdontwork,,,,,,,[],,,,
1498619283332640774,1498352186052386816,1646133654000.0,2022-03-01 03:20:54,-700,,@bitternilikeit @IllinoisDCFS &amp; even then they have no authority to force ppl to cover their airways—esp w/o offering ANY scientific evidence proving masks prevent the transmission of an airborne virus! #masksdontwork,en,['masksdontwork'],[],1420786795558670336,1420786795558670336,Blanco919isback,Blanco🇺🇸,2,3,https://twitter.com/Blanco919isback/status/1498619283332640774,[],[],0,,False,1,0,0,,#masksdontwork,,,,,,,"[{'screen_name': 'bitternilikeit', 'name': 'Kent Williams', 'id': '267752108'}, {'screen_name': 'IllinoisDCFS', 'name': 'IllinoisDCFS', 'id': '2255492516'}]",,,,
1498585072743874568,1498545138725175296,1646125498000.0,2022-03-01 01:04:58,-700,,@TjornSibma Around 150 research studies have been done. They conclusively agree #Masks well #masksdontwork in fact they can and do make it worse in many cases.,en,"['masks', 'masksdontwork']",[],1439506025334263808,1439506025334263808,Cutter_the_1st,Cutter,2,1,https://twitter.com/Cutter_the_1st/status/1498585072743874568,[],[],0,,False,2,0,0,,#masksdontwork,,,,,,,"[{'screen_name': 'TjornSibma', 'name': 'Tjorn Sibma MLC', 'id': '437314671'}]",,,,
1498579447925985283,1498579447925985283,1646124157000.0,2022-03-01 00:42:37,-700,,#masksdontwork,und,['masksdontwork'],[],902528816,902528816,CaccioppoliMike,MikeUnleashed,2,0,https://twitter.com/CaccioppoliMike/status/1498579447925985283,[],[],0,,False,0,0,0,https://twitter.com/CaccioppoliMike/status/1498578318894895107,#masksdontwork,,,,,,,[],,,,
1498579294892793857,1498241937647702018,1646124120000.0,2022-03-01 00:42:00,-700,,"@AmerCdn @whatgives1313 Thanks to Fauci and his ghouls, including an ignorant hateful media. #Ivermectin  #Hydroxychloroquine  #FauciLied #masksdontwork  #LetsGoBrandon",en,"['ivermectin', 'hydroxychloroquine', 'faucilied', 'masksdontwork', 'letsgobrandon']",[],133135155,133135155,oklahomakitty,Kathi Trent,2,0,https://twitter.com/oklahomakitty/status/1498579294892793857,[],[],0,,False,3,0,0,,#masksdontwork,,,,,,,"[{'screen_name': 'AmerCdn', 'name': 'David Rasmusson', 'id': '19040142'}, {'screen_name': 'whatgives1313', 'name': 'Southeerner', 'id': '1116213423266648064'}]",,,,
1498579071957147648,1498571887190093828,1646124067000.0,2022-03-01 00:41:07,-700,,"@Jpana75 @DanielAndrewsMP What pro Covid19 jabbers/mask enforcers ignore, that viruses also  enter thru the eyes. #MasksDontWork  Not a vaccine but a #GeneTherapy  #VaccineMandate",en,"['masksdontwork', 'genetherapy', 'vaccinemandate']",[],1434727849060179968,1434727849060179968,CitiZen30558051,Citizen,2,0,https://twitter.com/CitiZen30558051/status/1498579071957147648,[],[],0,,False,1,0,0,,#masksdontwork,,,,,,,"[{'screen_name': 'Jpana75', 'name': 'YNWA', 'id': '300521129'}, {'screen_name': 'DanielAndrewsMP', 'name': 'Dan Andrews', 'id': '228535666'}]",,,,
1498578438021689346,1498241937647702018,1646123916000.0,2022-03-01 00:38:36,-700,,@rickgouldner @whatgives1313 Could have lived without Fauci and his death ghouls and an ignorant media determination to ruin Trump.  There's the culprits. #DoNotComply #Ivermectin  #Hydroxychloroquine  #LetsGoBrandon  #masksdontwork,en,"['donotcomply', 'ivermectin', 'hydroxychloroquine', 'letsgobrandon', 'masksdontwork']",[],133135155,133135155,oklahomakitty,Kathi Trent,2,0,https://twitter.com/oklahomakitty/status/1498578438021689346,[],[],0,,False,1,1,0,,#masksdontwork,,,,,,,"[{'screen_name': 'rickgouldner', 'name': 'Rick Gouldner ⚡️Writer etc.', 'id': '1079446037461233665'}, {'screen_name': 'whatgives1313', 'name': 'Southeerner', 'id': '1116213423266648064'}]",,,,
1498576363371986946,1498576363371986946,1646123421000.0,2022-03-01 00:30:21,-700,,Time to lawyer up New Zealand and take the govt to court over violations of human rights. Bombard them with law suits!  Mandates will be dropped immediately!  We can stop them!  #EndTheMandatesNow #ResignJacinda #masksdontwork #ConvoyForFreedom,en,"['endthemandatesnow', 'resignjacinda', 'masksdontwork', 'convoyforfreedom']",[],1305344501397909504,1305344501397909504,conspiracytalk9,🎯Not the girl in the photo🎯,2,0,https://twitter.com/conspiracytalk9/status/1498576363371986946,[],[],0,,False,21,2,5,,#masksdontwork,,,,,,,[],,,,
1498575510292467714,1498575510292467714,1646123218000.0,2022-03-01 00:26:58,-700,,Do the MOH do studies themselves? The CDC in America has backtracked on masks and deem them basically useless for stoping transmissions (We knew this all along). Why then have these harmful masking mandates in place? Very silly!  #masksdontwork #ResignJacinda #EndTheMandatesNow,en,"['masksdontwork', 'resignjacinda', 'endthemandatesnow']",[],1305344501397909504,1305344501397909504,conspiracytalk9,🎯Not the girl in the photo🎯,2,0,https://twitter.com/conspiracytalk9/status/1498575510292467714,[],[],0,,False,4,0,0,,#masksdontwork,,,,,,,[],,,,
