id,conversation_id,created_at,date,timezone,place,tweet,language,hashtags,cashtags,user_id,user_id_str,username,name,day,hour,link,urls,photos,video,thumbnail,retweet,nlikes,nreplies,nretweets,quote_url,search,near,geo,source,user_rt_id,user_rt,retweet_id,reply_to,retweet_date,translate,trans_src,trans_dest
1496273292495409168,1496273292495409168,1645574327000.0,2022-02-22 15:58:47,-0700,,Amnesty for illegals but Ukraine's boundaries are sacred right John? #RINO warmonger John Curtis needs to be replaced with #AmericaFirst in 2022.,en,"['rino', 'americafirst']",[],1117468951,1117468951,lifeisdriving,Adam Bartholomew 🗨️,2,15,https://twitter.com/lifeisdriving/status/1496273292495409168,[],[],0,,False,1,0,0,https://twitter.com/RepJohnCurtis/status/1496142882998210560,#americafirst,,,,,,,[],,,,
1496272996515860482,1496172450953973772,1645574256000.0,2022-02-22 15:57:36,-0700,,@Muuubon Speak for yourself 🇺🇸 #AmericaFirst #MakeAmericaGreatAgain #MAGA #OwnTheLibs #Trump2024 #TranniesForTrump #GunRightsAreHumanRights,en,"['americafirst', 'makeamericagreatagain', 'maga', 'ownthelibs', 'trump2024', 'tranniesfortrump', 'gunrightsarehumanrights']",[],1380579856547782666,1380579856547782666,ProducedByZesty,Elli,2,15,https://twitter.com/ProducedByZesty/status/1496272996515860482,[],[],0,,False,2,1,0,,#americafirst,,,,,,,"[{'screen_name': 'Muuubon', 'name': 'Muubon || literally just A Cat', 'id': '1170457335204143106'}]",,,,
1496272741330300932,1496272741330300932,1645574195000.0,2022-02-22 15:56:35,-0700,,What are liberals going to do when #TruthSocial explodes and no one listens to their stupid thoughts anymore? 😂 #MassFormationPsychosis #FollowTheMoney #AmericaFirst #GreatReset #EmergencyMeasuresAct #KlausSchwab #GoHomeFluTruxKlan #GOP,en,"['truthsocial', 'massformationpsychosis', 'followthemoney', 'americafirst', 'greatreset', 'emergencymeasuresact', 'klausschwab', 'gohomeflutruxklan', 'gop']",[],1361345883703554058,1361345883703554058,daveisback12,dave,2,15,https://twitter.com/daveisback12/status/1496272741330300932,[],[],0,,False,0,0,0,,#americafirst,,,,,,,[],,,,
1496270935095234565,1496270935095234565,1645573764000.0,2022-02-22 15:49:24,-0700,,The #AmericaFirst president. The #Republican #Patriot  #PutinsPuppet  Aka tfg trump,en,"['americafirst', 'republican', 'patriot', 'putinspuppet']",[],2391333660,2391333660,Bojo40Com,facendacrowd,2,15,https://twitter.com/Bojo40Com/status/1496270935095234565,[],[],0,,False,0,0,0,https://twitter.com/MeidasTouch/status/1496225109220237317,#americafirst,,,,,,,[],,,,
1496270332008841216,1496270332008841216,1645573621000.0,2022-02-22 15:47:01,-0700,,"I don't care about Ukraine, I care about America #AmericaFirst",en,['americafirst'],[],502399178,502399178,mfriend1979,michelle friend 🇺🇲,2,15,https://twitter.com/mfriend1979/status/1496270332008841216,[],[],0,,False,9,0,1,https://twitter.com/catturd2/status/1496109173494403077,#americafirst,,,,,,,[],,,,
1496270005058650119,1496270005058650119,1645573543000.0,2022-02-22 15:45:43,-0700,,@MaximeBernier this guy has lost it haha 🤔 Says the guy WHO IS authoritarian himself 😂  We want our lives back you 🤡 #RussiaUkraineCrisis #Ukraine #Chinada #Canada #cdnpoli #AmericaFirst #USA,en,"['russiaukrainecrisis', 'ukraine', 'chinada', 'canada', 'cdnpoli', 'americafirst', 'usa']",[],1484931703609061379,1484931703609061379,Milos797979,Efstratios,2,15,https://twitter.com/Milos797979/status/1496270005058650119,[],[],0,,False,0,0,0,https://twitter.com/disclosetv/status/1496257072706502661,#americafirst,,,,,,,[],,,,
1496269791002509315,1496269791002509315,1645573492000.0,2022-02-22 15:44:52,-0700,,"SIU investigating incidents involving police horse, projectiles fired during Ottawa protest operation  https://t.co/rSwBJxksui  #MAGA #AmericaFirst #Trump #Trump2024 #SaveAmerica  #FreedomConvoy #FreedomConvoyusa2022",en,"['maga', 'americafirst', 'trump', 'trump2024', 'saveamerica', 'freedomconvoy', 'freedomconvoyusa2022']",[],739286654486089728,739286654486089728,TrumpWorld2017,PatriotsForTrump,2,15,https://twitter.com/TrumpWorld2017/status/1496269791002509315,['https://www.cp24.com/news/siu-investigating-incidents-involving-police-horse-projectiles-fired-during-ottawa-protest-operation-1.5788900'],[],0,,False,0,1,1,,#americafirst,,,,,,,[],,,,
1496269594742476800,1494289792565133319,1645573445000.0,2022-02-22 15:44:05,-0700,,@concavebt @Apple @Cubs @Lamborghini @SamsungUS @oldstylebeer @Dell @FortniteGame @ChicagoBears @LGUS @PabstBlueRibbon @budlight Wow!! #AmericaFirst,und,['americafirst'],[],2492414263,2492414263,freewillagain,Ronald Locke JR,2,15,https://twitter.com/freewillagain/status/1496269594742476800,[],[],0,,False,0,0,0,,#americafirst,,,,,,,"[{'screen_name': 'concavebt', 'name': 'Concave Brand Tracking', 'id': '2446845086'}, {'screen_name': 'Apple', 'name': 'Apple', 'id': '380749300'}, {'screen_name': 'Cubs', 'name': 'Chicago Cubs', 'id': '41144996'}, {'screen_name': 'Lamborghini', 'name': 'Lamborghini', 'id': '323319539'}, {'screen_name': 'SamsungUS', 'name': 'Samsung US', 'id': '34356968'}, {'screen_name': 'oldstylebeer', 'name': 'Old Style Beer', 'id': '1149444438'}, {'screen_name': 'Dell', 'name': 'Dell', 'id': '58561993'}, {'screen_name': 'FortniteGame', 'name': 'Fortnite', 'id': '425871040'}, {'screen_name': 'ChicagoBears', 'name': 'Chicago Bears', 'id': '47964412'}, {'screen_name': 'LGUS', 'name': 'LG Electronics', 'id': '212350063'}, {'screen_name': 'PabstBlueRibbon', 'name': 'Pabst Blue Ribbon', 'id': '384624984'}, {'screen_name': 'budlight', 'name': 'Bud Light', 'id': '742011151'}]",,,,
1496269315204698112,1496267246221541384,1645573378000.0,2022-02-22 15:42:58,-0700,,"@AurelianofRome @ChristinaPushaw Unfortunately, this is why I support #AmericaFirst #AmericaFirstAgenda Candidates. There are lots of them, even in Florida we have @CoryMillsFL @VoteAPL @lavern_spicer @RepMontague @RepMattGaetz and many others. Fight for them, not a penny offshore, till our house is in order!",en,"['americafirst', 'americafirstagenda']",[],1011084486698831872,1011084486698831872,clabaugh_mark,🇺🇸Mark Clabaugh🇺🇸,2,15,https://twitter.com/clabaugh_mark/status/1496269315204698112,[],[],0,,False,0,0,0,,#americafirst,,,,,,,"[{'screen_name': 'AurelianofRome', 'name': 'Aurelian of Rome ☪️', 'id': '902950509769875456'}, {'screen_name': 'ChristinaPushaw', 'name': 'Christina Pushaw 🇺🇸', 'id': '31667539'}]",,,,
1496269260317941762,1496269260317941762,1645573365000.0,2022-02-22 15:42:45,-0700,,Every product you see in #AmericaFirst film #Hollywood as #Advertising is still in America first #industryofinvention #stockmarkets #madeinchina #productplacement is amazing like a #wok 🤣 @amazon amazing as always keep our country going #LasVegas even if we forget the manual,en,"['americafirst', 'hollywood', 'advertising', 'industryofinvention', 'stockmarkets', 'madeinchina', 'productplacement', 'wok', 'lasvegas']",[],2492414263,2492414263,freewillagain,Ronald Locke JR,2,15,https://twitter.com/freewillagain/status/1496269260317941762,[],[],0,,False,0,0,0,,#americafirst,,,,,,,[],,,,
1496268591729152006,1496268591729152006,1645573206000.0,2022-02-22 15:40:06,-0700,,You support Trump Trump supports Putin You support Putin You’re an anti-American piece of shit Ronald Reagan would piss on you You’re worse than the squad Fuck off #GOP  #BidenWorstPresidentEver #AmericaFirst #DonaldTrump #JoeBiden #BidenBorderCrisis,en,"['gop', 'bidenworstpresidentever', 'americafirst', 'donaldtrump', 'joebiden', 'bidenbordercrisis']",[],1426287640442179584,1426287640442179584,IntinsivPurpose,IntinsivPurpose,2,15,https://twitter.com/IntinsivPurpose/status/1496268591729152006,[],[],0,,False,1,0,0,,#americafirst,,,,,,,[],,,,
1496268245363564545,1496168377961926658,1645573123000.0,2022-02-22 15:38:43,-0700,,@Alicia0Givens It's patriots like Mt. Rittenhouse who solidify our Constitutional rights under the law and while showing the path to righteousness.  Successful self-defense is righteousness. Killing an evil person who is trying to kill you is righteousness.  #AmericaFirst #TrumpWasRight  #MAGA,en,"['americafirst', 'trumpwasright', 'maga']",[],4160021788,4160021788,govt45701,Dems & RINOs Hurt America and Weaken Her Economy,2,15,https://twitter.com/govt45701/status/1496268245363564545,[],[],0,,False,0,0,0,,#americafirst,,,,,,,"[{'screen_name': 'Alicia0Givens', 'name': 'Alicia', 'id': '1472114253729435654'}]",,,,
1496267634735779841,1496267634735779841,1645572978000.0,2022-02-22 15:36:18,-0700,,So Hunter Biden worked for a Ukrainian gas company. Now Joe is about to declare War on Russia to defend Ukrainian. Seems like the Biden’s want to protect their own interest. Just saying. #AmericaFirst #kennywallace #Pelosi #danaldtrumpjr,en,"['americafirst', 'kennywallace', 'pelosi', 'danaldtrumpjr']",[],1005308713496993794,1005308713496993794,Spanky88374785,Spanky,2,15,https://twitter.com/Spanky88374785/status/1496267634735779841,[],[],0,,False,0,0,0,,#americafirst,,,,,,,[],,,,
1496267481027170305,1496253593753686022,1645572941000.0,2022-02-22 15:35:41,-0700,,"@MichaelStrike10 @FoxNews What about free college and healthcare as Biden promised 😕😕  Where is the infrastructure spending?   Why did none of this happen, When #DonaldTrump was president  #AmericaFirst",en,"['donaldtrump', 'americafirst']",[],779262744944119809,779262744944119809,Big_crusher1000,End White Guilt 🌎🏈🏈🇺🇸 ⚡⚡⚡🏆🏆,2,15,https://twitter.com/Big_crusher1000/status/1496267481027170305,[],[],0,,False,0,0,0,,#americafirst,,,,,,,"[{'screen_name': 'MichaelStrike10', 'name': 'Michael Striker', 'id': '1181863232006438917'}, {'screen_name': 'FoxNews', 'name': 'Fox News', 'id': '1367531'}]",,,,
1496267321287000068,1496267321287000068,1645572903000.0,2022-02-22 15:35:03,-0700,,"What about free college and healthcare as Biden promised 😕😕  Where is the infrastructure spending?   Why did none of this happen, When #DonaldTrump was president  #AmericaFirst",en,"['donaldtrump', 'americafirst']",[],779262744944119809,779262744944119809,Big_crusher1000,End White Guilt 🌎🏈🏈🇺🇸 ⚡⚡⚡🏆🏆,2,15,https://twitter.com/Big_crusher1000/status/1496267321287000068,[],[],0,,False,0,0,0,https://twitter.com/MichaelStrike10/status/1496253593753686022,#americafirst,,,,,,,[],,,,
1496265891058786305,1496265891058786305,1645572562000.0,2022-02-22 15:29:22,-0700,,America first is a phrase created by Nazi sympathizers in 1939 to help keep America out of WW2. Seems oddly fitting now doesn't it? #AmericaFirst #MAGA #Biden #RussiaUkraineConflict,en,"['americafirst', 'maga', 'biden', 'russiaukraineconflict']",[],885187110021595137,885187110021595137,Matt24818188,Matt Yemma,2,15,https://twitter.com/Matt24818188/status/1496265891058786305,[],[],0,,False,0,0,0,https://twitter.com/GOPChairwoman/status/1496263786969374720,#americafirst,,,,,,,[],,,,
1496265801237770243,1496265801237770243,1645572540000.0,2022-02-22 15:29:00,-0700,,I am sorry the people in Ukraine are suffering.  I a very sorry the people in Canada are suffering.  I am responsible for my family in the US.  I don't expect either of those countries to take care of me or mine. That is why I am #AmericaFirst,en,['americafirst'],[],1639677391,1639677391,AnnaSellers14,🇺🇸Anna Sellers🇺🇸,2,15,https://twitter.com/AnnaSellers14/status/1496265801237770243,[],[],0,,False,0,0,0,,#americafirst,,,,,,,[],,,,
1496265312412606465,1496265312412606465,1645572424000.0,2022-02-22 15:27:04,-0700,,Politically crush Democrats (aka American Marxists) AND #RINO's without mercy. #arpx #argop #arleg #ARhousecaucus #ARnews  https://t.co/cLPoj9LyOQ #Liberty #AmericaFirst  https://t.co/AioKDvNCXi,en,"['rino', 'arpx', 'argop', 'arleg', 'arhousecaucus', 'arnews', 'liberty', 'americafirst']",[],1429874378007883776,1429874378007883776,ChrisBequetteAR,Chris Bequette for Lt. Governor,2,15,https://twitter.com/ChrisBequetteAR/status/1496265312412606465,['http://www.BequetteForArkansas.com'],['https://pbs.twimg.com/media/FMPNXz-XEAAgRVF.jpg'],1,https://pbs.twimg.com/media/FMPNXz-XEAAgRVF.jpg,False,0,0,0,https://twitter.com/FaxMuck/status/1496200972628115464,#americafirst,,,,,,,[],,,,
1496264406937780231,1496264406937780231,1645572208000.0,2022-02-22 15:23:28,-0700,,Who you kidding? Joe? #1984IsHere #25thAmendment #AmericaFirst #SleepyJoe  https://t.co/AXY3k0QosM,en,"['1984ishere', '25thamendment', 'americafirst', 'sleepyjoe']",[],932063803562479616,932063803562479616,merican_hero,Merican Hero🇺🇸,2,15,https://twitter.com/merican_hero/status/1496264406937780231,[],['https://pbs.twimg.com/media/FMPMb-MXIAQx1wW.jpg'],1,https://pbs.twimg.com/media/FMPMb-MXIAQx1wW.jpg,False,1,1,0,,#americafirst,,,,,,,[],,,,
1496264241233694721,1496264241233694721,1645572169000.0,2022-02-22 15:22:49,-0700,,"I don’t give a fuck about Ukraine let Russia do Russia no war, not this not over something so minuscule. Ukraine country full of corruption and Nazi whores #NoWarWithRussia #NoWarInUkraine #AmericaFirst",en,"['nowarwithrussia', 'nowarinukraine', 'americafirst']",[],1182156481564536832,1182156481564536832,matthew11591148,JOE BIDEN IS A NAZI VAMPIRE PEDOPHILE,2,15,https://twitter.com/matthew11591148/status/1496264241233694721,[],[],0,,False,1,0,0,,#americafirst,,,,,,,[],,,,
1496263447193190400,1496263447193190400,1645571979000.0,2022-02-22 15:19:39,-0700,,The USA should be making its oil at home. We should let Europe handle its Russian oil problem. We should be watching China.  #DCMuppets #AmericaFirst,en,"['dcmuppets', 'americafirst']",[],268065458,268065458,rayarchwood,Larkins 先生,2,15,https://twitter.com/rayarchwood/status/1496263447193190400,[],[],0,,False,3,0,1,,#americafirst,,,,,,,[],,,,
1496263024663056387,1496263024663056387,1645571878000.0,2022-02-22 15:17:58,-0700,,"RONNA, if you would have stood up in November of 2020 he would be our President now.  #RonnaMustGO #AmericaFirst #WeThePeople",en,"['ronnamustgo', 'americafirst', 'wethepeople']",[],1362170729584877569,1362170729584877569,rettiwtskcus2,rettiwtskcus,2,15,https://twitter.com/rettiwtskcus2/status/1496263024663056387,[],[],0,,False,2,0,2,https://twitter.com/GOPChairwoman/status/1496133541175906306,#americafirst,,,,,,,[],,,,
1496262941338968064,1496262941338968064,1645571859000.0,2022-02-22 15:17:39,-0700,,#AmericaFirst,und,['americafirst'],[],309277109,309277109,EricsTweetsRock,Eric R. Morgan,2,15,https://twitter.com/EricsTweetsRock/status/1496262941338968064,[],[],0,,False,0,0,0,,#americafirst,,,,,,,[],,,,
1496262751240560643,1496262751240560643,1645571813000.0,2022-02-22 15:16:53,-0700,,Imagine how hard Putin is laughing at our Commander-in-Chief; he can only read and not good at that. Embarrassing. #AmericaFirst,en,['americafirst'],[],1492549463763730444,1492549463763730444,USAFreedom23,USAFreedom,2,15,https://twitter.com/USAFreedom23/status/1496262751240560643,[],[],0,,False,0,0,0,https://twitter.com/FoxNews/status/1496250952210391046,#americafirst,,,,,,,[],,,,
1496262446788579331,1496242769530134536,1645571741000.0,2022-02-22 15:15:41,-0700,,"@hankelvis Everything seen in corporate media was put there by political activist owners, program directors and editors opposed to the America First agenda.  The dem's media are indeed the enemy of We The People and therefore are failing America  #AmericaFirst #TrumpWasRight #MAGA",en,"['americafirst', 'trumpwasright', 'maga']",[],4160021788,4160021788,govt45701,Dems & RINOs Hurt America and Weaken Her Economy,2,15,https://twitter.com/govt45701/status/1496262446788579331,[],[],0,,False,1,0,0,,#americafirst,,,,,,,"[{'screen_name': 'hankelvis', 'name': 'Hankelvis', 'id': '1227625370528157696'}]",,,,
1496261561769418760,1496240608234643456,1645571530000.0,2022-02-22 15:12:10,-0700,,"@DavgrfnG @wendyp4545 You're exactly right, I remember it clearly just as you described it.  The corporate media are indeed the enemy of We The People and are failing America.  President Trump was the best president since Abraham Lincoln.  #AmericaFirst #TrumpWasRight  #VoteRed #MAGA",en,"['americafirst', 'trumpwasright', 'votered', 'maga']",[],4160021788,4160021788,govt45701,Dems & RINOs Hurt America and Weaken Her Economy,2,15,https://twitter.com/govt45701/status/1496261561769418760,[],[],0,,False,1,0,1,,#americafirst,,,,,,,"[{'screen_name': 'DavgrfnG', 'name': 'David G', 'id': '899323831952826369'}, {'screen_name': 'wendyp4545', 'name': 'Wendy Patterson Stands with the real truth', 'id': '2734574376'}]",,,,
1496261552617439233,1496261552617439233,1645571527000.0,2022-02-22 15:12:07,-0700,,I don't care about #Ukraine.  I care about The United States.  #AmericaFirst,en,"['ukraine', 'americafirst']",[],83148068,83148068,CarlosSimancas,Uncensored USA 🇺🇸,2,15,https://twitter.com/CarlosSimancas/status/1496261552617439233,[],[],0,,False,248,13,48,,#americafirst,,,,,,,[],,,,
1496260769981284354,1496256847967367175,1645571341000.0,2022-02-22 15:09:01,-0700,,"@Breaking911 Yeah, every place else but America. 😡 #AmericaFirst",en,['americafirst'],[],31059227,31059227,rumba_cat,Anthony J Martinez,2,15,https://twitter.com/rumba_cat/status/1496260769981284354,[],[],0,,False,6,0,0,,#americafirst,,,,,,,"[{'screen_name': 'Breaking911', 'name': 'Breaking911', 'id': '375721095'}]",,,,
1496259388595748864,1496259388595748864,1645571012000.0,2022-02-22 15:03:32,-0700,,Remember when we had an administration that put #AmericaFirst  #RemoveResidentBiden #TrumpWon,en,"['americafirst', 'removeresidentbiden', 'trumpwon']",[],987781550434500608,987781550434500608,MoreFairytales,FracturedFairyTales AKA #DeathOfTheAmericanDream🍊,2,15,https://twitter.com/MoreFairytales/status/1496259388595748864,[],[],0,,False,2,0,2,https://twitter.com/Breaking911/status/1496256847967367175,#americafirst,,,,,,,[],,,,
