id,conversation_id,created_at,date,timezone,place,tweet,language,hashtags,cashtags,user_id,user_id_str,username,name,day,hour,link,urls,photos,video,thumbnail,retweet,nlikes,nreplies,nretweets,quote_url,search,near,geo,source,user_rt_id,user_rt,retweet_id,reply_to,retweet_date,translate,trans_src,trans_dest
1493011598453219334,1492971256412528642,1644796678000.0,2022-02-13 15:57:58,-700,,@CTVNews Good.  I supported #TruckersConvoy2022 for abt the first 5-6 days. Now I don't. Time to become ex- #TruckersConvoy2022,en,"['truckersconvoy2022', 'truckersconvoy2022']",[],2324123887,2324123887,trav_mitch,Travis W Mitchell,7,15,https://twitter.com/trav_mitch/status/1493011598453219334,[],[],0,,False,1,0,0,,#TruckersConvoy2022,,,,,,,"[{'screen_name': 'CTVNews', 'name': 'CTV News', 'id': '203123011'}]",,,,
1493011043571937286,1493011043571937286,1644796546000.0,2022-02-13 15:55:46,-700,,If I was Justin Trudeau I would cue the commie coup right now because there's no way he's making it to the next election.  #TrudeauMustResign #EndAllMandates #EndTheMandates #EndTheMandatesNow #TruckersForFreedom2022 #TruckersConvoy2022 #FreedomConvoyCanada2022,en,"['trudeaumustresign', 'endallmandates', 'endthemandates', 'endthemandatesnow', 'truckersforfreedom2022', 'truckersconvoy2022', 'freedomconvoycanada2022']",[],1385303251562778626,1385303251562778626,atlanticannabis,Allan Young,7,15,https://twitter.com/atlanticannabis/status/1493011043571937286,[],[],0,,False,2,0,0,,#TruckersConvoy2022,,,,,,,[],,,,
1493010700372889601,1493010700372889601,1644796464000.0,2022-02-13 15:54:24,-700,,"Don't ever forget this moment.  California is in a State Of Emergency. The Super Bowl could be in any other state but instead we have likely 100,000 maskless people not socially distanced screaming their heads off.  Canada, wake up.  The pandemic is over.  #TruckersConvoy2022  https://t.co/nf6gQM4UVW",en,['truckersconvoy2022'],[],768502348779884544,768502348779884544,SayNoToReset,Unacceptable #BlackfaceHitler,7,15,https://twitter.com/SayNoToReset/status/1493010700372889601,[],['https://pbs.twimg.com/media/FLg9UbnVgAAfbko.jpg'],1,https://pbs.twimg.com/media/FLg9UbnVgAAfbko.jpg,False,7,0,4,,#TruckersConvoy2022,,,,,,,[],,,,
1493009675788464131,1493009675788464131,1644796220000.0,2022-02-13 15:50:20,-700,,The sell out that is @JustinTrudeau is an example why I don't vote. #CanadaHasFallen #CanadaFreedomConvoy #TruckersForFreedom #TruckersForFreedom2022 #TruckersConvoy2022 #Trudeau,en,"['canadahasfallen', 'canadafreedomconvoy', 'truckersforfreedom', 'truckersforfreedom2022', 'truckersconvoy2022', 'trudeau']",[],1430812215930728452,1430812215930728452,bloodycyclistcc,The Bloody Cyclist,7,15,https://twitter.com/bloodycyclistcc/status/1493009675788464131,[],[],0,,False,0,0,0,,#TruckersConvoy2022,,,,,,,[],,,,
1493009670797201417,1493009670797201417,1644796218000.0,2022-02-13 15:50:18,-700,,#Jerusalem  #TruckersForFreedom  #TruckersConvoy2022  #EndGlobalMandates #CanadaTruckers2022,und,"['jerusalem', 'truckersforfreedom', 'truckersconvoy2022', 'endglobalmandates', 'canadatruckers2022']",[],400419867,400419867,995mu,995mu,7,15,https://twitter.com/995mu/status/1493009670797201417,[],[],0,,False,2,0,2,https://twitter.com/VivianBercovici/status/1492897914712203266,#TruckersConvoy2022,,,,,,,[],,,,
1493008558635507713,1493008558635507713,1644795953000.0,2022-02-13 15:45:53,-700,,#history #TruckersForFreedom #TruckersConvoy2022  https://t.co/OvS56woegk,und,"['history', 'truckersforfreedom', 'truckersconvoy2022']",[],20157213,20157213,Dr_Voll,"Amandha Dawn Vollmer, Medicine Woman, Truthsayer",7,15,https://twitter.com/Dr_Voll/status/1493008558635507713,[],['https://pbs.twimg.com/media/FLg7XwwXsAAMULw.jpg'],1,https://pbs.twimg.com/media/FLg7XwwXsAAMULw.jpg,False,26,0,17,,#TruckersConvoy2022,,,,,,,[],,,,
1493008121903603717,1492598228717506560,1644795849000.0,2022-02-13 15:44:09,-700,,@IAMRockwell Nothing stops you from distancing and wearing masks mandates or no mandates. Against democracy in action ?  Masks outside ?!! What are afraid of ? Did you all left your immune systems at home ? Will you be as PEACEFUL as the TRUCKERS ? #TruckersConvoy2022 #TruckersForFreedom2022,en,"['truckersconvoy2022', 'truckersforfreedom2022']",[],462296335,462296335,nixiane,Magalie B.,7,15,https://twitter.com/nixiane/status/1493008121903603717,[],[],0,,False,1,0,0,,#TruckersConvoy2022,,,,,,,"[{'screen_name': 'IAMRockwell', 'name': 'Jason Rockwell (He/Him)', 'id': '228477243'}]",,,,
1493008051892219904,1492894569792475137,1644795832000.0,2022-02-13 15:43:52,-700,,"@franceswoolley And that's your right,  as it is theirs.  #HonkHonk  #TruckersConvoy2022",en,"['honkhonk', 'truckersconvoy2022']",[],777159520539795456,777159520539795456,joelJoh29453569,Joel🇨🇦,7,15,https://twitter.com/joelJoh29453569/status/1493008051892219904,[],[],0,,False,2,0,0,,#TruckersConvoy2022,,,,,,,"[{'screen_name': 'franceswoolley', 'name': 'Frances Woolley', 'id': '271500022'}]",,,,
1493008046062198796,1493008046062198796,1644795831000.0,2022-02-13 15:43:51,-700,,"This girl is crazy, people are allowed to protest? And you crash into her vehicle and? I would’ve been offff at her 🤬 #TruckersForFreedom2022 #FreedomConvoy #FreedomConvoyCanada2022 #TruckersForFreedom #TruckersConvoy2022 #FreedomOfSpeech #Freedom #EndTheMandates",en,"['truckersforfreedom2022', 'freedomconvoy', 'freedomconvoycanada2022', 'truckersforfreedom', 'truckersconvoy2022', 'freedomofspeech', 'freedom', 'endthemandates']",[],920794424774447105,920794424774447105,anthony_d75,Anthony 🇺🇦,7,15,https://twitter.com/anthony_d75/status/1493008046062198796,[],[],0,,False,2,0,0,https://twitter.com/OzraeliAvi/status/1492806558816026624,#TruckersConvoy2022,,,,,,,[],,,,
1493007642381348865,1492989803947704325,1644795735000.0,2022-02-13 15:42:15,-700,,"@lamphieryeg Do you think @CBCNews will draw the same conclusions they did from the Nazi &amp; Rebel flags spotted at the #TruckersConvoy2022? Obviously, Gary, PSAC has been infiltrated by treacherous Communists. Sad to admit that 50 years ago I was a card-carrying member of this union. 🤨",en,['truckersconvoy2022'],[],202429604,202429604,richardgoatcher,Richard Goatcher,7,15,https://twitter.com/richardgoatcher/status/1493007642381348865,[],[],0,,False,14,3,4,,#TruckersConvoy2022,,,,,,,"[{'screen_name': 'lamphieryeg', 'name': 'Gary Lamphier', 'id': '38885578'}]",,,,
1493007586148462595,1493007586148462595,1644795721000.0,2022-02-13 15:42:01,-700,,"Cops will put BLM protesters on the ground just for looking at them wrong. Wonder what the difference is?  Also, side note, I swear I thought the other guy was about to say ""Give yer balls a tug, ya t*tf***er!"" 😅 Canadian af.  #TruckersConvoy2022 #TruckersConvoy #Truckers #ferda",en,"['truckersconvoy2022', 'truckersconvoy', 'truckers', 'ferda']",[],839932772445716480,839932772445716480,RogerWallaceTX,Roger Wallace,7,15,https://twitter.com/RogerWallaceTX/status/1493007586148462595,[],[],0,,False,1,0,0,https://twitter.com/Gray_Mackenzie/status/1492993130337034242,#TruckersConvoy2022,,,,,,,[],,,,
1493007402345517058,1493007402345517058,1644795678000.0,2022-02-13 15:41:18,-700,,"You won't hear @POTUS or @CanadianPM criticizing this violations of human rights, because they endorse them... #Canada #FreedomConvoyCanada2022 #TruckersConvoy2022 #TruckersConvoy #cdnpolitics #cdnpoli",en,"['canada', 'freedomconvoycanada2022', 'truckersconvoy2022', 'truckersconvoy', 'cdnpolitics', 'cdnpoli']",[],1380289049706033152,1380289049706033152,CryptosWizzz,We ride at dawn...,7,15,https://twitter.com/CryptosWizzz/status/1493007402345517058,[],[],0,,False,0,0,0,https://twitter.com/MarcScottEmery/status/1492841817737285632,#TruckersConvoy2022,,,,,,,[],,,,
