id,conversation_id,created_at,date,timezone,place,tweet,language,hashtags,cashtags,user_id,user_id_str,username,name,day,hour,link,urls,photos,video,thumbnail,retweet,nlikes,nreplies,nretweets,quote_url,search,near,geo,source,user_rt_id,user_rt,retweet_id,reply_to,retweet_date,translate,trans_src,trans_dest
1500578996592918528,1500557487665299461,1646600886000.0,2022-03-06 13:08:06,-0700,,"@iMac24666401 @RussianEmbassy @mfa_russia @RusEmbUSA @RusembUkraine @mod_russia @rusembassynl @BBCWorld @guardian @GBNEWS @itvnews @REESOxford A year ago #lableak was a crackpot idea, crackpot.",en,['lableak'],[],1194957349,1194957349,beachvetlbc,Dr. Ena Valikov aka Notorious KGB Aggie,7,13,https://twitter.com/beachvetlbc/status/1500578996592918528,[],[],0,,False,0,0,0,,#lableak,,,,,,,"[{'screen_name': 'iMac24666401', 'name': 'Senātus Populusque Rōmānus', 'id': '964805029'}, {'screen_name': 'RussianEmbassy', 'name': 'Russian Embassy, UK', 'id': '114718372'}, {'screen_name': 'mfa_russia', 'name': 'MFA Russia 🇷🇺', 'id': '255471924'}, {'screen_name': 'RusEmbUSA', 'name': 'Russian Embassy in USA 🇷🇺', 'id': '1267887043'}, {'screen_name': 'RusembUkraine', 'name': 'RusEmbassy Ukraine', 'id': '1256490685'}, {'screen_name': 'mod_russia', 'name': 'Минобороны России', 'id': '2742078001'}, {'screen_name': 'rusembassynl', 'name': 'Russian Embassy in NL🇷🇺🇳🇱', 'id': '3256927757'}, {'screen_name': 'BBCWorld', 'name': 'BBC News (World)', 'id': '742143'}, {'screen_name': 'guardian', 'name': 'The Guardian', 'id': '87818409'}, {'screen_name': 'GBNEWS', 'name': 'GB News', 'id': '1339166129110065152'}, {'screen_name': 'itvnews', 'name': 'ITV News', 'id': '21866939'}, {'screen_name': 'REESOxford', 'name': 'Oxford University Russian & East European Studies', 'id': '1856942821'}]",,,,
1500548236716777474,1500548236716777474,1646593553000.0,2022-03-06 11:05:53,-0700,,"Gosh, where did they get bogus claims like this? Who used these frames for tragic consequences....? #lableak #virustruthers",en,"['lableak', 'virustruthers']",[],15201021,15201021,mem_somerville,Dr. mem_somerville | Wossamotta U,7,11,https://twitter.com/mem_somerville/status/1500548236716777474,[],[],0,,False,4,0,0,https://twitter.com/oneunderscore__/status/1500528904506859531,#lableak,,,,,,,[],,,,
1500522843548704769,1500522843548704769,1646587498000.0,2022-03-06 09:24:58,-0700,,Emails reveal suspected COVID leaked from a Wuhan lab -- then censored themselves #lableak #wuhan #censorship  https://t.co/uwq8ZKKiPr,en,"['lableak', 'wuhan', 'censorship']",[],834109481717997568,834109481717997568,cessiamonster,Jennie,7,09,https://twitter.com/cessiamonster/status/1500522843548704769,['https://nypost.com/2022/01/24/emails-reveal-suspected-covid-leaked-from-a-wuhan-lab-then-censored-themselves/'],[],0,,False,0,0,0,,#lableak,,,,,,,[],,,,
1500505943662022658,1500505943662022658,1646583469000.0,2022-03-06 08:17:49,-0700,,"Scientists released a pair of studies on Saturday that once again reprise the assertion that the COVID-19 pandemic began in a Wuhan market, not a lab. Case closed then, right? #Wuhan #LabLeak #Covid #Pandemic  We Get This Wrong?  https://t.co/suNeIwcLOX",en,"['wuhan', 'lableak', 'covid', 'pandemic']",[],1302434618956812290,1302434618956812290,ltprentice,ltprentice,7,08,https://twitter.com/ltprentice/status/1500505943662022658,['https://rumble.com/vwgrjj-did-we-get-this-wrong.html'],[],0,,False,1,0,0,,#lableak,,,,,,,[],,,,
1500501590351958017,1500485871455412225,1646582431000.0,2022-03-06 08:00:31,-0700,,"@tony_vandongen Always thought that only politicians could suffer from selective amnesia? Guess I was wrong? I am not a scientist, so I am free to say more points to #gainoffunction and #lableak fuck up, than something that happened naturally. What are they hiding and why? #OriginOfCovid",en,"['gainoffunction', 'lableak', 'originofcovid']",[],2873578621,2873578621,hanszandvliet79,Hans Zandvliet,7,08,https://twitter.com/hanszandvliet79/status/1500501590351958017,[],[],0,,False,1,1,0,,#lableak,,,,,,,"[{'screen_name': 'tony_vandongen', 'name': 'Tony VanDongen', 'id': '4786238905'}]",,,,
1500452979723632640,1500452979723632640,1646570842000.0,2022-03-06 04:47:22,-0700,,The Story Changes Again  https://t.co/aRTpoNDbdR #Wuhan #LabLeak #COVID,en,"['wuhan', 'lableak', 'covid']",[],4503010398,4503010398,ewe_ryu,Ewe Ryu,7,04,https://twitter.com/ewe_ryu/status/1500452979723632640,['https://youtu.be/R1TisjALpow'],[],0,,False,0,0,0,,#lableak,,,,,,,[],,,,
1500443206252740610,1500443206252740610,1646568511000.0,2022-03-06 04:08:31,-0700,,The Story Changes Again  https://t.co/95l3CIy3qW via @YouTube #Wuhan #LabLeak #Covid,en,"['wuhan', 'lableak', 'covid']",[],19819733,19819733,ScotlandRobbed,Scotland is Being Robbed,7,04,https://twitter.com/ScotlandRobbed/status/1500443206252740610,['https://youtu.be/R1TisjALpow'],[],0,,False,0,0,0,,#lableak,,,,,,,[],,,,
1500314520589320198,1500314520589320198,1646537830000.0,2022-03-05 19:37:10,-0700,,#lableak #PropagandaMachine #MSM  https://t.co/hGoG21sweL,und,"['lableak', 'propagandamachine', 'msm']",[],862740661,862740661,HollyFromTexas,Holly ♥️,6,19,https://twitter.com/HollyFromTexas/status/1500314520589320198,['https://youtu.be/R1TisjALpow'],[],0,,False,1,0,1,,#lableak,,,,,,,[],,,,
1500286920173268994,1500286918034178052,1646531250000.0,2022-03-05 17:47:30,-0700,,002) But is #Wuhan #lableak #Lab #Leak” #Media Cover-Up? #Fauci #NIAID sponsored this the investigation haha #Covid  https://t.co/Mn7A172eJH  https://t.co/Bw4ABfqWKO,en,"['wuhan', 'lableak', 'lab', 'leak', 'media', 'fauci', 'niaid', 'covid']",[],7528832,7528832,robhonig,Honig ™,6,17,https://twitter.com/robhonig/status/1500286920173268994,['https://youtu.be/R1TisjALpow'],"['https://pbs.twimg.com/media/FNIWsroWQAIh3Et.jpg', 'https://pbs.twimg.com/media/FNIWss-WQAAGz8p.jpg', 'https://pbs.twimg.com/media/FNIWsumXsAE5Y3F.jpg', 'https://pbs.twimg.com/media/FNIWswJXMAM13BS.jpg']",1,https://pbs.twimg.com/media/FNIWsroWQAIh3Et.jpg,False,0,0,0,,#lableak,,,,,,,[],,,,
1500215457663569923,1500215457663569923,1646514212000.0,2022-03-05 13:03:32,-0700,,"It Just Got Worse  A study featured in the New York Times once again reprises the assertion that the COVID-19 pandemic began in a Wuhan market, not a lab. Case closed then, right?   #Wuhan #LabLeak #Covid #Pandemic    https://t.co/Oa7RpJ2C3H via @YouTube",en,"['wuhan', 'lableak', 'covid', 'pandemic']",[],23231925,23231925,andyoval,Andy Thomas 🌸,6,13,https://twitter.com/andyoval/status/1500215457663569923,['https://youtu.be/R1TisjALpow'],[],0,,False,0,0,0,,#lableak,,,,,,,[],,,,
1500186150627004417,1500186150627004417,1646507225000.0,2022-03-05 11:07:05,-0700,,They’re Even Shutting This Down  https://t.co/bAhGnFoBSH via @YouTube #Wuhan #LabLeak #Covid,en,"['wuhan', 'lableak', 'covid']",[],832037354,832037354,wally_gc,Wally Thomas,6,11,https://twitter.com/wally_gc/status/1500186150627004417,['https://youtu.be/R1TisjALpow'],[],0,,False,1,0,0,,#lableak,,,,,,,[],,,,
1500179433025642507,1500179433025642507,1646505623000.0,2022-03-05 10:40:23,-0700,,"They Want You To Stop Talking About This  https://t.co/5iCpgJCGAa via @YouTube A study featured in the NYT's once again reprises the UNPROVEN assertion that the COVID-19 pandemic began in a Wuhan market, not a lab. Case closed then, right? #Wuhan #LabLeak #Covid #Pandemic  https://t.co/BYPv6Kd8mR",en,"['wuhan', 'lableak', 'covid', 'pandemic']",[],1090667626441961473,1090667626441961473,queenb_wiov,@QueenB_wiov Deborah R Culver,6,10,https://twitter.com/queenb_wiov/status/1500179433025642507,['https://youtu.be/R1TisjALpow'],['https://pbs.twimg.com/media/FNG1PckXsAYWtX6.jpg'],1,https://pbs.twimg.com/media/FNG1PckXsAYWtX6.jpg,False,1,0,0,,#lableak,,,,,,,[],,,,
1500175707477004297,1500175707477004297,1646504735000.0,2022-03-05 10:25:35,-0700,,#Wuhan #COVID19 #LabLeak #China #COVID   They Want You To Stop Talking About This  https://t.co/VJUl6DVKfd via @YouTube,en,"['wuhan', 'covid19', 'lableak', 'china', 'covid']",[],1463413340672118789,1463413340672118789,LawTubeClips,LawTubeClips,6,10,https://twitter.com/LawTubeClips/status/1500175707477004297,['https://youtu.be/R1TisjALpow'],[],0,,False,0,0,0,,#lableak,,,,,,,[],,,,
1500175141334138882,1500175141334138882,1646504600000.0,2022-03-05 10:23:20,-0700,,#Wuhan #LabLeak #Covid  They Want You To Stop Talking About This  https://t.co/YMogeFPmhD via @YouTube,en,"['wuhan', 'lableak', 'covid']",[],1492872702776033288,1492872702776033288,StefanB99992028,Steven Brown 🇨🇦🇨🇦🇨🇦,6,10,https://twitter.com/StefanB99992028/status/1500175141334138882,['https://youtu.be/R1TisjALpow'],[],0,,False,0,0,0,,#lableak,,,,,,,[],,,,
1499947939711565828,1499592141730992128,1646450431000.0,2022-03-04 19:20:31,-0700,,@sanewman1 Lmao. Ya cause it’s not like someone could make the samples show up.. It’s Fucking CHINA! Nice try Fauci and China! #lableak,en,['lableak'],[],1192984305326284804,1192984305326284804,Rdog88813232,Rdog,5,19,https://twitter.com/Rdog88813232/status/1499947939711565828,[],[],0,,False,0,0,0,,#lableak,,,,,,,"[{'screen_name': 'sanewman1', 'name': 'Stuart Newman', 'id': '19346727'}]",,,,
1499943551819464704,1499943551819464704,1646449385000.0,2022-03-04 19:03:05,-0700,,Look at this news article from The Daily Caller: ’Journalistic Malpractice’: NYT Slammed For Hyping Two Flawed Studies To Downplay Lab Leak Theory #FakeNews #LabLeak #COVID19 #COVID_19 #coronavirus #Russia #Ukraine  https://t.co/cOtgy2BqVh,en,"['fakenews', 'lableak', 'covid19', 'covid_19', 'coronavirus', 'russia', 'ukraine']",[],854365810013483009,854365810013483009,Thesanelib,Thesanelib,5,19,https://twitter.com/Thesanelib/status/1499943551819464704,['https://dailycaller.com/2022/03/04/covid-19-coronavirus-origin-lab-leak-theory-nyt-wuhan-china/'],[],0,,False,0,0,0,,#lableak,,,,,,,[],,,,
1499842038858010625,1499399016034881545,1646425182000.0,2022-03-04 12:19:42,-0700,,"@garyruskin @emilyakopp @USRightToKnow Did you see this? Adds a ton of context to the #lableak #originofcovid, and has a deep bibliography.    https://t.co/NER7CRUYkn",en,"['lableak', 'originofcovid']",[],788131260359061504,788131260359061504,ethanbrooke11,Ethan Brooke,5,12,https://twitter.com/ethanbrooke11/status/1499842038858010625,['https://twitter.com/ethanbrooke11/status/1499839650839465985?s=20&t=bre7Hi5uzDxDzSc8AJx13A'],[],0,,False,1,0,0,https://twitter.com/ethanbrooke11/status/1499839650839465985?s=20&t=bre7Hi5uzDxDzSc8AJx13A,#lableak,,,,,,,"[{'screen_name': 'garyruskin', 'name': 'Gary Ruskin', 'id': '16897082'}, {'screen_name': 'emilyakopp', 'name': 'Emily Kopp', 'id': '303434772'}, {'screen_name': 'USRightToKnow', 'name': 'U.S. Right To Know', 'id': '1637048450'}]",,,,
1499841407481044993,1499498691928940547,1646425031000.0,2022-03-04 12:17:11,-0700,,"@emilyakopp Did you see this?  Adds a lot more context for a #lableak than I have seen before, particularly on China, but also covers a lot of US research.  Good bibliography also.   https://t.co/NER7CRUYkn",en,['lableak'],[],788131260359061504,788131260359061504,ethanbrooke11,Ethan Brooke,5,12,https://twitter.com/ethanbrooke11/status/1499841407481044993,['https://twitter.com/ethanbrooke11/status/1499839650839465985?s=20&t=bre7Hi5uzDxDzSc8AJx13A'],[],0,,False,0,0,0,https://twitter.com/ethanbrooke11/status/1499839650839465985?s=20&t=bre7Hi5uzDxDzSc8AJx13A,#lableak,,,,,,,"[{'screen_name': 'emilyakopp', 'name': 'Emily Kopp', 'id': '303434772'}]",,,,
1499839650839465985,1499839650839465985,1646424613000.0,2022-03-04 12:10:13,-0700,,"In this detailed and highly researched write up, the context for a #lableak #originofcovid is given in greater detail than I have seen before.  The sinister world of #bioweapons research in China and the US needs do be put before the American public.    https://t.co/eGkFqHCwPe",en,"['lableak', 'originofcovid', 'bioweapons']",[],788131260359061504,788131260359061504,ethanbrooke11,Ethan Brooke,5,12,https://twitter.com/ethanbrooke11/status/1499839650839465985,['https://lawrencesellin.substack.com/p/the-laboratory-origin-of-covid-19?s=r'],[],0,,False,2,0,1,,#lableak,,,,,,,[],,,,
1499824430549110785,1499824430549110785,1646420984000.0,2022-03-04 11:09:44,-0700,,The evidence of a #lableak #Originofcovid continues to grow with the release of this paper.  It directly connects the research proposed in the DARPA proposal to the actual physiology of SARS-CoV-2.,en,"['lableak', 'originofcovid']",[],788131260359061504,788131260359061504,ethanbrooke11,Ethan Brooke,5,11,https://twitter.com/ethanbrooke11/status/1499824430549110785,[],[],0,,False,44,1,19,https://twitter.com/CharlesRixey/status/1499822606773538816,#lableak,,,,,,,[],,,,
1499805962097475584,1497898515242045444,1646416581000.0,2022-03-04 09:56:21,-0700,,@mvankerkhove #FauciLeak #LabLeak   https://t.co/lEeWLpoXx5,und,"['faucileak', 'lableak']",[],51575486,51575486,scarredeye,B R 💉💉💉,5,09,https://twitter.com/scarredeye/status/1499805962097475584,['https://twitter.com/alisonannyoung/status/1444698910560227333?s=20'],[],0,,False,0,0,0,https://twitter.com/alisonannyoung/status/1444698910560227333?s=20,#lableak,,,,,,,"[{'screen_name': 'mvankerkhove', 'name': 'Maria Van Kerkhove', 'id': '2178775035'}]",,,,
1499762185064566797,1499762185064566797,1646406143000.0,2022-03-04 07:02:23,-0700,,Another bogus claim that the virus originated from Wuhan wet market animals in Dec 2019.  This cannot be true as SARS-CoV-2 was circulating in Europe in summer of 2019.  That is without even touching the genetic evidence.  #wuhan #COVID19 #lableak #Lies   https://t.co/h9Q3izvbAx,en,"['wuhan', 'covid19', 'lableak', 'lies']",[],1127057432503517184,1127057432503517184,yolovalpal,"Val, Teddy & Muffin 💃🧸🐾🧁",5,07,https://twitter.com/yolovalpal/status/1499762185064566797,['https://www.npr.org/sections/goatsandsoda/2022/03/03/1083751272/striking-new-evidence-points-to-seafood-market-in-wuhan-as-pandemic-origin-point'],[],0,,False,0,0,0,,#lableak,,,,,,,[],,,,
1499734121073061889,1499734121073061889,1646399452000.0,2022-03-04 05:10:52,-0700,,Homo-centric twitter leftist science deniers back at it gleefully spreading disinfo per usual. #Wuhan #LabLeak,en,"['wuhan', 'lableak']",[],1476389103595831306,1476389103595831306,BluepiIIed,🇷🇺,5,05,https://twitter.com/BluepiIIed/status/1499734121073061889,[],[],0,,False,1,0,0,https://twitter.com/ByZen/status/1499523407355858953,#lableak,,,,,,,[],,,,
1499726548030660617,1499490834676334596,1646397647000.0,2022-03-04 04:40:47,-0700,,"@InWuchang again: a #lableak is sloppy science, a conspiracy is often well-planned (or at least an intention to implement a secret plan, against XXX)",en,['lableak'],[],728352151,728352151,KlausRiede,Klaus Riede,5,04,https://twitter.com/KlausRiede/status/1499726548030660617,[],[],0,,False,1,1,0,,#lableak,,,,,,,"[{'screen_name': 'InWuchang', 'name': 'WhatsInWuchang', 'id': '1374475545488941060'}]",,,,
1499651739921829889,1499651739921829889,1646379811000.0,2022-03-03 23:43:31,-0700,,"Das ist eine rhetorische Frage. viel wichtiger ist: Wie können wir das rückgängig machen, sollte die Mehrheit der Parlamentarier das beschließen? Die Mehrheit scheint weder #Wiesendangers Infos zum #Lableak wahrgenommen zu haben noch die Skandale rund um #Pfizer, Fauci et al.",de,"['wiesendangers', 'lableak', 'pfizer']",[],730680242306748416,730680242306748416,EnigmaDerZeit,Enigma der Zeit,4,23,https://twitter.com/EnigmaDerZeit/status/1499651739921829889,[],[],0,,False,2,0,1,https://twitter.com/marcfriedrich7/status/1499622868379971593,#lableak,,,,,,,[],,,,
1499534388542853128,1499534388542853128,1646351832000.0,2022-03-03 15:57:12,-0700,,"More evidence #COVID originated in a market and NOT a lab. Does this mean we can trust Fauci again (p.s. I already did). The new data is described by independent scientists as ""'very convincing' and a 'blow' to the lab-leak theory."" #Wuhan #COVID #lableak  https://t.co/74Hda6KceJ",en,"['covid', 'wuhan', 'covid', 'lableak']",[],41203121,41203121,RamblingMyMind,Mind Rambling,4,15,https://twitter.com/RamblingMyMind/status/1499534388542853128,['https://www.npr.org/sections/goatsandsoda/2022/03/03/1083751272/striking-new-evidence-points-to-seafood-market-in-wuhan-as-pandemic-origin-point'],[],0,,False,0,3,0,,#lableak,,,,,,,[],,,,
1499528196374417440,1499482973476990982,1646350356000.0,2022-03-03 15:32:36,-0700,,"@ggronvall @NateSilver538 Your confidence that science supports a zoonotic origin is silly.  #lableak  are common!  Wikipedia lists several dozen - there are a zillion ways this could have leaked out of the Wuhan BSL4 lab. That's not conspiracy, just common sense.   https://t.co/DlaA40gtqt",en,['lableak'],[],788131260359061504,788131260359061504,ethanbrooke11,Ethan Brooke,4,15,https://twitter.com/ethanbrooke11/status/1499528196374417440,['https://en.wikipedia.org/wiki/List_of_laboratory_biosecurity_incidents'],[],0,,False,3,0,0,,#lableak,,,,,,,"[{'screen_name': 'ggronvall', 'name': 'Gigi Gronvall', 'id': '47430888'}, {'screen_name': 'NateSilver538', 'name': 'Nate Silver', 'id': '16017475'}]",,,,
1499525564813561874,1499482973476990982,1646349729000.0,2022-03-03 15:22:09,-0700,,"@ggronvall @K_G_Andersen @NateSilver538 If you are looking for some real journalism on this topic, see below.  The facts in this case have been hard won, and have come out by FOIA, Leak, and Lawsuit.  The Hill @HillTVLive has done a good job on the #lableak story.    https://t.co/Q7fbLWzvee",en,['lableak'],[],788131260359061504,788131260359061504,ethanbrooke11,Ethan Brooke,4,15,https://twitter.com/ethanbrooke11/status/1499525564813561874,['https://www.youtube.com/watch?v=sD0i_YxPATc'],[],0,,False,2,1,0,,#lableak,,,,,,,"[{'screen_name': 'ggronvall', 'name': 'Gigi Gronvall', 'id': '47430888'}, {'screen_name': 'K_G_Andersen', 'name': 'Kristian G. Andersen', 'id': '2887865951'}, {'screen_name': 'NateSilver538', 'name': 'Nate Silver', 'id': '16017475'}]",,,,
1499523944361377792,1499523944361377792,1646349342000.0,2022-03-03 15:15:42,-0700,,Why are @PeterDaszak and @EcoHealthNYC STILL hiding information that WE NEED to verify the origins of #COVID19? These shady individuals are going to rot in hell if they’re responsible for the pandemic and subsequent coverup. #PeterDaszak #lableak  https://t.co/0fXXi4MWvS,en,"['covid19', 'peterdaszak', 'lableak']",[],1189527890309763072,1189527890309763072,Fork_1813,Anti-Climacus,4,15,https://twitter.com/Fork_1813/status/1499523944361377792,['https://theintercept.com/2022/03/03/wuhan-coronavirus-research-nih-ecohealth/?utm_source=facebook&utm_medium=social&utm_campaign=theintercept&fbclid=IwAR0k--02pGp92zy9dVftNYNZtMLqzEmkjw85dJuNafFh3J-vAiQ0ck13TaQ'],[],0,,False,0,0,0,,#lableak,,,,,,,[],,,,
1499523347830296589,1499482973476990982,1646349200000.0,2022-03-03 15:13:20,-0700,,@nikl2103 @NateSilver538 @K_G_Andersen There was no new data to consider when he changed his mind - only political pressure.  This is all clear from the FOIA records of his (and others) emails. The #lableak #OriginOfCovid was carefully covered up from the start.   https://t.co/Q7fbLWzvee,en,"['lableak', 'originofcovid']",[],788131260359061504,788131260359061504,ethanbrooke11,Ethan Brooke,4,15,https://twitter.com/ethanbrooke11/status/1499523347830296589,['https://www.youtube.com/watch?v=sD0i_YxPATc'],[],0,,False,8,0,1,,#lableak,,,,,,,"[{'screen_name': 'nikl2103', 'name': 'NL', 'id': '1254988348386676737'}, {'screen_name': 'NateSilver538', 'name': 'Nate Silver', 'id': '16017475'}, {'screen_name': 'K_G_Andersen', 'name': 'Kristian G. Andersen', 'id': '2887865951'}]",,,,
1499521167173976064,1499521167173976064,1646348680000.0,2022-03-03 15:04:40,-0700,,Nate Silver -a brave voice among mainstream intellectuals- is calling BS on the current academic malpractice being perpetrated by many of the worlds leading Virologists. The #lableak #OriginOfCovid must be investigated by the judicial and congressional branches of our government.,en,"['lableak', 'originofcovid']",[],788131260359061504,788131260359061504,ethanbrooke11,Ethan Brooke,4,15,https://twitter.com/ethanbrooke11/status/1499521167173976064,[],[],0,,False,1,0,0,https://twitter.com/NateSilver538/status/1499491432687718400,#lableak,,,,,,,[],,,,
1499498356661440518,1499498356661440518,1646343242000.0,2022-03-03 13:34:02,-0700,,Emails point to oversight problems with NIH bat coronavirus grant  https://t.co/bkPsTSxa5d by @MaraHvistendahl #lableak,en,['lableak'],[],1423002268144701443,1423002268144701443,MichaelofAlbans,Michael First we take Manhattan,4,13,https://twitter.com/MichaelofAlbans/status/1499498356661440518,['https://interc.pt/3pvAkh9'],[],0,,False,0,0,0,,#lableak,,,,,,,[],,,,
1499496834976206848,1499496834976206848,1646342879000.0,2022-03-03 13:27:59,-0700,,I'm so glad to have @Ayjchan as a prime champion of the #lableak theory of the #OriginofCovid - what a sound and reasonable voice.,en,"['lableak', 'originofcovid']",[],788131260359061504,788131260359061504,ethanbrooke11,Ethan Brooke,4,13,https://twitter.com/ethanbrooke11/status/1499496834976206848,[],[],0,,False,6,0,1,https://twitter.com/Ayjchan/status/1499440918797107201,#lableak,,,,,,,[],,,,
1499495930403254296,1499495549598199813,1646342663000.0,2022-03-03 13:24:23,-0700,,"Indeed, there's a reason why I view most (but not all) versions of #lableak as conspiracy theories. It's because they have all the hallmarks, including a lack of true parsimony.",en,['lableak'],[],85227160,85227160,gorskon,"David Gorski, MD, PhD",4,13,https://twitter.com/gorskon/status/1499495930403254296,[],[],0,,False,48,1,2,,#lableak,,,,,,,[],,,,
1499495688203169792,1499482973476990982,1646342606000.0,2022-03-03 13:23:26,-0700,,@BioTurboNick @NateSilver538 Exactly. #lableak is about as far from parsimony in terms of an explanation for how the pandemic got started as you can get.,en,['lableak'],[],85227160,85227160,gorskon,"David Gorski, MD, PhD",4,13,https://twitter.com/gorskon/status/1499495688203169792,[],[],0,,False,86,4,0,,#lableak,,,,,,,"[{'screen_name': 'BioTurboNick', 'name': 'Nicholas Bauer, PhD 👨\u200d🔬🔬', 'id': '15451869'}, {'screen_name': 'NateSilver538', 'name': 'Nate Silver', 'id': '16017475'}]",,,,
1499495588089446408,1499495588089446408,1646342582000.0,2022-03-03 13:23:02,-0700,,"Here's another way of thinking about the #lableak v. animal origin:  The new genetic data (if it’s all correct) has the virus emerging in late November so that by early December about 70 people were infected, maybe fewer, in the entire city. What are the chances.. (1/2)",en,['lableak'],[],631532178,631532178,FoodieScience,"Michaeleen Doucleff, PhD",4,13,https://twitter.com/FoodieScience/status/1499495588089446408,[],[],0,,False,1,9,0,,#lableak,,,,,,,[],,,,
1499495551468900354,1499495549598199813,1646342573000.0,2022-03-03 13:22:53,-0700,,"Seriously, @NateSilver538, if there's one thing #lableak DOESN'T rest on, it's parsimony. The chain of events necessary for lab leak to have actually happened is astounding in how many low probability things would have to have happened at just the right time.",en,['lableak'],[],85227160,85227160,gorskon,"David Gorski, MD, PhD",4,13,https://twitter.com/gorskon/status/1499495551468900354,[],[],0,,False,83,6,5,,#lableak,,,,,,,[],,,,
1499455030037995525,1499455030037995525,1646332912000.0,2022-03-03 10:41:52,-0700,,"Was @c_drosten für die forschungsbasierte Aufklärung über #SARSCoV2 geleistet hat, ist vorbildlich und bedarf unser Aller Anerkennung. Wie bei sowjetischen #ActiveMeasures der 1980er, #HIV käme aus dem Labor, versuchen Medien und Aktivisten die #lableak-Verschwörungsth.zu pushen.",de,"['sarscov2', 'activemeasures', 'hiv', 'lableak']",[],1863171672,1863171672,Sociopathblog,Weltgeist redux 💉💉💉,4,10,https://twitter.com/Sociopathblog/status/1499455030037995525,[],[],0,,False,0,0,0,https://twitter.com/SZ/status/1499429912293396482,#lableak,,,,,,,[],,,,
1499445976494444544,1499445976494444544,1646330753000.0,2022-03-03 10:05:53,-0700,,"Gosh, I wonder where they found people primed to think of bioweapons... #lableak",en,['lableak'],[],15201021,15201021,mem_somerville,Dr. mem_somerville | Wossamotta U,4,10,https://twitter.com/mem_somerville/status/1499445976494444544,[],[],0,,False,1,0,0,https://twitter.com/Justin_Ling/status/1499436754776080386,#lableak,,,,,,,[],,,,
1499433884798398469,1499433884798398469,1646327870000.0,2022-03-03 09:17:50,-0700,,"Begrüßenswert wäre, wenn sich @c_drosten endlich aktiv an der Aufklärung der Ereignisse von #Wuhan beteiligen würde, anstatt Kollegen juristisch zu drohen. #lableak #laborthese #wiesendanger  https://t.co/CuG4EvgjXU",de,"['wuhan', 'lableak', 'laborthese', 'wiesendanger']",[],42894164,42894164,PhilippMattheis,Philipp Mattheis,4,09,https://twitter.com/PhilippMattheis/status/1499433884798398469,['https://sz.de/1.5540659'],[],0,,False,91,7,22,,#lableak,,,,,,,[],,,,
1499429532343750660,1499429532343750660,1646326833000.0,2022-03-03 09:00:33,-0700,,"Not excluding #LabLeak at all, but in many ways this is a tempest in a teapot. Until it started in humans, there was no way to know SARS2 would take off therein. It was just an anonymous bat virus. So some huge ""fail"" in Wuhan became important only thru our bad luck.",en,['lableak'],[],2880447465,2880447465,hjelle_brian,"Brian Hjelle, virologist",4,09,https://twitter.com/hjelle_brian/status/1499429532343750660,[],[],0,,False,26,5,1,https://twitter.com/emilyakopp/status/1499398310825656330,#lableak,,,,,,,[],,,,
1499376944453988352,1499376944453988352,1646314295000.0,2022-03-03 05:31:35,-0700,,#Uranian #lableak no more.,en,"['uranian', 'lableak']",[],1140114439913521153,1140114439913521153,MyHeartlandia,My Heartlandia,4,05,https://twitter.com/MyHeartlandia/status/1499376944453988352,[],[],0,,False,1,0,0,https://twitter.com/SchwabMeNoMore/status/1499173529538945031,#lableak,,,,,,,[],,,,
