id,conversation_id,created_at,date,timezone,place,tweet,language,hashtags,cashtags,user_id,user_id_str,username,name,day,hour,link,urls,photos,video,thumbnail,retweet,nlikes,nreplies,nretweets,quote_url,search,near,geo,source,user_rt_id,user_rt,retweet_id,reply_to,retweet_date,translate,trans_src,trans_dest
1490837780649623553,1490837780649623553,1644278399000.0,2022-02-07 15:59:59,-700,,WEIRD SCIENCE  #COVID19 @FX2trot  https://t.co/BJeBJ801p9,en,['covid19'],[],1478524243591630850,1478524243591630850,Crito72,Numenius,1,15,https://twitter.com/Crito72/status/1490837780649623553,[],['https://pbs.twimg.com/media/FLCFCZeaIAAO5KG.jpg'],1,https://pbs.twimg.com/media/FLCFCZeaIAAO5KG.jpg,False,0,1,1,,#COVID19,,,,,,,[],,,,
1490837736424886272,1490837736424886272,1644278389000.0,2022-02-07 15:59:49,-700,,"É legítimo ser de direita, de esquerda, de centro e até ser neutro. O que não pode é cometer crime, espalhando mentiras e atentando contra a saúde da população. Tem uma turma fazendo isso e ninguém faz nada. #Covid19 #FakeNews #Vacinação",pt,"['covid19', 'fakenews', 'vacinação']",[],42157075,42157075,flaviofachel,flaviofachel 🇧🇷📺,1,15,https://twitter.com/flaviofachel/status/1490837736424886272,[],[],0,,False,383,6,27,,#COVID19,,,,,,,[],,,,
1490837704510115842,1490837704510115842,1644278381000.0,2022-02-07 15:59:41,-700,,"#Nacionales #Salud #Covid19   Reporta México 9,242 casos de Covid-19 en las últimas 24 horas  ▶️ https://t.co/CIdgzGJmJb  https://t.co/sX5tMLoI6n",es,"['nacionales', 'salud', 'covid19']",[],1058515061470384128,1058515061470384128,infomediamx4,@infomediamx__,1,15,https://twitter.com/infomediamx4/status/1490837704510115842,['http://www.infomediamx.com/71618/'],['https://pbs.twimg.com/media/FLCE_C1XwAEj-98.jpg'],1,https://pbs.twimg.com/media/FLCE_C1XwAEj-98.jpg,False,0,0,0,,#COVID19,,,,,,,[],,,,
1490837652030967808,1490837652030967808,1644278369000.0,2022-02-07 15:59:29,-700,,What do you know? California will lift mask its indoor mask requirement for vaccinated people on February 16.  Will WA be the last state to do so? #COVID19 #endemic #MaskMandates #EmergencyPowersReform  https://t.co/a2WdhzayfZ,en,"['covid19', 'endemic', 'maskmandates', 'emergencypowersreform']",[],59518272,59518272,thausman,Todd Hausman,1,15,https://twitter.com/thausman/status/1490837652030967808,['https://www.sacbee.com/news/politics-government/capitol-alert/article258142588.html#storylink=cpy'],[],0,,False,0,1,0,,#COVID19,,,,,,,[],,,,
1490837643713998851,1490837643713998851,1644278367000.0,2022-02-07 15:59:27,-700,,.@BorisJohnson: Hold a public inquiry into the Government's handling of the Covid-19 pandemic #Covid19 - Sign the Petition!  https://t.co/ShQfShRxV4 via @UKChange,en,['covid19'],[],586637116,586637116,TerryB28937065,Terry Brough #PeaceJusticeSocialism ✊,1,15,https://twitter.com/TerryB28937065/status/1490837643713998851,['https://chng.it/zgCMDxck'],[],0,,False,0,0,0,,#COVID19,,,,,,,[],,,,
1490837622444666880,1490837622444666880,1644278362000.0,2022-02-07 15:59:22,-700,,#covid19 #liberte,und,"['covid19', 'liberte']",[],27051412,27051412,marye_eve,Hope,1,15,https://twitter.com/marye_eve/status/1490837622444666880,[],[],0,,False,0,0,0,https://twitter.com/france_soir/status/1490362678061125635,#COVID19,,,,,,,[],,,,
1490837617402855425,1490837617402855425,1644278361000.0,2022-02-07 15:59:21,-700,,"🔴☣ #ÚLTIMAHORA | #México suma 156,916 casos activos estimados de #covid19.  https://t.co/mi6iMTTZKx",es,"['últimahora', 'méxico', 'covid19']",[],104683173,104683173,Excelsior,Excélsior,1,15,https://twitter.com/Excelsior/status/1490837617402855425,['https://bit.ly/3uyNygD'],[],0,,False,7,0,7,,#COVID19,,,,,,,[],,,,
1490837600441094144,1490837600441094144,1644278357000.0,2022-02-07 15:59:17,-700,,"#Covid19 #Impfpflicht  #Österreich #Deutschland  #SPÖ #ÖVP #FPÖ #NEOS #Grüne #Covididioten  #esreicht #genugistgenug    Ja, es gibt mehr von jenen - die einfach kein Covid bekommen. Dafür aber vielleicht nach einer Impfung schwerste Nebenwirkungen.   1/2  https://t.co/jgXA8XTq9j",de,"['covid19', 'impfpflicht', 'österreich', 'deutschland', 'spö', 'övp', 'fpö', 'neos', 'grüne', 'covididioten', 'esreicht', 'genugistgenug']",[],886508098491482112,886508098491482112,PesendorferSa,Sabine Amsellem-Gaisbauer,1,15,https://twitter.com/PesendorferSa/status/1490837600441094144,['https://twitter.com/xsSandysx/status/1490733836115787783'],[],0,,False,2,2,0,https://twitter.com/xsSandysx/status/1490733836115787783,#COVID19,,,,,,,[],,,,
1490837493322817537,1490837493322817537,1644278331000.0,2022-02-07 15:58:51,-700,,#Corona Info for #USA: New Cases: 106504 Today Recovery: 160399 Today Deaths: 905 Total Active Cases: 29138370 Total Cases: 78248857 Total Recovery: 48182351 Total Deaths: 928136 #Coronavirus  #Covid19 #Covid_19 #SARSCoV2 #StaySafe   Source: 'CoronaTrackerNepal_bot' #Telegram.,en,"['corona', 'usa', 'coronavirus', 'covid19', 'covid_19', 'sarscov2', 'staysafe', 'telegram']",[],976098246882885634,976098246882885634,krishna444_test,World Alert,1,15,https://twitter.com/krishna444_test/status/1490837493322817537,[],[],0,,False,1,0,0,,#COVID19,,,,,,,[],,,,
1490837445021077507,1490837445021077507,1644278319000.0,2022-02-07 15:58:39,-700,,"Pt walked in a waiting rm full of 😷 pts - 🚫 mask - surprised when I told them to 😷  ""Oh, are we still doing that?""  Didn't flinch until I mentioned brand new transplant pts... suddenly, they realized we should protect vulnerable ppl &amp; 😷  ...imagine that. #COVID19 #Transplant  https://t.co/QXZza3JbLP",en,"['covid19', 'transplant']",[],3192437540,3192437540,klutz_n_chucks,Heather likes 💉,1,15,https://twitter.com/klutz_n_chucks/status/1490837445021077507,[],['https://pbs.twimg.com/tweet_video_thumb/FLCEwE4WQAcPbuT.jpg'],1,https://pbs.twimg.com/tweet_video_thumb/FLCEwE4WQAcPbuT.jpg,False,1,0,0,,#COVID19,,,,,,,[],,,,
1490837406018580481,1490837406018580481,1644278310000.0,2022-02-07 15:58:30,-700,,Phil Murphy’s Handlers. Writing his Daily #COVID19 numbers and restrictions for him. @PearlGabel @GunaRockYa @Edwinjtorres @megancoyne23 Sorry @mbzhad you’re just a bench player. Work harder I guess 🤷🏼‍♀️  https://t.co/cJXh7pY0vf,en,['covid19'],[],1432793587780046854,1432793587780046854,RachelMaryColl,Rachel Mary ❤️🗝,1,15,https://twitter.com/RachelMaryColl/status/1490837406018580481,[],['https://pbs.twimg.com/media/FLCEt2AXoAEkH58.jpg'],1,https://pbs.twimg.com/media/FLCEt2AXoAEkH58.jpg,False,3,1,0,,#COVID19,,,,,,,[],,,,
1490837396195524611,1490783195431940105,1644278308000.0,2022-02-07 15:58:28,-700,,@lucky5496 @TomEvan81013762 @VracarXIV @nemanjamilosev6 Yes that’s what I thought. Medical doctors are afraid. Too much involvement it’s a risk for them. #COVID #VACCINE #COVID19,en,"['covid', 'vaccine', 'covid19']",[],1234909953342701568,1234909953342701568,Porti86862233,Rose Porti,1,15,https://twitter.com/Porti86862233/status/1490837396195524611,[],[],0,,False,11,2,0,,#COVID19,,,,,,,"[{'screen_name': 'lucky5496', 'name': 'Lucky5496', 'id': '795403092233752576'}, {'screen_name': 'VracarXIV', 'name': 'Милано', 'id': '1345546112862711809'}, {'screen_name': 'nemanjamilosev6', 'name': 'nemanja milosevic', 'id': '851694770'}]",,,,
1490837298409213952,1490837298409213952,1644278285000.0,2022-02-07 15:58:05,-700,,El estado de Sao Paulo vacunó a la mitad de los niños contra el #COVID19  https://t.co/ixyw3qDGYl,es,['covid19'],[],253020963,253020963,SputnikMundo,Sputnik Mundo,1,15,https://twitter.com/SputnikMundo/status/1490837298409213952,['https://mundo.sputniknews.com/20220207/el-estado-de-sao-paulo-vacuno-a-la-mitad-de-los-ninos-contra-el-covid-19-1121301513.html?utm_source=dlvr.it&utm_medium=twitter'],[],0,,False,1,0,1,,#COVID19,,,,,,,[],,,,
1490837279908106244,1490837279908106244,1644278280000.0,2022-02-07 15:58:00,-700,,"50% Off!  Fire TV Stick with Alexa Voice Remote (includes TV controls), HD streaming device   https://t.co/rBROu4R1rC  #BwcDeals #Dogecoin #nfts #Breaking #clearthelist #Covid19  https://t.co/ymvgZ7BeUU",en,"['bwcdeals', 'dogecoin', 'nfts', 'breaking', 'clearthelist', 'covid19']",[],1178811384387293187,1178811384387293187,BwcDeals,BwcDeals,1,15,https://twitter.com/BwcDeals/status/1490837279908106244,['https://www.amazon.com/dp/B08C1W5N87?tag=bwcdeals-20&linkCode=osi&th=1&psc=1'],['https://pbs.twimg.com/media/FLCEmycVcAQy2fq.jpg'],1,https://pbs.twimg.com/media/FLCEmycVcAQy2fq.jpg,False,1,0,1,,#COVID19,,,,,,,[],,,,
1490837272589000704,1490837272589000704,1644278278000.0,2022-02-07 15:57:58,-700,,Compartimos la situación sanitaria diaria de #covid19 en la ciudad.  Estos datos corresponden a las notificaciones en el Sistema Nacional de Vigilancia en Salud. #Rosario #santafe  https://t.co/FRpUXPB3Qf,es,"['covid19', 'rosario', 'santafe']",[],788410598853840896,788410598853840896,SomosRosarioOK,Somos Rosario,1,15,https://twitter.com/SomosRosarioOK/status/1490837272589000704,[],['https://pbs.twimg.com/media/FLCEl0yWYAEw_Rj.png'],1,https://pbs.twimg.com/media/FLCEl0yWYAEw_Rj.png,False,1,0,3,,#COVID19,,,,,,,[],,,,
1490837267350700032,1490837267350700032,1644278277000.0,2022-02-07 15:57:57,-700,,Facebook is fact checking the British Medical Journal calling it a “news blog”. Yes you heard it right #covid19,en,['covid19'],[],17647340,17647340,david_barrett1,David Barrett,1,15,https://twitter.com/david_barrett1/status/1490837267350700032,[],[],0,,False,0,0,0,,#COVID19,,,,,,,[],,,,
1490837264305471493,1490837264305471493,1644278276000.0,2022-02-07 15:57:56,-700,,"MEXICO'S CONFIRMED DEATH TOLL FROM COVID-19 RISES TO 309,752- HEALTH MINISTRY DATA #News #Forex #COVID19 #MEXICO",en,"['news', 'forex', 'covid19', 'mexico']",[],1312246113244794881,1312246113244794881,Capital_Hungry,Capital Hungry,1,15,https://twitter.com/Capital_Hungry/status/1490837264305471493,[],[],0,,False,1,1,0,,#COVID19,,,,,,,[],,,,
1490837160689225728,1490837160689225728,1644278252000.0,2022-02-07 15:57:32,-700,,#Nacional El expresidente Francisco Sagasti se pronunció este lunes 7 de febrero al recordar que se cumple un año de la llegada del primer lote de vacunas al Perú para frenar la expansión del coronavirus (#COVID19).  https://t.co/ygSZhO7BlJ,es,"['nacional', 'covid19']",[],53443209,53443209,elbuho_pe,El Búho🦉,1,15,https://twitter.com/elbuho_pe/status/1490837160689225728,[],['https://pbs.twimg.com/media/FLCERcBXsAQk7Oo.jpg'],1,https://pbs.twimg.com/media/FLCERcBXsAQk7Oo.jpg,False,5,1,1,,#COVID19,,,,,,,[],,,,
1490837136798470146,1490837129986928643,1644278246000.0,2022-02-07 15:57:26,-700,,"Only by adopting a proactive “dynamic zero-case policy” can #HongKong reduce infections and deaths, prevent medical resources from being overwhelmed, and maximize the protection of people’s health. #covid19  https://t.co/qGg2QG3MPC",en,"['hongkong', 'covid19']",[],1267598593780666369,1267598593780666369,FlamencoJacob,Jacob Good,1,15,https://twitter.com/FlamencoJacob/status/1490837136798470146,[],['https://pbs.twimg.com/media/FLCEKqCUYAQJ-L0.jpg'],1,https://pbs.twimg.com/media/FLCEKqCUYAQJ-L0.jpg,False,0,0,0,,#COVID19,,,,,,,[],,,,
1490837129986928643,1490837129986928643,1644278244000.0,2022-02-07 15:57:24,-700,,"If #HongKong chooses “lying flat” instead of “dynamic clearing” in front of the pandemic, the virus will foreseeably spread rapidly, causing serious damage to people’s livelihood and the region’s economic and social development. #covid19  https://t.co/iUXgDmxPzG",en,"['hongkong', 'covid19']",[],1267598593780666369,1267598593780666369,FlamencoJacob,Jacob Good,1,15,https://twitter.com/FlamencoJacob/status/1490837129986928643,[],['https://pbs.twimg.com/media/FLCEE0EVUAU-4iu.jpg'],1,https://pbs.twimg.com/media/FLCEE0EVUAU-4iu.jpg,False,1,1,0,,#COVID19,,,,,,,[],,,,
1490837074886344704,1490837074886344704,1644278231000.0,2022-02-07 15:57:11,-700,,"#Gejala #Omicron #Covid19 #Kesehatan |  Gejala ringan infeksi Omicron menyerupai flu, membuat sulit membedakan infeksi yang terjadi, sehingga perlu dilakukan pemeriksaan RT-PCR untuk memastikan penyakitnya.    https://t.co/ne1SxbC8Gc",in,"['gejala', 'omicron', 'covid19', 'kesehatan']",[],64635651,64635651,serambinews,Serambi Indonesia,1,15,https://twitter.com/serambinews/status/1490837074886344704,['https://aceh.tribunnews.com/2022/02/08/langkah-langkah-perlu-diketahui-jika-terinfeksi-omicron-gejala-ringan'],[],0,,False,1,0,0,,#COVID19,,,,,,,[],,,,
1490837038903414787,1490837038903414787,1644278223000.0,2022-02-07 15:57:03,-700,,Compartimos la situación sanitaria diaria de #covid19 en la ciudad.  Estos datos corresponden a las notificaciones en el Sistema Nacional de Vigilancia en Salud. #Rosario #santafe  https://t.co/oNauRJmv7r,es,"['covid19', 'rosario', 'santafe']",[],788410598853840896,788410598853840896,SomosRosarioOK,Somos Rosario,1,15,https://twitter.com/SomosRosarioOK/status/1490837038903414787,[],"['https://pbs.twimg.com/media/FLCEYA5XsAIy2KI.jpg', 'https://pbs.twimg.com/media/FLCEYCQXIAY5afk.jpg']",1,https://pbs.twimg.com/media/FLCEYA5XsAIy2KI.jpg,False,0,0,1,,#COVID19,,,,,,,[],,,,
1490837032918302720,1490837032918302720,1644278221000.0,2022-02-07 15:57:01,-700,,#Pandemia La @SSalud_mx reporta un total de cinco millones 160 mil 767 casos confirmados de #COVID19 y 309 mil 752 defunciones…  En 24 horas se registraron nueve mil 242 casos y 206 muertes.  #NoBajesLaGuardia #UsaCubrebocas  https://t.co/GWOGek6xuE,es,"['pandemia', 'covid19', 'nobajeslaguardia', 'usacubrebocas']",[],32155954,32155954,alfredolez,Alfredo González,1,15,https://twitter.com/alfredolez/status/1490837032918302720,[],['https://pbs.twimg.com/media/FLCEYJvXsAUTAE-.jpg'],1,https://pbs.twimg.com/media/FLCEYJvXsAUTAE-.jpg,False,1,0,3,,#COVID19,,,,,,,[],,,,
1490837016304517121,1490837016304517121,1644278217000.0,2022-02-07 15:56:57,-700,,"“Other counties with local mask orders will remain in place, such as in Los Angeles County and much of the San Francisco Bay Area.”   Can’t make any of this stuff up…  LA County gonna LA County. #Covid19",en,['covid19'],[],701481363854200832,701481363854200832,gamesblazer06,PlungeProtectionTeam,1,15,https://twitter.com/gamesblazer06/status/1490837016304517121,[],[],0,,False,7,4,1,https://twitter.com/latimes/status/1490828429289144320,#COVID19,,,,,,,[],,,,
1490836921358045186,1490834861015597056,1644278195000.0,2022-02-07 15:56:35,-700,,"@joncoopertweets I would like everyone to live as long as they can. I believe that masks, along with vaccinations and social distancing are the best ways to prevent getting #COVID19 or mitigation. This frees up beds for people with other illnesses. I don't agree with canceling the mandate.  https://t.co/p1HxmaKzJ6",en,['covid19'],[],218949823,218949823,Hellacort,David Hilycord,1,15,https://twitter.com/Hellacort/status/1490836921358045186,[],['https://pbs.twimg.com/tweet_video_thumb/FLCERezVQAAkjLm.jpg'],1,https://pbs.twimg.com/tweet_video_thumb/FLCERezVQAAkjLm.jpg,False,2,0,1,,#COVID19,,,,,,,"[{'screen_name': 'joncoopertweets', 'name': 'Jon Cooper', 'id': '27493883'}]",,,,
1490836882280022019,1490836882280022019,1644278185000.0,2022-02-07 15:56:25,-700,,Clinica de Vacunacion COVID19 &amp; GRIPA Gratis!! Latinx Immigrants of Iowa wn Colaboracion con @EMBARCiowa @polkcohealth y Vaxi Taxi para COVIDA19 no necesita registrase para Gripa si  https://t.co/CxVfhsQAjf o llame al 5154216773 #latinx #iowa #covid19  https://t.co/56aKrrEWXI,ca,"['latinx', 'iowa', 'covid19']",[],1294648214960984064,1294648214960984064,latinximmigrant,Latinx Immigrants Of Iowa,1,15,https://twitter.com/latinximmigrant/status/1490836882280022019,['https://www.immunizepolk.com/appointment/en/clinic/search'],['https://pbs.twimg.com/media/FLCCw2pXwAEJdDk.jpg'],1,https://pbs.twimg.com/media/FLCCw2pXwAEJdDk.jpg,False,1,0,0,,#COVID19,,,,,,,[],,,,
1490836845445492742,1490836845445492742,1644278177000.0,2022-02-07 15:56:17,-700,,"#Egypt’s Health Ministry: 2,272 #coronavirus new cases, 57 #COVID19 fatalities and 2,147 fully recov... via @24liveblog  https://t.co/Xbe1ORPfGs",en,"['egypt', 'coronavirus', 'covid19']",[],608583,608583,Zeinobia,Zeinobia is fully vaccinated 💉💉💉,1,15,https://twitter.com/Zeinobia/status/1490836845445492742,['https://egyptianchronicles.blogspot.com/2022/02/coronavirus-on-nile-february-2022s.html'],[],0,,False,0,0,0,,#COVID19,,,,,,,[],,,,
1490836841716723714,1490836841716723714,1644278176000.0,2022-02-07 15:56:16,-700,,"Also, in case you missed, Gov. Lamont leaving mask mandates to each municipality/school district starting 2/28 #COVID19",en,['covid19'],[],372630924,372630924,dennisreports,Dennis Valera,1,15,https://twitter.com/dennisreports/status/1490836841716723714,[],[],0,,False,4,0,0,https://twitter.com/marcy_jonestv/status/1490800386181148678,#COVID19,,,,,,,[],,,,
1490836779582345222,1490836779582345222,1644278161000.0,2022-02-07 15:56:01,-700,,"#COVID19 Update ▶️ Total patients tested for COVID-19 at Michigan Medicine since the pandemic began: 344,357 ▶️ Total positive tests: 20,292 ▶️ Current inpatients that are COVID-19 positive: 67 ▶️ Total COVID-19 patients discharged: 4,739 ▶️ Learn more:  https://t.co/ukxkcQrbcO  https://t.co/nQmkNb3gQk",en,['covid19'],[],15457383,15457383,umichmedicine,Michigan Medicine,1,15,https://twitter.com/umichmedicine/status/1490836779582345222,['http://michmed.org/COVID-19'],['https://pbs.twimg.com/media/FLCEJlyX0AMuAMT.png'],1,https://pbs.twimg.com/media/FLCEJlyX0AMuAMT.png,False,9,1,4,,#COVID19,,,,,,,[],,,,
1490836751706775552,1490836751706775552,1644278154000.0,2022-02-07 15:55:54,-700,, https://t.co/RnBgvZnbRb Un vidéo de 2014 qui nous rappel qu'en 2014 André qui à mal vieillit... monsieur qui combat les réseaux pédophile serait-il un menteur ? #covid19 #quebec #Epstein,fr,"['covid19', 'quebec', 'epstein']",[],1490377764771446786,1490377764771446786,conspiwatch,Conspirorisme Watch,1,15,https://twitter.com/conspiwatch/status/1490836751706775552,['https://www.youtube.com/watch?v=njbvt2L_foY'],[],0,,False,0,0,1,,#COVID19,,,,,,,[],,,,
1490836706131591173,1490836706131591173,1644278143000.0,2022-02-07 15:55:43,-700,,"Over the past two years, the majority of calls our #HR directors have received are directly related to the pandemic and how to handle #employees who test positive for #COVID19 or are exposed to someone with COVID. Can you solve this COVID riddle?  https://t.co/diDE4cZDwv  https://t.co/z6KZgQhbn4",en,"['hr', 'employees', 'covid19']",[],256334037,256334037,CEAemployers,CA Employers Assn.,1,15,https://twitter.com/CEAemployers/status/1490836706131591173,['http://ow.ly/4kEE50HOUqW'],['https://pbs.twimg.com/media/FLCEFXkXwAIMdi7.jpg'],1,https://pbs.twimg.com/media/FLCEFXkXwAIMdi7.jpg,False,0,0,0,,#COVID19,,,,,,,[],,,,
1490836620081528833,1490836620081528833,1644278123000.0,2022-02-07 15:55:23,-700,,Mais dois óbitos em decorrência da Covid-19 são registrados em Varginha; três crianças estão internadas  https://t.co/BlHckgxccv #Varginha #covid19,pt,"['varginha', 'covid19']",[],135272073,135272073,Varginha_online,Varginha Online,1,15,https://twitter.com/Varginha_online/status/1490836620081528833,['https://www.varginhaonline.com.br/195363/mais-dois-obitos-em-decorrencia-da-covid19-sao-registrados-em-varginha-tres-criancas-estao-internadas.html'],[],0,,False,1,0,0,,#COVID19,,,,,,,[],,,,
1490836609163739136,1490836609163739136,1644278120000.0,2022-02-07 15:55:20,-700,,"#SantaCruz reportó este lunes 850 nuevos casos, 1.196 recuperados y 4 fallecidos por #COVID19  https://t.co/ZDZPxr8GTs",es,"['santacruz', 'covid19']",[],188870982,188870982,ErbolDigital,ERBOL,1,15,https://twitter.com/ErbolDigital/status/1490836609163739136,[],['https://pbs.twimg.com/media/FLCD_SpXsAIA6ZR.jpg'],1,https://pbs.twimg.com/media/FLCD_SpXsAIA6ZR.jpg,False,5,0,1,,#COVID19,,,,,,,[],,,,
1490836573209853952,1490836573209853952,1644278112000.0,2022-02-07 15:55:12,-700,,I have mailed #covid19 test after getting exposure alert 🚨 notification from #covidalertnj app  https://t.co/2DzUlkDaUq,en,"['covid19', 'covidalertnj']",[],241645179,241645179,skostiaev,Sergei Kostiaev,1,15,https://twitter.com/skostiaev/status/1490836573209853952,['https://www.instagram.com/p/CZsf12XL0Ye/?utm_medium=twitter'],[],0,,False,0,0,0,,#COVID19,,,,,,,[],,,,
1490836536644014081,1490836536644014081,1644278103000.0,2022-02-07 15:55:03,-700,,"Cases: 396,940,741 (+0)  Deaths: 5,748,061 (+598)  Recovered: 0 (+0)  Active Cases: 396,940,741 (100%) Completed Cases: 5,748,061 (1.45%) Mortality Rate: 1.45% (No Change) Case Fatality Rate: 100.00% (No Change)  #COVID19 #Coronavirus #StayHome",en,"['covid19', 'coronavirus', 'stayhome']",[],1237837670182793217,1237837670182793217,_covid_19_bot_,Covid-19 Bot,1,15,https://twitter.com/_covid_19_bot_/status/1490836536644014081,[],[],0,,False,0,0,0,,#COVID19,,,,,,,[],,,,
1490836506935640067,1490836506935640067,1644278096000.0,2022-02-07 15:54:56,-700,, https://t.co/21iwS2ak5y  @JustinTrudeau @theJagmeetSingh @CBCNews   #TruckersForFreedom2022 #ConvoyForFreedom2022 #covid19 #Ottawa #OttawaOccupation is bullshit @OttawaPolice,en,"['truckersforfreedom2022', 'convoyforfreedom2022', 'covid19', 'ottawa', 'ottawaoccupation']",[],1328688970151038976,1328688970151038976,6_rabbits,6-rabbits,1,15,https://twitter.com/6_rabbits/status/1490836506935640067,['https://maybury.ca/the-reformed-physicist/2022/02/03/a-night-with-the-untouchables/'],[],0,,False,0,0,0,,#COVID19,,,,,,,[],,,,
1490836424580808704,1490836424580808704,1644278076000.0,2022-02-07 15:54:36,-700,,Mars 2021 infected  August 2021 first dose  September 2021 second dose  February 2022 infected  #covid19,en,['covid19'],[],306778673,306778673,Sumaya_Alsawadi,سٌمية,1,15,https://twitter.com/Sumaya_Alsawadi/status/1490836424580808704,[],[],0,,False,0,0,0,,#COVID19,,,,,,,[],,,,
1490836383870877697,1490836383870877697,1644278066000.0,2022-02-07 15:54:26,-700,,📍Estos serán los módulos que se tendrán en #Morelos para la #PruebasAntigénicas para la detección de #Covid19 del 08 al 11 de febrero. #ZacualpanDeAmilpas #Huitzilac y #Tlaltizapán  https://t.co/bIjxuISeQT,es,"['morelos', 'pruebasantigénicas', 'covid19', 'zacualpandeamilpas', 'huitzilac', 'tlaltizapán']",[],308003872,308003872,TelevisaMorelos,Nueve Morelos,1,15,https://twitter.com/TelevisaMorelos/status/1490836383870877697,[],"['https://pbs.twimg.com/media/FLCDyhpVEAYQl_p.jpg', 'https://pbs.twimg.com/media/FLCDyhnVUAAJBpC.jpg', 'https://pbs.twimg.com/media/FLCDyitVgAA1lIN.jpg', 'https://pbs.twimg.com/media/FLCDyiwUYAYAKZz.jpg']",1,https://pbs.twimg.com/media/FLCDyhpVEAYQl_p.jpg,False,2,0,3,,#COVID19,,,,,,,[],,,,
1490836366132973569,1490836366132973569,1644278062000.0,2022-02-07 15:54:22,-700,,"Measles is, of course, the most contagious virus. #COVID19",en,['covid19'],[],14110428,14110428,oldak,oldak,1,15,https://twitter.com/oldak/status/1490836366132973569,[],[],0,,False,0,1,0,https://twitter.com/mitchellreports/status/1490746713044406277,#COVID19,,,,,,,[],,,,
1490836340245921792,1490836340245921792,1644278056000.0,2022-02-07 15:54:16,-700,,#COVID19 #HonkHonk @FX2trot  https://t.co/mv6jfIt2p6,und,"['covid19', 'honkhonk']",[],1478524243591630850,1478524243591630850,Crito72,Numenius,1,15,https://twitter.com/Crito72/status/1490836340245921792,[],['https://pbs.twimg.com/media/FLCDuEzaUAEAki0.jpg'],1,https://pbs.twimg.com/media/FLCDuEzaUAEAki0.jpg,False,2,1,2,,#COVID19,,,,,,,[],,,,
1490836328623140864,1490836328623140864,1644278053000.0,2022-02-07 15:54:13,-700,,"#AHORA🔴: La @SSalud_mx informa de 9,242 nuevos contagios😷 y 206 nuevas defunciones☠️ por #Covid19. Se reconocen 146,575 #CasosActivos🦠. 💉Se aplicaron 53,402 dosis de #VacunaCovid19 y se completaron 77.6M de esquemas en 24 horas.  #Vacunate #UsaCubrebocas.  https://t.co/UxRR0Vug5p",es,"['ahora', 'covid19', 'casosactivos', 'vacunacovid19', 'vacunate', 'usacubrebocas']",[],3434204479,3434204479,FerMoctezumaO,Fernando Moctezuma Ojeda,1,15,https://twitter.com/FerMoctezumaO/status/1490836328623140864,[],"['https://pbs.twimg.com/media/FLCDLuvUYAEB-9M.jpg', 'https://pbs.twimg.com/media/FLCDGo1VcAENDH1.jpg', 'https://pbs.twimg.com/media/FLCDH5dVIAIUwaM.jpg', 'https://pbs.twimg.com/media/FLCDIbzVUAMunAN.jpg']",1,https://pbs.twimg.com/media/FLCDLuvUYAEB-9M.jpg,False,5,0,8,,#COVID19,,,,,,,[],,,,
1490836294372851714,1490836291390676993,1644278045000.0,2022-02-07 15:54:05,-700,,"Asimismo, la directora de inmunizaciones, Gabriela Jiménez hizo un resumen del proceso de vacunación contra la #COVID19 de Puno.",es,['covid19'],[],138471254,138471254,Minsa_Peru,Ministerio de Salud,1,15,https://twitter.com/Minsa_Peru/status/1490836294372851714,[],[],0,,False,17,0,0,,#COVID19,,,,,,,[],,,,
1490836285870977024,1490836285870977024,1644278043000.0,2022-02-07 15:54:03,-700,,Federal Gov't Settles with #Kroger Over online #COVID19 #vaccine registration #accessibility • The Georgia Virtue #inclusion #PwD #disabilityinclusion  https://t.co/sE3pH1oi7O  https://t.co/UDNyS9AGXP,en,"['kroger', 'covid19', 'vaccine', 'accessibility', 'inclusion', 'pwd', 'disabilityinclusion']",[],748308274974326785,748308274974326785,StreitzAbility,Richard Streitz,1,15,https://twitter.com/StreitzAbility/status/1490836285870977024,['https://buff.ly/3HxHGb2'],['https://pbs.twimg.com/media/FLCDs1dX0AIZohZ.jpg'],1,https://pbs.twimg.com/media/FLCDs1dX0AIZohZ.jpg,False,1,0,0,,#COVID19,,,,,,,[],,,,
