id,conversation_id,created_at,date,timezone,place,tweet,language,hashtags,cashtags,user_id,user_id_str,username,name,day,hour,link,urls,photos,video,thumbnail,retweet,nlikes,nreplies,nretweets,quote_url,search,near,geo,source,user_rt_id,user_rt,retweet_id,reply_to,retweet_date,translate,trans_src,trans_dest
1494446532589862916,1494446532589862916,1645138793000.0,2022-02-17 14:59:53,-700,,"Buy USA supplies, equipment and products only. Stop doing business with China. #ChinaVirus ðºðžðšðŠ",en,['chinavirus'],[],117340300,117340300,VegasNFLChickie,VegasNFLChickie,4,14,https://twitter.com/VegasNFLChickie/status/1494446532589862916,[],[],0,,False,0,0,0,https://twitter.com/MariaBartiromo/status/1494339613346967553,#chinavirus,,,,,,,[],,,,
1494445873144610824,1494445873144610824,1645138636000.0,2022-02-17 14:57:16,-700,,"China, already the greatest power, owns north of 64% of USA, feeds USA laced-Fentanyl via our Southern Border, and will come up with another #ChinaVirus to finish off over 300 million Americans by 2024.",en,['chinavirus'],[],117340300,117340300,VegasNFLChickie,VegasNFLChickie,4,14,https://twitter.com/VegasNFLChickie/status/1494445873144610824,[],[],0,,False,0,0,0,https://twitter.com/MariaBartiromo/status/1494344664941486093,#chinavirus,,,,,,,[],,,,
1494436098155724800,1494263450889031685,1645136305000.0,2022-02-17 14:18:25,-700,,"@Respond2Racism Calling it the #ChinaVirus isnât racist, itâs where it came from",en,['chinavirus'],[],1257700290,1257700290,gator_bait420,michael topliff,4,14,https://twitter.com/gator_bait420/status/1494436098155724800,[],[],0,,False,0,0,0,,#chinavirus,,,,,,,"[{'screen_name': 'Respond2Racism', 'name': 'First Responder', 'id': '1255603473309028352'}]",,,,
1494421700804591617,1494398753771593731,1645132873000.0,2022-02-17 13:21:13,-700,,@SenRubioPress @EnesFreedom @Apple @Nike Did you 2 talk about the reparation of #ChinaVirus? this is the most important issue,en,['chinavirus'],[],1462222623723642886,1462222623723642886,DonnaWongHK,Donna 3.0ð,4,13,https://twitter.com/DonnaWongHK/status/1494421700804591617,[],[],0,,False,1,1,0,,#chinavirus,,,,,,,"[{'screen_name': 'SenRubioPress', 'name': 'Senator Rubio Press', 'id': '229966028'}, {'screen_name': 'EnesFreedom', 'name': 'Enes FREEDOM', 'id': '302111485'}, {'screen_name': 'Apple', 'name': 'Apple', 'id': '380749300'}, {'screen_name': 'Nike', 'name': 'Nike', 'id': '415859364'}]",,,,
1494420268294492162,1494420268294492162,1645132531000.0,2022-02-17 13:15:31,-700,,"Although I really don't wanna talk about American politics bc I'm not an American, but #ChinaVirus is man-made for sure! and those claims of just reparations were wrongly halted by the Dem! thatâs why prices are skyrocketing now  it's so fucking crazy, it was 10 trillion! not 10",en,['chinavirus'],[],1462222623723642886,1462222623723642886,DonnaWongHK,Donna 3.0ð,4,13,https://twitter.com/DonnaWongHK/status/1494420268294492162,[],[],0,,False,11,2,1,,#chinavirus,,,,,,,[],,,,
1494383369081217024,1494383369081217024,1645123734000.0,2022-02-17 10:48:54,-700,,Why would @POTUS buy #CovidTesting kits from the very people who gave us the #ChinaVirus?  https://t.co/hRutByWBKs,en,"['covidtesting', 'chinavirus']",[],786701463410073601,786701463410073601,allen_rizzi,Allen E. Rizzi ðºðžðŠð¹ð®ð¹,4,10,https://twitter.com/allen_rizzi/status/1494383369081217024,[],['https://pbs.twimg.com/media/FL0dd85XIAc8Qym.jpg'],1,https://pbs.twimg.com/media/FL0dd85XIAc8Qym.jpg,False,4,0,1,,#chinavirus,,,,,,,[],,,,
1494375584163516417,1494317167717748743,1645121878000.0,2022-02-17 10:17:58,-700,,"@The_Acumen Yeah, this was early on and commonly reported before being roundly shouted down and bullied out by the information police. For some, there are unspeakable words. How dumb is that?  #chinavirus #censorship",en,"['chinavirus', 'censorship']",[],1326542942211764227,1326542942211764227,PerkWarbeck,Perkin Warbeck,4,10,https://twitter.com/PerkWarbeck/status/1494375584163516417,[],[],0,,False,0,0,0,,#chinavirus,,,,,,,"[{'screen_name': 'The_Acumen', 'name': 'AshleyStevens', 'id': '248023936'}]",,,,
1494325456576729100,1494325456576729100,1645109926000.0,2022-02-17 06:58:46,-700,,"The timing of the recent death of Luc Montagnier, who won a Nobel prize for discovering HIV, coincides with the emergence of the new HIV variant.  He said #ChinaVirus originated from a lab, contains an HIV sequence, and that it creates deadlier variants.    https://t.co/WhjjzGLM9J",en,['chinavirus'],[],1447307976725893133,1447307976725893133,StarmanVii,ð¥ðâ¡Starman VII: The Fertile Mysticâ¡ðð¥,4,6,https://twitter.com/StarmanVii/status/1494325456576729100,['https://bit.ly/34SUg6y'],[],0,,False,3,1,2,,#chinavirus,,,,,,,[],,,,
1494321155502587909,1494321155502587909,1645108901000.0,2022-02-17 06:41:41,-700,,New COVID variant  Founded in uk  Name: Deltacron  Combination of delta and omicron  #COVID19 #Chinavirus #coronavirus,en,"['covid19', 'chinavirus', 'coronavirus']",[],860934549253087232,860934549253087232,krishstocks,krishâ¢,4,6,https://twitter.com/krishstocks/status/1494321155502587909,[],[],0,,False,17,2,0,,#chinavirus,,,,,,,[],,,,
1494321032420757504,1494321032420757504,1645108871000.0,2022-02-17 06:41:11,-700,,This explains all of the new hiv drug commercials #democratsliepeopledie #chinavirus #DontTreadOnMe #FightForAmerica #GodBlessAmerica,en,"['democratsliepeopledie', 'chinavirus', 'donttreadonme', 'fightforamerica', 'godblessamerica']",[],36407829,36407829,tbbni,America Matters Not The Party,4,6,https://twitter.com/tbbni/status/1494321032420757504,[],[],0,,False,1,0,0,https://twitter.com/Lukewearechange/status/1494069457358053377,#chinavirus,,,,,,,[],,,,
1494307505949794307,1494224138411589633,1645105646000.0,2022-02-17 05:47:26,-700,,"@nypost The Political Doctor says the Elections are coming, forget everything. #FauciLied #chinavirus #wuhanvirus #DemocratsAreDestroyingAmerica",en,"['faucilied', 'chinavirus', 'wuhanvirus', 'democratsaredestroyingamerica']",[],28695381,28695381,Sherm00,BigPerm,4,5,https://twitter.com/Sherm00/status/1494307505949794307,[],[],0,,False,0,0,0,,#chinavirus,,,,,,,"[{'screen_name': 'nypost', 'name': 'New York Post', 'id': '17469289'}]",,,,
1494305427735130117,1494305427735130117,1645105151000.0,2022-02-17 05:39:11,-700,,Hungarian Scientists Find Absolute Proof That COVID Originated In Chinese Lab   #chinavirus #COVID19 #Hungary #lableak #WuhanLab   https://t.co/5uEtrDI0GT  https://t.co/qUsWA0vM1N,en,"['chinavirus', 'covid19', 'hungary', 'lableak', 'wuhanlab']",[],735342424336306178,735342424336306178,en_volve,enVolve,4,5,https://twitter.com/en_volve/status/1494305427735130117,['https://en-volve.com/2022/02/17/hungarian-scientists-find-absolute-proof-that-covid-originated-in-chinese-lab/'],['https://pbs.twimg.com/media/FLzW3ikXoAA4CX8.jpg'],1,https://pbs.twimg.com/media/FLzW3ikXoAA4CX8.jpg,False,0,0,0,,#chinavirus,,,,,,,[],,,,
1494445106895601689,1494445106895601689,1645138453000.0,2022-02-17 14:54:13,-700,,"So now that everyone has been infected/injected with HIV, the evil ones will make trillions selling the new HIV antidote/vaccine. None of this is by accident/coincidence. Pay attention. Or sheep out with the rest of them. #Plandemic #FJB #LetsGoBrandon #CovidHoax #FauciLied",en,"['plandemic', 'fjb', 'letsgobrandon', 'covidhoax', 'faucilied']",[],1476328260703297536,1476328260703297536,Gary84700786,GaryMAGABuck,4,14,https://twitter.com/Gary84700786/status/1494445106895601689,[],[],0,,False,0,0,0,,#covidhoax,,,,,,,[],,,,
1494383378958897154,1494383378958897154,1645123736000.0,2022-02-17 10:48:56,-700,,#covidhoax has been all smoke &amp; mirrors from day 1!,en,['covidhoax'],[],1483634161160228864,1483634161160228864,PolinaBrik69,Tulik Cat,4,10,https://twitter.com/PolinaBrik69/status/1494383378958897154,[],[],0,,False,0,0,0,https://twitter.com/thevivafrei/status/1494382150610829319,#covidhoax,,,,,,,[],,,,
1494361253699072007,1494361253699072007,1645118461000.0,2022-02-17 09:21:01,-700,,The only thing necessary for tyranny to fall is for good men to disobey. #ElectionFraud #January6thSetup  #CovidHoax #TruckersForFreedom   https://t.co/YmdYUnrOWH,en,"['electionfraud', 'january6thsetup', 'covidhoax', 'truckersforfreedom']",[],1397268212522291211,1397268212522291211,Category12J,Category12Jenn,4,9,https://twitter.com/Category12J/status/1494361253699072007,['https://gettr.com/post/puzq7ua57e'],[],0,,False,1,0,0,,#covidhoax,,,,,,,[],,,,
1494335493705584663,1494335493705584663,1645112319000.0,2022-02-17 07:38:39,-700,,Interessant filmpje over het #WEF en zijn young globals school. Wat een criminele bende bijelkaar. #tribunalen #wefgate #Schwab #PlandemicGameOver #covidhoax,nl,"['wef', 'tribunalen', 'wefgate', 'schwab', 'plandemicgameover', 'covidhoax']",[],1146002706,1146002706,PatriciaSt1948,patricia,4,7,https://twitter.com/PatriciaSt1948/status/1494335493705584663,[],[],0,,False,4,0,4,https://twitter.com/MorigeauJanine/status/1494333323014918153,#covidhoax,,,,,,,[],,,,
1494318466689429505,1494318466689429505,1645108260000.0,2022-02-17 06:31:00,-700,,La strategia migliore Ãš quella di mandare tutti quelli come questo a zappare i campi con la palla al piede.  #Gimbe  #COVIDIOTS  #COVIDscam  #COVIDhoax,it,"['gimbe', 'covidiots', 'covidscam', 'covidhoax']",[],1011364610987962370,1011364610987962370,GianpaoloRinet1,Il Pensiero Del Mattino,4,6,https://twitter.com/GianpaoloRinet1/status/1494318466689429505,[],[],0,,False,0,0,0,https://twitter.com/Cartabellotta/status/1494280553067077633,#covidhoax,,,,,,,[],,,,
1494318054548795392,1494280553067077633,1645108161000.0,2022-02-17 06:29:21,-700,,@Cartabellotta La strategia migliore Ãš quella di mandare tutti quelli come lei a zappare i campi con la palla al piede.  #Gimbe  #COVIDIOTS  #COVIDscam  #COVIDhoax,it,"['gimbe', 'covidiots', 'covidscam', 'covidhoax']",[],1011364610987962370,1011364610987962370,GianpaoloRinet1,Il Pensiero Del Mattino,4,6,https://twitter.com/GianpaoloRinet1/status/1494318054548795392,[],[],0,,False,0,0,0,,#covidhoax,,,,,,,"[{'screen_name': 'Cartabellotta', 'name': 'Nino Cartabellotta', 'id': '231902290'}]",,,,
1494303729813790723,1494303729813790723,1645104746000.0,2022-02-17 05:32:26,-700,,"How long, indeed. If the #CovidHoax has shown us anything, its that our government will tell any lie or abrogate any fundamental civil right if it furthers their twisted goal. The government is evil, and is the #EnemyOfThePeople.  https://t.co/7gGfTdn05F",en,"['covidhoax', 'enemyofthepeople']",[],894233983902302209,894233983902302209,Fairbanks357,Joe Fairbanks,4,5,https://twitter.com/Fairbanks357/status/1494303729813790723,['https://www.breitbart.com/clips/2022/02/16/carlson-how-long-until-we-get-canadian-style-tyranny-in-the-u-s/'],[],0,,False,2,0,1,,#covidhoax,,,,,,,[],,,,
1494299438969495552,1494299438969495552,1645103723000.0,2022-02-17 05:15:23,-700,,#CovidHoax #plandemic #truckers #Canada #cashless  .... #crypto solves this and the #WEF doesn't like it!,en,"['covidhoax', 'plandemic', 'truckers', 'canada', 'cashless', 'crypto', 'wef']",[],1387445194681896963,1387445194681896963,ChancerDr,Dr Chancer,4,5,https://twitter.com/ChancerDr/status/1494299438969495552,[],[],0,,False,0,0,0,https://twitter.com/Dennis_Porter_/status/1493971401396551687,#covidhoax,,,,,,,[],,,,
1494283216269852677,1494283216269852677,1645099855000.0,2022-02-17 04:10:55,-700,,#CovidHoax,und,['covidhoax'],[],1175277688560291840,1175277688560291840,TheCana07792546,The Canadian,4,4,https://twitter.com/TheCana07792546/status/1494283216269852677,[],[],0,,False,1,0,1,https://twitter.com/TorranceEddie/status/1494014145871687694,#covidhoax,,,,,,,[],,,,
1494260330003935238,1494260330003935238,1645094399000.0,2022-02-17 02:39:59,-700,,#klimaathoax #covidhoax en ðis het nieuwe roken ð¬ Je gaat er snel of langzaam aan dood ðŠ ððâ°ïž,nl,"['klimaathoax', 'covidhoax']",[],1385958645352050691,1385958645352050691,pietjeb28162595,lex1967 2,4,2,https://twitter.com/pietjeb28162595/status/1494260330003935238,[],[],0,,False,5,0,1,,#covidhoax,,,,,,,[],,,,
1494460161376894976,1494341773576998913,1645142042000.0,2022-02-17 15:54:02,-700,,@ikuo1000 @DrHarryThomas I wonder how many antivax parents have a kid w peanut allergies. Quite a conundrum but I'm sure they've justified it to themselves. #COVIDIOT,en,['covidiot'],[],1480568263394398214,1480568263394398214,JoBuko1,Ho Jo,4,15,https://twitter.com/JoBuko1/status/1494460161376894976,[],[],0,,False,5,0,0,,#covidiot,,,,,,,"[{'screen_name': 'ikuo1000', 'name': 'Irene Rideout é­æ°žäœ³', 'id': '917402543151616000'}, {'screen_name': 'DrHarryThomas', 'name': 'Harry Thomas', 'id': '1429437000'}]",,,,
1494458602953883651,1494458602953883651,1645141671000.0,2022-02-17 15:47:51,-700,,"Mince alors de nouveaux complotistes !!!!!!!! Tout le monde le sait, le #COVIDIOT Ã©galement, cela n'existe pas. #PassVaccinalDeLaHonte #vaccination",fr,"['covidiot', 'passvaccinaldelahonte', 'vaccination']",[],380007544,380007544,VBordenave,VÃ©ronique Bordenave,4,15,https://twitter.com/VBordenave/status/1494458602953883651,[],[],0,,False,1,0,0,https://twitter.com/PhilippeMurer/status/1493716395992965120,#covidiot,,,,,,,[],,,,
1494457945337253888,1494457945337253888,1645141514000.0,2022-02-17 15:45:14,-700,,exposing pharma scandal for injecting kids .#COVIDIOT #BreakingNews,en,"['covidiot', 'breakingnews']",[],1029333408219058176,1029333408219058176,John711942221,John,4,15,https://twitter.com/John711942221/status/1494457945337253888,[],[],0,,False,0,0,0,https://twitter.com/BigFish3000/status/1493905815547400195,#covidiot,,,,,,,[],,,,
1494457093407055875,1492178160024178689,1645141311000.0,2022-02-17 15:41:51,-700,,@GravelT3 @sajanorth22 @NOconsensus Just glad you didn't hurt yourself writing such a scathing comeback.  #RamRanchResisitance  #GoHomeFluTrucksKlan  #COVIDIOT,en,"['ramranchresisitance', 'gohomeflutrucksklan', 'covidiot']",[],1363867413209563138,1363867413209563138,funswick,Elected Grand Pooh-Bah of the Truckers,4,15,https://twitter.com/funswick/status/1494457093407055875,[],[],0,,False,0,1,0,,#covidiot,,,,,,,"[{'screen_name': 'GravelT3', 'name': 'GravelT', 'id': '1202121556912160769'}, {'screen_name': 'sajanorth22', 'name': 'Vinny Zinâïžðð·ðððšðŠððð»', 'id': '380451775'}, {'screen_name': 'NOconsensus', 'name': 'Donna Laframboise', 'id': '58550802'}]",,,,
1494456813521149956,1493282790762332163,1645141244000.0,2022-02-17 15:40:44,-700,,@jstylman Vaccine mandates are like Jim Crow laws and the Nazi regime?!! I will make it my lifeâs work to make sure anyone I know  never drinks whatever swill youâre brewing! ð #dumbass #covidiot  https://t.co/Uxz3tv6qF7,en,"['dumbass', 'covidiot']",[],34114873,34114873,BradTrent,Brad Trent,4,15,https://twitter.com/BradTrent/status/1494456813521149956,[],['https://pbs.twimg.com/tweet_video_thumb/FL1giE9XwAM9qN9.jpg'],1,https://pbs.twimg.com/tweet_video_thumb/FL1giE9XwAM9qN9.jpg,False,1,0,0,,#covidiot,,,,,,,"[{'screen_name': 'jstylman', 'name': 'Josh Stylman', 'id': '8731812'}]",,,,
1494454197319831554,1494047389803593728,1645140620000.0,2022-02-17 15:30:20,-700,,@RnEmergency Fake.  News.  #COVIDIOT #Quack,en,"['covidiot', 'quack']",[],1125932021883256832,1125932021883256832,nellastu1,nellastu,4,15,https://twitter.com/nellastu1/status/1494454197319831554,[],[],0,,False,0,0,0,,#covidiot,,,,,,,"[{'screen_name': 'RnEmergency', 'name': 'Emergency Room RN', 'id': '1469813670771404803'}]",,,,
1494453873515196437,1494453873515196437,1645140543000.0,2022-02-17 15:29:03,-700,,Current COVID policy now from @WADeptHealth @GovInslee @kcexec @KCPubHealth @WaHealthSec   #COVIDIOT #COVID19 #BA2variant #CovidGames #MayTheOdds  https://t.co/ZHsRwEViaK,en,"['covidiot', 'covid19', 'ba2variant', 'covidgames', 'maytheodds']",[],988251034786054144,988251034786054144,CorporalWacky,Elect More Real Scientists Please (not TV ones),4,15,https://twitter.com/CorporalWacky/status/1494453873515196437,[],['https://pbs.twimg.com/tweet_video_thumb/FL1d3_TVcAA7b57.jpg'],1,https://pbs.twimg.com/tweet_video_thumb/FL1d3_TVcAA7b57.jpg,False,3,0,0,,#covidiot,,,,,,,[],,,,
1494453689175531521,1494453689175531521,1645140499000.0,2022-02-17 15:28:19,-700,,#COVIDIOT,und,['covidiot'],[],902528816,902528816,CaccioppoliMike,MikeUnleashed,4,15,https://twitter.com/CaccioppoliMike/status/1494453689175531521,[],[],0,,False,0,0,0,https://twitter.com/CaccioppoliMike/status/1494453598599540740,#covidiot,,,,,,,[],,,,
1494452950319747075,1494452950319747075,1645140323000.0,2022-02-17 15:25:23,-700,,Dear Doug Ford:   No one in the scientific community is saying âwe are over Covid-19â.   Why are you?   104 days until we #VoteFordOut   #onpoli #Ontario #COVIDIOT,en,"['votefordout', 'onpoli', 'ontario', 'covidiot']",[],27590358,27590358,thejennyb75,Nova+Nylaâs Human,4,15,https://twitter.com/thejennyb75/status/1494452950319747075,[],[],0,,False,2,0,0,,#covidiot,,,,,,,[],,,,
1494449910602612769,1494449910602612769,1645139598000.0,2022-02-17 15:13:18,-700,,@evil4life101 Talk about word vomit with his statement. He should have just kept it cute and just said he canât go. But no I guess itâs too much to ask a #COVIDIOT to keep to themselves= kind like guess it 's too much to ask you to shut your mouth. but one can always hope.,en,['covidiot'],[],1429685951501008896,1429685951501008896,jleemil,JLee Miller,4,15,https://twitter.com/jleemil/status/1494449910602612769,[],[],0,,False,0,0,0,,#covidiot,,,,,,,[],,,,
1494448842863005699,1494448842863005699,1645139344000.0,2022-02-17 15:09:04,-700,,LOL! Tom Tom thinks weâve âcompletedâ Covid! ð€¡  GBeebies finest hereâŠ #ThickAsPigShit #Gbeebies #Covidiot,en,"['thickaspigshit', 'gbeebies', 'covidiot']",[],1291891260136001536,1291891260136001536,Cuidad10,Cuidad,4,15,https://twitter.com/Cuidad10/status/1494448842863005699,[],[],0,,False,2,0,0,https://twitter.com/tomhfh/status/1494432448649781248,#covidiot,,,,,,,[],,,,
1494447799852679174,1494447799852679174,1645139095000.0,2022-02-17 15:04:55,-700,,#COVIDIOT,und,['covidiot'],[],902528816,902528816,CaccioppoliMike,MikeUnleashed,4,15,https://twitter.com/CaccioppoliMike/status/1494447799852679174,[],[],0,,False,0,0,0,https://twitter.com/CaccioppoliMike/status/1494236544118366208,#covidiot,,,,,,,[],,,,
1494446050651750408,1494446050651750408,1645138678000.0,2022-02-17 14:57:58,-700,,"The #COVIDIOT s were arrested one by one, hurrah, hurrah ð€   #RamRanchResistance",en,"['covidiot', 'ramranchresistance']",[],1493647401059508229,1493647401059508229,PeterCaineRanch,Peter Caine,4,14,https://twitter.com/PeterCaineRanch/status/1494446050651750408,[],[],0,,False,2,0,0,,#covidiot,,,,,,,[],,,,
1494441776823816193,1493676491716149251,1645137659000.0,2022-02-17 14:40:59,-700,,"@TheView @drlaurenawright Wow, this just proves they will give anyone the title of doctor. So the next time there's an ebola outbreak, please travel there...don't wear a mask when you get there &amp; see how that goes for you. #Covidiot #DoBetterABC",en,"['covidiot', 'dobetterabc']",[],1347931984698503168,1347931984698503168,WesB73,WesB73,4,14,https://twitter.com/WesB73/status/1494441776823816193,[],[],0,,False,2,1,0,,#covidiot,,,,,,,"[{'screen_name': 'TheView', 'name': 'The View', 'id': '21258337'}, {'screen_name': 'drlaurenawright', 'name': 'Lauren A. Wright', 'id': '4617538938'}]",,,,
1494441510770778113,1493694348176891904,1645137596000.0,2022-02-17 14:39:56,-700,,"@drlaurenawright Wow, this just proves they will give anyone the title of doctor. So the next time there's an ebola outbreak, please travel there...don't wear a mask when you get there &amp; see how that goes for you. #Covidiot",en,['covidiot'],[],1347931984698503168,1347931984698503168,WesB73,WesB73,4,14,https://twitter.com/WesB73/status/1494441510770778113,[],[],0,,False,1,0,0,,#covidiot,,,,,,,"[{'screen_name': 'drlaurenawright', 'name': 'Lauren A. Wright', 'id': '4617538938'}]",,,,
1494437774019252229,1494289037179469827,1645136705000.0,2022-02-17 14:25:05,-700,,"@MrRaceBannon @MelissaLantsman goes on #FoxNotNews aka #AmericaPravda. So Mel, is the original #Pravda next or @RT_com? #KarenConvoy #COVIDIOT #VaccineMandate #VaccinePassport #RealScienceMatters #RealFactsMatter alternative facts are just lies! The next @CPC_HQ member to run for leadership ð  https://t.co/uWBqTRbiKq",en,"['foxnotnews', 'americapravda', 'pravda', 'karenconvoy', 'covidiot', 'vaccinemandate', 'vaccinepassport', 'realsciencematters', 'realfactsmatter']",[],495173663,495173663,airbus63,AndrÃ© Forcier I Stand with ðºðŠ,4,14,https://twitter.com/airbus63/status/1494437774019252229,[],['https://pbs.twimg.com/tweet_video_thumb/FL1PO4cWQAUvQ5X.jpg'],1,https://pbs.twimg.com/tweet_video_thumb/FL1PO4cWQAUvQ5X.jpg,False,0,0,0,,#covidiot,,,,,,,"[{'screen_name': 'MrRaceBannon', 'name': 'Mister Race Bannon', 'id': '40444923'}]",,,,
1494436323545034760,1494436323545034760,1645136359000.0,2022-02-17 14:19:19,-700,,Random stranger walking around coughing and no maskâŠOK Rona Rita! #COVIDIOT #COVID19 #ronarita #haha #masks,en,"['covidiot', 'covid19', 'ronarita', 'haha', 'masks']",[],2326373269,2326373269,22mariposa78,marie mariposa,4,14,https://twitter.com/22mariposa78/status/1494436323545034760,[],[],0,,False,0,0,0,,#covidiot,,,,,,,[],,,,
1494436226132320262,1494436226132320262,1645136336000.0,2022-02-17 14:18:56,-700,,On the plus side thereâs not one #troofer #antivaxxer or #COVIDIOT who knows thereâs a highly dangerous storm coming to the uk.,en,"['troofer', 'antivaxxer', 'covidiot']",[],1492932667796606985,1492932667796606985,IamIron62,IamIronman,4,14,https://twitter.com/IamIron62/status/1494436226132320262,[],[],0,,False,0,0,0,,#covidiot,,,,,,,[],,,,
1494436184222801922,1494436184222801922,1645136326000.0,2022-02-17 14:18:46,-700,, https://t.co/Fz1OuYBl4G  #Schwurbler  #COVIDIOT,und,"['schwurbler', 'covidiot']",[],838364904004464643,838364904004464643,Demosanis_Nord,Demosâ¶nis Nord,4,14,https://twitter.com/Demosanis_Nord/status/1494436184222801922,['https://www.derstandard.de/story/2000109455158/wie-viel-nazi-ideologie-steckt-im-begriff-schulmedizin'],[],0,,False,0,0,0,,#covidiot,,,,,,,[],,,,
1494436123283636232,1494436123283636232,1645136311000.0,2022-02-17 14:18:31,-700,,"""We would've done something  sooner, but it took us three weeks to come up with an acronym."" - Gavin Newsom   #COVIDIOT",en,['covidiot'],[],13222472,13222472,hydar,(((Common Man))) - Pray for Ukraine! ðºðŠ,4,14,https://twitter.com/hydar/status/1494436123283636232,[],[],0,,False,0,0,0,https://twitter.com/GavinNewsom/status/1494432468924973072,#covidiot,,,,,,,[],,,,
1494434953983152132,1494434953983152132,1645136032000.0,2022-02-17 14:13:52,-700,,"TGRT de bitane Prof demeye bin Åahit isteyen varlÄ±k , az Ã¶nce  en iyi baÄÄ±ÅÄ±klÄ±k toplumsal doÄal baÄÄ±ÅÄ±klÄ±k deÄil aÅÄ± ile olan baÄÄ±ÅÄ±klÄ±k dedi . Bu Prof  TÄ±p bitirmiÅ.  Buna muayene oluyor can emanet ediyorlar.  #COVID19 #Covid_19 #COVIDIOT #OmicronVariant #MaskeniCÄ±karNefesAl",tr,"['covid19', 'covid_19', 'covidiot', 'omicronvariant', 'maskenicÄ±karnefesal']",[],1349859297883283460,1349859297883283460,Ufuk_ermann,UFUK ERMAN,4,14,https://twitter.com/Ufuk_ermann/status/1494434953983152132,[],[],0,,False,0,0,0,,#covidiot,,,,,,,[],,,,
1494434769211428869,1494434769211428869,1645135988000.0,2022-02-17 14:13:08,-700,,ðŠð #ULTIMAHORA â¡ïž Se hace pÃºblico que un empleado de #Pfizer lleva a juicio a la compaÃ±Ã­a por falsedad documental en los ensayos de Fase 3 de la #VacunaCOVID19 #COVID #COVID19 #COVIDIOT.  https://t.co/FhPlHxQ5oN,es,"['ultimahora', 'pfizer', 'vacunacovid19', 'covid', 'covid19', 'covidiot']",[],1483177830208970752,1483177830208970752,OrdoLucendi,ðŒðŸð²ð·ððŽð»ðŸ ðŠ,4,14,https://twitter.com/OrdoLucendi/status/1494434769211428869,[],['https://pbs.twimg.com/media/FL1MIOyXwAEtrGu.jpg'],1,https://pbs.twimg.com/media/FL1MIOyXwAEtrGu.jpg,False,2,0,6,https://twitter.com/OrdoLucendi/status/1494384056829726723,#covidiot,,,,,,,[],,,,
1494434767680462852,1494434767680462852,1645135988000.0,2022-02-17 14:13:08,-700,,#COVIDIOT #Clownvoy,und,"['covidiot', 'clownvoy']",[],16293469,16293469,Aussiemandias,- Aussiemandias - ðšðŠðŠðºð¬ð§ðºðŠ,4,14,https://twitter.com/Aussiemandias/status/1494434767680462852,[],[],0,,False,0,0,0,https://twitter.com/jfinch/status/1494313577322328068,#covidiot,,,,,,,[],,,,
1494434672306438144,1494431481066057729,1645135965000.0,2022-02-17 14:12:45,-700,,@CaptainInterna1 @TimLovesCake @NSWHealth So if you murder an 82 year old you shouldn't be charged with murder because the death couldn't be prevented?  #COVIDIOT,en,['covidiot'],[],39121780,39121780,kittycatsrule,kittycatsrule,4,14,https://twitter.com/kittycatsrule/status/1494434672306438144,[],[],0,,False,5,2,0,,#covidiot,,,,,,,"[{'screen_name': 'CaptainInterna1', 'name': 'Captain Internationalist', 'id': '1056248805329297408'}, {'screen_name': 'TimLovesCake', 'name': 'Tim Caek', 'id': '1400263705212854276'}, {'screen_name': 'NSWHealth', 'name': 'NSW Health', 'id': '40778270'}]",,,,
1494434460791865344,1494277795845144583,1645135915000.0,2022-02-17 14:11:55,-700,,@janine_sawtell #COVIDIOT,und,['covidiot'],[],1252002555107749888,1252002555107749888,Cate78029240,Cate,4,14,https://twitter.com/Cate78029240/status/1494434460791865344,[],[],0,,False,0,0,0,,#covidiot,,,,,,,"[{'screen_name': 'janine_sawtell', 'name': 'Jaysa #EnoughIsEnough ððð', 'id': '51683450'}]",,,,
