id,conversation_id,created_at,date,timezone,place,tweet,language,hashtags,cashtags,user_id,user_id_str,username,name,day,hour,link,urls,photos,video,thumbnail,retweet,nlikes,nreplies,nretweets,quote_url,search,near,geo,source,user_rt_id,user_rt,retweet_id,reply_to,retweet_date,translate,trans_src,trans_dest
1500984620451516421,1500984620451516421,1646697595000.0,2022-03-07 15:59:55,-700,,"Los contagios activos de #COVID19 disminuyen a 3,113 con una positividad de 5.4%, de acuerdo con el informe del @MINSAPma. #Noticiasvip24  https://t.co/nJcYx4EJ9L",es,"['covid19', 'noticiasvip24']",[],1380668913546039297,1380668913546039297,noticiasvip24,Noticiasvip24,1,15,https://twitter.com/noticiasvip24/status/1500984620451516421,[],[],1,https://pbs.twimg.com/ext_tw_video_thumb/1500984598876073992/pu/img/zm7KOYIT9Ntb5TxY.jpg,False,0,0,0,,#COVID19,,,,,,,[],,,,
1500984541095526400,1500984432567930882,1646697576000.0,2022-03-07 15:59:36,-700,,",...a NON-#covid19 death ON TOP OF ALL the #covid19 deaths (March 7, 2022; 22:17 HKT) #HONGKONG #HK",en,"['covid19', 'covid19', 'hongkong', 'hk']",[],313536147,313536147,ActivistBowen2,ActivistBowen: FULLY VAXXED + BOOSTED!,1,15,https://twitter.com/ActivistBowen2/status/1500984541095526400,[],[],0,,False,0,0,0,,#COVID19,,,,,,,[],,,,
1500984528755638280,1500984528755638280,1646697573000.0,2022-03-07 15:59:33,-700,,Este martes arrancará una nueva jornada de vacunación contra la #COVID19 en 74 municipios de Puebla 💉  https://t.co/hzFMVk3F0h,es,['covid19'],[],1182346073312055296,1182346073312055296,AlmanaquePuebla,📰🔥Almanaque🔥📰,1,15,https://twitter.com/AlmanaquePuebla/status/1500984528755638280,['https://almanaquerevista.com/puebla/vacunacion-covid-puebla/'],[],0,,False,0,0,0,,#COVID19,,,,,,,[],,,,
1500984495830450184,1500984495830450184,1646697565000.0,2022-03-07 15:59:25,-700,,A look at COVID medical waste and how to handle it   #COVID #COVID19,en,"['covid', 'covid19']",[],1498321010738802688,1498321010738802688,EnvironMedicine,EnvironMedicine,1,15,https://twitter.com/EnvironMedicine/status/1500984495830450184,[],[],0,,False,0,0,0,https://twitter.com/sciam/status/1500814026699329536,#COVID19,,,,,,,[],,,,
1500984478457634817,1500984478457634817,1646697561000.0,2022-03-07 15:59:21,-700,,Uncontrolled spread of #Covid19 can lead to the creation of a worse variant.  US seems to be setting up perfect conditions for a worse variant that won’t just harm our country but will harm the world.  It’s shameful we won’t even take the simple step to continue masking.,en,['covid19'],[],87358629,87358629,myrabatchelder,Myra Batchelder - Still masking!,1,15,https://twitter.com/myrabatchelder/status/1500984478457634817,[],[],0,,False,1913,47,343,,#COVID19,,,,,,,[],,,,
1500984476456861698,1500984476456861698,1646697560000.0,2022-03-07 15:59:20,-700,,"#Institucional | Cumpliendo con el protocolo sanitario, hoy realizamos las pruebas PCR a jugadores y cuerpo técnico de nuestro equipo para descartar casos de #COVID19.  https://t.co/6eZSwvcii1",es,"['institucional', 'covid19']",[],104858289,104858289,MinerosGuayana,Mineros de Guayana,1,15,https://twitter.com/MinerosGuayana/status/1500984476456861698,[],"['https://pbs.twimg.com/media/FNSRZdeX0AEAONj.jpg', 'https://pbs.twimg.com/media/FNSRaHVXoAAny9I.jpg', 'https://pbs.twimg.com/media/FNSRarKXwAI-DHt.jpg', 'https://pbs.twimg.com/media/FNSRbSdWQAU5pNP.jpg']",1,https://pbs.twimg.com/media/FNSRZdeX0AEAONj.jpg,False,9,0,0,,#COVID19,,,,,,,[],,,,
1500984231022845953,1500984231022845953,1646697502000.0,2022-03-07 15:58:22,-700,,In #mnhouse #agriculture committee #deerfarm spokester &amp; GOP allies go to bizarro world.#mnleg #CWD #COVID19  https://t.co/fNcYrkeGju,en,"['mnhouse', 'agriculture', 'deerfarm', 'mnleg', 'cwd', 'covid19']",[],7807292,7807292,sallyjos,Sally Jo Sorensen,1,15,https://twitter.com/sallyjos/status/1500984231022845953,['https://bit.ly/3HSAu8G'],[],0,,False,1,0,1,,#COVID19,,,,,,,[],,,,
1500984218297503744,1500929153020870659,1646697499000.0,2022-03-07 15:58:19,-700,,@RealScottRitter Buddy...half way into trumps term I thought this nation was on life support...I thought only the most dramatic changes could help this nation survive...little was done in reality. Now after #covid19 and this absolute foreign policy abomination..only some real miracle can do it.,en,['covid19'],[],944984099743260673,944984099743260673,rayetxkl,WolfRayetxkl,1,15,https://twitter.com/rayetxkl/status/1500984218297503744,[],[],0,,False,3,0,1,,#COVID19,,,,,,,"[{'screen_name': 'RealScottRitter', 'name': 'Scott Ritter', 'id': '1018582177381081095'}]",,,,
1500984199796436996,1500984199796436996,1646697494000.0,2022-03-07 15:58:14,-700,,#Internacionales | Puerto Rico eliminará el uso obligatorio de mascarillas  Amplía la información aquí:  https://t.co/wHJ8CsHoLY  #NoticieroVV #Medida #Gobierno #Salud #Covid19 #7Mar  https://t.co/awA962SVM0,es,"['internacionales', 'noticierovv', 'medida', 'gobierno', 'salud', 'covid19', '7mar']",[],44145131,44145131,noticierovv,Noticiero Venevisión,1,15,https://twitter.com/noticierovv/status/1500984199796436996,['https://bit.ly/3hNz3xP'],['https://pbs.twimg.com/media/FNSRKliXIAAFX0Q.jpg'],1,https://pbs.twimg.com/media/FNSRKliXIAAFX0Q.jpg,False,2,0,0,,#COVID19,,,,,,,[],,,,
1500984186575933443,1500984186575933443,1646697491000.0,2022-03-07 15:58:11,-700,,#Hilo Un minuto para enterarte de las noticias más destacadas de la semana anterior. ✅ Legalización Villa Mady etapa II. ✅ 500 mil dosis contra el #Covid19. ✅ Kits escolares para niños de Buenavista y Buenavistica.  https://t.co/IHbvcRT0Ha,es,"['hilo', 'covid19']",[],455470763,455470763,alcaldiasljo,Alcaldía Sincelejo,1,15,https://twitter.com/alcaldiasljo/status/1500984186575933443,[],[],1,https://pbs.twimg.com/ext_tw_video_thumb/1500984082976628742/pu/img/9FRQ7vDV9HxnEcXh.jpg,False,2,1,1,,#COVID19,,,,,,,[],,,,
1500984179793801217,1500984179793801217,1646697490000.0,2022-03-07 15:58:10,-700,,"Zullen we óók een dag en avond invullen voor de slachtoffers van #Groningen, #Toeslagenaffaire en #COVID19 slachtoffers die nu aan de grond zitten? #ikdeug",nl,"['groningen', 'toeslagenaffaire', 'covid19', 'ikdeug']",[],915584155009912832,915584155009912832,FrancoiseKeeken,FrançoisevanAssisië,1,15,https://twitter.com/FrancoiseKeeken/status/1500984179793801217,[],[],0,,False,24,3,2,,#COVID19,,,,,,,[],,,,
1500984178996879362,1500984178996879362,1646697489000.0,2022-03-07 15:58:09,-700,,London police are keeping their #COVID19 vaccination mandate in place even though the province’s top doctor says he wants to scrap the mandates for health and education workers. @DaleatLFPress has more:  https://t.co/fgEpv0RQUw #ldnont  https://t.co/rED31FHiGw,en,"['covid19', 'ldnont']",[],15033673,15033673,LFPress,London Free Press,1,15,https://twitter.com/LFPress/status/1500984178996879362,['https://tinyurl.com/58c7b59a'],['https://pbs.twimg.com/media/FNSRJMIWUAMNAgU.jpg'],1,https://pbs.twimg.com/media/FNSRJMIWUAMNAgU.jpg,False,25,3,4,,#COVID19,,,,,,,[],,,,
1500984151025012736,1500984151025012736,1646697483000.0,2022-03-07 15:58:03,-700,,"Cases: 447,352,722 (+46,782)  Deaths: 6,006,152 (+0)  Recovered: 0 (+0)  Active Cases: 447,352,722 (100%) Completed Cases: 6,006,152 (1.34%) Mortality Rate: 1.34% (No Change) Case Fatality Rate: 100.00% (No Change)  #COVID19 #Coronavirus #StayHome",en,"['covid19', 'coronavirus', 'stayhome']",[],1237837670182793217,1237837670182793217,_covid_19_bot_,Covid-19 Bot,1,15,https://twitter.com/_covid_19_bot_/status/1500984151025012736,[],[],0,,False,0,0,0,,#COVID19,,,,,,,[],,,,
1500984082427088899,1500984082427088899,1646697466000.0,2022-03-07 15:57:46,-700,"{'type': 'Point', 'coordinates': [28.13333333, -81.63166667]}",2 years ago... this was our last normal week and nobody knew it... #qoutes #covid19 @ Florida  https://t.co/PJNUTkBcRQ,en,"['qoutes', 'covid19']",[],516801659,516801659,AimsterSkitz0rz,Aimee Grace ♫♪,1,15,https://twitter.com/AimsterSkitz0rz/status/1500984082427088899,['https://www.instagram.com/p/Ca0mZFaOo6o/?utm_medium=twitter'],[],0,,False,0,0,0,,#COVID19,,,,,,,[],,,,
1500984050336493569,1500984050336493569,1646697459000.0,2022-03-07 15:57:39,-700,,#DidYouKnow that monoclonal antibody treatment for #COVID19 is available right here in #Vegas? 🏥  It was great to tour Elite Medical Center's services that provide important treatment for our residents.  Learn more by contacting 702-481-4209 or visiting  https://t.co/bdSnCdI0Jm!  https://t.co/6Y9nDikdH2,en,"['didyouknow', 'covid19', 'vegas']",[],87509322,87509322,BrianforLV,Brian Knudsen,1,15,https://twitter.com/BrianforLV/status/1500984050336493569,['https://elitelv.com/'],"['https://pbs.twimg.com/media/FNSP9PcVkAQGWLI.jpg', 'https://pbs.twimg.com/media/FNSQ9s3UcAETLnp.jpg']",1,https://pbs.twimg.com/media/FNSP9PcVkAQGWLI.jpg,False,7,1,2,,#COVID19,,,,,,,[],,,,
1500984041331466241,1500984041331466241,1646697457000.0,2022-03-07 15:57:37,-700,,"LA PRUEBA DE QUE NO ESTAMOS ANTE UNA #PANDEMIA, SINO ANTE UNA #PLANDEMIA, QUE ES MUY DISTINTO, PORQUE, COMO PODÉIS VER ARRIBA A LA IZQUIERDA, LA FECHA DE FABRICACIÓN DE ÉSTA CAJA DE VACUNA ASTRAZENECA ES JULIO DE 2.018, EL ARMA BIOLÓGICA #COVID19 ESTABA PROGRAMADA ANTES DE 2.019  https://t.co/bnGfkcW9cR",es,"['pandemia', 'plandemia', 'covid19']",[],257053584,257053584,SoyCibelino,Miguel Ángel López González. Derrotaremos al #NOM.,1,15,https://twitter.com/SoyCibelino/status/1500984041331466241,[],['https://pbs.twimg.com/media/FNSP-oqXMAEahex.jpg'],1,https://pbs.twimg.com/media/FNSP-oqXMAEahex.jpg,False,8,1,9,,#COVID19,,,,,,,[],,,,
1500983978043445249,1500983978043445249,1646697441000.0,2022-03-07 15:57:21,-700,,"“Are we all going to get it? Yes…that might happen…Are we at a time to embrace that philosophy? No, because the virus is still causing a lot of suffering. Almost 2,000 deaths per day is no walk in the park.”  #COVID #COVID19 #CovidIsNotOver #MaskUp    https://t.co/nDcEtBzSvu",en,"['covid', 'covid19', 'covidisnotover', 'maskup']",[],98071814,98071814,justjukka,Jessica,1,15,https://twitter.com/justjukka/status/1500983978043445249,['https://www.sfchronicle.com/health/article/For-people-who-never-got-COVID-what-are-the-odds-16982524.php'],[],0,,False,0,0,0,,#COVID19,,,,,,,[],,,,
1500983957873205248,1500983957873205248,1646697437000.0,2022-03-07 15:57:17,-700,,Celatına aşık olmuşsa bir milet ister ezan ister çan dinlet sürü gibi ihtiras etmiyorsa ilet ona müstehaktır her türlü zilet.   #COVID19 #benzin20,tr,"['covid19', 'benzin20']",[],1178592495237816320,1178592495237816320,Erkanunr,Erkan üner,1,15,https://twitter.com/Erkanunr/status/1500983957873205248,[],[],0,,False,3,0,0,,#COVID19,,,,,,,[],,,,
1500983952642879490,1500983952642879490,1646697435000.0,2022-03-07 15:57:15,-700,,The latest The Child protection Daily!  https://t.co/zTUKDuTMzN #covid19 #news,en,"['covid19', 'news']",[],832332705459224576,832332705459224576,MTotoNews,MToto News,1,15,https://twitter.com/MTotoNews/status/1500983952642879490,['https://paper.li/f-1495659288?share_id=509eaf80-9e72-11ec-9b52-fa163eed9ef2'],[],0,,False,1,0,0,,#COVID19,,,,,,,[],,,,
1500983918467719172,1500983918467719172,1646697427000.0,2022-03-07 15:57:07,-700,,Molto interessante da ascoltare #COVID19 #Warzone  #Europa   https://t.co/1p6PgS3qKz,it,"['covid19', 'warzone', 'europa']",[],1483536289941098506,1483536289941098506,lucrezia_madama,Madama Lucrezia 🎭🏴‍☠️🚚,1,15,https://twitter.com/lucrezia_madama/status/1500983918467719172,['https://www.youtube.com/watch?v=LEPqsjU4F6A'],[],0,,False,0,0,0,,#COVID19,,,,,,,[],,,,
1500983889564741632,1500983889564741632,1646697420000.0,2022-03-07 15:57:00,-700,,Has anyone else’s heart rate gone up 20-30% after a Covid shot or the last booster/3rd jab (like in my case with Pfizer )?  It went up exact day of my booster shot  #pfizerdocuments #COVID19 #covidheartdamage @catturd2  @StephHoover8 @conmomma @atensnut @ScottAdamsSays,en,"['pfizerdocuments', 'covid19', 'covidheartdamage']",[],1366797585453879300,1366797585453879300,k4nh1,k4nh,1,15,https://twitter.com/k4nh1/status/1500983889564741632,[],[],0,,False,0,0,0,,#COVID19,,,,,,,[],,,,
1500983875207680006,1500983875207680006,1646697417000.0,2022-03-07 15:56:57,-700,,"SURGING 🏥—Hospitalizations for #COVID19 is surging sharply ⬆️ 15.6% in England🏴󠁧󠁢󠁥󠁮󠁧󠁿 again—across **ALL AGE GROUPS**, elderly to kids. Notably, hospitalizations up ⬆️ 26% in kids 6-17 in just 1 week. This is #BA2 subvariant + no mitigations that we warned about.  HT @Antonio_Caramia  https://t.co/QGkStwKuKk",en,"['covid19', 'ba2']",[],18831926,18831926,DrEricDing,Eric Feigl-Ding,1,15,https://twitter.com/DrEricDing/status/1500983875207680006,[],"['https://pbs.twimg.com/media/FNSQ4O1XoAE5qU8.jpg', 'https://pbs.twimg.com/media/FNSQ4PyXIAAG-JM.jpg']",1,https://pbs.twimg.com/media/FNSQ4O1XoAE5qU8.jpg,False,4495,235,2414,,#COVID19,,,,,,,[],,,,
1500983804294758401,1500983800817655810,1646697400000.0,2022-03-07 15:56:40,-700,,I’ll have to stay home today as I’m still sick so won’t have anything to report on tomorrow. (3/3  Stay safe and healthy everyone!  #covid19 #covid19aus #auspol #school #education #masks #vicpol #nswpol #covid19vic #covid19nsw #masksinschools #teachers #covidschool,en,"['covid19', 'covid19aus', 'auspol', 'school', 'education', 'masks', 'vicpol', 'nswpol', 'covid19vic', 'covid19nsw', 'masksinschools', 'teachers', 'covidschool']",[],1486309729152692227,1486309729152692227,Justamelbkid,🦠Just a Melbourne Kid in Year 12 during Covid 🦠,1,15,https://twitter.com/Justamelbkid/status/1500983804294758401,[],[],0,,False,18,0,1,,#COVID19,,,,,,,[],,,,
1500983793154416642,1500983793154416642,1646697397000.0,2022-03-07 15:56:37,-700,,"#Elililly, Boehringer Ingelheim's Jardiance turns up heat on [  https://t.co/B5WJx1x0El ] Il y a 8heures The FDA has rejected Ocugen and Bharat #Biotech's #Covid19 vaccine for those between 2 and 18 years old.#Japan and the U.K.have pledged more than   https://t.co/1HZGRLO1Z2",en,"['elililly', 'biotech', 'covid19', 'japan']",[],4838520568,4838520568,Tian_A1,Tian_A1,1,15,https://twitter.com/Tian_A1/status/1500983793154416642,"['http://www.fiercepharma.com', 'https://bit.ly/3CBeZIR']",[],0,,False,0,0,0,,#COVID19,,,,,,,[],,,,
1500983674216587267,1500983674216587267,1646697369000.0,2022-03-07 15:56:09,-700,,"In two to three weeks when the public health preventions like masking have had time to become widespread, it’s pretty clear we will see spikes of #COVID19 infections. The CDC will undercount due to their incorrect reliance on hospitalization data, and we could get a new variant.",en,['covid19'],[],14223726,14223726,erikaherzog,Erika Herzog,1,15,https://twitter.com/erikaherzog/status/1500983674216587267,[],[],0,,False,1,1,1,,#COVID19,,,,,,,[],,,,
1500983646714753025,1500983646714753025,1646697362000.0,2022-03-07 15:56:02,-700,,"Well I have joined the good, the bad and the ugly with COVID, but very mild symptoms so far. Hopefully that has something to do with being triple vaxxed #COVID19",en,['covid19'],[],261550863,261550863,larryschles,Larry Schlesinger,1,15,https://twitter.com/larryschles/status/1500983646714753025,[],[],0,,False,3,2,0,,#COVID19,,,,,,,[],,,,
1500983628334985218,1500983628334985218,1646697358000.0,2022-03-07 15:55:58,-700,,#โควิด19 #COVID19,und,"['โควิด19', 'covid19']",[],1398493746811990016,1398493746811990016,ratjio,ratjio,1,15,https://twitter.com/ratjio/status/1500983628334985218,[],[],0,,False,0,0,0,https://twitter.com/army_greenbrain/status/1500669730503290880,#COVID19,,,,,,,[],,,,
1500983626929885184,1500983626929885184,1646697358000.0,2022-03-07 15:55:58,-700,,Pres Biden &amp; Congress are working on new spending to help the nation recover from #covid19  But #seniorliving is not included…again  #BUILDBACKBETTER shouldn’t mean leaving 2 MIL SENIORS in #assistedliving behind  Go here to help:  https://t.co/kBcpoaddj3  https://t.co/Fj7RxpjqoB,en,"['covid19', 'seniorliving', 'buildbackbetter', 'assistedliving']",[],1379476894706376705,1379476894706376705,utassisted,Utah Assisted Living Association,1,15,https://twitter.com/utassisted/status/1500983626929885184,['https://standingwithseniors.com/'],['https://pbs.twimg.com/media/FNSQBfsVIAQaT6M.jpg'],1,https://pbs.twimg.com/media/FNSQBfsVIAQaT6M.jpg,False,0,0,0,,#COVID19,,,,,,,[],,,,
1500983614976061440,1500983614976061440,1646697355000.0,2022-03-07 15:55:55,-700,,"#EspacioCovid  #ReporteCOVID19   ▶️#Puebla registra bajas de contagios por #COVID19 pero se mantienen fallecimientos  ▶️El secretario de @SaludGobPue @JAntonioMtzGa aseveró que están disminuyendo los contagios, así como la positividad   ✍️@alecafierro  https://t.co/vsldl9HgdD",es,"['espaciocovid', 'reportecovid19', 'puebla', 'covid19']",[],396370824,396370824,espaciolibrepue,Espacio Libre Puebla,1,15,https://twitter.com/espaciolibrepue/status/1500983614976061440,['http://espaciolibrepuebla.com/puebla-registra-bajas-de-contagios-por-covid-19-pero-se-mantienen-fallecimientos/'],[],0,,False,0,0,2,,#COVID19,,,,,,,[],,,,
1500983606306553861,1500983606306553861,1646697353000.0,2022-03-07 15:55:53,-700,,"Compartimos los resultados de la 5ta ronda de la #EncuestaRápida de #COVID19 que muestran el impacto de la pandemia en la educación de las niñas, niños y adolescentes al cierre del 2021. ¿Cuáles son los principales desafíos que enfrenta el sistema educativo este año? 👇🏻",es,"['encuestarápida', 'covid19']",[],158219178,158219178,corast,Cora Steinberg,1,15,https://twitter.com/corast/status/1500983606306553861,[],[],0,,False,4,0,1,https://twitter.com/UNICEFargentina/status/1500932995989254144,#COVID19,,,,,,,[],,,,
1500983493966376965,1500983493966376965,1646697326000.0,2022-03-07 15:55:26,-700,,🦠 Situación Epidemiológica en Soledad de Graciano Sánchez.  📱#SGS #SituaciónEpidemiologica #COVID19 #MedidasSanitarias #cubrebocas #LavadoFrecuenteDeManos #gelantibacterial #ReporteCOVID19  https://t.co/krucITmVwu,es,"['sgs', 'situaciónepidemiologica', 'covid19', 'medidassanitarias', 'cubrebocas', 'lavadofrecuentedemanos', 'gelantibacterial', 'reportecovid19']",[],764394696,764394696,MunicipioSGS,Municipio de Soledad de Graciano Sánchez,1,15,https://twitter.com/MunicipioSGS/status/1500983493966376965,[],['https://pbs.twimg.com/media/FNSQgo2WQAYhPJy.jpg'],1,https://pbs.twimg.com/media/FNSQgo2WQAYhPJy.jpg,False,0,0,0,,#COVID19,,,,,,,[],,,,
1500983473804357635,1500983473804357635,1646697321000.0,2022-03-07 15:55:21,-700,,Country-level #antimicrobialstewardship policies were associated with decreasing consumption which generally continued during #COVID19. #PharmacoEquity #GlobalHealth Supported by @IQVIA_Institute. Published in @BSACandJAC. @Mina__T  https://t.co/AzdQCd6OZG,en,"['antimicrobialstewardship', 'covid19', 'pharmacoequity', 'globalhealth']",[],329976710,329976710,Sudamonas,SUDAmonas,1,15,https://twitter.com/Sudamonas/status/1500983473804357635,['https://academic.oup.com/jac/advance-article/doi/10.1093/jac/dkac028/6530407#.YiaaFtzn30k.twitter'],[],0,,False,4,1,2,,#COVID19,,,,,,,[],,,,
1500983391453392896,1500983391453392896,1646697302000.0,2022-03-07 15:55:02,-700,,CEO’S destacan 3 áreas de enfoque para integrar más la inclusión en el lugar de trabajo.  #COVID19 ha ampliado la brecha económica de género. Están mejorando su protección de las comunidades LGBTIQ+ Trabajan para eliminar el racismo sistémico.  👉🏻  https://t.co/S4iz8fzXwB  https://t.co/W1CLx7PkfG,es,['covid19'],[],90344783,90344783,PactoMundialMex,Pacto Mundial México,1,15,https://twitter.com/PactoMundialMex/status/1500983391453392896,['https://bit.ly/3B0rwne'],['https://pbs.twimg.com/media/FNSQcM2XoAQR8qN.jpg'],1,https://pbs.twimg.com/media/FNSQcM2XoAQR8qN.jpg,False,0,0,0,,#COVID19,,,,,,,[],,,,
1500983384792723457,1500983384792723457,1646697300000.0,2022-03-07 15:55:00,-700,,"📅 07 de Mar. de 2022  🇧🇷 #Brasil soma 29.077.831 casos confirmados e 652.648 óbitos por #COVID19, com 20.007 novos casos e 205 novos óbitos.   📊 A incidência máxima de:  🤒️ casos confirmados foi de 285.451 em 03 Fev. 2022;  💀️ óbitos foi de 4.148 em 08 Abr. 2021.  https://t.co/dv92nZr9qQ",pt,"['brasil', 'covid19']",[],1453836191363633162,1453836191363633162,covidbrasilbot,covidbrasilbot 🤖,1,15,https://twitter.com/covidbrasilbot/status/1500983384792723457,[],['https://pbs.twimg.com/media/FNSQbd6VEAESKj1.png'],1,https://pbs.twimg.com/media/FNSQbd6VEAESKj1.png,False,2,0,0,,#COVID19,,,,,,,[],,,,
1500983381001187335,1500964781783666690,1646697299000.0,2022-03-07 15:54:59,-700,,"AC enforced mandates, contrary to well-established science of virus-induced immunity &amp; waning vaccine efficacy.  In doing so, you put those previously infected at higher risk of vaccine side effects, harming employees.   https://t.co/G4y1htSiPO  #VaccineSideEffects #COVID19 #risk",en,"['vaccinesideeffects', 'covid19', 'risk']",[],15360015,15360015,akardys,akardys,1,15,https://twitter.com/akardys/status/1500983381001187335,['https://cutt.ly/kAW6Qzg'],[],0,,False,0,1,0,,#COVID19,,,,,,,[],,,,
1500983361208205314,1500983361208205314,1646697294000.0,2022-03-07 15:54:54,-700,,Article no longer available on Yahoo but is backed up on Archive   https://t.co/WmpEVhSyHJ  #COVID #Vaccines #Covid19  https://t.co/jWjPivDLDW,en,"['covid', 'vaccines', 'covid19']",[],1447767392088731653,1447767392088731653,OopOopzs,⚡𝙊𝙤𝙥𝙯s - ✟♡🇺🇸✟,1,15,https://twitter.com/OopOopzs/status/1500983361208205314,['https://web.archive.org/web/20220303212101/https://finance.yahoo.com/news/chd-says-pfizer-fda-dropped-205400826.html'],['https://pbs.twimg.com/media/FNSOw1-XwAAfgbG.png'],1,https://pbs.twimg.com/media/FNSOw1-XwAAfgbG.png,False,0,1,0,,#COVID19,,,,,,,[],,,,
1500983343412047873,1500983343412047873,1646697290000.0,2022-03-07 15:54:50,-700,,"""The group who had mild COVID an average of five months beforehand had thinning of brain tissue in several brain regions, ranging from 0.2% to around 2% compared to their pre-COVID scan."" #CovidIsNotOver #COVID19   https://t.co/HDkQOEacYG via @ConversationEDU",en,"['covidisnotover', 'covid19']",[],1245526679998459904,1245526679998459904,CarissaLeeG,Carissa Lee,1,15,https://twitter.com/CarissaLeeG/status/1500983343412047873,['https://theconversation.com/even-mild-covid-can-cause-brain-shrinkage-and-affect-mental-function-new-study-shows-178530?utm_source=twitter&utm_medium=bylinetwitterbutton'],[],0,,False,2,1,0,,#COVID19,,,,,,,[],,,,
1500983288894218250,1500983288894218250,1646697277000.0,2022-03-07 15:54:37,-700,,Please let this be the beginning of the end of this nightmare 🤞🤞🤞 #COVID19    https://t.co/jXrEIuuuS2,en,['covid19'],[],633419360,633419360,JMoore821,Justin Moore,1,15,https://twitter.com/JMoore821/status/1500983288894218250,['https://www.cbsnews.com/video/cdc-no-new-coronavirus-variants-of-concern-right-now/'],[],0,,False,0,0,0,,#COVID19,,,,,,,[],,,,
1500983270581936133,1500983270581936133,1646697273000.0,2022-03-07 15:54:33,-700,,Alagoas registra 74 novos casos e dez mortes por Covid-19  https://t.co/5yIB4UXFCE #covid #COVID19 #coronavírus #alagoas #saúde #pandemia  https://t.co/nil5me5Z5A,pt,"['covid', 'covid19', 'coronavírus', 'alagoas', 'saúde', 'pandemia']",[],2557438489,2557438489,JornaldeAlagoas,Jornal de Alagoas,1,15,https://twitter.com/JornaldeAlagoas/status/1500983270581936133,['https://bit.ly/3sQ9brz'],['https://pbs.twimg.com/media/FNSQPVsXIAINfmZ.jpg'],1,https://pbs.twimg.com/media/FNSQPVsXIAINfmZ.jpg,False,0,0,1,,#COVID19,,,,,,,[],,,,
1500983227812823042,1500983227812823042,1646697263000.0,2022-03-07 15:54:23,-700,,ตรวจATKแล้วเป็นบวก​ แต่เราไม่มีรถส่วนตัว​ อยากได้แท็กซี่​ไปโรงพยาบาล ใครพอจะแนะนำ​ได้ไหมคะ​  🙏🙏🙏 #กรมควบคุมโรค #โควิด19 #COVID19,th,"['กรมควบคุมโรค', 'โควิด19', 'covid19']",[],4367412434,4367412434,Pju_ree,🎀BB​ slow mo คิมิโนโตะ🤗,1,15,https://twitter.com/Pju_ree/status/1500983227812823042,[],[],0,,False,0,0,0,,#COVID19,,,,,,,[],,,,
1500983220657172486,1500983220657172486,1646697261000.0,2022-03-07 15:54:21,-700,,"If you sign on to this letter about #COVID19 therapeutics (i.e. #Paxlovid and #EvuSheld), @resistbot will send this letter to your U.S. Senators, your Member of Congress, and @POTUS.",en,"['covid19', 'paxlovid', 'evusheld']",[],276688330,276688330,mattbc,"Matthew Cortland, JD",1,15,https://twitter.com/mattbc/status/1500983220657172486,[],[],0,,False,43,3,23,https://twitter.com/openletterbot/status/1500982297272545280,#COVID19,,,,,,,[],,,,
1500983171592110084,1500972258797531136,1646697249000.0,2022-03-07 15:54:09,-700,,@NYCHealthCommr @InsideCityHall @DrMaryTBassett @NY1 @errollouis Your decision for everyone to unmask while we are still in middle of #Covid19 pandemic is shameful and puts millions of New Yorkers lives in danger.   Masks are a key way to stop #Covid19 transmission.   #MaskingforaFriend #MandateMasksNY,en,"['covid19', 'covid19', 'maskingforafriend', 'mandatemasksny']",[],1437276203312984070,1437276203312984070,MandateMasksNY,Mandate Masks NY,1,15,https://twitter.com/MandateMasksNY/status/1500983171592110084,[],[],0,,False,3,1,0,,#COVID19,,,,,,,"[{'screen_name': 'NYCHealthCommr', 'name': 'Commissioner Ashwin Vasan, MD, PhD', 'id': '2350222669'}, {'screen_name': 'InsideCityHall', 'name': 'Inside City Hall', 'id': '44491388'}, {'screen_name': 'DrMaryTBassett', 'name': 'Dr. Mary T. Bassett', 'id': '818577976619102208'}, {'screen_name': 'NY1', 'name': 'Spectrum News NY1', 'id': '43425975'}, {'screen_name': 'errollouis', 'name': 'Errol Louis', 'id': '16376937'}]",,,,
