id,conversation_id,created_at,date,timezone,place,tweet,language,hashtags,cashtags,user_id,user_id_str,username,name,day,hour,link,urls,photos,video,thumbnail,retweet,nlikes,nreplies,nretweets,quote_url,search,near,geo,source,user_rt_id,user_rt,retweet_id,reply_to,retweet_date,translate,trans_src,trans_dest
1500984639997059073,1499225302131691522,1646697599000.0,2022-03-07 15:59:59,-700,,"@MaryLTrump @DavidCornDC Agreed, why do people keep on supporting Democrats??? From the COVID-19 lies to the fake climate crisis to the fake Jan 6th insurrection to the fake inflation caused by greedy corporations to the …",en,[],[],1242924947938463745,1242924947938463745,needlenose5,needlenose,1,15,https://twitter.com/needlenose5/status/1500984639997059073,[],[],0,,False,0,0,0,,#Covid-19,,,,,,,"[{'screen_name': 'MaryLTrump', 'name': 'Mary L Trump', 'id': '1045110787'}, {'screen_name': 'DavidCornDC', 'name': 'David Corn', 'id': '15220768'}]",,,,
1500984635593048067,1500984635593048067,1646697598000.0,2022-03-07 15:59:58,-700,,"#LTahora El Sedes de #Cochabamba reporta 52 casos nuevos de Covid-19, 55 recuperados y un deceso.  https://t.co/H4eQZjLlqu",es,"['ltahora', 'cochabamba']",[],94438031,94438031,LosTiemposBol,Los Tiempos,1,15,https://twitter.com/LosTiemposBol/status/1500984635593048067,[],['https://pbs.twimg.com/media/FNSRj89X0AAgPeS.jpg'],1,https://pbs.twimg.com/media/FNSRj89X0AAgPeS.jpg,False,1,0,0,,#Covid-19,,,,,,,[],,,,
1500984626743066638,1500984626743066638,1646697596000.0,2022-03-07 15:59:56,-700,,AD iHealth™ Covid-19 Antigen testing kits for sale   https://t.co/4BMuYxmuH5,en,[],[],759232045679779840,759232045679779840,workonline44,onlinesitestore,1,15,https://twitter.com/workonline44/status/1500984626743066638,['https://www.cov.care/?ref=mb13'],[],0,,False,0,0,0,,#Covid-19,,,,,,,[],,,,
1500984618861875209,1500984618861875209,1646697594000.0,2022-03-07 15:59:54,-700,,Study links even mild Covid-19 to changes in the brain - CNN #DemForce   https://t.co/diPFToBDv6,en,['demforce'],[],706225427413655552,706225427413655552,Uab_BabaKofi,Baba Kofi Seti I “Coalition of Conscience” member,1,15,https://twitter.com/Uab_BabaKofi/status/1500984618861875209,['https://apple.news/AIvqHokpUQN69Itg77fluVQ'],[],0,,False,0,0,0,,#Covid-19,,,,,,,[],,,,
1500984616546705408,1500984616546705408,1646697594000.0,2022-03-07 15:59:54,-700,,Covid-19: Brasil registra 20.456 novos casos e 198 mortes  https://t.co/2Hv9x22zsr,pt,[],[],2977077706,2977077706,TodaBahia,Toda Bahia,1,15,https://twitter.com/TodaBahia/status/1500984616546705408,['https://todabahia.com.br/covid-19-brasil-registra-20-456-novos-casos-e-198-mortes/'],[],0,,False,0,0,0,,#Covid-19,,,,,,,[],,,,
1500984595541823489,1500984595541823489,1646697589000.0,2022-03-07 15:59:49,-700,,"Kasus harian Covid-19 di wilayah khusus Hongkong China kembali mengalami peningkatan, akibatnya pemerintah setempat, memutuskan untuk memberlakukan lockdown parsial di negara tersebut.warga Hongkong masih boleh mencari nafkah, namun dengan penerapan protokol kesehatan ketat",in,[],[],980097559736721408,980097559736721408,AlbertSolo2,Albert Solo,1,15,https://twitter.com/AlbertSolo2/status/1500984595541823489,[],[],0,,False,2,0,1,,#Covid-19,,,,,,,[],,,,
1500984591137619981,1500984591137619981,1646697588000.0,2022-03-07 15:59:48,-700,,"🏥Disponibilidad hospitalaria de la Red COVID-19 del SNS  ➡️Capacidad hospitalaria, camas UCI y ventiladores de la Red COVID-19 del SNS.   👉🏽Dato actualizado hoy lunes 7 de marzo a las 12:00 meridiano.  #ElCuidadoSeMantiene #NoBajesLaGuardia #EstamosCambiandoEnSalud  https://t.co/8JLQus5MWR",es,"['elcuidadosemantiene', 'nobajeslaguardia', 'estamoscambiandoensalud']",[],835614023785791488,835614023785791488,HospitalJPP,Hospital J. P. Pina,1,15,https://twitter.com/HospitalJPP/status/1500984591137619981,[],['https://pbs.twimg.com/media/FNSRh17XMAAPyIS.jpg'],1,https://pbs.twimg.com/media/FNSRh17XMAAPyIS.jpg,False,0,0,0,,#Covid-19,,,,,,,[],,,,
1500984555859230727,1500984555859230727,1646697579000.0,2022-03-07 15:59:39,-700,,"El gobernador de #PuertoRico 🇵🇷, @pedropierluisi , emitió una Orden Ejecutiva donde elimina varias medidas para contener la expansión de la #COVID-19 como el uso obligatorio de la mascarilla y los límites de aforo en sitios públicos.  https://t.co/j4kAFLUkeJ",es,"['puertorico', 'covid']",[],45013575,45013575,teleSURtv,teleSUR TV,1,15,https://twitter.com/teleSURtv/status/1500984555859230727,['https://www.telesurtv.net/news/puerto-rico-elimina-uso-mascarilla-limites-aforo-20220307-0025.html'],[],0,,False,12,0,9,,#Covid-19,,,,,,,[],,,,
1500984539988230147,1500984539988230147,1646697575000.0,2022-03-07 15:59:35,-700,,Penanganan pandemi covid-19 di tanah air terus membaik  #WujudkanPemulihanNegeri  https://t.co/b3rvNju0cx,in,['wujudkanpemulihannegeri'],[],1479410580393922568,1479410580393922568,Putri50381027,Putri,1,15,https://twitter.com/Putri50381027/status/1500984539988230147,[],['https://pbs.twimg.com/media/FNSRe-daUAADpWA.jpg'],1,https://pbs.twimg.com/media/FNSRe-daUAADpWA.jpg,False,3,0,0,,#Covid-19,,,,,,,[],,,,
1500984533893664769,1500984533893664769,1646697574000.0,2022-03-07 15:59:34,-700,,"#Sinaloa🕊 | Este lunes por la tarde falleció Rosalía Camacho Rojas, esposa del exgobernador Jesús Aguilar Padilla a causa de las secuelas del COVID-19.  #ObservandoEnVivo🔴 | @Noticierista   https://t.co/2mjHwSXxdR",es,"['sinaloa', 'observandoenvivo']",[],1410104462522392577,1410104462522392577,noticieristas,Los Noticieristas,1,15,https://twitter.com/noticieristas/status/1500984533893664769,['https://losnoticieristas.com/post/179607/fallece-rosalia-camacho-esposa-del-exgobernador-jesus-aguilar-padilla/'],[],0,,False,1,0,1,,#Covid-19,,,,,,,[],,,,
1500984528965226496,1500984528965226496,1646697573000.0,2022-03-07 15:59:33,-700,,SFC urges Hong Kong businesses to update continuity plans as mass Covid-19 testing looms in the city  https://t.co/bcx5kVFP3t,en,[],[],606281620,606281620,RAChampion,Richard Champion,1,15,https://twitter.com/RAChampion/status/1500984528965226496,['http://dlvr.it/SLGTrW'],[],0,,False,0,0,0,,#Covid-19,,,,,,,[],,,,
1500984518458556419,1500848077497724931,1646697570000.0,2022-03-07 15:59:30,-700,,@Lou_ell_ah @RachelNotley You’ve taken a few too many hits on the crack pipe. Our natural immunity works better than any vaccine. My whole family had Covid 19- not hospitalized! We are healthy people. No vaccine required. God bless,en,[],[],1486788589962731520,1486788589962731520,ConureTamara,Tamara Conure,1,15,https://twitter.com/ConureTamara/status/1500984518458556419,[],[],0,,False,14,0,0,,#Covid-19,,,,,,,"[{'screen_name': 'Lou_ell_ah', 'name': 'Lou_ell_ah', 'id': '568728759'}, {'screen_name': 'RachelNotley', 'name': 'Rachel Notley', 'id': '42836999'}]",,,,
1500984516680241152,1500984516680241152,1646697570000.0,2022-03-07 15:59:30,-700,,"🇨🇴 Este 7 de marzo se reportaron 29 fallecidos confirmados por Covid-19 en Colombia, la cifra más baja desde el 20 de diciembre de 2021.  https://t.co/vVkqsfBYhO",es,[],[],253406489,253406489,DiegoFuerteB,Diego Fuerte 🗳️🇨🇴,1,15,https://twitter.com/DiegoFuerteB/status/1500984516680241152,[],['https://pbs.twimg.com/media/FNSRW1GXMAIzHLG.jpg'],1,https://pbs.twimg.com/media/FNSRW1GXMAIzHLG.jpg,False,34,0,7,,#Covid-19,,,,,,,[],,,,
1500984516604829700,1500984516604829700,1646697570000.0,2022-03-07 15:59:30,-700,,"#IndependienteRivadavia 🔵   Formaciones confirmadas para ambos equipos. Con respecto a la última alineación vs GyE, el Azul sufre la baja de Matias Quiroga por COVID 19. Entra en su lugar Lucas Algozino.  @CSIRoficial @FerroOficial  https://t.co/sbQERvnjDP",es,['independienterivadavia'],[],4885625231,4885625231,FrancoGriso13,Franco Grisolía 🇦🇷,1,15,https://twitter.com/FrancoGriso13/status/1500984516604829700,[],"['https://pbs.twimg.com/media/FNSRdW8XoAImZpD.jpg', 'https://pbs.twimg.com/media/FNSRdW8XEAY67kZ.jpg']",1,https://pbs.twimg.com/media/FNSRdW8XoAImZpD.jpg,False,1,0,0,,#Covid-19,,,,,,,[],,,,
1500984486674194442,1500984486674194442,1646697563000.0,2022-03-07 15:59:23,-700,,"….information from the platforms about the major sources of Covid-19 misinformation, including those that engaged in the sale of unproven Covid-19 products, services and treatments.   LOL that would be you!",en,[],[],1426965176180363268,1426965176180363268,Melanie53929943,Melanie💋🇺🇸🙏,1,15,https://twitter.com/Melanie53929943/status/1500984486674194442,[],[],0,,False,0,0,0,https://twitter.com/Surgeon_General/status/1500938298306539520,#Covid-19,,,,,,,[],,,,
1500984413034881032,1500984408299511808,1646697545000.0,2022-03-07 15:59:05,-700,,"#Covid_19  Subsecretario Redes Asistenciales, @AlbertoDougnac, se mostró complacido porque no le faltó cama crítica a ningún paciente, gracias a su equipo y al de subsecretaria @ValenzuelaMTere, en gestión que iniciaron @jmanalich, @pdazan y @arturozunigaj  https://t.co/8v6eWrMDQc",es,['covid_19'],[],1272365334767550464,1272365334767550464,AuroraAlDia,Aurora al día,1,15,https://twitter.com/AuroraAlDia/status/1500984413034881032,[],[],1,https://pbs.twimg.com/amplify_video_thumb/1500863495004426240/img/qPdv4F1iSwc9J8SJ.jpg,False,1,0,1,,#Covid-19,,,,,,,[],,,,
1500984411084500992,1500984408299511808,1646697545000.0,2022-03-07 15:59:05,-700,,"#Covid_19   El ministro @DrEnriqueParis se emocionó hasta las lágrimas, por la confianza entregada a su equipo durante la #pandemia   https://t.co/GtpeD8jBAe",es,"['covid_19', 'pandemia']",[],1272365334767550464,1272365334767550464,AuroraAlDia,Aurora al día,1,15,https://twitter.com/AuroraAlDia/status/1500984411084500992,[],[],1,https://pbs.twimg.com/amplify_video_thumb/1500861895695376394/img/uiD5Gr5h8Q5CHJup.jpg,False,2,1,1,,#Covid-19,,,,,,,[],,,,
1500984408299511808,1500984408299511808,1646697544000.0,2022-03-07 15:59:04,-700,,"#Covid_19   A cuatro días de entregar su segundo Gobierno, el presidente Sebastián Piñera encabezó la conferencia de prensa de @ministeriosalud, para entregar el reporte de la #pandemia, y aprovechó para reconocer al ministro @DrEnriqueParis #Chile  https://t.co/1THtYKauFN  https://t.co/NG0tu2zdqj",es,"['covid_19', 'pandemia', 'chile']",[],1272365334767550464,1272365334767550464,AuroraAlDia,Aurora al día,1,15,https://twitter.com/AuroraAlDia/status/1500984408299511808,[],['https://pbs.twimg.com/media/FNSPeUDXIAAZ8Gk.jpg'],1,https://pbs.twimg.com/media/FNSPeUDXIAAZ8Gk.jpg,False,3,1,1,,#Covid-19,,,,,,,[],,,,
1500984404369281028,1500965744741433344,1646697543000.0,2022-03-07 15:59:03,-700,,@alfredodelmazo Gracias a todos los que trabajan en el sector salud por apoyarnos en las medidas sanitarias contra el covid-19,es,[],[],1273841808175480832,1273841808175480832,JesusFla1,Jesus Flores,1,15,https://twitter.com/JesusFla1/status/1500984404369281028,[],[],0,,False,0,0,0,,#Covid-19,,,,,,,"[{'screen_name': 'alfredodelmazo', 'name': 'Alfredo Del Mazo', 'id': '39860797'}]",,,,
1500984401777369092,1500554725808386051,1646697542000.0,2022-03-07 15:59:02,-700,,@ManuelConecta Malditos gobiernos maldita sociedad maldita democracia maldito mundo y la gente cree cuando le dicen que se vacunen del COVID-19 es porque a ellos le importa la humanidad malditos los que nos dirigen,es,[],[],1229437575502401536,1229437575502401536,luiseldomi,luis love,1,15,https://twitter.com/luiseldomi/status/1500984401777369092,[],[],0,,False,0,0,0,,#Covid-19,,,,,,,"[{'screen_name': 'ManuelConecta', 'name': 'Manuel Nuñez', 'id': '1149791602942119937'}]",,,,
1500984397641748488,1500984397641748488,1646697541000.0,2022-03-07 15:59:01,-700,,"Does anyone know if iHealth Covid-19 antigen rapid tests from USPS are approved for travel back to U.S.? I'm getting conflicting answers online. Technically the test should be acceptable when proctored online since it's FDA approved and antigen, but there are reports it's not.",en,[],[],4893971685,4893971685,astral_monad,Dr. Wanyoung Kim ⚛️🌊🤍,1,15,https://twitter.com/astral_monad/status/1500984397641748488,[],[],0,,False,1,3,0,,#Covid-19,,,,,,,[],,,,
1500984392621121540,1500984392621121540,1646697540000.0,2022-03-07 15:59:00,-700,,Fraud Alert: COVID-19 scams (OIG)  https://t.co/XOWsqSlIYY,en,[],[],14777730,14777730,CandiceRose,Candice Rose,1,15,https://twitter.com/CandiceRose/status/1500984392621121540,['https://oig.hhs.gov/fraud/consumer-alerts/fraud-alert-covid-19-scams/?utm_campaign=20220217_cvd_prv_frd_gal&utm_content=english&utm_medium=email&utm_source=govdelivery'],[],0,,False,0,0,0,,#Covid-19,,,,,,,[],,,,
1500984390138023938,1500984390138023938,1646697540000.0,2022-03-07 15:59:00,-700,,İllere göre haftalık Covid-19 vaka haritası paylaşıldı  https://t.co/HGAgDkFMEj,tr,[],[],1169548940389355520,1169548940389355520,kisadalgamedya,Kısa Dalga,1,15,https://twitter.com/kisadalgamedya/status/1500984390138023938,['https://kisadalga.net/haber/detay/bakan-koca-haftalik-covid-vakalarini-acikladi-en-cok-vaka-amasya-kirsehir-ve-samsunda-en-az-vaka-sirnakta_25858#.YiYbhB7y4Pk.twitter'],[],0,,False,0,0,0,,#Covid-19,,,,,,,[],,,,
1500984390138007552,1500984390138007552,1646697540000.0,2022-03-07 15:59:00,-700,,Tucumán: registraron 15 casos y tres fallecidos por Covid-19  https://t.co/x4oeoOLHr7,es,[],[],2842069054,2842069054,telefetucuman,Telefe Tucumán,1,15,https://twitter.com/telefetucuman/status/1500984390138007552,['https://tucuman.mitelefe.com/local/tucuman-registraron-15-casos-y-tres-fallecidos-por-covid-19/'],[],0,,False,0,0,0,,#Covid-19,,,,,,,[],,,,
1500984390008164352,1500984390008164352,1646697540000.0,2022-03-07 15:59:00,-700,,La violencia contra las mujeres en México incrementó durante la pandemia de Covid-19: en 2021 hubo más feminicidios que en 2020  https://t.co/QwLaATYRS8,es,[],[],2847223757,2847223757,LaSagaOficial,La Saga,1,15,https://twitter.com/LaSagaOficial/status/1500984390008164352,['https://www.la-saga.com/actual/8m-el-panorama-de-los-feminicidios-en-mexico'],[],0,,False,1,0,0,,#Covid-19,,,,,,,[],,,,
1500984382483533824,1500984382483533824,1646697538000.0,2022-03-07 15:58:58,-700,,Global Covid-19 deaths surpass 6 million   https://t.co/pLsNYOQFXB,en,[],[],996885086741106688,996885086741106688,mykael_makaveli,Political Preacher🌊🇵🇷🇺🇸,1,15,https://twitter.com/mykael_makaveli/status/1500984382483533824,['https://www.cnn.com/2022/03/07/health/global-covid-deaths-surpass-six-million/index.html'],[],0,,False,1,0,1,,#Covid-19,,,,,,,[],,,,
1500984348778151942,1500984348778151942,1646697530000.0,2022-03-07 15:58:50,-700,,#Actualidad Tres muertos por Covid-19 y 362 casos nuevos se registran en las últimas 24 horas en Panamá  https://t.co/pqSDIhNCBf vía @radiopanama  https://t.co/o7AsIUrTCY,es,['actualidad'],[],280638438,280638438,radiopanama,Radio Panamá,1,15,https://twitter.com/radiopanama/status/1500984348778151942,['https://bit.ly/3IVkCUg'],['https://pbs.twimg.com/media/FNSRS1oXIAEVWyS.jpg'],1,https://pbs.twimg.com/media/FNSRS1oXIAEVWyS.jpg,False,2,0,0,,#Covid-19,,,,,,,[],,,,
1500984347746136064,1500984347746136064,1646697530000.0,2022-03-07 15:58:50,-700,,"COBAT garantiza un retorno seguro de su comunidad estudiantil, docente y directiva a clases presenciales, con el propósito de evitar la propagación de contagios causados por el Covid-19, espera recibir a poco más de 14 mil estudiantes y 700 docentes en las aulas del subsistema.  https://t.co/mcen22nURZ",es,[],[],867469599306022912,867469599306022912,Cobat_Tlaxcala,COBAT TLAXCALA,1,15,https://twitter.com/Cobat_Tlaxcala/status/1500984347746136064,[],"['https://pbs.twimg.com/media/FNSRS9vUUAQ6zy-.jpg', 'https://pbs.twimg.com/media/FNSRS9wVgAEU_vR.jpg', 'https://pbs.twimg.com/media/FNSRS9wUUAAF8qp.jpg']",1,https://pbs.twimg.com/media/FNSRS9vUUAQ6zy-.jpg,False,1,0,0,,#Covid-19,,,,,,,[],,,,
1500984342205841409,1500984342205841409,1646697528000.0,2022-03-07 15:58:48,-700,,@MarkPlackett1 ABC - Life. Death. COVID-19  https://t.co/xJdinEMGuX,en,[],[],51378153,51378153,nobby15,💧DUKE Clyde (HANSARD)CFW9 (Biden-Harris ELECT)💧,1,15,https://twitter.com/nobby15/status/1500984342205841409,['https://www.abc.net.au/news/2022-03-08/australia-covid-19-deaths-and-mortality/100857462?utm_source=sfmc%E2%80%8B%E2%80%8B&utm_medium=email%E2%80%8B%E2%80%8B&utm_campaign=abc_news_newsmail_am_sfmc%E2%80%8B%E2%80%8B&utm_term=%E2%80%8B&utm_id=1827239%E2%80%8B%E2%80%8B&sfmc_id=103581714'],[],0,,False,0,0,0,,#Covid-19,,,,,,,[],,,,
1500984324266422276,1500984324266422276,1646697524000.0,2022-03-07 15:58:44,-700,,"@AljawazatKSA i have working(90 days) visa &amp; its provided by my current company, so it's mandatory for me also have medical insurance for covid-19?.  When i travailing need to show it to Airports authority?",en,[],[],1195666136370569216,1195666136370569216,Mohiuddin_30,কাজি মহিউদ্দিন,1,15,https://twitter.com/Mohiuddin_30/status/1500984324266422276,[],[],0,,False,1,1,0,,#Covid-19,,,,,,,[],,,,
1500984296219238401,1500964112892846086,1646697517000.0,2022-03-07 15:58:37,-700,,@SenTedCruz Ted Cruz Got $35 Million For Billionaire Fracking Donors In Last COVID-19 Aid: Report  https://t.co/AvBpS2WCLv via @Yahoo,en,[],[],16225955,16225955,cowboytexas,cowboytexas🇺🇸🌊,1,15,https://twitter.com/cowboytexas/status/1500984296219238401,['https://www.yahoo.com/huffpost/wilks-fracking-donors-ted-cruz-35-million-loan-coronavirus-relief-040634919.html?soc_src=social-sh&soc_trk=tw&tsrc=twtr'],[],0,,False,69,6,33,,#Covid-19,,,,,,,"[{'screen_name': 'SenTedCruz', 'name': 'Senator Ted Cruz', 'id': '1074480192'}]",,,,
1500984265449689092,1500984265449689092,1646697510000.0,2022-03-07 15:58:30,-700,,COVID-19: How Omicron overtook Delta in three charts  https://t.co/7d3QYzDtPs,en,[],[],805163799988711424,805163799988711424,rgergelymd,"Robert Gergely, MD",1,15,https://twitter.com/rgergelymd/status/1500984265449689092,['https://www.nature.com/articles/d41586-022-00632-3'],[],0,,False,0,0,0,,#Covid-19,,,,,,,[],,,,
1500984260903190533,1500984260903190533,1646697509000.0,2022-03-07 15:58:29,-700,,Covid 19 Benzin 20 Mazot 21 Sene 22 Hedef 23...,tr,[],[],1080510976150200320,1080510976150200320,fatihgyk4423,Fatih  Geyik,1,15,https://twitter.com/fatihgyk4423/status/1500984260903190533,[],[],0,,False,5,0,0,,#Covid-19,,,,,,,[],,,,
1500984244033761285,1500984244033761285,1646697505000.0,2022-03-07 15:58:25,-700,,Watch live: Today's Covid-19 update.   https://t.co/2eMPWFIFxx,en,[],[],2783063791,2783063791,TheSpinoffTV,The Spinoff,1,15,https://twitter.com/TheSpinoffTV/status/1500984244033761285,['https://thespinoff.co.nz/live-updates/08-03-2022/watch-latest-covid-19-numbers-to-be-released'],[],0,,False,0,0,0,,#Covid-19,,,,,,,[],,,,
1500984232751116290,1500984232751116290,1646697502000.0,2022-03-07 15:58:22,-700,,Ron DeSantis talks Covid-19 lockdown failures  https://t.co/D0LeHYskZB via @FacebookWatch,en,[],[],2426430200,2426430200,FAITHflipflops,A walk in FAITH is a walk in flip flops...,1,15,https://twitter.com/FAITHflipflops/status/1500984232751116290,['https://fb.watch/bClpUDRbQm/'],[],0,,False,2,0,1,,#Covid-19,,,,,,,[],,,,
1500984224962453504,1500984224962453504,1646697500000.0,2022-03-07 15:58:20,-700,,Watch Live: Covid-19 update.  https://t.co/LRjttzWNmf,en,[],[],1014397887059406851,1014397887059406851,HawkesBayApp,Hawke's Bay App,1,15,https://twitter.com/HawkesBayApp/status/1500984224962453504,['https://cdn.hbapp.co.nz/news/news/watch-live-covid-19-update-1'],[],0,,False,0,0,0,,#Covid-19,,,,,,,[],,,,
1500984201528717316,1500984201528717316,1646697495000.0,2022-03-07 15:58:15,-700,,Uruguay registra 1.508 casos nuevos de covid-19 y seis fallecidos  https://t.co/g8clEe4wsc a través de @Yahoo,es,[],[],485807929,485807929,selaromselarom,Felix Morales Morales,1,15,https://twitter.com/selaromselarom/status/1500984201528717316,['https://es-us.noticias.yahoo.com/uruguay-registra-1-508-casos-232447283.html?soc_src=social-sh&soc_trk=tw&tsrc=twtr'],[],0,,False,0,0,0,,#Covid-19,,,,,,,[],,,,
1500984176127918083,1500974355706269696,1646697489000.0,2022-03-07 15:58:09,-700,,"Ron DeSantis es una desgracia absolutamente a Florida. Cerca 71,000 Floridanos han muerto debido a COVID-19 y DeSantis es haciendo campaña y llamando mascarillas “teatro de COVID”. La ciencia demuestra que mascarillas funcionan a pesar el mentiras por DeSantis.",es,[],[],558992230,558992230,JaysonFras,Jayson Frascatore,1,15,https://twitter.com/JaysonFras/status/1500984176127918083,[],[],0,,False,0,1,0,,#Covid-19,,,,,,,[],,,,
1500984170239209473,1500984170239209473,1646697487000.0,2022-03-07 15:58:07,-700,,"🧨JUST IN: Florida Dept. of Health to recommend against COVID-19 vaccine for healthy children, becoming the first state in the country to directly contradict guidance from the CDC",en,[],[],1443612874161721346,1443612874161721346,lonestarherd,LoneStarHerd 🇺🇸,1,15,https://twitter.com/lonestarherd/status/1500984170239209473,[],[],0,,False,6,2,0,,#Covid-19,,,,,,,[],,,,
1500984155731111946,1500947723708768261,1646697484000.0,2022-03-07 15:58:04,-700,,"@IRaigothI @Jeffrey67094350 @richmeyer @TheLesson55 @JaydensNana03 This sounds awfully familiar with a little something called Covid-19, where it was a global problem and Trump was the one that was blamed in the US. Spare me the BS you are gonna spew back. I’m not a trump supporter, I just find it ironic.",en,[],[],799469049361170433,799469049361170433,slamgill,Slamual,1,15,https://twitter.com/slamgill/status/1500984155731111946,[],[],0,,False,1,2,0,,#Covid-19,,,,,,,"[{'screen_name': 'IRaigothI', 'name': 'Raigoth', 'id': '2257433532'}, {'screen_name': 'Jeffrey67094350', 'name': 'Frank F', 'id': '1420225308356190209'}, {'screen_name': 'richmeyer', 'name': 'Rich Meyer', 'id': '14638232'}, {'screen_name': 'TheLesson55', 'name': 'Edge', 'id': '1322755604730040320'}, {'screen_name': 'JaydensNana03', 'name': 'Someones Nana', 'id': '30438828'}]",,,,
1500984155584163843,1500984155584163843,1646697484000.0,2022-03-07 15:58:04,-700,,Excellent news! Congratulations Florida on following the science &amp; the lawful path. #Vaccine #Florida #NoVaccine  Florida to Become First State to Recommend Against COVID-19 Vaccines for Healthy Children  https://t.co/mGBmNlnTjM,en,"['vaccine', 'florida', 'novaccine']",[],1144065374,1144065374,ACC_Andrew,Andrew A. Currie,1,15,https://twitter.com/ACC_Andrew/status/1500984155584163843,['https://www.theepochtimes.com/florida-to-become-first-state-to-recommend-against-covid-19-vaccines-for-healthy-children_4321865.html'],[],0,,False,0,0,1,,#Covid-19,,,,,,,[],,,,
1500984151901622277,1500984151901622277,1646697483000.0,2022-03-07 15:58:03,-700,,"Kıtlık olacaksa, tabiattan kaynaklanan bir kıtlık olmayacak. Küresel sapkınların yıllardır planlı oluşturdukları sahte kıtlık olacak. Küresel iklim değişikliği safsatası ile kolay yutturulacak. Pandemi, savaş, iklim değişikliği, gıda kıtlığı.. #ALTIN #anne #Ukraine️ Covid 19",tr,"['altin', 'anne', 'ukraine️']",[],180328049,180328049,seyfetindemir,Seyfettin Demir,1,15,https://twitter.com/seyfetindemir/status/1500984151901622277,[],[],0,,False,0,0,0,,#Covid-19,,,,,,,[],,,,
1500984151025012736,1500984151025012736,1646697483000.0,2022-03-07 15:58:03,-700,,"Cases: 447,352,722 (+46,782)  Deaths: 6,006,152 (+0)  Recovered: 0 (+0)  Active Cases: 447,352,722 (100%) Completed Cases: 6,006,152 (1.34%) Mortality Rate: 1.34% (No Change) Case Fatality Rate: 100.00% (No Change)  #COVID19 #Coronavirus #StayHome",en,"['covid19', 'coronavirus', 'stayhome']",[],1237837670182793217,1237837670182793217,_covid_19_bot_,Covid-19 Bot,1,15,https://twitter.com/_covid_19_bot_/status/1500984151025012736,[],[],0,,False,0,0,0,,#Covid-19,,,,,,,[],,,,
1500984138777739264,1500984138777739264,1646697480000.0,2022-03-07 15:58:00,-700,,Your community depends on you. Want to help stop the spread of COVID-19? #GetVaccinatedNow!  https://t.co/M9Oyq4464e,en,['getvaccinatednow'],[],2598357146,2598357146,GailWaldby,💉💉💉 #DemCast Gail Waldby,1,15,https://twitter.com/GailWaldby/status/1500984138777739264,[],['https://pbs.twimg.com/media/FNC0XnDVkAImn4K.png'],1,https://pbs.twimg.com/media/FNC0XnDVkAImn4K.png,False,0,0,0,,#Covid-19,,,,,,,[],,,,
1500984130271645706,1500984130271645706,1646697478000.0,2022-03-07 15:57:58,-700,,BLOG  ALEXANDREPFILHO: COVID -19: BRASIL  REGISTRA  20.456 NOVOS CASOS E ...  https://t.co/Ioym3bfeXN,pt,[],[],995423656091275264,995423656091275264,Alexand62706316,Alexandre Pereira Filho,1,15,https://twitter.com/Alexand62706316/status/1500984130271645706,['https://alexandrepfilh.blogspot.com/2022/03/covid-19-brasil-registra-20456-novos.html?spref=tw'],[],0,,False,1,0,0,,#Covid-19,,,,,,,[],,,,
1500984123606933505,1500984123606933505,1646697476000.0,2022-03-07 15:57:56,-700,,"Descubrieron que el covid-19 tiene efectos de gran alcance en la salud más allá de la fase aguda de la enfermedad. Un estudio descubrió que las personas con covid-19 tienen un mayor riesgo de enfermedades cardiovasculares a largo plazo, al menos un año después de la recuperación.  https://t.co/e4gNb7sLIM",es,[],[],1321555575004684294,1321555575004684294,LyonMedSAS,Lyon Med,1,15,https://twitter.com/LyonMedSAS/status/1500984123606933505,[],['https://pbs.twimg.com/media/FNSRGy_WYAUaOZB.jpg'],1,https://pbs.twimg.com/media/FNSRGy_WYAUaOZB.jpg,False,1,0,1,,#Covid-19,,,,,,,[],,,,
1500984116283691009,1500984116283691009,1646697474000.0,2022-03-07 15:57:54,-700,,"Dr David Martin, [Mar 7, 2022 at 17:35] Released Documents by Pfizer Show BioNTech Paid FDA $2,875,842.00 “Drug User Fee” for COVID-19 Vaccine    https://t.co/wBiA6J5ujn",en,[],[],881476096730042368,881476096730042368,HelenSu22257678,Helen Sun,1,15,https://twitter.com/HelenSu22257678/status/1500984116283691009,['https://t.me/DrDavidMartin/56'],[],0,,False,0,0,0,,#Covid-19,,,,,,,[],,,,
